0,1
Cafe Réveille,"Love Réveille! Every location in SF is great, but we usually go this one because it’s closer to our home. Fresh and home roasted coffee, great selection of Japanese loose tea that they serve in Kinto teapot😍. Amazing breakfast and food quality. Prices are great! Also their pastries are from Starter Bakery which is good too, but before Starter bakery used to bake better quality for wholesale as for me. Anyway, highly recommend this place - their breakfast, tea, coffee, fresh squeezed juices and best chia pudding in the world!!"
Cafe Réveille,"When I arrived there was a line that took around 10 minutes, but the staff were friendly and made my order very quickly. The cappuccino I got was great, as was the coffee cake. I will say that there were some smaller light brown species of cockroaches in the bathroom crawling around on the sink. This was a bit unnerving, but nevertheless it was reasonable for SF so I can't blame this place in particular."
Cafe Réveille,very normal i was kinda craving a regular croissant normal but could only find sweet pastries. maybe I'd come here to study as a student... the coffee looked good too. not too expensive for decent quality. just don't expect nothing special. gotta give them props for the ginger tho that one had my socks spinning
Cafe Réveille,"Sorry, but this place is the definition of mediocre. Food, coffee, service and atmosphere are super mid. Just nothing special about it."
Cafe Réveille,My favorite coffee in town! Their cappuccinos are addicting :D They also have great brunch options. Lots of space both inside and outside to sit down. Also dog friendly!
Cafe Réveille,"(Update) In case helpful:  Indoor seating: yes WiFi: yes, with protected password Restroom: yes, two Recommendations: Acai bowl for food and latte for drinks  Ordered the Homestyle Breakfast and Açaí Bowl, for coffee we had a latte with oat milk and another latte with almond milk. The food was good and the coffee was good too. Slightly on the pricier end, but felt that Açaí bowl was especially worth it!  Update: I’ll probably keep updating as I come back to the place, but so far I’ve had:  Food: Homestyle Breakfast, Breakfast Sandwich (with the works), and Acai Bowl. I like Acai Bowl the best so far.  Drinks: I’ve had latte w almond milk, capuccino with almond milk, matcha latte with almond milk. I like my matcha latte without so much foam (some places make it like 80% foam so there is almost no weight to the drink at all) and I like that here, it was rich and creamy instead of being foamy. I still think latte with almond milk is the best.  Pastries: For pastries, both coffee cake and croissant were good. I might try to get the croissant warmed up next time :)"
Cafe Réveille,"An impressive coffee place in the neighborhood!  Dropped by this place to pick up a coffee for the go. I was impressed by the ambience of the place and friendliness of the staff.  We got a matcha latte and latte. Both were delicious. They had a single size, the prices are at par to Starbucks. The size of coffee is similar to Grande of Starbucks.  I didn’t dine-in but there were people who were dining indoor and outdoors. The condiments - sugar/ cream area is open too.  Will definitely go back to their other items on the menu!"
Cafe Réveille,"The best breakfast bowl I've ever had. So flavorful, filling, and beautifully presented! The breakfast sandwich, coconut breakfast bowl, and smoothies are all so good. Everything I've had so far is tasty and reasonably priced. Love this local spot for brunch."
Cafe Réveille,"Really mellow atmosphere, with modern decor. Tall cellings with plants placed above the windows. Perfect for enjoying a coffee/tea beverage.  Food is very good, had the eggs and potato breakfast with a side of falafel. Chimichurri was awesome.  I'm hoping to go back soon and try more dishes."
Cafe Réveille,"Been here multiple times, always great coffee. They also have baked goods and smoothies/bowls that are yum! Tasteful interior and great spot to WFH"
Cafe Réveille,"Come here for coffee & a chocolate kouign amann or a healthy-ish brunch! I love this place so much but my favorites are definitely the espresso drinks, kouign amanns, chilaquiles, the açaí bowl, and any breakfast that comes with the smashed golden potatoes. It’s dog-friendly (but no indoor seating at the moment) and has a few different locations.  Will def be coming back here again and again!"
Cafe Réveille,"Great venue for breakfast/brunch. It gets really busy but if you patient it is worth the wait. Very healthy options (food and drinks). The team are really helpful, friendly and professional."
Cafe Réveille,The breakfast burrito was so good. And the shakshuka was very good. cinnamon roll Was OK only cause the surprise raisins 😅. First time and I think it my breakfast spot.
Cafe Réveille,"Relaxed modern cafe in the mission area of SF, super close to the last CalTrain station if you are commuting into the city :)  This place got featured on the LV city guides for SF; we had to check it out to see what the hype was about — not going to lie, aesthetic af!  I didn’t get a chance to try a lot of the menu; I got the locally brewed Golden Shore Iced Tea. I’d recommend you check this out for small groups or for a modest work session!"
Cafe Réveille,"Cafe Reveille is my go-to for mid morning weekday brunch and, by convenience, early afternoon laptop tapping.  Coffee is solid, breakfast options are all tasty. Pastries come from nearby luminaries like Neighbor Bakehouse (you should go to there as well...).  The Moroccan shakshuka is hearty and delicious. For lighter fare, go for one of the avocado toast variations.  Only downside is that brunch ends at 11:30 when they switch to a lunch menu.  Dear Réveille staff - if you’re reading this, please bring back the cold brew. Thanks."
Cafe Réveille,"Had a breakfast burrito, great tastes and filling,..you may want to share this one.  Group was happy with all the their selections."
Cafe Réveille,"Lovely place for a good weekend brunch. They have quite a few options for food. Tried the latte, almond croissant, lemon poppyseed muffin and a  breakfast sandwich (with the works). They forgot to put hot sauce in the breakfast sandwich which kind of made it taste bland. Absolutely loved the almond croissant and the muffin. Do give it a try. Will visit again to try their acai bowls."
Cafe Réveille,"Love this cafe, great spot to read, grab a cup of coffee. Their food is healthy and delicious. Can't go wrong"
Cafe Réveille,"Delicious food, strong and tasty coffee. Sometimes the staff messes up my order but they’re quick to fix.  They’ve recently started sometimes having folks add their own creamer and sweetener for your latte which I am not a fan of, but it’s hit or miss depending on the barista you get.  When they do actually do your latte for you, it looks pretty."
Cafe Réveille,"Currently takeaway/outdoor seating only. But, very pleasing and warm atmosphere inside when you order, though the music is a little loud to hear the barista. Located right at the intersection of quiet residential streets, this is a must-visit. The cream/sugar area is currently not available for customers and requires a staff member to administer."
Cafe Réveille,"Easy parking around, nice outdoor seating, although can get a little warm during lunch time. We got grilled chicken sandwich, açaí bowl, latte and cappuccino, all are yummy"
Cafe Réveille,"Efren Villalobos Head Chef Cafe Reveille Feeling great and happy to serve fresh, local, sustainable and most organic food to our guests, using fresh seasonal products, supporting our local farmers and committed to provide a great experience in every dish that our team will prepare for you"
Cafe Réveille,The food is really delicious here and service is always A1 at that. They have a wonderful menu selection and the service staff are the best.
Cafe Réveille,"The go-to sit-down-and-vibe cafe in Mission Bay. Been here more times than I can count. Great breakfast burrito and funguy pasta. Okay coffee, but the overall atmosphere makes up for it."
Cafe Réveille,"Grabbed the matcha latte with oat milk in the morning here. Although it was already 8:30am, there was a decent line around 9 (around 5-10 people). Food options ranged from savory toasts to pastries, all looked good. This branch has quite some seating for a coffee shop, though the tables are a bit small. If you’re looking for a casual workspace with decent coffee and food, would highly recommend! I plan on going back soon."
Cafe Réveille,Has that new feel and a designer menu. The burger did not disappoint and came off the grill quickly. Wish my working boots didn’t have me falling over the table when I got up.
Cafe Réveille,Great local Instagram-worthy place. Amazing breakfast plates: from smoothie bowls to fry-ups. Great coffee too.
Cafe Réveille,"Love this place and their breakfast bowls are the best, honestly they have the best dirty chai latte. ✅ I love ordering and walking to the park to much in peace. Sooooooo good, try everything on the menu. Also I don’t mind spending good money on fresh quality food."
Cafe Réveille,"Love this cafe! Their Acai bowl is the bomb. So many textures and layers, and a pretty sizable portion too. The rest of the food looked good too so will def come back here to try more on the menu.  Worked here for a few hours on a Tuesday. Thought it would be quiet and empty but it was bustling. So not a good place if you want some peace and quiet but nice for people watching and if you like to work in more lively environments. The wifi was good but I couldn’t find any power sockets."
Cafe Réveille,"I had an iced coffee and an open faced toast. Coffee was quite big and really amazing! I would not recommend the toast. Ambiance is nice for laptop work, reading, or a coffee meeting. Most of the seating is a bit sunny and can get hot in the early hours."
Cafe Réveille,Love their açaí bowl! The food and coffee here are great! They have a variety of different flavor profiles in their dishes and service is pretty fast.
Cafe Réveille,"Very hip environment. Ie, a decent cross-section of hipsters South of Market in Dogpatch area. Kitchen closed early on a Sunday, around 3 p.m., but selection of pastries was quite good. Quality of barrista craftsmanship was quite good. Seating can be difficult to come by but nevertheless a good place to socialize or read a book."
Cafe Réveille,The açaí bowls here are amazing!  I also love the fact that the barista asked how much water I wanted in my americano.  I feel like most places put way too much water in!
Cafe Réveille,Great morning spot to grab a coffee and breakfast Sandwich. Low key vibe in and outdoor seating.
Cafe Réveille,"Actually I have been back to Taiwan from SF for 5 months so far...and I don't know why this delicate cafe just came to my mind, then I just realized how much I miss this place! Miss the Latte, the avocado toast, and the atmosphere there! So I just want to say if your are visiting San Francisco or you haven't been there, please walk in and taste some happiness :)"
Cafe Réveille,Used to regularly come here but the service has extremely gone down. Baristas are very impatient with customers but also very slow to make drinks. Loved coming here every morning before work but sad to stay we no longer enjoy coming here. Tried to give it another shot multiple times and faced same issues with barista’s attitude.
Cafe Réveille,One of the best  Açaí bowl of all time - consider this comment from someone who had all the best rating açaí bowls in Hawaii
Cafe Réveille,"This is my second time being here. Personally, I don't have high standards for coffees, but I do love the vibe and the lights coming through the windows. A great place for hanging out and chatting with friends."
Cafe Réveille,The breakfast bowl was wholesome and high quality. Smooth delicious cappuccino as well.  They have outdoor seating if you have your dog with you.  Bringing the dog inside just to order was not a problem.
Cafe Réveille,Wonderful spicy shakshuka breakfast in a modern clean space. Quick and friendly service.
Cafe Réveille,On the pricey side but drip coffee was great and food was very tasty with healthy options available. Coffee had fruity notes and was not over roasted. Had a great breakfast there
Cafe Réveille,There was bacon in my veggie breakfast burrito. Coffee was good. Acai bowl was good.
Cafe Réveille,"Delicious Coffee, healthy and savory lunch options but a bit pricey. The pastries are pretty good too!"
Cafe Réveille,"First time trying this place out and it was a hit! Loved the tea, coffee to-go, and breakfast sandwich. I'll definitely plan to go back after weekend visits to Barry's Bootcamp."
Cafe Réveille,"Amazing food, excellent service and lots of cool dogs to see."
Cafe Réveille,OMG. Their breakfast burrito is so delicious. Salsas have just the right amount of heat. Espresso is also great- this is my baseline for coffee places
Cafe Réveille,"I was looking for a quality place to eat and thought 7:30 am might be too early for such luck. I'm so lucky I found this spot. The matcha was beautiful. The bowl seemed thoughtfully created. It had tasty, clean well prepared ingredients. Anyway, I like what this place is doing and hope to come again soon."
Cafe Réveille,"This Reveille is the most beautiful one of San Francisco location, spacious and clean as hell. Too good of a place for working on your computer, grab a quick vegetarian bite, or meet up with friends for coffee in mission Bay Area. Their outdoor seating feels so good under the sun."
Cafe Réveille,My dish was quite dry. A sauce would have helped to make it more interesting. My husbands shakshuka was very delicious.
Cafe Réveille,"I really love the food here everything is really good. Plenty of options for vegetarians, quality cooks and quality coffee drinks. Also the tea is top tier"
Cafe Réveille,"Good coffee, a bit slow in service, atmosphere is a bit sterile"
Cafe Réveille,Just was passing by this cafe and really loved the design inside and decided to order the matcha latte. So Yummy!😍 Barista is very friendly and making great foam🤤 …
Cafe Réveille,So many delicious options for a quick breakfast or snack. You can't go wrong with the acai and mango spinach superfood bowls.
Cafe Réveille,The acai bowl was very good. My partner liked his breakfast sandwich as well. High quality and well-prepared ingredients all around.
Cafe Réveille,Decor is very instagrammable. Prices are a bit high but worth checking it out. The pink tables outside were my fave.
Cafe Réveille,"Got the chocolate croissant and breakfast sandwich, were both quite good."
Cafe Réveille,"Don't let the relatively short menu discourage you, the food here is good. The indoor and outdoor seating is well spread out and everything is kept clean. Service was quick and easy with the standard order up front and take a number stand for the table format. There are various parking options around including street and public parking sites with Caltrain, Muni and bus stops also close by."
Cafe Réveille,It was a delicious plate but adding some vegetable would be better.
Cafe Réveille,Great food options! Love the eggs with mushroom combinations they offer!
Cafe Réveille,"Very friendly staff, delicious food, good place to get some work done. Opens early in the morning. There is a great wifi. No power outlets just yet (indoor seating was not open as of the time of writing). Pleasant outdoor seating space, maybe there could be a bit more outdoor seats given how popular the place is."
Cafe Réveille,"A little too much wait time, only one cashier. It’s a good place."
Cafe Réveille,I was surprised by how good the drip coffee is at this place- perfect for sitting and enjoy the wonderful atmosphere or a quick to-go cup for when you’re on the run. It might even be my favorite coffee in the city!  They have a full menu and the food that comes out of the kitchen looks amazing (I haven’t tried it yet). Their selection of ‘ready to order’ food is so good; the pastries are amazing and the ready made toasts are delicious. The staff is friendly and if there is a line it moves pretty quick. It’s one of my favorite places in Mission Bay.
Cafe Réveille,"Had heard good things so we wanted to check it out, but after waiting in line for 20 minutes, when we got to the counter, we were told their system had been down and that we wouldn't be able to order food.  I said it would have been nice for them to tell the large line of people, so that we didn't have to wait for nothing, and they just responded ""yeah sorry we weren't sure how long it would last"", yet it had already been 20 minutes.  I then suggested that they tell the rest of the long line, and they said ""yeah sorry"" again, and then didn't bother telling the rest of the line (which ended up leaving one after the other after finally getting to the front).  These sorts of things happen and it would have been okay if they had just told us, rather than wasting everyone's time.  We'll give it another try in future, but a disappointing first experience.  Edit: We've had a few good visits, the food is quite good, but it's really hit and miss as far as how long it'll take. E.g., it took upwards of 45 minutes for a breakfast wrap and burrito, even when the restaurant wasn't full."
Cafe Réveille,This is an excellent place to have really good coffee in a nice light-filled space. The pastries aren’t bad either. They also have plenty of outdoor seating when the weather permits.
Cafe Réveille,"The service was quick and friendly. A little pricier than I would have liked, but average for downtown SF. My half and half cappuccino was killer. ❤️"
Cafe Réveille,Local roaster of single origin coffee. Trendy and lay back environment.  Perfect place to spend an hour sipping a cup of coffee in the morning.
Cafe Réveille,"Reveille has a great vibe, fabulous Latte’s, and friendly staff. My wife and I were so impressed when we first walked in. There was a small wait to get our coffee but the barista made us feel right at home.  The ambiance was exactly what we were looking for; modern and clean. It was very quick and the area in Mission Bay is very new and trendy.  The best part is that the coffee was excellent. We had just gotten the worst coffee that we threw away because it wasn’t worth it. Reveille hit the spot and made everything worth it."
Cafe Réveille,"The coffee (espresso) was horrible, I wouldn’t recommend it at all! Disappointed because the place is nice, and expensive AF."
Cafe Réveille,"Only open in the morning. Kitchen is really slow, if you're looking for food to grab and go, this is not the place; a breakfast burrito can take 15 minutes to make.  This would make a great afternoon coffee spot but limited hours make if difficult to take advantage of. Faster food is available immediately across the street."
Cafe Réveille,"Excellent place for brunch, coffee, or dinner. The space is beautiful and the staff is pretty chill. I know a friend had poor service one time, but I haven't heard anyone else have issues and I certainly haven't. The food is really good, but a bit on the pricey side (a little more than SF avg). Good place to work as well, though not many outlets."
Cafe Réveille,"Horrible unseasoned food. Only is seasoned with salt..... maybe pepper, it tastes absolutely disgusting! I have no idea how people stand this place.  Not to mention the girl at the register made me wait while she was ordering something for herself so i was just standing there at the counter.  Never want to come back."
Cafe Réveille,"Great coffee, not cheap especially if you need almond or soy milk though which adds an extra 75¢."
Cafe Réveille,"The service is a bit slow but incredible food, coffee, and a really nice ambiance."
Cafe Réveille,"I love this café! I used to work here all the time pre-COVID because they had a great location and great atmosphere (lots of windows/sun, and very chill but lively). The lattes here are my favorite, very well-made and comparable to Blue Bottle which is my other go-to. I would rank Reveille’s coffee as some of the best for specialty cafés I have been to in the Bay Area. It can be a little pricey, especially if you get the non-dairy replacements that cost extra. The food is also quite good, generally nutritious and with great flavor. Not cheap but I would mostly consider it worth it. The baristas are very friendly, and takes time in their prep, which I really appreciate. If you’re in the area I highly recommend stepping in for a coffee or some food, and enjoying it in the park nearby."
Cafe Réveille,"The customer service at this location was beyond atrocious. I went between 11am-12pm on a Sunday and I moved to take a drink that I mistook for mine. Rather than politely correct me, the barista working there publicly accused me of being a thief even though they knew I had ordered the exact same drink.  Not to mention this place is outrageously overpriced for the quality of their beverages.  If Google would let me give 0 stars, I'd do that in a heartbeat. Don't go here!"
Cafe Réveille,There was only 1 person in front of us and 2 baristas yet we waited about 10-12 minutes just to give our order. Got the iced coffee but it was too bitter even with cream and sugar. Have had their lattes before and those were decent.
Cafe Réveille,"4.5 stars, rounded up  Thumbs up: - Nicely varied but not overwhelming menu (and everything smelled amazing!) - Delicious smoothies! - My friend later told me that she loves this place; high quality dishes!  Thumbs down: - A bit loud and crowded, was hard to find seating for two - Wobbly table"
Cafe Réveille,"45 min wait on a less than busy Sunday morning for a juice and açaí bowl. Everyone who ordered hot food got their order within 10-15 mins. After following up multiple times, was told the person making juices was on a break and the juice wasn’t still ready!!! (Didn’t know only one person at a cafe knows how to operate a blender) got the açaí after 45 mins. The açaí was hard frozen and could not be consumed. Won’t be coming back."
Cafe Réveille,Perfectly prepared Latte art and delicious coffee. We forgot a shopping bag there and came back to friendly and kind staff who noticed and set aside.
Cafe Réveille,"Easily the only coffee shop worth going to in the area. Their imported coffee beans and special roasting techniques combine to make the freshest coffee I've ever had.  Not to mention they have the friendliest staff; especially kyle who always makes a different house-blend coffee roast for me, and every time it gets better and better.  *********WARNING: THEIR COFFEE IS SO DELICIOUS YOU'LL GET ADDICTED*********  Their food is simple, yet very effective. I love all of the wraps.  10/10 would smash."
Cafe Réveille,This bustling cafe is great for a quick and easy breakfast/brunch. Their Shakshuka is quite nice as are most of the egg preparations as well as the bowls. I wish they’d lower their price point by $1-$2 per dish and I’d go here much more often.
Cafe Réveille,"Excellent if hipster-fawncy coffee shop / cafe; there's enough choice in food for them to correctly call it a cafe, but enough people just buying coffee that you have to include coffee shop.  The food is not cheap in any way, but otherwise it's a good place for your avocado toast or protein bowl or whatever.  Yes, they also have egg sandwiches, don't worry."
Cafe Réveille,Pastry selection is great. I didn't have their brunch but they look really nice. I had a latte. The flavor didn't stand out too much but it's very balanced and smooth. That's all you want for a latte :)
Cafe Réveille,"Food is good, kitchen staff very nice. However, servers are not friendly. Waited 50 minutes for one breakfast item."
Cafe Réveille,Food was only partially good- the breakfast burger and açaí bowl were delicious. The banana almond bread was not enjoyable at all because the bread was so hard I barely could cut nor bite it. Girls who took our order seemed  extremely snobby and bothered. Unfortunately I cannot recommend this cafe.
Cafe Réveille,Get the Levantine Sandwich with Chicken Thighs. Super delicious!  Coffees were fine not amazing. But pastries were also delicious we got the chocolate thing.  Be aware that their kitchen closes at 3pm so you won't be able to get food here after that.
Cafe Réveille,"Yummy espresso and pastries, with lots of seating"
Cafe Réveille,"Been here a few times since moving to the area. There's usually a line to order food, but it moves quickly. Table turnover is pretty quick as well, so don't worry if it looks crowded. Most of the time the food is great. Occasionally the food in the display is left out too long, but they can make it fresh if you ask."
Cafe Réveille,"Imagine the exclusivity of Blue Bottle, paired with delightful food options, in a bright and modern setting - Cafe Réveille in the Mission Bay neighborhood got what it takes the be in line for one of the top coffee places in the city.  I love the interior design, especially the well-designed coffee bar. Small tables and even an outdoor patio - extra space is needed as this place gets poppin', especially for brunch. And we know that San Franciscans like to brunch all day long.  First time I got here was on a Sunday when the nearby Starbucks on 3rd was closed. I mean, I don't necessarily need to pay #3.50 for my non-fancy cup of coffee but this place got me convinced I should."
