0,1
Cafe Réveille,"Went for coffee/brunch with some friends. Picked the location because our usual haunts were likely to be overflowing that morning and it was situated about halfway between us. I'd been to the Castro location before and relatively pleased with it.  We showed up around 11:30 on a Saturday morning. There was a line, but it moved pretty quickly, and we were able to secure a table for 4 before our food and beverages were ready. Coffee was good, as was the food, and we were able to have a good chat while eating (i.e., it wasn't too loud or crowded).  I'd definitely go back and try some of the other offerings. I also noted the place was pretty family friendly (several families with young children present, and suitable facilities for such)."
Cafe Réveille,Fantastic cafe. Best acai bowl I've ever had in my life. The breakfast sandwich is also very tasty.
Cafe Réveille,"Good coffee, food and atmosphere. Really friendly staff."
Cafe Réveille,"Amazing breakfast place! Irresistible selection of pastries, great coffee and nice ambience. At the same time, this makes their lunch menu comparatively disappointing. Staff can also seem less than friendly and rather aloof at times."
Cafe Réveille,"When I work from home I usually head were to grab a latte and get on with work.  I've had several drinks and one of the pastries. My wife has had a few teas. We've both liked everything we've tried there.  The restrooms were originally equipped with mouthwash, which was great for combating coffee breath, but the last couple of times I've been there it has been absent.  I'm looking forward to trying the meals there."
Cafe Réveille,"What a lovely little cafe located in Mission Bay. I was visiting San Francisco and my brother lives in this new development. Their mocha was spot on and I dig the creative design with the foam. The morning bun with cheese and ham is crispy and satisfying. The mushroom hash was simple, but tasty. It was served sunny side up, so you can dip your toast in yolks. Yum! Service is friendly and attentive. If you do not like the loud music, one end of the cafe is quieter than the other. What a plus to the neighborhood."
Cafe Réveille,"For some reason the coffee is always served like warm - ask for an extra hot one. Other than that the coffee, teas, and food is awesome. Expect a long line and few open seats during peak hours. They get through the lines pretty quickly and food is also swift - so it’s only an issue with space. My favorites are the  Shakshuka, mushroom hash, and  açaí bowl"
Cafe Réveille,Great brunch place with gourmet coffee
Cafe Réveille,"Cool and laid back place, some chick, Carla I think it was. . .offered some of the best barista service, friendly & cheery! My boyfriend agrees. . .he got the best latte he's ever had. And I'm visiting from  LA, so it seems a lot more chill around here and that's a big deal. 😉 …"
Cafe Réveille,"The space is very modern and clean. However, the self serve water bar had a funny odor, almost of wet dog.  Service was friendly and quick.  Coffee and food was simple. If driving, parking is rare and hard to find."
Cafe Réveille,Rich coffee. They make a mean matcha latte too!
Cafe Réveille,"Great for dining in and coffee, terrible for to go! The food is delicious, if overpriced, and the coffee is always great. However, I have had more to go orders than I care to admit, especially considering the short time span reveille has been open, and every single time the order is wrong. I'll continue to go here in person, that way I can send it back if something is off. However, I'll never order anything to go from here ever again, other than the coffee."
Cafe Réveille,Busy part of San Fran. Brunch ends STRICTLY at 11:15 am. Missed it by 2 minutes. Lunch had some good options prices pretty high compared to other bigger cities. 3% extra charge for employees. Fries were okay. They were more on the harder side. Steak sandwich was medium. Very pink center. BLT has large thick bread pieces but very tastey. Chicken sandwich was very good. This place likes to serve thick carbs.
Cafe Réveille,"I came here with my friend one weekend to work on our laptops and chill at a coffee shop, but Cafe Reveille was more restaurant-y than I expected. While it was still okay to work (I saw a bunch of people doing this), I felt bad so I limited my time doing so. It's a nice place to just hang out in anyway, though it gets quite loud at times. The drinks here are fancy-ish and rich. I had a green tea latte, and my friend and I shared some of the hummus with pita as a snack.  One thing I particularly liked at this place was all the windows, letting in a lot of natural light. The location is great, especially for Mission Bay where I find the options for places to hang out are sometimes limited. The counter and table staff were friendly, although I found it difficult to get the attention of table staff (it was busy, but not thaaat busy)."
Cafe Réveille,"Not bad. But the good pastries are imported and thus upcharged, the breakfast sandwich we got was cold, and the coffee is expensive. If its a nice day and you have some time better going to spark social a couple blocks away."
Cafe Réveille,The coffee is great. The food is very tasty and well prepared.  The prices are San Francisco normal. They have limited seating for any group larger than 4.
Cafe Réveille,"Réveille may serve the best cappuccinos in town, and one can watch the staff roast their beans right in the middle of this beautiful contemporarily designed restaurant. Although it was a bit pricey, the breakfast food was tasty. Weekend brunch crowds are almost certain to materialize as the word gets out. Unfortunately, they intentionally do not offer WiFi (at this time), and there are no power outlets near any of the tables. Depending on one's perspective, that could be either a good thing or a bad thing. For me, it's a bad thing, and I docked the place one star because of it."
Cafe Réveille,"This place has good food generally, but they are reducing the quantity of the açaí bowl far too much. It does not justify the cost anymore.  I hope they fix this."
Cafe Réveille,"A favorite cafe.. own roasted beans, quality pastries,  comfy, friendly."
Cafe Réveille,"We were visiting the city and good coffee was a must! Since we tried blue bottle, I was ready for a new place. GMG posted about Cafe Reveille so we went to check it out on our last day. My matcha latte did not disappoint. The service was quick and friendly. The decor is on point! I hope to visit again one day."
Cafe Réveille,"It's a well loved coffee with top to floor windows that ensure tons of light, as well as long stream of aficionadas of their coffee. ★★★★★ Location: right off the busy office area of Mission Bay,   close to the Caltrain train station. ★★★★★ Ambience: great lighting, tons of space with mostly table for 2. ★★★☆☆ F&B: the coffee quality is great, albeit at a steep price (cappuccino go for $4, chai between 4-6) , but that's average for SF central area. Food wise it has room to be improved. Avocado are usually turning black. Almost no vegan options.  WIFI: provided albeit a bit slow. Music: trendy pop. Whilst seating there it was of the genre of Bruno Mars. Oulets: None WC: 2 clean"
Cafe Réveille,Absolutely grateful to have this cafe near me. They understand coffee and how it should be served. Best cappuccino I've had in SF area.
Cafe Réveille,"Cute cafe with a great atmosphere. They have Neighborhood bakery croissants, which are delicious. Coffee was great. The açaí bowl on the other hand was nothing to write home about."
Cafe Réveille,"A beautiful addition to mission bay! The interior is lovely and the espresso here is great. I ordered a macchiato, my friends ordered hot chocolate, cappuccino, and 3 breakfast sandwiches for us all. First - the espresso drinks here were perfection. I loved the taste of the espresso, and I tried the hot chocolate, which was indulgent but not too sweet. The breakfast sando was not impressing to me - the bread could have been toasted, and there was a lot of bread-to-stuff. At the end I was left with a third of my bread, which was good, but sort of dry and cold. The marguez lamb sausage was delicious, but it was really greasy and left a puddle oil on my plate. The sando also had a lot of aioli - I ended up scraping off a good bit. I did however enjoy how much avocado and greens was on the sandwich, and the display was pretty. I would definitely come again, but I do not recommend the breakfast sandwich."
Cafe Réveille,"Tried to come here for brunch but apparently it was over because all they had were some breakfast sandwiches wrapped in foil under a heat lamp. What they did have (chia bowls, juice, etc) was really delicious but super small and overpriced. I ate the chia bowl in three bites. Coffee was really good."
Cafe Réveille,"Great vibes and great food! Also, random — the bathroom is cool."
Cafe Réveille,"Well-made espresso drinks, excellent food, and freshly roasted beans. Nice folks working there, too."
Cafe Réveille,Loved the fish tacos I had for lunch.  They roast & brew a great coffee.  Deducted 1 star because the restaurant is dirty.  It's needs a good scrub.
Cafe Réveille,Great little spot with good food and decent coffee. Always busy but somehow there's always space.
Cafe Réveille,"Good coffee and pastries. But you need to wait for ages if you order a juice. We waited for 30min with the order number on our table. I asked about my order when they started to serve people who ordered after me, but they lost my order. I will not go there again. Bad service."
Cafe Réveille,"Note: I'm really picky about coffee. The latte and cappuccino are tasty, and they accept credit cards!  Lots of seating, which is generally open. This is a solid choice of coffee for the area, especially if you don't have any cash on you."
Cafe Réveille,The interior feels very modern and urban. The coffee is excellent. The service was friendly and prompt. The only concern is the constant line on the weekends. I suppose it's a good problem to have since it means the products are popular.
Cafe Réveille,Well-lit and pleasant ambience -- one of my favorite reading/working neighborhood cafes. Coffee is delicious; iced latte is beautiful. Matcha latte had a bit of a fishy taste (not sure why).
Cafe Réveille,Lovely ambiance and decent service. Unfortunately I felt their cortado fell a little short. The shot pulled was overly acidic and a bit astringent. I thought the milk was a bit too cold as well.
Cafe Réveille,Sf has trend of very light roasting coffee. This results in sour green coffee and any self respecting Italian would avoid. This location cute as it may be roasts their coffee such that it tastes like vinegar and at $3.25 a shot simply is a pass imho
Cafe Réveille,Friendly staff and the matcha latte I ordered was great! Only giving 4 stars because there are no outlets to plug electronics.
Cafe Réveille,"I'm really disappointed with the new menu. I always came here for the shakshuka which was the best shakshuka I've had, but they just changed the menu and the new shakshuka is terrible. They took out the chickpeas and bread from the dish, and added in a whole bunch of salt! The bread was the best part of the dish, the chickpeas added substance, and now it's sickeningly salty. I've never heard of serving shakshuka without bread/pita. Also, the poached eggs were over cooked, and somehow the yolks were tiny... very odd. So sad to never have their old shakshuka again. Two stars because their coffee is still good, but that's not enough to bring me back."
Cafe Réveille,Great spot for a great coffee and fresh  breakfast/lunch options. I will be returning!
Cafe Réveille,just okay. got the dirty chai and wouldn’t get it again. nice space though
Cafe Réveille,On point espresso and the roaster is very friendly. Great guy to nerd out with on the finer points of roasting and it's science.  Great atmosphere as well. +1 for the always cute baristas
Cafe Réveille,"Beautiful interior, pleasant service, mighty expensive and avoid the croissants- look great but totally lacking in taste and texture. Nice table seating outside"
Cafe Réveille,Excellent matcha latte and açaí bowls.
Cafe Réveille,"Pissy counter service but other than that, this place deserves your business. Well prepared food at a reasonable price. Solid coffee. Stylish setting. Bus boys kick ass"
Cafe Réveille,"Food and coffee are good, though on the pricier side. They have amazingly fast WiFi, which makes this place great for work. If you can find a seat, that is."
Cafe Réveille,"Great coffee, tea and pastries, fresh squeezed juices! Also, a variety of healthy, freshly made dishes and appetizers, some vegan options and a great breakfast menu too!"
Cafe Réveille,"Great coffee, ambience, and food options. I love the breakfast sandwich o the weekends!"
Cafe Réveille,The breakfast treats look delicious and got raves from our party. Good for and well situated seating make this a great place to grab a cup of joe.
Cafe Réveille,"They just don't know how to handle a rush here during busy times. Never got my food. Was told ""just 20 more seconds"" after inquiring politely. Still nothing. Just didn't have time to wait around and harass them to get around to it. Had to leave without receiving what I paid for."
Cafe Réveille,Cafe Reveille makes a hot sauce that makes me wonder if they made a deal with the devil-- it's that good and I love hot sauces. The rest of their menu is delicious and the service is always top-notch.
Cafe Réveille,All-time favorite coffee shop. I love coming here for amazing iced coffee and maybe even a grilled chicken sandwich
Cafe Réveille,"Initially went in to grab a quick coffee before a lunch date - saw the food menu and called and audible and ate here. Food is healthy, kitchen is quick and the portions are substantial."
Cafe Réveille,Delicious coffee and delightful juices. Beautiful interior with chill vibe. The turmeric shot is a burst flavor and frothiness.
Cafe Réveille,"One of the best roasters in SF. The china basin location is open and airy. Also, they serve neighbor bakery goods which are fantastic"
Cafe Réveille,Excellent brunch offering. Well cooked. Ate takeaway outside with young children. A tad cool.
Cafe Réveille,"8-10$ for a standard sized smoothie is pretty pricey, but their ingredients are nice. Pretty good chilaquiles too!"
Cafe Réveille,"I lived close by. When they first open it was great and I""m so glad we have coffee shop open. But after a few months somehow quality went down drastically and I no longer want to go there."
Cafe Réveille,"Bustling neighborhood spot, with great selection of pastries in the morning and a fun lunch menu - their kitchen is top notch! Oh, and the coffee is great too!"
Cafe Réveille,Good food and a nice atmosphere
Cafe Réveille,"Long line for food, but you can sit outside which is lovely. There was not a lot of space inside on a weekday afternoon. Coffee was good."
Cafe Réveille,Do yourself a favor this wknd and make brunch plans at Cafe Réveille. 🥞 One of my favorite neighborhood cafes with super yummy brekkie without a long wait. …
Cafe Réveille,Amazing coffee. Some of the best espresso in the city. Really enjoyed the pastries and the breakfasts were great.
Cafe Réveille,Cool place... delicious blueberries pistachios croissant!
Cafe Réveille,My friend dealt with a ridiculously rude barista here earlier today. Will never be going back and supporting a place that delivers terrible customer service & overpriced selections.
Cafe Réveille,Very attractive Cafe with outstanding coffee and Pastries.
Cafe Réveille,"A little pricey, but really good. Vanilla latte with vegetarian breakfast sandwich was delicious."
Cafe Réveille,Went by to get coffee at 4:45 and they were closed in preparation for a dinner service.  The name is a bit misleading.  I would expect a coffee place to be open at that time and serving coffee to go.  Oh well.  I will update my star rating after I've had a chance to actually try their goods.
Cafe Réveille,"Excellent coffee and food, great for brunch and for working for a few hours."
Cafe Réveille,"Great breakfast items, pastries and freshly roasted coffee."
Cafe Réveille,"Great food. But no table service (ordering), detracts from the experience. Also prices were a bit on the high end."
Cafe Réveille,"I come here all the time purely for convenience.  The gem here is the Açaí bowl. Get it to go. I swear the portions are getting smaller and smaller, unless it’s in their to go box."
Cafe Réveille,Used to love this place but probably won’t be returning. They got rid of everything good on their menu. Seems like they are trying to hard. Food wasn’t good.
Cafe Réveille,"Lunch is great. Highly recommend the salad. Coffee here is pricey but not so great, just walk down the street to Phil's."
Cafe Réveille,"You can get coffee and pastry, and full breakfast, lunch, and dinner here. Great little place to stage an early escape from work for a glass of wine."
Cafe Réveille,"Hands down the best coffee, perhaps the only passable coffee, in mission bay. I'm also a fan of their hibiscus iced tea in the afternoons."
Cafe Réveille,"Visited for brunch, overall food quality is good but too less quantity and exoensive. Meal for 2 can cost upto 50 bucks"
Cafe Réveille,Nice space but pretty bland coffee without any real depth to the espresso. Conveniently located. Nice staff.
Cafe Réveille,"Americano is so great and perfect~ Only one thing is....NOT coffee-related, which is NO electric outlets....my laptop is out of juice...but no way to recharge ~"
Cafe Réveille,"Great coffee, I also like the avocado toast and the salad bowl."
Cafe Réveille,But little coffee shop in mission bay. Tried the cappuccino and it was made to perfection. Friendly staff and nice place to sit.
Cafe Réveille,Yummy coffee and pastries and a great place to get some work done and do some people watching.  My only complaint is that they don’t have outlets
Cafe Réveille,"Good, slightly more interesting than normal breakfast, for slightly higher than normal prices. Good espresso most days."
Cafe Réveille,"Customer service is the worst! All the employees ESPECIALLY the girls at the register seem like they are being forced to work there and have the longest mean faces ever, Wow very sad to have walked in to this place, never again!"
Cafe Réveille,Great breakfast menu and awesome cold brew. My only suggestion is to make the ice coffee to go bigger.
Cafe Réveille,Excelent coffee and awesome Gluten-free açai bowl
Cafe Réveille,"Great service from friendly people with friendly people. Coffee was really great and the croissant was will done, flaky and still moist."
Cafe Réveille,"Good cafe, expensive food. The place has free wifi but still. It very convince to to work from and also tends to be very packed."
Cafe Réveille,Amazing green tea lattes! All the Lyft employees go here to get em' 💚
Cafe Réveille,Good atmosphere and coffee.
Cafe Réveille,Great food and drinks but watch out when you go in the yellow line on the floor is a step but I think should be grinded down is a trip hazard.... my son fell on his hands and knees..
Cafe Réveille,"Short menu, but good service, and food is quite tasty. So not for every day but OK from time to time or if you happen to be in the area."
Cafe Réveille,"By far the best coffee in the area. friendly, accepts credit cards, and does outstanding pour-over and milky coffee"
Cafe Réveille,"Limited menu but good food (had basic eggs, bacon, potatos) and decent pricing (<$20)"
Cafe Réveille,Food is great. But lines can be crazy long on weekend mornings. Get here before 9am to avoid the crowd
Cafe Réveille,"Yum! Great coffee, snacks, and outdoor seating to watch Mission Bay be built up around you.  A gem."
Cafe Réveille,"Breakfast is good. Has variety of options. And the environment is pretty nice, atmosphere is comfy."
Cafe Réveille,"Boujee, techie coffee spot where the coffee is too much and the workers are too “cool”. Worst part is I can get a better cup of coffee at Starbucks...."
Cafe Réveille,Good coffee. Has good pastries and salads. The coffees are expensive and they charge extra for alternative milks.
Cafe Réveille,Good food and coffee. Coffee could be less milky to get a 5 for my taste.
Cafe Réveille,A bit overpriced but good. Americano tasted more like drip coffee than an espresso drink.
Cafe Réveille,Great coffee and ambience! I always prefer this place when I am around this area.
Cafe Réveille,Amazing almond milk matcha latte!! So happy I stumbled upon this place in Mission Bay.
Cafe Réveille,"Best latte in the city in my opinion, but it takes a while to come out"
Cafe Réveille,Overall not bad. I like the latte.
Cafe Réveille,Open sandwich was really yummy but this is the worst coffe ever (if you like burned coffe then great)
Cafe Réveille,For folks who get something to go:  Bottom of bowls: compostable Lids of bowls: recyclable Cups: recyclable Straws: compostable
Cafe Réveille,"Definitely mediocre. Food was uninspired, seemed to value hipster-ness over flavor."
Cafe Réveille,"Great food, juice and coffee but no outlets. Otherwise a good spot to work."
Cafe Réveille,Great pour over brew. Hip and vibrant music that's loud enough for conversation cover and just right for concentration.
Cafe Réveille,Great latte! Atmosphere was a bit lacking. Mostly business people enroute somewhere else.
Cafe Réveille,"strange layout.terrible acoustics. clean and modern, almost lifeless. nice addition to the up and coming new neighborhood"
Cafe Réveille,Dont know why everyone thinks This place is so hip? Its sorta cool. Food is good. BUT EXPENSIVE.
Cafe Réveille,"The look and feel of this place and its coffee are clean and pretty, but it's overpriced and overrated in my opinion."
Cafe Réveille,"Decent breakfast, really good coffee. Nice atmosphere."
Cafe Réveille,Beautiful open space with good coffee and a nice selection of food options - from breakfast to lunch.
Cafe Réveille,"Great breakfast or lunch spot. I recommend the egg sandwich, well worth $7."
Cafe Réveille,Truly delicious shakshuka.
Cafe Réveille,"Great breakfast/ lunch place with lots of tables, good coffee, and wifi"
Cafe Réveille,Great espresso
Cafe Réveille,Decent coffee but not brilliant. Good pain au Chocolat but overpriced.
Cafe Réveille,"Oh my goodness, the food at this instance of Reveille is amazingly good! Forget the coffee, order from the lunch menu!"
Cafe Réveille,Great food delicious coffee💗 BUT just a few bugs hanging around 😒 …
Cafe Réveille,"Great menu, pastry, and wifi. Surprisingly good flash brew."
Cafe Réveille,"Coffee is great, especially the iced coffee. Food is average at best."
Cafe Réveille,Very good breakfast and nice environment for chilling out and catching up with friends
Cafe Réveille,"Reasonable prices and out of the few times I've been here, service has been consistently good, food was tasty, and vibe was chill 👌 …"
Cafe Réveille,Love their matcha latte and egg sandwich with merguez added! Absolutely delicious!
Cafe Réveille,"Good fresh light meals, their Acai bowl and egg sandwich are the stand out."
Cafe Réveille,"Great food and coffee, but very spotty wifi and no power plugs for seating."
Cafe Réveille,"Good breakfast, a bit expensive but you can find a lot of thing from bio to preteinated lunch"
Cafe Réveille,Love the pink tables and interior. Recommend getting the matcha latte with avocado toast.
Cafe Réveille,Simple and tasty
Cafe Réveille,No hours on the door. Went in at 7:02am but was not ready for serve food. No estimated hours of when they would be ready.
Cafe Réveille,Best place for a healthy lunch! Amazing brunch on weekends.
Cafe Réveille,My favorite coffee shop near my place. Highly recommended ..
Cafe Réveille,Love this location. Same great coffee but a bigger kitchen.
Cafe Réveille,"Clean, friendly, good coffee. Hip atmosphere. We like."
Cafe Réveille,"Cool place, good coffee!"
Cafe Réveille,Great atmosphere and acai bowls.
Cafe Réveille,"Really good food and drinks, no idea why this place closes at 6:30pm in SF!"
Cafe Réveille,Love their iced green tea lattes made with almond milk.
Cafe Réveille,Really solid brunch selection and of course great coffee
Cafe Réveille,"Not the most unique menu or the most creative. But certainly, the variety is appealing."
Cafe Réveille,"Awesome ambiance, very bright and delicious healthy menu."
Cafe Réveille,Great coffee. Good environment. Friendly staff.
Cafe Réveille,"This particular location, not sure what's ""wrong"" with it, but the locations in North Beach and Castro feels less sterile."
Cafe Réveille,"Food was great, we especially loved the Chia Pudding!"
Cafe Réveille,Pricey but good. Kombucha wasn't worth the $5
Cafe Réveille,Highly recommend their dirty chai! Good WiFi and great place to work
Cafe Réveille,Friendly staff: 3/10 Coffee: 6/10 Hipster vibe: 9/10
Cafe Réveille,Delicious coffee and food!
Cafe Réveille,"The coffee is good, but overpriced is really the word I'm looking for."
Cafe Réveille,Amazing coffee!!! Our new favorite coffee shop.
Cafe Réveille,Good food reasonable prices. Nice breakfast
Cafe Réveille,"Best vanilla latte in SF, plus they play cool music"
Cafe Réveille,Amazing place to take a load off and just relax in a calm coffee shop.
Cafe Réveille,Great Coffee nice atmosphere and up and coming area
Cafe Réveille,"Waited 30 minutes for a Caesar salad, eggs and toast which weren't good."
Cafe Réveille,Acai bowl is really good
Cafe Réveille,My favorite coffee shop near my place. Highly recommended ..
Cafe Réveille,Nice coffee stop free wifi range of cakes and food
Cafe Réveille,"Cute breakfast spot, great food, coffee, and service"
