0,1
Cafe Réveille,Cool local café. Love it's style and food and drinks.
Cafe Réveille,Great coffee and snacks. They also roast here.
Cafe Réveille,"The food and coffee are average, I only tried the smoke salmon dish..."
Cafe Réveille,Great flavors and interesting combinations albeit on the expensive side of things
Cafe Réveille,"Over priced food, didn't taste good, rude staff"
Cafe Réveille,What a great addition to the Reveille cafes. This one does dinner as well.
Cafe Réveille,Had the falafel bowl to go - excellent!!
Cafe Réveille,Love their BBAA - beets bacon avocado aragula
Cafe Réveille,Great space with lots of natural light. Cappuccino on point.
Cafe Réveille,"The wifi password is   ""cafereveille"". without the quote's"
Cafe Réveille,Probably the best chilaquiles I've had in the city! 🙌🏼✨ …
Cafe Réveille,Quite slow wait time. Otherwise very good
Cafe Réveille,Amazing
Cafe Réveille,Limited brunch options.
Cafe Réveille,Nice coffee and atmosphere
Cafe Réveille,"Amazing dirty chai, friendly, helpful staff, clean, great location."
Cafe Réveille,Great food and coffee. Recommend
Cafe Réveille,Good food and coffee. A bit busy.
Cafe Réveille,"Clean expensive bougie place, macchiato pretty good"
Cafe Réveille,Clean bright space &tasty chow
Cafe Réveille,"Castro location is better, but overall still good"
Cafe Réveille,The only thing that is above average here is their prices! $6 for pour over!
Cafe Réveille,Bright modern style with good coffee & eats.
Cafe Réveille,Great espresso and great Acai bowls
Cafe Réveille,Expensive but fresh and high quality ingredients
Cafe Réveille,Their acai bowl is amazing!!
Cafe Réveille,Awesome food and coffee / tea!
Cafe Réveille,"Pure service, and rude staff, bad quality food"
Cafe Réveille,Delicious. Hipster. Downtown. Need I say more?
Cafe Réveille,Great coffee in an actual for-here mug.
Cafe Réveille,Great espresso. Friendly staff.
Cafe Réveille,Delicious coffee and food in Soma!
Cafe Réveille,Pretty cool little coffee shop in Mission Bay!
Cafe Réveille,"Great ambience, polite staff, awesome pastries"
Cafe Réveille,Lots of choices. Prices are only slightly cheaper than Philz.
Cafe Réveille,Very tasty breakfast with mushrooms.
Cafe Réveille,"Shashuka was great, does get busy"
Cafe Réveille,Exceptional service great coffee
Cafe Réveille,Friendly baristas and fun atmosphere.
Cafe Réveille,Good coffee and A place to work on a laptop
Cafe Réveille,"Food is ok, service is horrible..."
Cafe Réveille,Amazing chicken sandwich and atmosphere.
Cafe Réveille,Good vibes good food
Cafe Réveille,They no longer offer burgers
Cafe Réveille,Average spot that will curb your hunger.
Cafe Réveille,The breakfast burrito was fantastic.
Cafe Réveille,Beautiful space with great coffee
Cafe Réveille,Overpriced neighborhood cafe with mediocre food
Cafe Réveille,Just passed by it today on the way to the Bart station
Cafe Réveille,The best people and the best coffee!
Cafe Réveille,The Lavantine sandwich and burger suck.
Cafe Réveille,Cosy place for a coffee and a light meal.
Cafe Réveille,Some of the best coffee in SF
Cafe Réveille,My favorite coffee in San Francisco
Cafe Réveille,Good food
Cafe Réveille,"Pricey, no bathroom..."
Cafe Réveille,Breakfast sandwich is excellent
Cafe Réveille,Great coffee
Cafe Réveille,Cute cafe with great options.
Cafe Réveille,Wonderful breakfast burrito
Cafe Réveille,Nice decor inside.
Cafe Réveille,Great Steak Sando!
Cafe Réveille,The service is as weak as the coffee
Cafe Réveille,go to a small business instead
Cafe Réveille,Excellent coffee and breakfast
Cafe Réveille,Great breakfast!
Cafe Réveille,Very nice space
Cafe Réveille,Self served breakfast.
Cafe Réveille,Good for brunch
Cafe Réveille,Solid cold brew.
Cafe Réveille,Cool hip cafe :)
Cafe Réveille,Strong coffee and amazing coffee
Cafe Réveille,Love this cute place
Cafe Réveille,Awesome espresso!!
Cafe Réveille,Really good!
Cafe Réveille,Delicious and unique
Cafe Réveille,Too expensive!!!
Cafe Réveille,expensive
Cafe Réveille,Great service...
Cafe Réveille,Great espresso
Cafe Réveille,Shh. Its a secret!
Cafe Réveille,Bathroom cool
Cafe Réveille,Awesome coffee
Cafe Réveille,Perfect coffee shop
Cafe Réveille,Delicious!!!
Cafe Réveille,Amazing macchiato
Cafe Réveille,Best coffee and people!
Cafe Réveille,Decent coffee
Cafe Réveille,Good coffee
Cafe Réveille,Hipsteriffic
Cafe Réveille,"Good coffee, the best in Mission Bay in fact. But the prices for any meal are outrageous. The avocado toast or the chia are great. Recommended to go with friends to have a good time, but not often."
Cafe Réveille,Good açai bowl!!
Cafe Réveille,great acai bowls
Cafe Réveille,"Good Italian coffee, in a ceramic cup and accompanied by sparkling water. The environment is comfortable and relaxing"
Cafe Réveille,When was this area also captured by hihi? Breakfast was ok just expensive. I wish I could have written two lines of code. . .
Cafe Réveille,Great coffee. There are queues.
Cafe Réveille,for the good coffee
