0,1
Caffe Greco,"Amazing friendly and hard working staff, the decor reminds me of old cafes in Italy. It's a great spot for working or meeting as it's generally not busy/noisy. I wish the pastries, coffees and food were up to Italian standards of quality. They are ok but not great."
Caffe Greco,"Caffè Greco is my favorite place for a cappuccino in Little Italy. The baristos are hilarious and friendly, speaking to me in Spanish and Italian and making a killer cappuccino. There are tons of great places for coffee in the area, but I always go to Greco for the environment on top of the  caffè buonissimo."
Caffe Greco,"Great coffee, good people, good vibes.They've got more than your typical selection of coffee."
Caffe Greco,"Delicious tiramisu that beats away afternoon fatigue. Beverages were also good, speedy and friendly staff and nice cozy atmosphere."
Caffe Greco,"Couldn't believe the absolute lack of service and respect. Asked for the receipt which he reluctantly gave, than noticed they wanted to charge $7:00 for a medium coffee. Asked the server why they didn't have the prices? They guy got angry and returned our money and asked us to leave! Incredible! If you want a tourist trap an want to be screwed. Stay. If you want the same thing at 1/3 the price go across  the street to Stella Pastry, and you can pay with your credit card. Easy!"
Caffe Greco,"Good spot in the middle of North Beach. Cash only, FYI"
Caffe Greco,This is a must go coffee shop that anyone should visit. This old coffee shop make you travel in time with their unique and old style. I orderd an americano which was dark and strong as I like and my party ordered hot chocolate that they enjoyed. we ordered cannolis with our drinks and in my case it gave me a little of sweetness that went well with my bitter dark coffee.  The place is nice and clean and also you can enjoyed the outdoor tables to contemplate people passing around with their dogs.
Caffe Greco,"The worst coffee of my life. I don't know what it was, but I had ordered a Latte😐 …"
Caffe Greco,Went this morning to this institution caffe I knew years ago for a quick breakfast: ordered 2 eggs and ham over muffins and a almond croissant. Eggs where over cooked and muffin where hiding over a old piece of cheese. My croissant was maybe 2/3 days old and hard to chew on! Anyhow this place is going downhill
Caffe Greco,"Walked in to order food. They told me no more food, when the sign out say’s Served all Day"
Caffe Greco,"After trying nearly all the Canolli in North Beach, I do declare Greco is #1"
Caffe Greco,"The last time I was there, the employee picked up my pastry with his dirty bare hands.  Some of the staff could learn to be friendlier as well. The decor and ambience of the place are nice, but just make sure to watch when they go to serve you."
Caffe Greco,"CASH ONLY. But besides that, amazing food and coffee in this cute artisan coffee shop. Lots of ample seating inside and outside. Try the Salmon bagel and cappuccino! Lovely staff, and locals and regulars were treated like family. Great place to go!"
Caffe Greco,Definitely one of the North Beach’s staple..
Caffe Greco,Delicious tiramisu and great coffee that comes with friendly service.
Caffe Greco,They can't make a proper cappuccino which is so basic. Way too hot to drink+ bitter taste+ won't make a breve+ no foam. Very disappointing.
Caffe Greco,Coffee was great. Panini had to be abandoned because they only take cash!
Caffe Greco,"Such a charming cafe! Tuck away in the city, and be immediately transported to Italy. Great food. Great vibe. Bring a book and just be."
Caffe Greco,"Great coffee. Great location right on Columbus. I've been going there for 20 years and the place retains its charm. Sitting outside definitely brings back memories of old Europe. Between the great coffee, excellent cakes, people watching, historic buildings across the street and outside air, the place has the whole package. The staff was very friendly and attentive to boot. I believe it's still cash only."
Caffe Greco,The Cannili n café latte was fabulous n delicious! I love North Beach at night. Viva Italy 🇮🇹 n Mona Lisa 🧡 …
Caffe Greco,"My cappuccino and my son's cake were good. My friend's wife's chai latte is more latte, less chai. The batista was very helpful though."
Caffe Greco,Very yummy cheesecake. I liked the music playing in the cafe. I saw people working on their laptops also.
Caffe Greco,"This place is cash only. Beware of frozen tiramisu. I was so excited to try their desserts, but their tiramisu had frozen ladyfingers layers with pieces of ice, and cream was basically tasteless. Frozen biscuits and melted cream do not make a good combination neither in texture, nor in taste."
Caffe Greco,"Just started coming here earlier this year because my favorite cafe closes a lot earlier than Cafe Greco does. The staff are very friendly and most days welcome you with a smile. I come here because they're one of the few cafes that serve the best cakes in North Beach! I love their Brasiliana and the Tiramisu is great too! The coffee is not as strong as I like but it's okay, especially with their cakes!"
Caffe Greco,Casual and small. A nice place to relax and have a quick snack
Caffe Greco,The food was very good and there were many choices that were yummy
Caffe Greco,Simply one of the best double espresso in San Francisco.
Caffe Greco,There is no way to call it America !!!!! While sitting here you feel full enjoinment with very and very delicious food !!! IMPRESSED !
Caffe Greco,Really good breakfast in San Francisco
Caffe Greco,Very friendly and cozy. Food was great too!
Caffe Greco,This is a nice Italian cafe in North Beach. Spacious seating area with free WiFi and outlets. I had the latte and shared a cannoli with my girlfriend. Everything was delicious. Italian music and oldies are serenading the patrons at this shop. Friendly staff. Cash only. Nice ambience in this place and great place to spend some time on a lazy Sunday.
Caffe Greco,"Great coffee, good people, good vibes.They’ve got more than your typical selection of coffee."
Caffe Greco,Great coffee but the best chocolate tartufo i ever had!. Pls keep in mind they only take cash. However there is an atm
Caffe Greco,"Had a late night coffee and dessert here! Loved the atmosphere. Heads-up, it's cash only!"
Caffe Greco,"CASH ONLY: Good food and really cute outdoor seating. Real reason to come is for the coffee though, good variety and well brewed."
Caffe Greco,"Italian cafe with drinks, salads, coffee and more in the bustling centrer of North Beach. Be prepared to self serve by ordering inside/taking outside to your table. Lots of folks walking by for a quasi- see & be- seen atmosphere."
Caffe Greco,Nice spot to sit down for a coffee or snack in North Beach. They had good nougat though a bit overpriced.
Caffe Greco,Great place to enjoy a coffee outdoors. Snacks are delicious  It's a nice place to relax and do some people watching. No one hurries you which is great. It's a good meeting place. Price is not above the average in the neighborhood.
Caffe Greco,Good if you're Greek.
Caffe Greco,Tiramisu is delicious! Friendly staff
Caffe Greco,Always superb coffee and yummy Tiramisu
Caffe Greco,"The Tiramisu was alright, a bit on the soggy side. The affogato was nice. Great place to hang out with friends."
Caffe Greco,Great atmosphere.  Friendly staff and excellent blackberry Cabernet gelato!
Caffe Greco,"Nice n cozy place with amazing selection of pastries,  Gelato, beverages and italian desserts."
Caffe Greco,The best cannolis I've ever had and the cappuccino was amazing....
Caffe Greco,"Stopped by for dessert on a weeknight. We had the ricotta cheesecake and a cannoli. They were both very good. The coffee was OK, not great. Steamed milk for the latte was not quite hot enough. Flavors were well balanced, textures were good. The cannoli is filled when you order it. This is an excellent way to do it since the shell gets soggy if it sits with the filling in it. Nice touch. Overall, this is great little spot for dessert in North Beach."
Caffe Greco,"I'm a little bewildered that I've been coming here for over a quarter-century and somehow have never left a review; mind blown.  Caffe Greco is a North Beach institution, and one of the reasons that I wanted to live in this San Francisco neighborhood. It exudes the same vibe I recall from spending time in countless neighborhood cafés around Italy, from Cortina to many Roman piazzas.  The pastries and cakes are varied; all I've tasted have been satisfying.  Their coffee drinks — usually a macchiato or cappuccino for me — have always been a delight; my ""madeline"" if you will. In these pandemic times they're served in a paper cup rather than the heavyweight ceramic of better days, but this too shall pass.  I'll be heading back to North Beach shortly, and Caffe Greco will get another visit. Friendly and helpful staff just drives home the deal."
Caffe Greco,Fantastic panini and coffee! Owners are very friendly also. Great outdoor seat area.
Caffe Greco,"My run too when all the Cafe's have closed down in North Beach District. I like their hot chocolate and chocolate cake, but there mochoas are good too...  Nice front patio and parking let for hanging out and having a smooth cup of jaw dropping coffee..."
Caffe Greco,"Cash only. Scrumptious paninis. The staff are very fast. I was here on a busy day, and my fabric was ready in less than two minutes. It came with a nice side salad. Decent selection of beer and wine fir such a small place. They have outdoor seating available and a whole other room with more tables through a door by the main entrance."
Caffe Greco,"Very nice staff but watch out, its cash only-amazing tiramisu and a nice place to work, extra seating in the room next door. Have breakfast+lunch food, outside seating, cakes and some alcoholic options."
Caffe Greco,"Note quite a replacement for our beloved Cafe Puccini which burned down, but very good."
Caffe Greco,"While strolling North Beach, this spot can’t be missed"
Caffe Greco,"Great place to enjoy coffee and dessert.   A bit pricey,  but not exorbitantly so."
Caffe Greco,"The only good thing about this place is the brand of coffee they use for their drinks. The atmosphere is that of an old coffee shop that's unmaintained and dirty. The baristas are disorganized and take too long to fix drinks, there are no napkins around, no individual sugar packets but sugar in bulk that you spoon in your coffee with the same spoon as every customer, and a few spoons that are used and thrown in a container with water that everyone uses - very unsanitary. Desserts are not fresh and they taste like cardboard. Not a good experience."
Caffe Greco,"In an area full of authenticity this place stood out as being functional (I am a fan of Illy coffee but it's everywhere in SF) but highly unauthentic, especially with a waiter who didn't know what a cannolo was.  The place itself was pleasant but if you want as genuine experience as you can get I'd suggest picking somewhere else."
Caffe Greco,"This place serves some great Italian desserts and espressos, and it's busy throughout the day. The staff is very polite. Some have said that it's a good place for studying or working, though I contend that it's too noisy and bustling for that. Instead, sit outdoors or by the window to watch the passerby, while you savor your espresso, your tiramisu, and the presence of your companions."
Caffe Greco,"Really enjoyed their late night atmosphere. We sat down for their cafe latte and a piece of tiramisu, which were both really food. There was line that moved pretty slow but the service was friendly. The price is standard for the neighborhood and seating was easy to get."
Caffe Greco,Always LOVE Caffe Greco! One of our top 3 espresso caffes in North Beach. I'm wheat flour allergic and the great staff helps direct me to what I can eat!!
Caffe Greco,I love coming here on Sunday mornings before going to the St. Francis of Assisi church across the street.  They have patio seating on the sunny side of the street so you can enjoy the warmth while people watching.  My go-to breakfast is their granola with yogurt and fruit and a medium cappuccino.  The granola is tasty and crunchy and they top that with creamy yogurt and sliced strawberries and bananas.  YUM!  I've also had their croissants and tiramisu - both were delicious.  The waiters are always so nice and helpful.  Great service.  Cash only.
Caffe Greco,My favorite coffee shop in San Francisco. It is my second favorite coffee in SF. It is a shop that offers plenty of seating inside and some outside patio too. Their coffee is delicious and you have to try their desserts.  Added bonus because they offer a non-dairy milk for those who are lactose-intolerant.
Caffe Greco,Great spot for breakfast or a late night tiramisu. Good quality food and friendly service.
Caffe Greco,"Wonderfully authentic espresso spot. Got a quick, quality espresso and a small covered table outside to enjoy it on the sidewalk and people watch. Great spot."
Caffe Greco,Absolutely delicious cappuccino and caffè latte
Caffe Greco,Wonderful  breakfast and coffee choices.  The pastry choices were good too.  Good prices for our family of five.  The staff was friendly and the service was great.  I would definitely come here again.
Caffe Greco,"Great place, good portions. Remember to bring cash to pay there."
Caffe Greco,Great local spot!  Had a delicious hot chocolate & some panforte.
Caffe Greco,"Cash only cash only cash only! This is one of the few original coffee shops in North Beach. Good quality coffee and pasteries, excellent European style cafe with plenty of seating. Reasonably quiet as well, did not have to yell my order, like we did at cafe triest."
Caffe Greco,"Nice location, coffee is ok. Nothin special"
Caffe Greco,Very delicious& Rich in taste🥰 …
Caffe Greco,"My favorite café is the entire world so far. I have been coming here for over fifteen years and every visit is just as good as the first. Perfectly prepared cappuccino, espresso, and coffees. Paired with Italian desserts and treats, with WIFI and outdoor al-fresco seating. Excellent for conversation and people watching. Prices are worth every penny. Highly recommended."
Caffe Greco,I love Cafe Greco. This was an old school meeting spot for when some  friends showed up from out of town. Hasn't really change one bit. Love the coffee and sandwich's are on poin💯❤ …
Caffe Greco,Caffe ' Greco it's like a very strong warrior. It gets better and better with time. Great place for a magnificent espresso. Brings back wonderful memories. 😉 …
Caffe Greco,I was here 4 months ago and had an excellent cup of coffee and house made tiramasu. It a very nice place to stop on my rest day when I was bikepacking the west coast!
Caffe Greco,"Greco has probably been around for longer than you’ve been alive. They have consistently good pastries and good coffee available all day and a good bit into the night, but unfortunately that has made them into a bit of a north beach staple. Expect a crowd. If you manage to find a time in which there isn’t one, take advantage of it."
Caffe Greco,"What a Cafe! Fun staff, and the best egg and cheese on a croissant I've ever had!"
Caffe Greco,Nice cozy cafe with amazing desserts
Caffe Greco,"Friendly staff, decent setting. Ok coffee if you like dark roasts."
Caffe Greco,Nice and cozy place on columbus ave. Seating arrangement was good. Staff was super nice and quality of food was amazing. We ordered egg and cheese sandwich with crossaint. Cappuccino was well made.
Caffe Greco,"Lots of seating for a cafe and has wifi. Also has outside seating which is great to  people watch in North Beach. Decent tiramisu...light airy, not too sweet or cakey but could use more rum and espresso in the ladyfingers. But it could have been because I got the corner piece which may not have gotten all the soaky goodness."
Caffe Greco,They only accept cash but expensive I feel but it is good.
Caffe Greco,"great portions, good coffee. the best part is the people watching!! they have these floor to ceiling windows, and columbus is just a very popular street. they've also extended the outside seating, so you can be indoors or out. love coming here with friends or by myself."
Caffe Greco,"Good ambience. I enjoyed the cider Abe cake. … they hide their WIFI info, and the customer service is ok at best."
Caffe Greco,"Decent coffee house with ample space &  seating in two rooms. Enjoyed their lattes & mochas-which are served in nice tall glasses. They carry a variety of italian pastries & cakes such cannoli, tiramisu, & sacripantina. Also, they sell Illy ground coffee in their signature cans. Overall a good spot to have a cup of coffee after dinner. Cash only!"
Caffe Greco,AUTHENTIC Italian coffee house with baked good and gelato. Only accepts case but great place to sit in Little Italy. Recommended.
Caffe Greco,I had a biscotti and an espresso. Awesome. Great service.
Caffe Greco,"Service was fast and members were nice. Coffee was just ok, a little on the pricey side but what can you expect from SF, right? P.S.: they only take cash."
Caffe Greco,"Salad had more flavor than my Chicken Zucchini Panini. Also, bummer they don't have waiters, U have to get up and go inside to counter each time you want something..."
Caffe Greco,"Easily the worst coffee I've tasted in years. Asked for decaf but it hit me exactly the way I didn't want to leaving awful aftertaste. Even cream was weak. They didn't have half-n-half, just milk and it was pretty diluted. Not coming back"
Caffe Greco,"Best coffee in the city! My Father who was a cop in SF for over 30 years and his buddies would go here everyday for coffee on their beat. Been going here since I was a little kid. Great service, great atmosphere and delicous coffee.  My personal reccomendation is the Greco Grande *"
Caffe Greco,This cafe is located in little Italy. The decor was inviting. Customer service was friendly. Their cuppicino was superb. My friends sat in the side walk patio and  enjoyed the cool weather.
Caffe Greco,Best café latte ever!
Caffe Greco,Good coffee. Great experience cruising the North Beach neighborhood. We enjoyed a traditional Italian dessert I can't find any where else. People watching is great here
Caffe Greco,Tiramisu was too soggy :(
Caffe Greco,Only accept cash. Very bad.
Caffe Greco,Charming looks but cappuccino was watery and tasteless and candle filling tasted like whipped cream. Lemon cake was good.
Caffe Greco,"Good Illy coffee, beer, wine, great atmosphere.  Always busy when I get here sundayS arroua 6:00, but always a seat.  Pastries are not the best.  I wish they would find a better bakery."
Caffe Greco,"Always a great experience, coffee, service"
Caffe Greco,We were greeted by a very friendly man who made the best cappuccino. The food was delicious and the almond pastry was excellent!
Caffe Greco,"no longer quite the place where San Francisco gathers, but still a spot where you can have a coffee and talk with a friend not a laptop ghetto."
Caffe Greco,"Our capuccino was burnt, which was pretty disappointing considering that's why we came. My husband was a barista and said it tasted like the beans were ground too course. The chocolate cake was great."
Caffe Greco,Cozy and authentic. Made great sandwiches and espresso that reminded me of Europe.  Lots of locals were there and plenty of tables to sit and unwind for a little while.  Nice staff and on-par prices.
Caffe Greco,Had a delicious hot chocolate here.
Caffe Greco,"The frothy cafe au lait transported my friend back to Paris! The sfogliatelle filled authentically with slightly sweet, orange-flavored ricotta made me want to order another.  With plenty of seating indoors and out, we enjoyed a relaxing Sunday morning breakfast. Quick, friendly service. Delicious food.  If only I lived here, I would be back to try their gelato and tantalizing desserts."
Caffe Greco,"DO NOT GO HERE FOR PASTRIES.  Go to Mara's (it is a few blocks away) if you want a Italian Pastry.   The coffee here was good, but that is hard to mess up.  We had the Canoli's from Greco and they were absolute dog crap.  You can tell the person who made them had no idea what a real Canoli tastes like."
Caffe Greco,"Great gelato. Wanted to try coffee, but didn't realize it was cash only- there was a sign near the register with the WiFi, and after we were told cash only, I looked back a moment later, and it had been turned around to announce cash only. Would have been nice to know before going in."
Caffe Greco,An Italian style coffee bar of superb quality. Great choice of coffees and pastry at reasonable prices. Nice staff. Definetely a recommendation in North Beach.
Caffe Greco,"Great coffee, excellent pastries and a wonderfully friendly staff! Oh and a nice cafe setting."
Caffe Greco,Nice food and coffee. Expensive but tasty
Caffe Greco,Caffe Grecco is a great place for a good cup of coffee and they also have very good hot chocolate. The variety of pastries is very low but they do have so good desserts. The service is very good and I would definetly reccomend going to it after dinner for a nice sweet treat.
Caffe Greco,"I just don't understand ""cash only"" places this day in age....really inconvenient and if someone in our party wouldn't have had enough cash for all of us than we would have had to go somewhere else. Decent breakfast, coffee and mimosas though."
Caffe Greco,Great place to enjoy a cup of coffee with delicious food. I had pouched eggs with salmon  suggested by Juan the cashier and it was divine. Definitely coming back!
Caffe Greco,"This spacious caffe in the heart of Little Italy has an ambience that makes you dream of the mediterranean sea, warm spring days and just good coffee. The experience is complemented by good wifi and lovely music. Would totally come back here for work (tables may be a bit too small for 2 laptops tho) or to just relax with a friend."
Caffe Greco,"Ordered tiramisu and coffee and the tiramisu was top notch, all flavors balanced and similar to the one I had in Florence :)"
Caffe Greco,"*Cash Only* Still my fave place to crash and plow through an inbox or catch up on reading. Lots of tables for heads down work and Illy espresso drinks in addition to a nice gelato and pastry selection. Don't don't miss the home made tiramisu!  For nice days, take your coffee out to the sidewalk seating and take in the North Beach vibe. Or, if you've already satiated your inner bookworm from a purchase from legendary City Lights Books down the street, no better way to page through your new literary acquisition than over a warm mocha at one of Greco's tables."
Caffe Greco,"I got the chai latte, and it was incredible. The creamy texture and light flavor were perfect to distract from my date that was tanking at the time. I'll be back again to try the tiramisu."
Caffe Greco,"Loved this place back when $9 pasta was a luxury, and still love it for nostalgia's sake. If you're looking for fine dining or in town for just a few days, go elsewhere, but locals should all give Greco a try."
Caffe Greco,"This is a ""Must visit"". Great coffee and friendly staff. It's almost like I stopped to visit with friends and family. I will return every time I'm in town. And that tiramisu was simply out of this world!"
Caffe Greco,"Great coffee.  Took home a bag of homemade macaroons, but they were dry.  Super nice staff and owner."
Caffe Greco,"First of all, cash only, so be sure to have it. Great cafe for drinks, we got a cappuccino, a blackberry cabarnet gelato which was amazing along with a Braziliana which is chocolate cake soaked in expresso with cream which was great. Great atmosphere as well as a friendly staff."
Caffe Greco,"What a great little piece of Europe. Loved everything from the ambience to the mind-boggling array of options.  The price is pretty decent too, considering the neighborhood and how upscale this cafe is. A break from America for a bit!"
Caffe Greco,"Espresso (Illy), which I almost always drink black, was up to snuff. However, the volume of the double shot was perhaps a bit excessive. Service at the counter could be improved, as a customer ordering directly from the barista I didn't feel very welcome."
Caffe Greco,"Great Cafe Mocha, the best teramasu I've had. Ham and cheese crucent good."
Caffe Greco,"Lots of seating and decent tea and coffee. Be sure to browse the dessert case! Seating is available outdoors too, even on rainy days as they have a canopy above the sidewalks!"
Caffe Greco,"Perfect coffee, perfect croque madame (they refer to it as poached egg panini). Best place to eat a yummy breakfast without making a fuss.  The place is really casual and cash only"
Caffe Greco,"Best thing here is their latte. The tiramisu is amazing as well. Just to cap it all off, the gelato was amazing. Plaenty of plug points for you to work on your laptop. My favorite cafe in North Beach."
Caffe Greco,"Cafe Greco is a great local place  for a cup of coffee. However, it does not offer very many pastries. The decor is good though, as it offers great inside and outside seating with a view."
Caffe Greco,Old school cash only charm with rare late hours for SF let down by subpar espresso and dated dining
Caffe Greco,"I cannot visit San Francisco without stopping by Caffe Greco for some coffee and dessert. If possible, I'd park myself in a seat there and stay the entire day, working my way through the dessert menu and drinking cup after cup of excellent coffee."
Caffe Greco,"Delicious coffee, and yummy pastry treats. Cash only, prices are fairly reasonable. My favorite cafe in Little Italy!"
Caffe Greco,"Go for the tiramisu and cannelloni! Just go... you'll love it! Oh...and don't forget a latte, too. Wonderful atmosphere makes you feel like you're back in old San Francisco."
