0,1
Caffe Greco,My favorite coffee spot in SF.  Carlos and the team run a great operation.  I go there every time I visit the city.  Coffee is high quality and the menu items are special.  Try the bagel w/ lox.  Seating on the sidewalk on Columbus Ave is great for people watching.
Caffe Greco,"I've been to this cafe about 3 times in the past year. I wish I lived closer and would definitely visit more often if I did. This last time, I wasn't sure if they would be open since it was new year's eve, but I still wanted to check, so my boyfriend and I went. They were open on new year's eve! I got my hot chocolate and carrot cake (someone took home the last 2 slices of tiramisu while we were in line.) Really nice spot to go to when alone or with friends or after dinner while on a date. Just make sure to have cash with you."
Caffe Greco,"My husbands favourite coffee place in SF, such a great vibe. Yummy tiramisu and cannoli"
Caffe Greco,"This was a perfect spot after a day walking around and exploring the city. Got an affogato, Italian soda and a dessert. It was exactly what we needed. Perfect place to recharge and relax. I’m definitely coming back."
Caffe Greco,"Quite a nice spot for a coffee or tea along with some quick bites. Particularly on a cool evening, it's a perfect respite to warm up and keep your chats going. The selection of drink options is solid though a few more snack and dessert options might be nice."
Caffe Greco,Stumbled on this spot on our way to the water. Feels like you’ve stepped into Europe. Buzzy atmosphere with a warm neighborhood feel. Breakfast bagel was delicious! Delicious and simple but somehow elevated.
Caffe Greco,amazing food and service! the inside is very pretty and chill! 10/10 place definitely recommend it!
Caffe Greco,"The coffee is delicious here, one of the best tiramisù’s in my life I found it here"
Caffe Greco,"Went there 3 times on our 5 day trip... Either just to enjoy a coffee and dessert or for a delicious breakfast sandwich, staff was so friendly and attentive!"
Caffe Greco,Great breakfast and coffee. Service was fast and friendly.
Caffe Greco,Fantastic quality from the coffee too the biscotti cookies to the deserts. It's almost as if I was transported to Italy or somewhere else in Europe with the authenticity of the food. I can't wait to come back for more.
Caffe Greco,"Large cafe/brunch joint in the heart of Little Italy. Offers a variety of coffee, drinks and paninis. Fast free wifi, cash only. Their grilled cheese chicken panini was decent, nothing particular."
Caffe Greco,"Great place to grab a hot drink or a sweet treat. We stopped in after seeing The Illusionist show nearby. It was pretty popular and about 80% full inside and out with people at 9pm on a Friday. Mixed crowd if I had to guess. Some older locals with books and chatting it up which was so nice to see. And of course a bunch of tourists wanting a sugar or caffeine fix. (Not a tourist myself in this situation, but I got both!) They care about their drinks offering multiple options for substitutions like soy milk and almond milk for your drinks. Thumbs up from me!"
Caffe Greco,"They are not ADA accessible to start. I took my mum who is on a walker here because I always had a great time, but we were shuffled to a side area with the server giving  an attitude. We are then told it would be cash only which is ridiculous. With the North Beach Festival on I suspect the restaurant didn’t want to pay taxes as the event is a cash cow.  A shame that this has left a bad taste in a City that is known for inclusiveness. I will need to have a serious think before I go here again or recommend it to others."
Caffe Greco,I always enjoyed my hot drinks here and the ice cream was yummy. My favorite is the Hazelnut flavor. Thank you to their attentive staff that kept this place clean and tidy.
Caffe Greco,"the prettiest and coziest café in sf. the servers are all so friendly and nice. amazing coffee machine and the coffee is incredible, literally the best! but you can only pay cash, so bring enough money to try all of the amazing cakes and waffles"
Caffe Greco,Amazing coffee and fabulous cakes and tiramisu that words cant describe. Much better than the place down the street on the corner where the hipsters go. This is where the locals have coffee in the am. Great pastry shop right across the street also. This has been our daily am coffee stop this whole week on our vacation.
Caffe Greco,"We had the falafel plate and the spanakopita. Both were ok but really lacked seasoning - especially garlic. The humus was excellent. The kazandibi also lacked, needed more vanilla. The kunefe was quite good.  Not sure I’d go back."
Caffe Greco,"The hot chocolate here is phenomenal! They also serve it in some of the largest mugs I've ever seen a cafe use, so the price is well worth it. The desserts I've had - tiramisu and the coconut macaroons - are mouthwatering without being too sweet, and, again, you get fairly large portions, which helps justify the somewhat pricey treats. If you're looking for something sweet after a walk around North Beach or a few slices of pizza in Little Italy, I definitely recommend you stop by!"
Caffe Greco,"Large coffee menu and plenty of treats in the case. We shared a piece of cheese cake, slice of brasiliana and sacrapatina. All were rich with flavor, great balance and large slices. Today was cash only or we would have added a few more treats to share. Not sure if cash only is the norm."
Caffe Greco,"Great spot for a pasty and coffee, especially in the am for some people watching. Make sure you have cash!"
Caffe Greco,"I ended up having breakfast here twice during my stay at at nearby Washington Square hotel. The staff are amazing—friendly, courteous and helpful. The coffee was delicious. And the food was amazing. Highly recommend. They only take cash, so come prepared."
Caffe Greco,"I don’t leave reviews often but I live right around the corner…. Decided to swing by, and was pretty disappointed. Was $6 for mocha. I got it iced with oat milk instead of regular milk. They charged me like $1 extra for ice? It’s frozen water that’s free for them with an ice machine. They also charged extra for the oat milk. Coffee came out to no joke $9 and was maybe 12 oz at best. No chocolate inside either literally tasted like regular coffee.  Just felt like it's really not worth the more premium price."
Caffe Greco,"During my trip to San Francisco, I made two stops into Caffe Greco and would have made more if I had more time. This is the perfect spot to grab coffee, gelato, dessert, whatever you want in an atmosphere you can just sit, relax, and hang out in.  The first visit was in the morning just to grab some coffee. My sister and I grabbed two caffe lattes & my boyfriend ordered the white caffe moca. All were delicious! The white caffe moca is a little sweet for my liking, but the taste of it was certainly enjoyable.  We stopped in again a different night, as they are conveniently open late. We ordered three hot chocolates, a cup of creme brulee gelato, a cup of spumoni gelato, a slice of sacripantina cake & a slice of chocolate kahlua cheesecake. The hot chocolates were tasty. The gelatos were to die for! So creamy and flavorful and a prime highlight for us. The cakes were the only disappointment. We previously had sacripantina from another nearby cafe which set the bar extremely high on our expectations. The kahlua cheesecake was pretty dry and just fell flat for us. Not to fret though, we still loved this place & thoroughly enjoyed everything else.  One tip to note, and honestly, a big disappointment due to the inconvenience is they are a cash-only business so plan accordingly if you're going to stop in."
Caffe Greco,"We have been coming here for years, love the dessert and cafe selection. It's retained it's North Beach vibe and is the perfect spot to people watch, relax or come with family. It's a tradition that I hope to continue for years to come."
Caffe Greco,I came here in sweats because of a recent assault… I don’t dress up in the city anymore. Was clean and kind and was treated like trash here. Denied a bathroom after purchasing coffee and food and glared at til I left. Decent place if you don’t care how employees treat others that may not look like millionaires. Usually a lot of people reading books here… Otherwise there’s better options.
Caffe Greco,This place could be insanely good but the traffic it gets brings that potential down a notch. Definitely overpriced and only takes cash. It is a self service place so you're on your own. The cappuccino was ok and the tiramisu was good.  The location is what you pay for. Amazing.
Caffe Greco,"I'm a regular but not really satisfied - music is set and rarely varies.  Coffee is very good, but the food and dessert offerings are just okay and high priced.  Very few power outlets for laptop use and those are not always functional. No heat so in chilly S.F. this place is usually cold (bring your warm gear if you get cold easily)."
Caffe Greco,"I came for the Tiramisu, but their deserts looked so good, I decided to try their Sacrapantina and their Brasiliana. Both were really good, although I enjoyed the Brasiliana just a little more. Their coffee with steamed milk was really good too. The only reason I didn't give this place a full five stars is because the ambiance is very dated."
Caffe Greco,Recommended by friends and came by for the Tiramisu ($25 for 4). It is very creamy (some how like melted ice cream) -- Not sure why it is in such different from other brand but we were to told to put it in refrigerator for couple days to be the best.
Caffe Greco,"I didn’t eat any food here but had to write a review of the white hot chocolate because it was just that good! I had never even heard of it but it was so delicious and a must try in San Francisco. If you want a soda, the Greco Sunrise is also fruity and delicious!"
Caffe Greco,"Amazing place. My husband was here 20 years ago and it still the same tasty, friendly and nice."
Caffe Greco,"Lovely neighborhood cafe in North Beach. No fuss no frills, a good hang out place.  Great coffee, pastries, paninis, salads and breakfast dishes. Excellent service and reasonable prices. They have indoor and outdoor seating."
Caffe Greco,"Very nice place nice friendly people variety of deserts ,coffees and more … must try place in North beach I would definitely recommend .thank you"
Caffe Greco,Definitely tasted much better tiramisu cakes before!
Caffe Greco,"Amazing food and great service!! This is just an amazing place to go to at any time! Good breakfasts, good lunches, and good dinners! All in all, if you're near, stop by. It's great for a quick break."
Caffe Greco,We came for a latte and ended up with their AMAZING home-made ricotta cheesecake!! It was still warm from the oven!! To die for❤❤ We even went back the next day for another slice!!
Caffe Greco,Best macchiato that I have had in the US. The flavor was amazing and the temperture on point! My husband had the affogato and it was delicious too!
Caffe Greco,Does remind us of Italy when we visited this place. A tip would be to order a small cup of latte because the large size is too much.
Caffe Greco,Very cute Cafe located in little Italy. Beautiful details and a friendly service make a visit an experience. The coffee is so good. They offer waffles? Sandwiches and eggs.
Caffe Greco,"This is probably the worst latte I've ever had. It's like drinking flavoured water. Ordered with oat milk, pretty sure they mix water into it perhaps to save on oat milk which is ridiculous when they also charge an extra buck for alternative milks. Stay away from this place if you want to enjoy your coffee!"
Caffe Greco,"Caffe Greco's Affogato and Tiramisu are a match made in coffee heaven. Together, they deliver an unforgettable culinary experience that will leave you craving more."
Caffe Greco,Caffe Greco is a heavenly cafe that serves authentic  espresso drinks and pastries. Their staff is delightful and very welcoming. Caffe Greco is always a treat to sit and enjoy good coffee.
Caffe Greco,Latte was great but my Brasiliana chocolate cake was too sweet for me.
Caffe Greco,"When you make people stand in line, don’t decide tip for yourself. You can’t keep their due change and force it in your jar!! It’s wrong at every level. Remember it’s about service. Pay your workers and raise the rate if you are short on money."
Caffe Greco,Unbelievably good. I have found my happy place.
Caffe Greco,Coffee was excellent and the service was excellent. It's just really pricey. $7.00 for a 16 oz late is a bit much.
Caffe Greco,Great coffee! Service is kind and fun. We had Greco Grande and Cappuccino + Lemon Cake and Walnut Coffee Cake. Great atmosphere. Nice music. Would recommend. Planning to come back! Enjoy!
Caffe Greco,Afogato was delicious. Was hoping for tiramisu but they were out. The staff were very friendly. Nice outdoor seating available now.
Caffe Greco,"Frozen in time. Great place to work, grab coffee.. good hot chocolate. Staff is welcoming.!"
Caffe Greco,One of my favourite Italian pub cafes in San Francisco! They have delicious hot chocolate and cakes!
Caffe Greco,"Tiramisu is fantastic, along with a cup of their coffee au lait goes well together here.  Service can be very slow when busy.  Nice atmosphere to soak up."
Caffe Greco,"Cozy, chill atmosphere. Has wifi and bathroom. Ask the people at the front counter for the wifi password."
Caffe Greco,It's a great little cafe to enjoy North Beach and people watch.
Caffe Greco,"You know it’s gonna be amazing when they take cash only…. Good vibes in the second room for studying, and open late in SF? Instant 5 stars"
Caffe Greco,"The location is so stunning. Tables outside very european. I had a pastrami sandwich which was delicious and chocolate, good prices. I enjoyed outside with the sun."
Caffe Greco,"Nice spot for a coffee in North Beach. Tables on the sidewalk are great for people watching, the coffee is strong and well made (Illy brand). Servive was also efficient and friendly. Didnt try any of the food."
Caffe Greco,Must have the coffee. I got an oat milk cappuccino. The desserts look amazing!
Caffe Greco,"Reliable North Beach cafe.  Has an Italian cafe vibe.  The staff is friendly and welcoming.  Great for people watching, and reading.  Has an array of sweets to offer as well as coffee and sandwiches."
Caffe Greco,"You want to remember your trip to Italy ? A quick trip oversees with no luggage or passport ? Stop by this place, once you do, read this review again. My combo: espresso ( they use high quality fresh Illy beans, homemade chocolate biscotti, and the best for the end … “Sfogliatella” ( puff pastry with lemon filling )"
Caffe Greco,"A charming, cozy cafe/restaurant. I went here for dinner with a friend. We got a tasty black bean salad (although I thought it was overdressed it was still yummy) and the hummus avocado sandwich w tomato and sprouts.  The man (owner?) who rang up our order was super friendly and kind.  We ordered a slice of pie and he HOOKED it up with HELLLA whipped cream, it was so sweet (literally and figuratively).  If you want a friendly, sunny, tasty experience check this spot out.  p.s. the prices were decent, for San Francisco anyway. Good music playing, dub/reggae when we went"
Caffe Greco,Crave for Italian coffee and dessert. My white mocha..is very good. Cannoli...and Tiramisu..are one of the best I have ever tasted...very nice service..my wife love afrogato..my friends love their cappuccino
Caffe Greco,"Such a fun and central cafe in little Italy! This location includes authentic Italian coffee. We lucked out with the beautiful weather in February, so it's a great time to people watch."
Caffe Greco,Nice cafe with a large sidewalk terrace. Good for people watching while eating a panini and drinking a coffee/wine/beer. Reasonably priced for SF. Recommended.
Caffe Greco,Beautiful atmosphere and amazing staff. They only take cash so get those greens ready. They make an amazing chai latte and hot chocolate for the kiddies! Plays beautiful acoustic music. Would come everyday if I could.
Caffe Greco,"Great atmosphere, good coffee but they only accept cash."
Caffe Greco,"Snarky baristas here are as permanent as fire hydrants; don’t pee on them ;  the owner is a glad hander and back slapper ;  he thinks he is The Godfather whose soundtrack is played repeatedly. Other than this, this is a great place ! Try instead Stella bakery opposite this cafe ; convivial service with attention to detail on making cappuccino.  My favorite patron here sits outdoors and drags deeply on his perfumed cigarette with visible pleasure, his eyes blissed out. I want to smoke what he smokes."
Caffe Greco,Had a cake and cappuccino greco grande. Both were delicious and at decent price
Caffe Greco,Two large White Mocha Latte and two Cannolis and small bag of some sort of chocolate tip cookies $40+ only wish the cannolis were larger.
Caffe Greco,"Fast yet cold service, staff were blunt and not very welcoming. Coffee was very average, food was presented well however, egg white was under cooked, generally the food was underwhelming. Atmosphere sitting outside was nice."
Caffe Greco,"Had the eggplant panini, cappuccino, and ricotta cheese cake while sitting outside and people watching.  Delicious and relaxing."
Caffe Greco,"Cash only, but had the selection of Italian sweets and amazing coffee. Would go back just to sit in the sidewalk and people watch."
Caffe Greco,"Hands down the best tiramisu in San Francisco. Light, airy, the espresso flavor is not too strong. The Lady Fingers and mascarpone are soft and fluffy with lots of cocoa powder. Caffe Greco is pretty much open from early morning to midnight. Neighborhood Italian coffee cafe that has been around for decades. Time has stood here in a great way. The place, quality of coffee and desserts have not changed. If you can grab a table outside, grab it. It's like taking a mini-vacation. Great coffee, homemade Italian desserts. Your blood pressure will drop. The people watching here is awesome. Cash only. There is an ATM machine next to the register."
Caffe Greco,Stopped by to have a coffee and ordered a cappuccino and it was delicious. My wife and I went to Rome a few months back and it was spot on. Definitely recommend for authentic Italian coffee. They do not accept card but they do have an ATM in the caffe!
Caffe Greco,"Caffe Greco is my first stop in San Francisco every time I come to visit. Over the last 10 years that I have been going there, the tiramisu has never disappointed. I always order atleast a couple. This is as local as it gets, and is almost never filled with tourists.  I almost want to keep this place a secret but it’s too good to be kept hidden."
Caffe Greco,"The coffee is good (they use Illy for their espresso and Cafe Trieste for their brewed coffee). The dessert (cakes and ice cream) are just ok, so I would recommend not passing on the dessert. Come if you want to chill and relax sitting outside watching cars and people go by.  Cash only."
Caffe Greco,"I thought it was the most unique café. I had a lovely cappuccino with my family and we shared dark chocolate dipped biscotti and coconut macaroons. Delicious, nostalgic, and perfect."
Caffe Greco,Old school espresso/bakery/cafe in North Beach.  Highly recommended.  Indoor and street side seating. Busy but worth the wait.
Caffe Greco,"Not that Cafe Grecco isn't inviting enough on its own to warrant a stop, but we had to leave a 5 star review after having one of the most enjoyable mornings on our trip while here. The atmosphere, quality of coffee/food, authentic service, and location/outdoor seating is everything you'd want in a Cafe in San Fran. Whether you're a local or on a trip, this is worth the time to stop and enjoy yourself."
Caffe Greco,I unfortunately had already eaten so didn't partake of the food or drink but the people I was with seemed happy with everything. They did say everything in SF was much higher in price than other big cities they've visited.
Caffe Greco,This is a great place to come and hangout with friends or go alone and get some work done. I've done both and both times I've enjoyed my visit. The staff were very friendly and outgoing. The cappuccino foam was heavenly.
Caffe Greco,Great outdoor sitting area with views of North Beach night live. Affogato and dessert not bad at all.
Caffe Greco,"I love this place. Pastries are better than most one finds in North Beach, IMO."
Caffe Greco,"Italian bar in the Italian district, with a lot of guests. The pastries are good, as well as the coffee. One single espresso is 2.75 usd, but it is very good"
Caffe Greco,"It was not fancy coffee shop as I imagined , but the tiramisu and coffee were really great. It is easy to get a seat in  Coffee Greco, and it is CASH ONLY!"
Caffe Greco,"Cafe Greco is a unique experience, located in the heart a little Italy. Fabulous coffee great place to sit in people watch. Wonderful safe neighborhood ( disclaimer always safe when I'm there) My kids often did their homework utilizing very fast Wi-Fi. Great neighborhood coffee shop tell me what you think."
Caffe Greco,"I've tried a bunch of cafes in the area over the years and this place is hands down my favorite cafe. Lots of seating. Great for people watching. Coffee and desserts are delicious too. I used to live in the area so whenever I visit I make it destination to sit down, enjoy a cup of Illy and gnosh on gelato."
Caffe Greco,Friendly service. Noticed wife Japanese and said hello and thank you in Japanese. Great flavor in coffee and fast service. Nice seating near street.
Caffe Greco,"Super nice cappuccino, latte, and torte. I enjoyed the environment, too, including on-trend music."
Caffe Greco,Loved this cafe. The staff is friendly and welcoming. I just went ga ga over their coffee :) They do not accept credit cards only cash. A must go
Caffe Greco,Really good gelatos and fun place to come for a dare or just wirh family . Alot of music around
Caffe Greco,"This is a traditional Italian style bar: no trendy or modern design, no frills or long list of ""latte piccolo macchiato"" nonsense a la Starbucks...  Just plain simple amazing espresso, cappuccino and traditional deserts. Try the cannolo, the tiramisu or a nice affogato. You won't be disappointed."
Caffe Greco,Great place to stop for coffee and dessert in North Beach.
Caffe Greco,Food is not good here for the price . Also I found hair in my bagel ...disgusting! One guy at the counter also takes only cash...
Caffe Greco,Classic coffee shop at North Beach. Pleasant ambiance. Great place for people watching. Friendly staffs. Loved the Braziliana dessert. Relatively affordable overall (won't break the bank 😉).
Caffe Greco,The coffee was decent. The cafe is cash-only which was a bummer.
Caffe Greco,"A friend of a friend recommended Caffe Greco to me, I tried the croissant sandwich with mozzarella and tomato and it was buttery, flaky and outstanding. This sandwich and Caffe Greco have been seared into my memory and become part of my personal San Francisco experience."
Caffe Greco,We are in 2023 and the only accept cash… if you don’t have it they have ATM that cost 3 dollars for transaction.
Caffe Greco,"They don't have a terminal to pay, asked only cash It's not possible in 2023 to exist like that"
Caffe Greco,"Fave place in North Beach (where so many classic restaurants have closed 😞 ) for espresso and dessert or a glass if wine outside on a sunny day. ""Don't forget the Cannoli!"" …"
Caffe Greco,Worst Tiramisu i have ever had. It was watery with no coffee taste whatsoever. Felt like they used whipped cream instead of marscapone. How incredibly disappointing!
Caffe Greco,"Had the gelato sundae, two vanilla lattes and a slice of tiramisu. Great sundae. Decent lattes. Ok Tiramisu. Great atmosphere and open late. Great after a slice at golden boy around the corner."
Caffe Greco,Always fun coming in here and having a coffee. The workers here are always so sweet!
Caffe Greco,"I ate an omelet, was very tasty. Decent prices and very good service"
Caffe Greco,Nice cozy atmosphere and excellent quality coffee
Caffe Greco,Cash only :( Otherwise the ricotta was delicious and the coffee was decent too.
Caffe Greco,"Great cappuccino, mild, creamy and toasty. Beautiful day for a hot cappuccino."
Caffe Greco,Best Latte iced and hot. Get it in house with real cups. Sandwiches are amazing also!!
Caffe Greco,"before moving, my dad raved about the best gelato he ever had… chocolate gelato from cafe greco in SF. safe to say yes, it is one of the best. she is sweet and very much traditional chocolate gelato. make sure to have cash on you as they are cash only"
Caffe Greco,Incredible chai tea!!! Incredible creme brulee gelato! Beyond 5-stars!!
Caffe Greco,Their hot chocolate ♥️ And perfect if you wana spend a summer noon while reading a book. And the interiors are super vintage. Be sure to have some cash on hand. Cards don’t usually work.
Caffe Greco,"We had to lined up in the evening, when we got to the cashier found they did not accept visa or debit, just cash. There was no notice to find out the rulls and avoid waiting for a long time in the line. I think it was overrated cafe. The quality of the pastries was ok,not so good."
Caffe Greco,"Amazing coffee, even better desserts!"
Caffe Greco,Good coffee! They only accept cash.
Caffe Greco,Very delicious coffee & desserts .. friendly staff ... Remember to bring Cash with you to be able to order ... Little Italy
Caffe Greco,I think this cafe is a nice place. I really enjoyed the cheesecake and cannoli.The thing that concerned me was the bathroom it doesn't even lock but other than I think it is a nice cafe.
Caffe Greco,"Excellent coffee, decent ambient, but * cash only * which is a deal breaker."
