0,1
Caffe Greco,The probably best chocolate cake I ever had. When you go there make sure to have a slice. Its also a relaxed atmosphere.
Caffe Greco,Been going there since late 80s. Love that I see the same crew for many years now. Love Caffe Greco. Going business picks up during these troubling times.
Caffe Greco,"Either in the afternoon or an after dinner caffe Greco is really good for coffee/dessert while watching people pass by. Usually packed with angry older Italian men arguing over something (in a cute Italian way), tourists and couples. Sit outside for if you like people watching.  The coffee is good. Get the affogato and forget about the calories for a moment. The desserts are also good here, Tiramisu and cannoli are great.  One of my go to cafes in Little Italy."
Caffe Greco,Enjoyed some delicious gelato and a cookie at the cafe seating out front on Columbus
Caffe Greco,"Wonderful cakes and coffee flavors. Brought overseas friend and we both enjoyed the outside sitting and the great coffee. Remember, CASH ONLY"
Caffe Greco,"Great spot to go after lunch/dinner for desserts, coffee, or tea.  Plenty of seating indoors as well as small tables with chairs outside on the walkway."
Caffe Greco,"Consistently tasty desserts and pleasantly pungent, strong coffee and coffee drinks.  Tables are kinda wobbly and it's neither a wonderfully comfortable nor intimate place, but it's got character."
Caffe Greco,"I only had an espresso machiatto but it was well done with just enough foam and a tiny, tiny hint of milk to round it up. The staff were helpful too."
Caffe Greco,Beautiful Outside seating is quaint and perfect for hearing and seeing the sounds of San Fran. Food was well prepared. Salmon was delicious. Thank you
Caffe Greco,"Great place with nice sitting area, but I came out a little disappointed with the Braziliana dessert: the cake part was dry, and even though creme was great, it was still FROZEN. :/"
Caffe Greco,"Wonderful little cafe with delicious espresso / cappuccino. Excellent service and a great selection of traditional and delicious Italian deserts (Tiramisu, Cannoli, Biscotti, etc...)"
Caffe Greco,***Try the Chocolate Bannana Bread Pudding*** & you'll become an Addict & get arrested :-) They only make 2 pans a day of it & when its gone its gone. Even saying you're the new Mayor (who is it?) won't get you a piece when its gone. Good sammies & great deserts.
Caffe Greco,Amazing. But bring cash!
Caffe Greco,"Obviously the closest official coffee shop you’ll get to Firenza, IT. Get a large cappuccino, not a small, you’ll thank me later bro/bra.  Only downer is CASH ONLY... it’s ok guys I’ll pay your taxes for the IRS because your coffee is so good!"
Caffe Greco,"Amazing gelato, I recommend the mint chip. The espresso is also really good. Definitely come here if you're looking for desert in the area."
Caffe Greco,"Good Coffee, Only downside is that its cash only, but come on, its a mom and pop shop, so what would you expect? Expect coming here for Great Coffee! Bring cash though"
Caffe Greco,"Great place with Illy brand coffee and some of the best desserts in the city. Gelato, cannoli, tiramisu, cheesecake, ect.  Nice seating outside as well. Ciao."
Caffe Greco,Excellent sidewalk cafe for Italian pastries and coffee. Lately I’ve been drinking a double mocha.
Caffe Greco,"Bad biscotti (stale?). We didn't know there could even be bad biscotti. Large, watery espresso shot in the latte made it dilute and watery (to be able to use less milk?).  If you go here, do it for the atmosphere."
Caffe Greco,Perfect for a breakfast ! Large choice of hot beverages and the pastries were freshly made and delicious
Caffe Greco,Classic North Beach Cafe experience.... the best coffee
Caffe Greco,Best cappuccino in the city. Nice outdoor and indoor seating. They speak Italian and Spanish here. Cash only.
Caffe Greco,Nice place. Food is tasty. Only cash but there's an ATM close to the caffe.
Caffe Greco,Seriously love this place. If u don’t consider coming here then u just missed the best Italian cafe there is in all of SF.
Caffe Greco,Excellent cappuccino and great fast service. The pastries look outstanding - I'm sad I'm to full to try any. Next time for sure
Caffe Greco,"Best cannolis ever! Everytime we come to San Francisco, we stop by this place and have never been let down. It's like a bit of heaven. One note..."
Caffe Greco,Amazing coffee. Great sweets!
Caffe Greco,"A real Italian-style coffee, the staff is super friendly and I warmly recommend a Greco Grande cappuccino and their Prosciutto-Caper-Tomatoes Croissant."
Caffe Greco,Owners are really nice  owners are really nice  Thanks ever body their taking care of my girlfriend the first time their.They mess up my girlfriends order they made it  right.i will be back again again thanks.you guys are the best coffe shop in north beach.😀😀😀😀😀😅😀😀😀😀😀😀😀😀. …
Caffe Greco,"Cappuccino and breakfast panini excellent, service fast, staff friendly and cheerful. A nice place to hang out with friends or get some work done."
Caffe Greco,"Cash only.  Couldn't buy what I wanted. Very expensive.  Crowded, limited outdoor seating."
Caffe Greco,The place for me was average... the waiter confused my husband's order even though we repeated it twice and the Gelato was more a regular ice cream.
Caffe Greco,Humble and not fancy. Hard working and polite servers. Great coffee and the Tiramisu is the best.
Caffe Greco,The best place for tiramsu and caffe latte.  No other place does it better than this place. The tiramus is very fresh and ready to eat.  Try it and you'll always come back for more.
Caffe Greco,"Easy spot for tea/coffee. Cannoli was fresh and crunchy; several gelato options, other dessert selection is limited."
Caffe Greco,Have a macaroon. They are fantastic.
Caffe Greco,I love coming here for the great coffee but avoid the Croissant
Caffe Greco,For the past 10 years Caffe Greco has offered the best affogatos and mocha's. Always consistently good.
Caffe Greco,"This Italian coffee place may be the best coffee in North Beach, and perhaps the best in San Francisco. Enough said. The place is CASH ONLY."
Caffe Greco,"Good coffee, good desserts, good ambiance. Cash only.  We love it."
Caffe Greco,Some dude peed in my coffee
Caffe Greco,This is a fab cafe. Busy but great coffee and the food was really yum. It had such a lovely vibe that I stayed for ages.
Caffe Greco,"Excellent atmosphere, the outside seating is reminiscent of cafes in Europe. Great place to grab a coffee and snack in Little Italy."
Caffe Greco,"After eating across the street at Calzones, I was in the mood for dessert and Caffee Greco caught my eye with the gelato. The gelato  and the cannolis really hit the spot."
Caffe Greco,This place was decent for its gelato. They only took cash. The restroom didn't have any toilet paper.
Caffe Greco,"Excellent service, great ambience, and delicious cafe latte. It's the perfect place to relax and enjoy a beautiful Sunday morning."
Caffe Greco,Their lattes are really good.Their cakes are delicious. The service is friendly. Parking is a bit tough.
Caffe Greco,"Panini sandwiches were OK, a bit greasy. Side salad was wilted and past its prime. Cash only (which is odd given the prices there)."
Caffe Greco,Ice cream was amazing ordered spimoni ice cream and large white chocolate cafe mocha. Everything was delicious and service was quick.
Caffe Greco,"Always one of my favorite places to go in San Francisco.  The service,  the coffee, and the pastries are all perfect!"
Caffe Greco,North Beach cafe. Wonderful coffee and pastries. Sidewalk tables. Charming San Francisco. Little Italy at best!
Caffe Greco,The coffee was amazing and the guy serving us was really friendly
Caffe Greco,"Nice place to relax, enjoy a hot coffee  served in a variety of ways along with a great assortment of sweet treats."
Caffe Greco,"good coffee, nice sidewalk tables, cash only"
Caffe Greco,"we visit this cafe often especially on the weekend. we love the cake and enjoy the coffee. it is a relaxing watching people,"
Caffe Greco,"The desserts and coffee where great, the people working there where super nice"
Caffe Greco,"Food was nice and the atmosphere was great.    Enjoyed the Greco Sunrise soda.  Cash only, no credit cards."
Caffe Greco,Best cafe experience at North Beach. The parklets decreased the ambiance but still good
Caffe Greco,"We had breakfast outside on the little sidewalk patio, our food and lattes were delicious, nice to sit and enjoy the busy surroundings"
Caffe Greco,Inviting and a lot of offerings. Seems popular with the local crowd. However they only take cash. Don't be caught off guard.
Caffe Greco,If you've been to Europe and miss that style of cafe... This helps :)  The crowd can get nuts on the weekend
Caffe Greco,Great Italian cappuccino! Good meals
Caffe Greco,"I've been going to this place since '90s, everything is great, with exception of coffee/espresso drinks tasting better in the old days..."
Caffe Greco,It’s the best breakfast/ brunch caffe in SF!!
Caffe Greco,"Proper coffee and patisserie. Great people. You lose one star because you only take cash. Come on guys, it's 2020."
Caffe Greco,Nice place to sit outside and enjoy an afternoon glass of bubbly wine.
Caffe Greco,"Good enough, but very expensive. Machiotto 3.50, just ok espesso. Cannoli was good but around 5 bucks."
Caffe Greco,$3 for an 8 oz glass of hot water with a basic twinings tea packet. Worse is they then want $1 for an extra 8oz of hot water.
Caffe Greco,Good vibe Average coffee Low service
Caffe Greco,"Cute cafe with amazing coffee, friendly staff, and a perfect outside patio"
Caffe Greco,I only get a chance to visit San Francisco every couple years or so and I always make sure to drop in here.  I love the latte.
Caffe Greco,"Good coffee, nice breakfast. Pleasant view from the window, or when you sit outside. Definitely a cozy place!"
Caffe Greco,Good espresso and great cannoli! Don’t forget your cash!
Caffe Greco,Get there early to get the hot scones!  Great coffee too.
Caffe Greco,Barista was careless. my espresso was clearlly over extracted. He also did not level the coffee before tamping it which makes coffee was not level inside.
Caffe Greco,"Expensive and mediocre. 17 bucks for 2 coffees. The people that work there are nice, but that doesn't justify the price."
Caffe Greco,Best coffee place in little Italy!!! You must try the cheese cake and cookies! The only downside is that is cash only!
Caffe Greco,Beautiful place for a cappuccino and biscotti at an outdoor table.  Mix of locals and tourists.  Cash only.
Caffe Greco,Incredible tiramisu!
Caffe Greco,"White mocha was absolutely incredible, and the gelato as well! Stumbled upon this place, but so glad we did."
Caffe Greco,The organization and designation for the ordering line could be better. My cappuccino came to me lukewarm. Good people watching.
Caffe Greco,Coffee was good. Cheese cake alright. Cash only! Really!
Caffe Greco,"Always great and fresh food.  Fantastic lox and bagel, great Greco grande cappuccino."
Caffe Greco,"Very welcoming, great coffee and pastries! When in San Francisco you will find this great place."
Caffe Greco,"Only had a coffee,  unfortunately it is a self service place."
Caffe Greco,"A couple of friends and I were lost in the city, then we met a Local Guide who introduced us to this place. Worth the visit as at the end of the night, we forgot we were lost in the first place."
Caffe Greco,I love this place and its peculiar atmosphere. Great option for a good coffee and people watching.
Caffe Greco,"Nice coffee place, great espresso and selection of tasty cheesecakes."
Caffe Greco,Great food. Great service. Gluten free options. Good place to bring your kids.
Caffe Greco,"Nice Illy Espresso & cappuccino, and the sweet of Cannoli is just appropriate! Really enjoy it!"
Caffe Greco,"If you want a real italian expresso in San Francisco, this is the place. I suggest also the Tiramisu, it's done with original italian recipe"
Caffe Greco,Best cafe in Sf
Caffe Greco,One of the best coffees and deserts in SF
Caffe Greco,"Good food and coffee with nice price, lazy worry free atmosphere, friendly smiling clerks."
Caffe Greco,"New restaurant with minimalist decor, staff that hustles, good food. Hope it fills it's tables"
Caffe Greco,"Awesome coffee, delicious cannoli, great staff and relaxing atmosphere."
Caffe Greco,Great cappuccino and tiramisu! Barmen are super fun and friendly even more if you speak Spanish😜 …
Caffe Greco,Nice paninis and drinks here. Enjoyed my stay while I sat and journaled. Bring cash only
Caffe Greco,"Great food, would've been 5 stars if they accepted credit cards."
Caffe Greco,great hot chocolate  and cake cool relato  many flavors
Caffe Greco,Macchiato was delicious. Lovely Cafe. Want to try the cheesecake next time.
Caffe Greco,Great people great coffee!
Caffe Greco,Cornetto not good. Really expensive
Caffe Greco,"Delicious coffee, nice seating outside and very friendly staff. The prices are very fair"
Caffe Greco,Service was slow and out door seated area was nice until some homeless person we don't know became agitated at the people seated there.
Caffe Greco,Love espresso here. Tiramisu is OMG
Caffe Greco,Nice place. We sat outside to watch the Italian Heritage Parade.
Caffe Greco,"Lots of great coffees, Italian sodas, desserts  and sandwiches. Outdoor seating is a plus!"
Caffe Greco,Best coffee in SF. I highly recommend a double macchiato enjoyed with a cigarette at a table outside.
Caffe Greco,"great food, coffee drinks and service!  and open till 11pm on weekends!"
Caffe Greco,"Great place, European atmosphere. Lived it"
Caffe Greco,Probably the best place for Italian desserts in SF! Their tramisu is to die for.
Caffe Greco,"Great coffee, great cafe, great staff and the cakes and pastries aren't to shabby either."
Caffe Greco,Best egg scrambler and chai tea latte I've had in a long time❤❤❤
Caffe Greco,Delicious food excellent service. Will definitely dine again when in town.
Caffe Greco,Lovely breakfast here!
Caffe Greco,"Delicious food, coffee and desserts are unbelievable good, great customer service."
Caffe Greco,Great service. Well made Greek coffee. Sidewalk tables are a great
Caffe Greco,"Cash only.  Popped in for dessert once -- pretty large selection, quick service, great taste for the price."
Caffe Greco,"Service was great,my cake was moist and not too sweet, restrooms were disgusting though"
Caffe Greco,Best place in town yo hang out with friends and family  for desserts and cpfee.😎 …
Caffe Greco,Smoked Salmon bagel was tasty as was the freshly squeezed orange juice but I was surprised at how expensive the total bill came to
Caffe Greco,"Awesome drink's and Italian pastries, great service latino team. Thanks all of you guys."
Caffe Greco,"Nice view of the street but the food is nothing special, not greek at all. Cash only."
Caffe Greco,"Great sandwich, cappuccino atmosphere and music! And nice staff."
Caffe Greco,"Belgium waffle with strawberries, bananas, and fresh whipped cream.. fresh squeezed orange juice... just amazing!"
Caffe Greco,"Favorite spot in SF, don't pass up espresso w/ Cannoli or Tiramisu"
Caffe Greco,Great cafe to do work or meet with friends. Great atmosphere. Great coffee.
Caffe Greco,One of the best traditional coffees in North Beach. Never disappoints.
Caffe Greco,"Great coffee, canolis are tasty too. Fair price. Hablan español."
Caffe Greco,My favorite coffee place in San Francisco. I love to sit outside and relax watching people walk by
Caffe Greco,"Wonderful airy atmosphere in an interesting location, great espresso, sweets, etc."
Caffe Greco,My favorite coffee house in North Beach! Carlos is the best barista ever!
Caffe Greco,Get there early if you want some fresh whipped cream on your hot cocoa.
Caffe Greco,"best coffee I ever had!! Thick foams, classic Italian style"
Caffe Greco,Desserts are great! Nice ambiance. Authentic Italian.
Caffe Greco,The afogato was very nice and the cappucino was ok  Great servce though
Caffe Greco,Interior is outdated. Cash only. Coffee is so - so. Place has a history but not the nicest.
Caffe Greco,Tiramisu and double African coffee. Yummmm
Caffe Greco,"Good coffee, ice cream. Very friendly staffs"
Caffe Greco,Excellent espresso and cappuccino and food. Service was great too.
Caffe Greco,"Great coffee and sweets, and above all great service with a big smile."
Caffe Greco,"Perfect european style caffe. A lot of differents caffes and chocolates, and they are bigsize! Great people too."
Caffe Greco,The best cheese cake and Coffee in San francisco. Love them to bits.
Caffe Greco,Cash only. The coffee is just great. Very cool touristy place
Caffe Greco,Lovely place ☕️
Caffe Greco,"Nice atmosphere and very friendly service, will visit more often."
Caffe Greco,Ice cream so yummy!
Caffe Greco,"Didn’t like the coffee here, ordered a soy latte."
Caffe Greco,Good coffee and pastries/desserts. Comfortable indoor and outdoor seating.
Caffe Greco,"Great place to have a cup of coffee and relax, read a book or watch people"
Caffe Greco,Italian coffee and great Turron. Good place to have breakfast.
Caffe Greco,"Coffee was great, good place to people watch"
Caffe Greco,"Nice place, good outside seating, good food! But, cash only!"
Caffe Greco,Super friendly and the tiramisu was fantastic.
Caffe Greco,Awesome coffee and awesome food! Outdoor sitting area is nice.
Caffe Greco,"Not good attention, you have to wait for too long and meanwhile you can't use the restrooms. Food is nothing great"
Caffe Greco,Good place for espresso drinks and gelato. Some outdoors seats as well.
Caffe Greco,The BEST espresso (illy) and cannolis in SF. Sit out front and people watch.
Caffe Greco,Good coffee. Nice outdoor seating. Friendly staff
Caffe Greco,Fabulous
Caffe Greco,Pricey for breakfast but it is San Francisco.
Caffe Greco,Great coffee and panini! The staff is so friendly
Caffe Greco,11 usd
Caffe Greco,Best cappuccino in sf for the 30 years I've been drinking them.
Caffe Greco,Good spot for coffee. The downside is that they take only cash.
Caffe Greco,Tiramisu was excellent. But my favorite was the Braziliana!!
Caffe Greco,Always come to this place for coffee when I am in SF.
Caffe Greco,i once had to poop here it was awesome!!!!
Caffe Greco,"Best Italian coffee in town! This is not the regular p** of Starbucks coffee, this is real Italian coffee culture!"
Caffe Greco,Nice coffe at little italy
Caffe Greco,The only caffe place u can smoke a cigarette with a good coffee
Caffe Greco,"Great service, delicious and authentic espresso drinks!"
Caffe Greco,Pretty decent dessert and coffee. The gelato was good.
Caffe Greco,A great hangout to enjoy an italian-style cappuccino in the heart of North Beach.
Caffe Greco,Afagado is the delicious drink which icecream then pouring the espresso over
Caffe Greco,This place is only cash
Caffe Greco,Gelato and cake. Loved it!! As usual!
Caffe Greco,"Some authentic Italian options hard to find elsewhere, though a bit pricey."
Caffe Greco,They were racist and unkind. Only cash can be paid and coffee and cake taste bad.
Caffe Greco,"Great chocolate, coffee and tiramisu! Cash only place"
Caffe Greco,Quick pit stop for a coffee and snack. Staff very friendly and happy.
Caffe Greco,Great place for a relaxing lunch
Caffe Greco,Nice small cafe we good gelato and nice pastries
Caffe Greco,Best Latte in city and desert is good too.
Caffe Greco,Excellent cannoli. Nice ambience. Takes only cash.
Caffe Greco,Enjoyed an espresso outside!
Caffe Greco,Lots of tasty cakes and a very delicious vanilla latte
Caffe Greco,Would be best place if they'd just get a Square machine.
Caffe Greco,"Great staff, nice rest stop and awesome coffee!"
Caffe Greco,"Great place, good snacks, nice people. Cash only!"
Caffe Greco,Classical world Italian Cafe with wonderful food and knowledgeable friendly staff
Caffe Greco,Very Good Tiramisu and they serve Illy Caffè
Caffe Greco,Good espresso. The local police force really loves this place
Caffe Greco,"We ate gelatos which were good, but the service was subpar and unattentive"
Caffe Greco,Amazing salmon eggs Benedict! Seriously. Nice atmosphere
Caffe Greco,Great service and tasty cannolo. It was like homemade.
Caffe Greco,Great hot chocolate!
Caffe Greco,"Good place for breakfast and coffee, waffles looks amazing."
Caffe Greco,Great espresso....desserts...atmosphere.
Caffe Greco,"tiramisu, gelato, anise cookies, cannoli and expresso. nothing to complain about here."
Caffe Greco,Its o.k
Caffe Greco,Always a pleasurable coffee experience.
Caffe Greco,They accept cash only.
Caffe Greco,Nice quite and spacious coffee shop in the middle of things
Caffe Greco,Delicious canolli and espresso! Friendly service
Caffe Greco,Great place for breakfast. Good coffee.
Caffe Greco,Really good Illy espresso and unique tiramisu.
Caffe Greco,Nothing tasted good! Waste of time and calorie!
Caffe Greco,The White Chocolate & Raspberry Gelato is absolutely delightful!
Caffe Greco,soooo good bro. the workers are good people.
Caffe Greco,Good coffee but the pastries were dry.
Caffe Greco,"Love this classic Italian Cafe, the real deal..."
Caffe Greco,Delicious paninis... My favorite the ham and egg breakfast panini
Caffe Greco,"Love the outside sidewalk seating, illy coffee!"
Caffe Greco,2017. San Francisco. North Beach. No credit or debit cards accepted.
Caffe Greco,Delicious Gelato and Chai latte. Friendly staff.
Caffe Greco,Cash only! Great cappuccino
Caffe Greco,"Long line, uncozy, stuff doesn’t speak English, food is not tasty"
Caffe Greco,A highlight of my trip was here. Amazing coffee
Caffe Greco,Cappuccino in SFO.
Caffe Greco,Nice place for morning coffee and cake.
Caffe Greco,Just amazing hot chocolate and tiramisu!
Caffe Greco,Great place to people watch.
Caffe Greco,Good coffee and very tasty Tiramisu.
Caffe Greco,Efficient friendly service. Good mocha.
Caffe Greco,Great illy coffee and yummy tiramisu.
Caffe Greco,Very cozy coffee shop with a quieter room in the back.
Caffe Greco,"Wow cakes and pastry here are really, really good!"
Caffe Greco,Great. Sweet Little Café. Good for Breakfast
Caffe Greco,You don't want to miss this place. Everything is perfect.
Caffe Greco,"Good sandwiches, but I think they are a bit overpriced."
Caffe Greco,best cannoli and Tiramisu on Columbus Avenue.
Caffe Greco,Great place for Italian pastries and coffee.
Caffe Greco,Had good coffee. Was crowded probably because of its demand
Caffe Greco,The pastry and coffee is delicious!
Caffe Greco,Excellent service the smoked salmon was amazing!
Caffe Greco,Just OK. Two better place on this street for coffee and desert
Caffe Greco,Nothing special really.  Sitting on the street was the only nice thing
Caffe Greco,Counterpersons are always great
Caffe Greco,delightful  and wonderful  coffee and treats
Caffe Greco,One of my favorite stops in little italy!
Caffe Greco,Great coffee and delicious cakes
Caffe Greco,Standard North beach cafe. Pretty good tiramisu.
Caffe Greco,Awesome chill cafe to relax and work with a cup of quality coffee
Caffe Greco,"Everything, desserts and coffee, were delicious, and served quickly"
Caffe Greco,High marks for excellent SF sidewalk viewing!
Caffe Greco,Ok.. gelato....will try coffee next time.
Caffe Greco,Great location but everything else was OK
Caffe Greco,Great cannoli! Not to sweet super creamy!
Caffe Greco,"Great  coffee, food, service and ambiance"
Caffe Greco,Good food and great atmosphere.
Caffe Greco,Amazing gem with great cappuccinos and pastries!
Caffe Greco,Didnt like their coffe and deserts
Caffe Greco,Cash Only.
Caffe Greco,Great place for coffee and dessert.
Caffe Greco,"The food was fine, but the service was slow and inefficient."
Caffe Greco,Nice coffee nice breakfast great service
Caffe Greco,Great place for a Italian desserts.
Caffe Greco,Great location. North Beach.
Caffe Greco,"Great staff, but limited and boring menu options."
Caffe Greco,Best coffee I've had in SF
Caffe Greco,Besides the coffee.....the pastries are excellent.
Caffe Greco,"Too loud, but good ambiance."
Caffe Greco,Great to just sit and drink a coffee.
Caffe Greco,Amazing pastries and espresso drinks.
Caffe Greco,Great coffee/espresso here!
Caffe Greco,Train station food at fine dining prices
Caffe Greco,Really.loved the oatmeal. Super yummy.
Caffe Greco,Bomb affogato! hands down the best.
Caffe Greco,Nice little Italian coffee shop
Caffe Greco,Best caffe in North Beach
Caffe Greco,"Great Italian coffees, sandwiches, and desserts"
Caffe Greco,Very nice place for breakfast.
Caffe Greco,Awesome canolli and iceds cappuccino!
Caffe Greco,Best cappuccino in North Beach
Caffe Greco,"Delicious tiramisu, great coffee!"
Caffe Greco,Really good tiramisu!
Caffe Greco,"Nice coffe, great espresso"
Caffe Greco,Magical
Caffe Greco,Love the tirimasu and affogato ... heavenly!
Caffe Greco,My go to spot whenever I'm in North Beach.
Caffe Greco,Best chai tea latte ever
Caffe Greco,great location.
Caffe Greco,"The smoothest, most amazing Cappuccino"
Caffe Greco,"The Best. Espresso, Gelato, Tiramisu... ❤"
Caffe Greco,Great Expresso. Has not changed in years.
Caffe Greco,"Normal, good, breakfast in north beach"
Caffe Greco,It is always great to go back.
Caffe Greco,Awesome coffee and dessert!
Caffe Greco,Amazing staff. Super friendly
Caffe Greco,Exellent the manager is so kindly and helpful
Caffe Greco,Great for meeting and people watching!
Caffe Greco,Amazing coffee and ice cream.
Caffe Greco,Nice cafe with delicious pastries.
Caffe Greco,Great service and food
Caffe Greco,Very good
Caffe Greco,Really nice and friendly staff.
Caffe Greco,Tiramisu was a little stale.
Caffe Greco,Perfect poched eggs and espresso.
Caffe Greco,Almond Latte and banana bread or an everything bagel
Caffe Greco,One of the best tiramisus!
Caffe Greco,I love the tiramisu.
Caffe Greco,Perfect thank you friendly staff
