0,1
Flywheel Coffee Roasters,"The blonde barista should learn a few manners. She was rude and unprofessional to me on one occasion and I let it slide, and then again today. I had been sitting for about ten minutes before she came up to me at a table and told me she needed to see my vaccination card, and also I needed to order something to sit here. I was waiting at a table for a friend to come, and half the cafe was vacant so it wasn’t like it was busy. There were three people to my right (all seated and not masked) and two to my left (also all seated and not masked). I was the only one she walked up to to inquire about proof of vaccination out of everyone in the cafe. She was not asking for proof of vaccination at the register either. She also said that even seated that I needed to be masked… and she said nothing to the other customers who were unmasked right next to me. I have no problems with masks whatsoever, but never have I been to an establishment since a pandemic started where someone who worked there said I needed to be masked while seated, and that I needed to get up and order something to stay there. And then to single me out among everyone else. Sad to say I will not be returning because of how awkward and anxious I felt afterward for being singled out and told I needed to buy some thing in order to continue sitting even though I was waiting for someone to join me. I felt so uncomfortable after this that I texted my friend who I was meeting there to not come, and we met up elsewhere. This had been a regular spot for me to come and do work, have a coffee, or something to snack on, but not after this experience. Plenty of other options out there with more hospitality. Good job!!"
Flywheel Coffee Roasters,Good coffee and fast wifi after you register with the temp email
Flywheel Coffee Roasters,"Modern, vibrant and unique coffee place with great vibes!"
Flywheel Coffee Roasters,Great if you just want straight up coffee. The ambiance was very hard-core coffee but the interior looks really cool. It's pretty pricey though.
Flywheel Coffee Roasters,"I stopped by Flywheel Coffee Roasters after a run and really enjoyed it. The cold brew was very good, but the real standout was the blueberry crumb cake, which was perfect. Flywheel is also in a cool area near Golden Gate Park."
Flywheel Coffee Roasters,Not many coffee options but their stuff is freshly made and tastes nice. They have a bunch of nice places to sit and work in along with power outlets and really nice ambience.
Flywheel Coffee Roasters,Cozy& nice place
Flywheel Coffee Roasters,Beautiful coffee shop right across the street of golden gate park! They have the nicest staff and great coffee. It's a nice working/socializing atmosphere - you can just be who you are there! Love it!
Flywheel Coffee Roasters,Great coffee roasters close to the Golden Gate Park.
Flywheel Coffee Roasters,High quality coffee. Great environment. I recommend.
Flywheel Coffee Roasters,Cool coffee shop with a great atmosphere. It’s very spacious and there is a cute covered back patio with seating! The location is great because it is right next to Haight and Golden Gate Park
Flywheel Coffee Roasters,"Friendly, fast service. Reasonably priced. Great coffee! Didn't order a pastry, but they looked good."
Flywheel Coffee Roasters,Coffee was good. Very limited menu. Ambience in the seating area below average
Flywheel Coffee Roasters,"One of my favorite coffee shops in the city. Their pourover is excellent, and they always have 3 choices for beans."
Flywheel Coffee Roasters,Awesome coffee place.  The coffee tastes great -- rich and fresh.  Great way to start the day.
Flywheel Coffee Roasters,Out Go-To place in Haight and we often purchase coffee beans here
Flywheel Coffee Roasters,Excellent coffee and a great environment to get some work done.
Flywheel Coffee Roasters,"I would like to Thank Flywheel for their compassionate kindness as I am a woman in my mid-years enduring a very lonely journey being homeless while a tooth that needs dental attention became severally infected and I was taking rest in the park near Flywheel for several days, very sick and in severe pain, Flywheel generously supplied for me, at no charge, ice to ice the swelling in my face and hot water for cup-a-noodles as eating was very difficult. Thank You Flywheel for your compassionate kindness that is more precious to me than all the worlds gold.  Your coffee is also quite good with being prepared with very loving personal care hand-brewed into every cup, Thank You."
Flywheel Coffee Roasters,Delicious pour-over coffee. One of the best tasting I've had.
Flywheel Coffee Roasters,"Cute and quite. Just what you need in a coffee house. The decoration is very soothing, they have a great little outdoor seating area. Happy to have them in the neighborhood."
Flywheel Coffee Roasters,"Great coffee/hot chocolate, good service and nice atmosphere"
Flywheel Coffee Roasters,"Great coffee, trendy crowd, and lots of pastries to fuel up on just before heading into the Golden Gate park on the west side of the street."
Flywheel Coffee Roasters,"Real good coffee, cold but chilled atmosphere, cool staff."
Flywheel Coffee Roasters,Great environment inside and fantastic location. Exquisite coffee on the pricey side.
Flywheel Coffee Roasters,Nice coffee and reasonablely prices. Staff were friendly and efficient.
Flywheel Coffee Roasters,Very good coffee.  Expensive.  Nice atmosphere.
Flywheel Coffee Roasters,"Love the atmosphere, staff are great and coffee is good.  Nice bit of backyard to sit in on sunny days."
Flywheel Coffee Roasters,I really enjoy the quality of their coffee.  They do a great job in following the social distance guidelines.
Flywheel Coffee Roasters,Great coffee and very nice people.  Try the coffee siphon if you have time.
Flywheel Coffee Roasters,"Nice variety of drip coffee, in a spacious but not too comfortable place. Food choices could be better and more varied. Definitely go here if you want dripper coffee, but that's it."
Flywheel Coffee Roasters,my favorite coffee shop around the park. Has amazing coffee...and espresso. The team is friendly and the service is right. You can tell their barista has some serious training and experience... perfect every time!
Flywheel Coffee Roasters,"I love pour single-origins from here. Always a great, insightful and warm conversation with the baristas; about all things coffee and the city. Loved being able to brew their beans throughout the pandemic!"
Flywheel Coffee Roasters,"Awesome coffee, great space, definitely visit if you're in the area and need a caffiene fix."
Flywheel Coffee Roasters,"Great shop, really friendly people working there. Excellent coffee and a great back patio for enjoying it."
Flywheel Coffee Roasters,"This shop was awesome ☕ The vibe was chill, the espresso was smooth & well poured, & baristas were AMAZING! Shout out to Keanu for the phenomenal hospitality & taking the time to make our day fun & filled with great coffee 🤘 Definitely will be back! 🌉 …"
Flywheel Coffee Roasters,Great coffee and atmosphere - sometimes gets too crowded and the seating is a little short.
Flywheel Coffee Roasters,Very friendly staff. Good coffee. Reliable WiFi. Great place to work out of. There is an extension across the road with outdoor seats as well.
Flywheel Coffee Roasters,"This place is an awesome coffee shop to just read. The bad thing about this place is that their internet is definitely not good. However, the cafe is a great place to think and read a good book for hours. The coffee is good and there is a bunch of seating. Great place to check out if you want to just chill and hang out alone."
Flywheel Coffee Roasters,Outstanding coffee. One of the top two in the Haight. Location next to the park is perfect. They also have a nice patio
Flywheel Coffee Roasters,Very good coffee and great location by th park.
Flywheel Coffee Roasters,Good local coffee shop near Golden Gate Park. Better the some of the other options nearby.
Flywheel Coffee Roasters,Awesome place to get good coffee! Vibe is great and would recommend. (Outlets and WiFi) (Cash only)
Flywheel Coffee Roasters,Don't really make use of the space they have. Only a few areas to sit with no power outlets. Service not great. Coffee average.
Flywheel Coffee Roasters,Great atmosphere in front of the park and good cappuccino. The staff is friendly. Would definitely recommend grabbing a coffee here on your way to the park.
Flywheel Coffee Roasters,Good coffee but limited food selection. Wi-Fi and a few outlets. Nice interior and small patio in back.
Flywheel Coffee Roasters,Good coffee. Super chill spot to hang out next to the park
Flywheel Coffee Roasters,"Great space, cool music, awesome coffee, high tables when needed and nobody bothers you. The perfect cafe."
Flywheel Coffee Roasters,Perfect cappuccino and good deserts!
Flywheel Coffee Roasters,"Really cool spot. Great coffee, the breads are good but the scones not so much. Highly recommend if you need a place to relax and work."
Flywheel Coffee Roasters,Flywheel has some of the highest quality pour over coffee in the city. And they even have a mural on the side of the building by the one and only @yonmeister
Flywheel Coffee Roasters,"Great coffee. Feels very spacious, and actually has WiFi. Like the back patio."
Flywheel Coffee Roasters,Great coffee. Nice outdoor seating in the back
Flywheel Coffee Roasters,The coffee was okay at best and you have to keep purchasing from the shop to extend your wifi every 2 hours... Seems a little cheap and I'm now regretting my $2 extra tip to them as I have to keep paying for items I don't want in exchange for wifi.
Flywheel Coffee Roasters,Love the coffee and vibe here! They also have nice juices to go.
Flywheel Coffee Roasters,"Best coffee I’ve had in America. This include New York City, Boston etc. do yourself a favor and get one."
Flywheel Coffee Roasters,Chill coffee house. Nice place.
Flywheel Coffee Roasters,Great coffee. Good staff. Nice snacks and space.
Flywheel Coffee Roasters,One of my favorite coffee places in sf. Definitely the best in the area and reasonably priced
Flywheel Coffee Roasters,This place is awesome if you are looking for a good place to work. There are plenty of electrical outlets and no one makes you feel like you have over extended your stay. Just buy their great coffee and tip well.
Flywheel Coffee Roasters,Nice place to grab a coffee and work. Lots of space and a cute outdoor area.
Flywheel Coffee Roasters,awesome hot latte ☕️😍👍🏻 …
Flywheel Coffee Roasters,Super cozy and opens relatively late (6 PM). Wi-Fi is fast too!
Flywheel Coffee Roasters,Great coffee. Yummy vegan pastries. Right across from the park!
Flywheel Coffee Roasters,I got a Nitro cold brew with almond milk from an extremely rude woman and it's so sour that it's actually undrinkable.
Flywheel Coffee Roasters,"Cool place with friendly, skilled staff. The one criticism I have is that they steam the milk too hot."
Flywheel Coffee Roasters,My neighborhood coffee shop that never ceases to amaze me. Very kind baristas and a nice selection of baked goods too. I love that it opens up so early during the week too.
Flywheel Coffee Roasters,This place has a great vibe and does real good coffees!
Flywheel Coffee Roasters,"Haven't been there in few months but I was regular last year. Staff was super friendly and professional, decor is inviting and coffee very nice."
Flywheel Coffee Roasters,Big fan of the espresso beverages here. Great selection of pastries and local pressed juices or other non-caffeinated drinks. Good space for work or a coffee date. Small back patio.
Flywheel Coffee Roasters,"Nice spot with pretty good Coffee,  I like sitting at the window and watching people walk by."
Flywheel Coffee Roasters,"Ordered and paid $3.50 for an Americano in 1 minute. Waited in line for at least 10 minutes, still no coffee in hand 😥😬 It might have been a busy day. If you don't want to wait for your coffee, this is not your place. If you do, give it a try ☕ …"
Flywheel Coffee Roasters,"Excellent coffee and beautiful cafe! They also have hot and iced  teas, which is not apparent from pics here."
Flywheel Coffee Roasters,super good - try the affogato
Flywheel Coffee Roasters,I’d say the most mediocre chocolate croissant that rivaled Costco in plainness but not in price
Flywheel Coffee Roasters,I stumbled on the place randomly when I stopped to warm up from a chilly motorcycle ride. Friendly service and good coffee. The atmosphere is relaxed and it's not crowded (at least while I was there)
Flywheel Coffee Roasters,Good coffee nut they had run out of most of the food options by 2pm
Flywheel Coffee Roasters,This page is filled with obviously fake reviews. How can I get paid to do that? I would do a much better job - without the awkward english and lack of any supporting detail. Are local coffee shops so hard up that they need to hire overseas fake reviews writers? Damn.
Flywheel Coffee Roasters,I love this coffee shop. The best around
Flywheel Coffee Roasters,"Excellent location, beautiful interior, very friendly and informed staff, great coffee."
Flywheel Coffee Roasters,One of my favorite coffee places in SF - taste really good and has great atmosphere.
Flywheel Coffee Roasters,We were sitting having coffee and one of the employees came by and told us they are closing and when we mentioned that the listing on google indicated that they are closing an hour later he became extremely rude and downright offensive. Don’t come back.
Flywheel Coffee Roasters,Love the Golden Gate Park pop up!  Unfortunately there was a very loud customer loitering inside the small space talking to the barista. I had to squeeze inside the shop to order along with this customer. Given how small this space is multiple customers at once is too much during COVID. Seems like the staff should really enforce one customer at a time.
Flywheel Coffee Roasters,"Nice place to warm up after walking through Golden Gate park, a lots of people with laptops. I guess this place is also great for remote work with a cup of great coffee."
Flywheel Coffee Roasters,I like this place inside. For some reason I just don't get on with the pour over coffee or the espresso.
Flywheel Coffee Roasters,I am a regular at Flywheel. Great coffee and friendly baristas. Also. always  good music playing. What's not to like! I'm there 5 or 6 times a week.
Flywheel Coffee Roasters,Great coffee and ambience! Will definitely go back!
Flywheel Coffee Roasters,Nice place for awesome coffee and baked goodies in the morning
Flywheel Coffee Roasters,Excellent cold brew
Flywheel Coffee Roasters,"Great Staff, Great Coffee, Great Escape from the Hippie Trash across the street and down it. I'd want to bring my laptop and work for hours next time :) If you want a coffee place that is low key, and vibrant, go here!"
Flywheel Coffee Roasters,"Great atmosphere and good coffee, but the staff was super rude and irritable."
Flywheel Coffee Roasters,Good pour over. Friendly service. Clean restroom. Space feels both roomy and cozy. Small back patio.
Flywheel Coffee Roasters,The coffee was mediocre at best. With all of the good coffee in the city it would be hard for me to justify going here over many other great options that exist in the city.
Flywheel Coffee Roasters,"Excellent coffee. Ethiopian beans were just like I remember when I had the real deal. Great vibe, some nice cakes/pastries also. Slightly too many mac users though ;)"
Flywheel Coffee Roasters,"Hipster almost to the point where it's no longer interesting, (and I live in the Mission). Maybe there was something about the place not being quite as genuine as one would have hoped. My coffee was, nevertheless, delivered superbly."
Flywheel Coffee Roasters,"Trendy coffee place. Very open layout, lots of space, with some outdoor seating in back. They don't seem to mind if people hang out a while to do work and they're friendly to dogs - even keep a water dish outside that they actually keep clean."
Flywheel Coffee Roasters,Sweet people welcoming you and they make a really Nice hot chocolate - the Thick and not to sweet one that you Will crave days after 🙏🏼 …
Flywheel Coffee Roasters,"First time here and the coffee is really good, and they created a really nice modern setup.  Also has a sunny back patio, and is pet friendly with clean bathroom."
Flywheel Coffee Roasters,Great coffee. Great vibe. Wonderful place to have a coffee after visiting the Golden Gate Park. I had an Americano and it was a very nice cup of coffee.
Flywheel Coffee Roasters,Really good coffee and very big coffee place to go and hang / work. It even has a patio
Flywheel Coffee Roasters,Cute location across the park. They have oat and almond milk dairy alternatives. The oat milk latte and the affogato were good!
Flywheel Coffee Roasters,Nice place to hang out with good coffee.
Flywheel Coffee Roasters,Excellent coffee. Baristas definitely knew how to stream milk. Both decaf and caffeine options (both were good). Loved that they sold fruit. Great locations. Parking is a little bit of a hassle. Lots of seating including some backyard spots.
Flywheel Coffee Roasters,"Nice vibe and minimal decor. The wait for the coffee wasn't too long. With minimal decor comes minimal steating. Coffee only comes in one size, a 12oz I believe. That being said, the coffee was good. The American wasn't very dark but was very flavorful. Worth a visit."
Flywheel Coffee Roasters,"Really pretty shop space with tasty craft coffee , fresh pastries, and friendly baristas. It also has a beautiful view of Golden Gate Park right across the street!"
Flywheel Coffee Roasters,"When I went there, it was crowded. I set near restouraroom. But soon I moved at the backside. I couldn't see much about moving and clam. If you are looking for a peaceful place with coffee, it is a good place."
Flywheel Coffee Roasters,"Late to discovering this neighborhood spot, but it has delicious coffee and pastries. Extra points for a nice layout with plenty of space to work, sitting or standing. There's even an outdoor patio."
Flywheel Coffee Roasters,Stupid expensive for coffee but some of the best I've had in the city
Flywheel Coffee Roasters,"Very cool roast-house, staff was super friendly and made excellent suggestions based on taste preferences."
Flywheel Coffee Roasters,Nice vibe with a decent amount of seating in a large space. Wasn’t loud even when fairly full.
Flywheel Coffee Roasters,You can see that they put effort into their food. This is my second time here and although I enjoyed the first time I was very impressed this second time.
Flywheel Coffee Roasters,"This place is the definition of 'not bad'. Everything about it is alright, but nothing has wowed me yet. I'd recommend going the extra mile down to the mill."
Flywheel Coffee Roasters,Cool coffee shop popular with earnest lap top wielders. Nice seating area out back. Great coffee. Guy who served me a bit vague about which donuts were which.
Flywheel Coffee Roasters,"Great baristas, excellent selection of beans, coupled with a wide variety of baked goods (some gluten free). They even have a nice covered patio out back."
Flywheel Coffee Roasters,"Great drinks, they roast their own coffee, and it's a good price per lb. On the bright/acidic side of coffee, but is usually very good."
Flywheel Coffee Roasters,"Nice place,  good coffee and they let you charge your board!"
Flywheel Coffee Roasters,"Perfectly brewed coffee, great blueberry coffee cake and a wonderful view of the park. Shout out to Jeff who gave perfect directions and helped me get home after my phone died."
Flywheel Coffee Roasters,"Good coffee, friendly stuff and awesome homemade puding"
Flywheel Coffee Roasters,"Great staff, tasty coffee. Unreliable wifi and expensive coffee."
Flywheel Coffee Roasters,Great atmosphere with really good coffee!
Flywheel Coffee Roasters,"Good coffee, nice space, lots of outlets, friendly staff. Minus one star fit flaky wifi that wants to email me ads."
Flywheel Coffee Roasters,You can not find a better cup.
Flywheel Coffee Roasters,one of the best coffee shops in the haight!
Flywheel Coffee Roasters,"Great coffee. You should definitely try out the siphon coffee. A really smooth,  clean coffee and the preparation is spectacular."
Flywheel Coffee Roasters,"Never really understood the whole ""Cold brew"" thing until I had it here, made in long ""Blinded me with science"" glass tubes, creating one of the smoothest  simple cups of coffee I've ever had. Nice for a pick me up while roller skating,  or strolling the haight, the coffee here is always spot in."
Flywheel Coffee Roasters,Great coffee and an awesome atmosphere.
Flywheel Coffee Roasters,Love their space and decor! We ordered two drip coffees and those were great too!
Flywheel Coffee Roasters,"Good coffee and atmosphere but like most things in SF it's pricey ($4 coffee). Pro tip: when using the free wifi, if you don't confirm your email address it will keep booting you off every 5 minutes"
Flywheel Coffee Roasters,"Always love stopping by here while shopping or heading to the park for some quiet time and good coffee. They make an industrial looking space feel cozy. Lots of people study here. It's fun to watch how the siphon coffee is made, but every kind of coffee drink had been excellent, and they've got a few pastries on hand too."
Flywheel Coffee Roasters,Great food and coffee - awesome location
Flywheel Coffee Roasters,Great coffee and really nice staff.
Flywheel Coffee Roasters,"Cool space, but poorly designed with very little seating considering the size of the venue. The coffee was average, although I struggled to find any good coffee in SF so maybe that's my London perspective."
Flywheel Coffee Roasters,If you need delicious strong coffee then this is your go to. Yum!
Flywheel Coffee Roasters,"Best pour over coffee in town, period."
Flywheel Coffee Roasters,Very friendly and helpful baristas. I ordered the almond milk mocha along a with a morning glory bread. The bread tastes amazing and the mocha with the rich dark chocolate is out of this world.  The atmosphere is quite nice and quiet.  I highly recommend coming here.
Flywheel Coffee Roasters,Pretty basic coffee shop with people glued to their Mac devices. The coffee itself was good.
Flywheel Coffee Roasters,"Nice atmosphere. Very high-priced though! And, only light roast."
Flywheel Coffee Roasters,This must be one of the best coffee shops ever
Flywheel Coffee Roasters,"Pretty good, didn't find any bugs in my cold brew coffee. Good place to use the bathroom before walking in the park"
Flywheel Coffee Roasters,Every time I'm home in SF this is one of my favorite places to get coffee and escape.
Flywheel Coffee Roasters,"Great spot right at the start the park.  Great service, the folks that work here are a pleasure.  They roast their own beans and have a large but cozy space if you want to spend some quality time.  Try the unwashed Ethiopian if you want a big bold cup that is nicely balanced and not too berry forward."
Flywheel Coffee Roasters,"The place was neat on the inside but the coffee was horrible ... we tried three: ethopian pour over, Rwandan pour over, and mocha ... all were too bitter"
Flywheel Coffee Roasters,"I love the drip coffee here, it is delicious and well worth the price."
Flywheel Coffee Roasters,The coffee is so good. They also make my favorite mocha on Haight st.
Flywheel Coffee Roasters,Great coffee. Outdoor patio is awesome. Spacious.
Flywheel Coffee Roasters,Beautiful space that even allows dogs! They have beans up at the counter for you to sniff before you order your coffee as well. Relaxed vibe with an outdoor garden in back.
Flywheel Coffee Roasters,"Fantastic espresso, and friendly staff. I broke a cup, and offered to pay, but they refused. Really genuine, good people. 10/10"
Flywheel Coffee Roasters,Regular coffee is weirdly expensive but espresso drinks are fairly priced given the quality. I wish the food selection was a bit wider but all in all this is a good neighborhood coffee shop.
Flywheel Coffee Roasters,Ambience and coffee both are worth trying.. they have their own coffee that they brew everytime.
Flywheel Coffee Roasters,"Over all good place to have coffee and sit and work. However after two hours of using WiFi, you need to buy something else to continue using WiFi."
Flywheel Coffee Roasters,If you like fancy expensive coffee it's fine but 4 dollars for a small coffee forget it !
Flywheel Coffee Roasters,Nice choice of baked goods.  Wish they had some cold drinks.
Flywheel Coffee Roasters,"I've been in the US for a long time. This is the best I ever had! Best coffee in America! ישראלים יקרים, זה הקפה  הכי קרוב לארץ שיש! מומלץ!"
Flywheel Coffee Roasters,Obnoxious music. Bad vibes
Flywheel Coffee Roasters,"Coffee is fresh roasted, and incredible. Prices are great. Atmosphere is rustic and coffee is served in Mason jars. Great place to stop with a friend."
Flywheel Coffee Roasters,"Very simple yet dependable setup from the layout to the offerings. Mostly a laptop crowd, I used to come here all the time to study."
Flywheel Coffee Roasters,Great coffee and tea in a airy but comfortable space.
Flywheel Coffee Roasters,Nice decor and ambiance. Great ice tea!
Flywheel Coffee Roasters,"One of my favorite coffee shops in SF. It's located between the Haight and Golden Gate Park, so it's always easy to make a stop! Coffee tastes great."
Flywheel Coffee Roasters,"You come here not for the coffee, but for the experience of having coffee. Solid coffee, but not proportioned well considering its price."
Flywheel Coffee Roasters,"Great space, great coffee, great service.  Always enjoy my trips to Flywheel."
Flywheel Coffee Roasters,"Nice, chill, place with good quality drinks and pastries. The only issue is the prices."
