0,1
Honey Honey Cafe & Crepery,Food was alright. Price too. But the place a bit noisy and messy
Honey Honey Cafe & Crepery,"I ate French Toast from here, and while it wasn't as flavourful as I would have expected, I still enjoyed it. And the portion was a good size."
Honey Honey Cafe & Crepery,Crossaint was way bigger then expected which is good especially since it was so delicious vanilla latte was bomb too
Honey Honey Cafe & Crepery,We had an American breakfast: pancakes with strawberries and bananas- really tasty
Honey Honey Cafe & Crepery,"Sweet baby pancake 🥞 heaven. My lovely grandmother Martha from Finland, would cook what she called ""swedish pancakes"", for me and me only. I was her ""Erki poika."" Which means good boy in Finish. I loved her and the huge, thin, sugar toped rolls of swedish pancakes she made with love. Honey Honey cafe & crepes comes the closet to my grandmothers delights. Delicious!"
Honey Honey Cafe & Crepery,Delicious food. Hot & served promptly. Went at 2:30pm on Sunday and walked right in with zero wait. Go at 8am and wait forever.
Honey Honey Cafe & Crepery,"The long line and wait time makes me say this place should get 1 star.  It was decent food..nothing outstanding, but I give them 3 stars because they had something green on the menu- spinach to the rescue!"
Honey Honey Cafe & Crepery,"We had a party of 7 and we all got something different from the menu. Every single dish was delicious. Service was amazing. The restaurant was packed, but we got our food really fast."
Honey Honey Cafe & Crepery,"Wonderful place to have a nice breakfast or some tasty crepes! The place has cozy interior, beautiful old tiles on the floor. Food was delicious and staff was friendly and helpful. Would definitely recommend!"
Honey Honey Cafe & Crepery,"The only good thing here is a service of a staff accepting orders. Food is not delicious and does not look good as well. The worst Greek salad I have ever tried, not even sure why doe they call this weird thing a Greek salad? They probably have another understanding of this salad. Probably crepes are good here, but my experience left me with never come back thinking."
Honey Honey Cafe & Crepery,"I had the regular eggs Benedict and my wife had the salmon Benedict. Both plates good 4 out of 5. Their coffee however, is delicious! Due to Covid, seating is only outside. There’s a lot of homeless around this area. Needless to say, during our meal we had 2 individuals walk up to us and ask for some money. One guy had no shame, he asked for $50...lol... either way, I’m just visiting this area. I would try another restaurant prior to coming back to this one just to explore."
Honey Honey Cafe & Crepery,"Great breakfast, fast organized service. Already know what I'm ordering next time."
Honey Honey Cafe & Crepery,"Delicious, abundant and they are super nice people! Highly recommend it!"
Honey Honey Cafe & Crepery,"My favorite breakfast spot near Union Square. Unfortunately nowadays too many people know it’s a great place so expect long lines between 8:30 and 10:30a, especially on weekends. Good news: a) it’s still worth it, b) you can go here for lunch or dinner as well! :)"
Honey Honey Cafe & Crepery,I was overwhelmed with menu options. I was confused. I felt bad for holding up the line.  It was hard to see over the tables so preview menu before you go. I enjoyed my crepe and potatoes were yummy.
Honey Honey Cafe & Crepery,"There was a long line but surprisingly it wasn’t too long a wait. They’re really efficient, and even though it looks really packed, they somehow found me a table.  I got the salmon scramble with the strawberry kiwi banana crepe and OJ. The presentation of the salmon scramble was a little sad but it was good. Very generous portion of salmon in the scramble which made it worth it. But other than that, nothing too impressive or mind blowing. The crepe was a little disappointing though. I thought the fruits would be wrapped in the crepe afterwards so it’s at least a cool temperature. But the fruits are like hot and soggy, the texture was just not it for me. It’s also very sour but they do come with whipped cream or ice cream so that kind of balanced it out. I’m not sure I’ll come back for the crepe again, maybe something else… the OJ was freshly squeezed which was amazing but dang it’s hella sweet. Ask for ice to go with it to help balance it out a little.  Maybe I had too high of an expectation for the cafe before coming in, so it kind of fell short of what I would’ve hoped for. But overall, it’s good, but not like mind blowing good (at least for the items I got)."
Honey Honey Cafe & Crepery,when i asked is any drink included in a breakfast he told me that no. but actually flavored water is for free. queue move fast. potatoes which goes as a side dish is overfried. toast overfried too. salmon was oversalted on my taste. maybe they used smoked salted salmon which became more salted after frying. if you decide to go i advise to order avacodo to toast. my experience was max on 3 stars
Honey Honey Cafe & Crepery,"Just left the hotel and stumbled on this cute cafe. I had the breakfast crepe. Staff is super friendly, ambience is great and walking distance from union square. Definitely recommend this place."
Honey Honey Cafe & Crepery,Came here for the first time and the staff are friendly and get you seated as soon as possible. Ordering is quick and simple. The freshly squeezed orange is a big hit for me and the chocolate waffle was gorgeous. Will be coming back again
Honey Honey Cafe & Crepery,My FAV WAS THE FRESH SQEEZED ORANGE JUICE.  My husband got the burrito and it was really good. Mine was eggs florentine and it was very spinachy. The nutella banana crepes was amazing!
Honey Honey Cafe & Crepery,"Underwhelming. Two out of the three crêpes we had were definitely sub-par. The savoury Salsa crêpe was nice because of the salsa itself, but the Torino (I think? It was feta, mushrooms & spinach) was bland and dry. The Blinz was the worst - half-baked and filled with sickeningly sweet strawberry and orange jams, no real fruit save for two lonesome strawberries that were put on as garnish. Cappuccino was poor, bit the lemonade was ok.  Also, I get they're keeping some sort of an image with the décor, and I liked the blackboard menu, but the rest of the place seems outdated and decrepit."
Honey Honey Cafe & Crepery,"Outstanding breakfast full of yumminess and seafood. Go here, but get here early. It gets packed and for good reason."
Honey Honey Cafe & Crepery,"I love this place. I try to go here every time I'm in San Francisco because it's simply wonderful in one of my favorite locations in the city. Highly recommended that you get there early because the place does fill up and there will be a line that may go outside, but it does move fairly quickly. Seating is pretty good for the place as people don't stay much past their time- but just be ready to wait for a seat in some instances. Even with all of that still highly recommended breakfast spot, but be careful since it does close fairly early."
Honey Honey Cafe & Crepery,First time in here..will definitely be last... Very musky smell when I walked in ...put me off my food... Hot drink was cold..food was cold too Ordered toast the butter did not even spread well
Honey Honey Cafe & Crepery,"The savoury Pesto crepes are quite big. Glad I got the bowl of fruit salad as the side. If you are very hungry then potatoes as a side, will fill you up."
Honey Honey Cafe & Crepery,"Lovely place to go for breakfast with lots and lots of options. I had a pesto crepe which had cheese, tomatoes, avocado and pesto in it and did feel a tad overwhelming so some simpler crepe options would have been nice. The oatmeal was also a bit watery and service could have been faster. However, the staff were run off their feet by the number of customers which in itself speaks for this cafe’s popularity. Solid place and would come back if I were in San Francisco for longer."
Honey Honey Cafe & Crepery,"Charming place. Loved the crepes and other breakfast combinations.  So hard to choose when everything looked delicious.  I'm guessing it's a family owned place as the service and quality of the food showed a well working group that take care of their customers.  Be warned, the lines are long on the weekends!"
Honey Honey Cafe & Crepery,"On Thanksgiving day in SF we wanted to find an open restaurant for an easy brunch and found this around the corner from our hotel. It was packed. I don't know if it's always that busy or if it was because of the holiday. We were wondering if we'd have to battle someone to claim a table, but they set us up and soon we were seated with our brunch. They had special sunrise scramble dish that was basically chilaquiles; it was awesome. I hope they make it a regular menu item."
Honey Honey Cafe & Crepery,"Tried the eggs crab cake Benedict. It was okay, I had better ones before elsewhere, wasn't impressed. You have to queue to order your own food ( and the queue can get pretty long during peak hours ) Staff did not informed that that there's extra charges for credit card usage, I only found out after I looked at the receipt, would have paid cash instead."
Honey Honey Cafe & Crepery,"Great breakfast. It gets crowded fast though, so be there early!"
Honey Honey Cafe & Crepery,Super nice staff. Good menu. We split the pesto crepe which was very tasty. The line is quite long.
Honey Honey Cafe & Crepery,"Excellent food, wonderful atmosphere, and great prices for such quality dishes. If you are looking for a good breakfast or brunch spot, I highly highly recommend."
Honey Honey Cafe & Crepery,Try to go early in the morning to avoid at least 30min queu.. breakfast are really tasty. I recommend the salmon benedict
Honey Honey Cafe & Crepery,I like that they offer ice cream as an option with the crepes! I had an SBK crepe and they accommodated my request for Nutella which was awesome.  The only con is that the bathrooms were a little dirty and not well maintained.
Honey Honey Cafe & Crepery,"Ate here for breakfast when I was on vacation. I seriously wanted to eat everything, the menu is huge and all the combos for crepes and omelettes sounded so good. The one I got had tomatoes, fresh basil, and mozzarella cheese. Omelettes also come with a side of toast (I got sourdough because, uh SF) and a small salad. I really enjoyed the salad dressing they used, it was light but had big flavor. I missed a big rush but the line was to the door most of the time I was eating so plan a lot of time if eating during peak hours. You order and then find any open table and they bring the food to you. Big groups might be tricky unless you're willing to split tables."
Honey Honey Cafe & Crepery,"This is a great place, good food, busy and happening.  Very reasonable, no nonsense.  Great"
Honey Honey Cafe & Crepery,Large menu with lots of options. Everything we tried was tasty. Good vegetarian options.
Honey Honey Cafe & Crepery,"Just amazingly delicious! A little Cafè not far away from Union Square where you can choose from fresh home made crepes, pancakes, sandiwiches (sweet and savoury), carrot or orange juice,  great taste and beautiful presentation. The expresso was good as well. Latin colours decorate the cafe' and a queue shows you that you are arrived at the right place.  Do not worry....the service is pretty fast (probably better to be there before 8 if you want avoid it) but it definitely worth it!"
Honey Honey Cafe & Crepery,"This place is good for breakfast/brunch.  Beware there is normally always a line out the door. You might have to wait for a bit but it is worth it. I would suggest they open up a second register so people won't have to wait very long. We had French toast, pancakes, and the Miami Heat crepe. All of it was delicious."
Honey Honey Cafe & Crepery,"Love this place! It's a cozy little restaurant with great breakfast options. Instead of a traditional ""sit-down and order"" type of restaurant, you first order and pay at the cashier, then they seat you. I found this quite refreshing and different from other places. Would love to come back again ♥️"
Honey Honey Cafe & Crepery,Very Good omelettes and potatoes. The crepés were no my my favorite but were ok. Fresh orange juice.
Honey Honey Cafe & Crepery,"This is my favourite breakfast place in San Francisco, everything I've tried was super tasty. Good portions and good price. Friendly and helpful staff. Good atmosphere."
Honey Honey Cafe & Crepery,"The food was delish! I expected it would be given there was a very long line outside and an equally long line inside. They have a pretty extensive breakfast and lunch menu posted on the wall, and they serve breakfast until closing at 3pm.  It's a counter service set up.  The food was great! I will definitely return during my next visit to San Francisco!"
Honey Honey Cafe & Crepery,"Pesto crepe = Amazing! Was the first place we ate coming into town.  The cashier was only so-so. I seem to be distracted and in a hurry, even though there was no one else in line behind us. The person that brought us our food was very kind and personable.  My friend said her sandwich was pretty basic run-of-the-mill. But I say when you go to a crepe place get crepes!"
Honey Honey Cafe & Crepery,"Casual ambience, good location. Friendly cashier; Abdul was very helpful, he even recommended me some places to visit while I was in downtown. I had a salmon sandwich and it was good... kind of pricy, but I guess that's San Francisco."
Honey Honey Cafe & Crepery,"Reasonable price and food in SF. There was a queue to enter the establishment to order food at the counter, which wasn't the most fun thing to do if you're hungry. I'd ordered the Two, Two and Two, which is pretty good."
Honey Honey Cafe & Crepery,"Decent food, worth going to if you aren’t sure where to go"
Honey Honey Cafe & Crepery,The eggs benedict were ok; there was a flavor in the hollandaise that I really did not like. The coffee was adequate. Others in my group really enjoyed their food. I would come back and try something different.
Honey Honey Cafe & Crepery,"I got the ""blintz"" dessert crepe and added Nutella on top. One of the best crepes I had! I am not a big fan of orange marmalade but their marmalade is great! Blends well with the ricotta cheese.  I also tried their iced mocha and it's good. Coffee is not overpowering the chocolate nor vice versa; it blends well and gives a nice flavor. Although the service is rushed, staff were not rude and tried to accommodate as much as they can.  P.S. Definitely add Nutella on top to balance the taste even more."
Honey Honey Cafe & Crepery,"Can't go wrong with their Sunrise Burrito.  Although some would wonder why I go to a place known for crepes, to get a breakfast burrito. The chorizo is delicious.  With that said, don't take their crepes lightly, they are outstanding."
Honey Honey Cafe & Crepery,"I visited San Francisco last year, ate here and it was unforgettable. Visiting again recently and the year apart has not dulled the experience. Amazing food, lovely staff and reasonable prices for the quality of the food! 10 out of 10 would recommend and would love to eat here again!"
Honey Honey Cafe & Crepery,Fantastic food. Ate the eggs benedict and SBK Crepe desert. Awesome place!
Honey Honey Cafe & Crepery,"Great food and service, love the cute interiors and their unlimited coffee refills. Usually a huge wait, so get here at off times if you can!"
Honey Honey Cafe & Crepery,Salmon Benedict was silky and lovely. Best potatoes we have ever had. Salmon was fresh and yummy.
Honey Honey Cafe & Crepery,"Great breakfast place. The breakfast crepe is delicious, and the food portions are great."
Honey Honey Cafe & Crepery,"So we tried out three places for breakfast during our stay in SF. Sweet Maple, MyMy and Honey Honey. Honey Honey was by far the best of the lot. The food is amazing, tasty & fresh. The price can be a little high but less than other places. The service is very good and the staff are really helpful. The queue for this place says it all but don’t get frightened away by this. It moves quick and they have a great system in place. Unlike the other two place Honey Honey will NOT disappoint. If we ever come back here I’d be happy to eat breakfast here everyday."
Honey Honey Cafe & Crepery,"Avoid. Upon first entering, a man rushes up to you and barks a question about how many people are in your party and assigns you a table before you've gotten to the counter to order. The menu is impressive, but the actual food is far from excellent—below the quality you would expect from a typical greasy spoon diner. The coffee drinks also are subpar. The atmosphere is offensive: not only is the speaker system blaringly loud, they are playing the most obnoxious, trite children's music with mistuned instruments. It's an assault on the senses."
Honey Honey Cafe & Crepery,"I arrived on a Sunday at about 9:30am and the line was up to the door. Three parties had left before they had a chance to order. I came here  expecting more fruit crepe options, but decided on a Belgian waffle instead. It was exactly what I was craving. Would definitely come back again."
Honey Honey Cafe & Crepery,"They don't take reservations, there was a 50 person line out the door on a Saturday, and the staff was not at all cool when we asked if our pregnant friend could sit down somewhere inside, so she wouldn't have to stand an hour in the rain to wait. Sorry, but no place with counter service is worth that kind of experience. There are a ton of places in the area that are far more accommodating. 🤷"
Honey Honey Cafe & Crepery,Loved the Banana Nutella crepe. The Miami heat savory crepe was beyond incredible. Definitely recommend having breakfast here.
Honey Honey Cafe & Crepery,Amazing selection of items to have an amazing breai in downtown San Francisco. However there's a long line of people waiting from outside during the weekend and hollydays.
Honey Honey Cafe & Crepery,"Had breakfast here. It was OK, nothing more. Pancakes were a bit stodgy. Whole place a bit tired."
Honey Honey Cafe & Crepery,"The place is kinda dingy. The eggs with toast were good. It wasn't a ton of eggs, which I liked. The pancakes & waffles were really soft and kinda plain tasting. No matcha. I wouldn't return."
Honey Honey Cafe & Crepery,"The menu offers a lot of options, but unfortunately what I ordered was just OK. Ordered the Sunrise burrito with beans and a bagel which wasn't good at all that came with butter and jam. The restaurant itself wasn't as clean as it should be."
Honey Honey Cafe & Crepery,"There was a bit of a wait, and no wonder why, this place is amazing. Went here multiple times during a work trip to SF. The fresh squeezed OJ is excellent too!"
Honey Honey Cafe & Crepery,Decent service. Good food. Get there early because the line is long
Honey Honey Cafe & Crepery,"This place is essentially a mom and pop crepevine. Looking at the reviews, I figured let's give it a shot. I came on Sunday and waited in line outside. While waiting in line, they assign you a table and you tell the cashier your number.  I got a savory crepe which was decent. The portions aren't as good as crepevine and the potatoes weren't as good either. Overall I probably wouldn't come back cause I don't think value for money is there. It isn't bad, just not as good as I was hoping.  Whitney S. Milwaukee, WI 154762 11/12/2022 1 photo Fun place for breakfast! They don't take reservations so get there just before opening if you want a table immediately.  Food was excellent. Medium on price. Our only issue was that they serve food as it's ready ...which means it's hot, however certain orders came out slowly and the rest of us were finished eating.  General vibe  Priyanka S.Elite 2022 San Francisco, CA 635112133 11/8/2022 1 photo I went to Honey Honey cafe and crepery with my boyfriend and got the nutella banana crepe and a blt sandwich both of which were solid but nothing amazing.  The nutella crepe was stuffed to the brim with nutella and the bananas were fresh, the crepe itself however was a tad soggy and not as firm as I normally like.  The sandwich on the other hand had very crispy bacon and fresh avocado with a light mayo spread, once again a staple BLT but nothing extraordinary.  If you are looking for good priced solid brunch food definitely check out Honey Honey!  Nutella banana crepe  Jared F.Elite 2022 Ontario, CA 77245410 10/5/2022 3 photos1 check-in My overall experience here was pretty good. The portion size for the price is good, and the menu is quite extensive. The inside is comfy, and the service is pretty quick. The drawback I noticed was that the potatoes were mushy and lacked flavor.  Order: I got the Eden crepe which was yummy but had an incredible amount of cheese in it  My mom got the chicken pesto crepe which was incredible and refreshing.  My dad got the Crab Cake Florentine Breakfast which was pretty good and large."
Honey Honey Cafe & Crepery,"We arrived for breakfast and realized it was a wait. The line was out the door and down the street. However, we were seated pretty quickly. Once inside it was a little hectic. People were everywhere (those in line/customers/staff) and the place is quite small. The female cashier seemed to be annoyed. Due to us being first-time visitors and had a few questions about the menu. Our order consisted of three orders of pancakes and they only brought out three very small containers of syrup for three pancakes each order. The syrup that was delivered wasn't suitable for one pancake. Upon delivery of the initial syrup, we requested more syrup. Again they brought three containers of syrup. I had to ask two additional times for syrup and the hostess seemed annoyed with that as well. Let's get to the food. The food was ok, nothing to write home about. If I never visited this restaurant again, I would not be disappointed."
Honey Honey Cafe & Crepery,"Great food and atmosphere. Don't sit by the door, it always gets left open."
Honey Honey Cafe & Crepery,I had the Belgium waffles and it was perfect. Service was quick. I didn't have to wait in a line as it was a weekend but heard that there are long lines waiting on weekends.
Honey Honey Cafe & Crepery,Breakfast are good. Good and fast service. Prices are reasonable.
Honey Honey Cafe & Crepery,"At first I thought I was in the wrong place. Two different music tracks playing at the same time (kitchen & dinning area) in an open space. The food selection is pretty good, quantities are generous, average quality. However the place is very dated, and not kept very clean. Trash accumulated in corners and under the tables, windows haven't been cleaned in years. A solid 3 star experience."
Honey Honey Cafe & Crepery,Amazing savory crepes!! The food was the star!  Kinda basic inside and long line but well worth it.
Honey Honey Cafe & Crepery,Location - 5/5 Entrance - 5/5 Staff - 5/5 Quality - 5/5 Quantity - 5/5 Serving time - 3/5 ( Serving is slow ) - All crepes are amazing and worth a try.
Honey Honey Cafe & Crepery,I waited thirty minutes for my food even though tables were open and available. We came at 8:45 AM. Food and service was decent but not worth the wait
Honey Honey Cafe & Crepery,"Great food, get there early when they open"
Honey Honey Cafe & Crepery,"Great breakfast spot! We stopped in for a quick bite and ended up sitting down to a great meal. My wife got a delicious crepe, and I got an omelet! Great portions and super tasty food. It got pretty busy while we were there, so arrive early when they open to make sure you get a spot! The service was also quick, so no worries if you have to wait in line.  Overall, highly recommend for breakfast in San Francisco!"
Honey Honey Cafe & Crepery,"For years, we lived down the street from Honey Honey Cafe and never went because the line was always so long. Finally we were able to check it out on a recent visit to SF, and we were impressed! My husband got the Miami Heat savory crepe and I had the breakfast croissant sandwich. Both were delicious and worth the slight wait. If you're craving delicious breakfast and in SF, check this place out."
Honey Honey Cafe & Crepery,Fast and efficient service. Great breakfast
Honey Honey Cafe & Crepery,The food is super yummy. The tomato basil soup is the best I've ever had.
Honey Honey Cafe & Crepery,I love Honey Honey for breakfast. Their Crab Cakes Florentine are absolutely amazing!
Honey Honey Cafe & Crepery,"I stopped by after work one day. The coffee was ok, a little watery. I ordered the Blitz crepe, and it was really good. Just a little cold. Might be better in the morning when everything is fresh!"
Honey Honey Cafe & Crepery,Lovely crepes and crab cakes at a very affordable price! Recommend to all
Honey Honey Cafe & Crepery,"Food is ok. Nothing amazing. Had the crab cake Florentine. Was bland. Side of bacon was ok, but like something I would cook at home. The cappuccino was not good. Maybe I should have gone with the crepes."
Honey Honey Cafe & Crepery,"I had the Santa Fe scramble and my husband had the two eggs. We both liked our meal quite a bit. The eggs were fluffy, the bread was tasty and the hashbrowns were yummy. The food service was fast. The americanos were ok."
Honey Honey Cafe & Crepery,"A different type of restaurant experience walking in, reviews were good, so my wife decided this is the place to go. Good food options, but I wasn't impressed by plating presentation at all. Salmon Scramble was salty as if cooked in butter, small portion for $14.95, and a plate of unseasoned, partially burned Home Fries 😳. Coffee was good, and the wife enjoyed her food. I just expected more after guy at register told me himself ""oh yes, the food is good, we have good reviews"" 😐😐"
