0,1
Honey Honey Cafe & Crepery,"Small and popular corner breakfast oriented  restaurant. The staff will find you a table while you wait in line to order. There are a lot of options to choose from for drinks and food, most of them geared towards breakfast."
Honey Honey Cafe & Crepery,"Very good crepe, omelette and overall breakfast place which is extremely busy but moves the crowd efficiently so that one is not in line long to order at the counter and be subsequently served at the table."
Honey Honey Cafe & Crepery,"Unpretentious diner with a huge selection of sweet and savory crepes and breakfasts. Low service, casual atmosphere. Order at the counter and your food comes out at lightning speed."
Honey Honey Cafe & Crepery,"The line moved smoothly and service of the waffles was fast. You can't really go wrong with waffles, but they were fruity and not overly sweet, and excellent for breakfast."
Honey Honey Cafe & Crepery,Good food friendly service. Long line and long wait for tables is common. Great pancakes and breakfast standards. Worth standing in line for
Honey Honey Cafe & Crepery,"Very nice place for breakfast. Warm and friendly. Food is plentiful and very tasty. There are many different options to choose from, a nice surprise. Moderately priced."
Honey Honey Cafe & Crepery,Great service. Friendly people. Food is good. Very long lines due to popularity but worth it! Love the freshly squeezed orange drink
Honey Honey Cafe & Crepery,"The crêpes are good and the service is quick. It is a fast food kind-of restaurant though, so don't come if you're looking for a cozy calm place for brunch."
Honey Honey Cafe & Crepery,"Hidden gem of a small cafe. Quick service, good food. Somewhat typical creperie-style fare plus sandwiches, but it's simple food done well."
Honey Honey Cafe & Crepery,"The food is either really good or just OK, depending on the time you waiting in line to get it. Try getting there first and it's a great place for breakfast."
Honey Honey Cafe & Crepery,I absolutely loved the Belgian waffle! It tasted amazing and was so filling! The line was out the door but it was definitely worth the wait!!
Honey Honey Cafe & Crepery,Great breakfast huevos rancheros croissant sandwich pancakes and fruit - it was all good! The line is an indication that you chose a winner😀 and it moves fast. Enjoy …
Honey Honey Cafe & Crepery,"If you are going on the weekend be prepared for a long line. Nevertheless, the food is great and the staff works really fast."
Honey Honey Cafe & Crepery,The tables weren't clean and the place wasn't organized either.
Honey Honey Cafe & Crepery,"I was walking by this place and a little homeless lady asked me if I'd buy her a cup of coffee. Why not? I asked her what she wanted and then went in. At first, they told me that they didn't have what she wanted - a caramel latte - but apparently I just had to ask for it the ""right way"". It was almost like the Soup Nazi episode of Seinfeld, if I didn't ask for exactly the right thing the way that they wanted then they were going to throw me out. It was an odd, surreal experience. I guess no good deed goes unpunished. I think they even charged me an extra $1 because I know tax isn't 30%."
Honey Honey Cafe & Crepery,"I came here expecting great crepes, I was very disappointed.  Thick and tasteless."
Honey Honey Cafe & Crepery,"Had to wait almost an hour. The menu is huge, plenty of choice. The staff work really hard to keep up and are very polite and helpfull in explain the choices and making recommendations. Highly recommended"
Honey Honey Cafe & Crepery,Had breakfast. It was exceptionally tasty. The overall rating is somewhere between good and fantastic. It is pretty cozy and has a nice relaxed atmosphere.
Honey Honey Cafe & Crepery,"Food was OK, good service, but the place is not clean, restrooms are gross, one of our plates was super old looking dirty, even one cup still had lipstick on it. Disgusting."
Honey Honey Cafe & Crepery,Came here with my brother and we both loved the food! The Belgian waffles are great
Honey Honey Cafe & Crepery,"Precooked eggs, barely heated raw vegetables, some diced sandwich meat, stuffed in a thick doughy crepe.  upon raising concerns I was told 'it depends on the cook'.  Yuck."
Honey Honey Cafe & Crepery,Good place to have breakfast. You line up and order.
Honey Honey Cafe & Crepery,Delicious! We had the eggs benedict and crab cake Florentine and they were amazing. A bit pricey for breakfast - but the food was definitely worth it.
Honey Honey Cafe & Crepery,"We visited the location for dinner. The food choice was sufficient. The quality of the served meal was okay, but not excessive. The location looked overdue for a makeover."
Honey Honey Cafe & Crepery,I ordered banana chocolate crepe and it was delicious! Pancakes and coffee was good too! Def my fav breakfast spot in the area.
Honey Honey Cafe & Crepery,"Good food good price. Unique omelette and crepe options. Self serve setup so no tip expected saves money, you pay before you eat."
Honey Honey Cafe & Crepery,"Food is delicious. They forgot one of our orders. We had to remind them, but by the time it came out the others were already done eating. No apologies given."
Honey Honey Cafe & Crepery,"Long wait. Food could be ok, but got some one hair and in the dish. Prices are a bit high for what you get. There are better places in town."
Honey Honey Cafe & Crepery,Line was long but it moved fast. Order at the counter then you get seated! The Lemon crepe is VERY lemony!
Honey Honey Cafe & Crepery,Terriffic experience! Food and service are memorable. Reasonable value. Wonderful selection.
Honey Honey Cafe & Crepery,"I ordered crab cake florentines, and it is one of the best one I have tried in years! Although the queue could be a bit long and intimidating, the food is great and worth it!"
Honey Honey Cafe & Crepery,Don't eat here plain trash
Honey Honey Cafe & Crepery,They have the best savory crepes in SF!!! Chicken pesto is my favorite but seriously every crepe dish is so good!!!
Honey Honey Cafe & Crepery,"Their fresh squeezed OJ is delicious! Great environment and customer service. Whether you're looking to sit down and eat or grab something on the go, this place is ideal."
Honey Honey Cafe & Crepery,"After waiting in line for 20 minutes, I got my food and realized that 20 minutes was totally worth it!!!!!!! The food is amazing, the service is perfect and the atmosphere is gorgeous! Love love love this place!"
Honey Honey Cafe & Crepery,"Amazing buttermilk pancakes, beautiful fresh orange"
Honey Honey Cafe & Crepery,"Miami HEAT! This savory crêpe had an amazing Cuban spicy sauce which needed no Tabasco enhancement, even for this spicy food lover. The soft chicken was well balanced by avocado and scallions, and the crêpe itself did its job well. Rest of the meal was good but nothing to write home about: OJ was ok, wife's pancakes were ok, chicken sausage was quite good."
Honey Honey Cafe & Crepery,"The creeps were delicious! Great for breakfast, awesome for lunch. Dozens of choices. Reasonable prices. Best breakfast place I tried."
Honey Honey Cafe & Crepery,"They have everything for breakfast needs!  From Granola to omlete, and from the fresh squeezed OJ to capucchino! Nice service,  spacious dining room, and honey is placed on the self-serving tray for your coffee!"
Honey Honey Cafe & Crepery,Latte was good. Philly steak omelet was good. Menu is extensive. Plenty of seating. Friendly staff. Short wait time for food.
Honey Honey Cafe & Crepery,Can't get a simple door dash order correct. Only order if you want a random item on the menu.
Honey Honey Cafe & Crepery,"Enjoyed my first experience there. They were very accommodating, friendly and efficient. I needed to modify my omelette and they were happy to do it!"
Honey Honey Cafe & Crepery,"Food was fantastic, however removed one star for how inefficient the process to get a table is. Waited in line for 45 minutes to get to place my order and then get seated even though there were many tables available."
Honey Honey Cafe & Crepery,Great place for brunch near Union Square
Honey Honey Cafe & Crepery,Absolutely fantastic food and atmosphere!!! Visiting for SoCal to watch USC beat the bears(cubs) and this place started us out right each morning...must try!
Honey Honey Cafe & Crepery,"Nice place, lovely food, quick service."
Honey Honey Cafe & Crepery,Pretty busy and their menu is huge but the food was just ok
Honey Honey Cafe & Crepery,"This place has DELICIOUS food. I had the Nutella and strawberry crepe. Wish I had gone back my second day, because the other breakfast place I went to didn't even light a candle to HH."
Honey Honey Cafe & Crepery,"When you enter to a cafe that opens 7::30 in the morning and it's full at 8, you've come to the right place"
Honey Honey Cafe & Crepery,"Amazing food - particularly the breakfasts, huge portions and they have fresh squeezed orange juice available 😍, all in a relaxed atmosphere. …"
Honey Honey Cafe & Crepery,This place looked good when I walked in. But as I sat down I seen the lady cleaning the coffee stand and dropped the honey cap. SHE looked around and just put it back on the honey as if nothing from the dusty floor is going to stick to the honey that I just used🤢 …
Honey Honey Cafe & Crepery,Omg the food and service was amazing order the egg benedic bagley 2 cups of amazing coffee. And every thing was delicious
Honey Honey Cafe & Crepery,Nice little cafe! Expect a wait for a table. The restaurant can only hold 46 people at a time.  The food is delicious.
Honey Honey Cafe & Crepery,"Good food and friendly staff.  I went for dinner and the Mediterranean crepe hit the spot, but still left enough space to go for one of the desert crepes."
Honey Honey Cafe & Crepery,Such a huge menu but everything was delicious and fast. Great brunch or breakfast stop. The prices are perfect for what you get.
Honey Honey Cafe & Crepery,"Really pleasant. Decent prices. Good quality crepe, bagel, assorted breakfasts. Really enjoyed my cappuccino."
Honey Honey Cafe & Crepery,"Good food, quick service! Breakfast isn't hard, but they have a good menu and fresh ingredients. Will go back for sure."
Honey Honey Cafe & Crepery,"Line was on the street, but the food was good. Different from what I'm used to being from Memphis, but still good."
Honey Honey Cafe & Crepery,"Absolute madhouse during the brunch rush! But for good reason, they really care about their customers and serve them high quality food. Great selection and unique options."
Honey Honey Cafe & Crepery,Poor service.  Staff was to busy talking to each other. Staff made me change three different times.  Felt like an inconvenience.
Honey Honey Cafe & Crepery,Shoutout to Mohammed who worked tirelessly and manage to multi-task effortlessly! Food was excellent!
Honey Honey Cafe & Crepery,Great breakfast. Eggs benedict and Mediterranean Crepe were fantastic. Highly recommended.
Honey Honey Cafe & Crepery,Worth the wait in line!
Honey Honey Cafe & Crepery,"Great food.  There was a long line when we visited, but that's a sign of good food.  Definitely worth the wait."
Honey Honey Cafe & Crepery,Good menu. Tasty food. Prime location. Free WiFi if you wanna work. Good music. Would definitely come back.
Honey Honey Cafe & Crepery,"Ordered Pesto Crepe, Blintz Crepe and tofu scramble breakfast items. We didn't like any of it.    Of the 3, Pesto Crepe was decent"
Honey Honey Cafe & Crepery,Good food. Loved the fresh orange juice. Expect long queues.
Honey Honey Cafe & Crepery,"Great food. Excellent service. Fair prices. Try the croissant breakfast sandwich, you won't be sorry. :)"
Honey Honey Cafe & Crepery,"I cannot praise this place enough... There is a reason there are long queues every morning! Great service,  lovely owners,  great food, value for money...  Best place in dowtown for breakfast!!"
Honey Honey Cafe & Crepery,"This place is cool, they could clean the light fixtures and the cashier is very aggressive. The pancakes was good... The seating is cram."
Honey Honey Cafe & Crepery,They have long list of foods I think they can be better Pepper potatoes was like very fast food type The rest was pretty Good
Honey Honey Cafe & Crepery,"One of the best breakfasts in the area, delicious, diverse menu options. Worth the long wait you may face some days."
Honey Honey Cafe & Crepery,Went there for breakfast and wasnt dissapointed. Typical american breakfast with beacon and egg. Orange juice is pressed freshly aswell. However its rather expensive there.
Honey Honey Cafe & Crepery,"Tasty but a bit dry sandwiches, could use more sauce or a dipper. The potato salad was mediocre.  The staff is very friendly!"
Honey Honey Cafe & Crepery,"I needed a fresh squeezed juice and latte and that's what I got. Quickly, I should add. I wish more juice options existed but I'm all out of magic lamps. It was a delightful juice and latte so thank you."
Honey Honey Cafe & Crepery,"Vast menu selection, fast service, delicious food (I got the Huevos Rancheros and a side of chorizo with an Anchor Steam beer to wash it down) and friendly service. Reasonably priced for the portions as well."
Honey Honey Cafe & Crepery,Great bloody mary's! I had their Santa Fe special and it was deliciously spicy! There is a wait during the breakfast rush but it is worth it!
Honey Honey Cafe & Crepery,"It's fast, good food and good people! I recommend"
Honey Honey Cafe & Crepery,"This place is really good, but for whatever reason the service is really slow, resulting in very long lines.  While the food is good, it's not good enough to wait more than fifteen minutes in line."
Honey Honey Cafe & Crepery,Loved their breakfast menu. Coffee could be a little better. Only one girl taking orders and also making coffee. Over all love the food.
Honey Honey Cafe & Crepery,"Absolutely delicious food, big portions, fluid service. Just wait in line, order at the register and they'll have a table ready for you by the time you place your order."
Honey Honey Cafe & Crepery,Eggs Benedict are great!
Honey Honey Cafe & Crepery,There is always pretty long queue. Surprisingly works pretty good to find empty table. It took some time prepare the food but was excellent.
Honey Honey Cafe & Crepery,Worth the wait online very friendly service the food was very tasty..
Honey Honey Cafe & Crepery,"Ordered an omelet and huevos rancheros. The omelet was eggs from a carton and the veggies were uncooked (from a can) and laid inside the egg,  not cooked into the egg. The huevos was not fresh, canned salsa and poorly warmed can beans. Didn't finish either."
Honey Honey Cafe & Crepery,"Very busy, but the line out the door went by quickly. The crepes are delicious, with a great selection of savory and non savory options."
Honey Honey Cafe & Crepery,This place is highly recommended I said at the Fitzgerald it was literally across the corner Fitzgerald was a nice cheap hotel but when I got there they had so much selections my wife got the hazelnut Crepes and I got the breakfast I got the breakfast omelettes the continental and it was amazing you have to go
Honey Honey Cafe & Crepery,Great food and atmosphere here! You seat yourself so be prepared to make space for yourself/your group or come at a less busy time.
Honey Honey Cafe & Crepery,"Got one (1) pancake for $9. Not sure, is this a joke? The tea was good though, that gets a second star. Why does this place even exist? Ugh."
Honey Honey Cafe & Crepery,It was dark and their menu didn't seemed appetizing. I walked out and had Delicious coffee and a yummy croissant sandwich at FarmTable two blocks away.
Honey Honey Cafe & Crepery,"What a cafe. So many breakfast items to select. A must go eatery place when roaming SFo downtown. From eggs to crepes, they have everything!"
Honey Honey Cafe & Crepery,Always a delicious spot. Eat here every time I’m in SF
Honey Honey Cafe & Crepery,"Very nice and effective cafe; the line is long, but fast, and there are always empty seats and the food is of an adequate quality, compared to the price and location"
Honey Honey Cafe & Crepery,We have eaten here every morning for 4 days and had lunch there today. We will probably eat there the next 3 days . So yeah very good.
Honey Honey Cafe & Crepery,"Good place for good breakfast. They have a big nice menu, and I liked latte there"
Honey Honey Cafe & Crepery,"Great crêpe, also staff was excellent!"
Honey Honey Cafe & Crepery,"We had pancakes, omelette and bagels. All were delicious and the portions are huge. Great value for money!"
Honey Honey Cafe & Crepery,"Fast service, great breakfast options for entire family, tasty food, and coffee that tastes like coffee, all for a reasonable price."
Honey Honey Cafe & Crepery,"Great food and atmosphere! Had the SBK and 2 and 2 and 2, check it out...and they make a great cup of cappuccino!"
Honey Honey Cafe & Crepery,Very long line and waiting times but the food is good.
Honey Honey Cafe & Crepery,Standard SF creperie. Their blintz is a little weird; it's made with cottage cheese (in addition to ricotta). Good selection of teas and solid egg dishes.
Honey Honey Cafe & Crepery,"The service was good, but I've had better eggs Benedict. Their menu is fantastic and great for brunch."
Honey Honey Cafe & Crepery,Food was okay. It's pretty pricey tbh. But it does fill you up.
Honey Honey Cafe & Crepery,Good variety of breakfast options.
Honey Honey Cafe & Crepery,Very nice place. There are no waiters. You wait in the queue for the counter to order your food. Therefore a group of 5+ people get food in different times.
Honey Honey Cafe & Crepery,Not so much....and have buckwheat crepes for GF if your going to have crepes.
Honey Honey Cafe & Crepery,"While the line begins early, waiting 30 minutes was worth the high quality breakfast. The fresh squeezed orange juice is a must."
Honey Honey Cafe & Crepery,"Expect a line, but so worth it. Very good food!!"
Honey Honey Cafe & Crepery,They have very good vegetarian options for both savory and sweet crepes. The food was good.
Honey Honey Cafe & Crepery,Delicious! I had the crab cake benedict with a couple of in-house fresh baked goodies. The freshly squeezed OJ was right on target for me as well.
Honey Honey Cafe & Crepery,The place is nice and the food is ok but slightly disappointed in the quality. I only had eggs Benedict so I am not sure if it's the standard qualify or not.
Honey Honey Cafe & Crepery,Delicious Strawberry & Nutella crepe. All staff were wearing mask! Ordering & Take Out easy.
Honey Honey Cafe & Crepery,"I had a really high expectations, based on previous reviews. After visiting this place I can say it's nice and that food is good, but still it left something to be desired."
Honey Honey Cafe & Crepery,Great food.. crowded.. rude service but this seems to be par for San Francisco... Don't expect service with a smile.. long line for breakfast but the food is worth the wait
Honey Honey Cafe & Crepery,"never went in to try this place. It was recommended by locals, however the line is ALWAYS out the door. So if you do not have time to wait, find somewhere else to go. We did not have time to wait."
Honey Honey Cafe & Crepery,"A good selectoon on the menu, all ctepes or related. Even during rush time they served us within 20 minutes. Food was good and savory."
Honey Honey Cafe & Crepery,Busy but cute little cafe with amazing crepes! Great brunch spot in San Francisco!
Honey Honey Cafe & Crepery,Great crepes and well organized. Top for breakfast
Honey Honey Cafe & Crepery,"Large variety of breakfast, dessert, and sandwich items. The line to order can become long. Be prepared to wait. The food is worth it. Beer and wine are available."
Honey Honey Cafe & Crepery,"Nice, homey feel. Like a French cafe."
Honey Honey Cafe & Crepery,"Food is good, however there was no feeling that I'm as guest are pretty welcome to more than just spend my money and leave asap..."
Honey Honey Cafe & Crepery,Yummy! Got the SKB crepe with potatoes and bacon! They also have mimosas!
Honey Honey Cafe & Crepery,Excellent breakfast and super fast once you get a table. Definitely worth the wait if it's packed.
Honey Honey Cafe & Crepery,"Tasty breakfast, amazing crepes! Coffee was good. Friendly service and food was out super fast"
Honey Honey Cafe & Crepery,"Monte cristo was insane!  I loved it and they gave it to me for free when I asked about a military discount.  The place has a long wait, I suggest showing up before it opens"
Honey Honey Cafe & Crepery,"You can never go wrong with Honey Honey.  Expect a line, especially on weekends."
Honey Honey Cafe & Crepery,"Really diverse menu for all meals.  Had the salmon and eggs combo, everyone's meal was delicious"
Honey Honey Cafe & Crepery,The crepes were pretty good but the line was confusing and it was hard to find a seat.   Make sure one of your party claims a seat before you get in line.
Honey Honey Cafe & Crepery,Super clean and oh my God the crab Benedict is so freakin good. I honestly wish I lived here so I could eat it everyday!
Honey Honey Cafe & Crepery,Great food busy but worth the wait.
Honey Honey Cafe & Crepery,"Good American crepes but if you are used to French ones, they are bit different. Also this place tends to be packed and you might wait in a queue but it goes fast"
Honey Honey Cafe & Crepery,What a fun restaurant. The service was great and the place seemed very popular. Our food came quickly and was delicious. I highly recommend.
Honey Honey Cafe & Crepery,"Delicious!  I got the eggplant crepe, it was fabulous and ready quickly."
Honey Honey Cafe & Crepery,"Brilliant place, amazing food, love their savoury crepes! Prices are reasonable, service is pretty good."
Honey Honey Cafe & Crepery,"Such a great place for breakfast in the city. So many options, they serve all of them and it's all delicious."
Honey Honey Cafe & Crepery,We enjoyed our lunch here. Lots of choice. Fresh OJ. Nice people. Nice ambience. Tasted well.
Honey Honey Cafe & Crepery,Great breakfast with and amazing selection. Staff is a little stressed at times due to very good turn-out in the morning.
Honey Honey Cafe & Crepery,The food was delicious and as you wait in line the servers find a table to seat ya. It is a  very popular place
Honey Honey Cafe & Crepery,"Overrated place. Visually appealing, good service but lack of flavor in all the plates. Eggs Benedict are like boiled eggs."
Honey Honey Cafe & Crepery,I am in love! A large selection of both sweet and savory crepes. Service CAN be slow but it's worth it.
Honey Honey Cafe & Crepery,The food was really good! The Acapulco omelet was superb 👌 …
Honey Honey Cafe & Crepery,I wish I knew about this place in the beginning of our trip ! The food was awesome and not expensive like others in the area. The staff was awesome as well.
Honey Honey Cafe & Crepery,"Great place for breakfast. Everything we ordered was great mocha, a veggie omlette and strawberry Nutella crepes"
Honey Honey Cafe & Crepery,Excellent food all around and the breakfast potatoes were perfect. I'm still thinking about the nutella and banana crepe. Im considering getting another one tomorrow!
Honey Honey Cafe & Crepery,Customer service was great quick great and easy. Now the FooD here was the best part ever! I had a belgam waffle with potatoes !!!
Honey Honey Cafe & Crepery,I ordered the granola and it was very nice.  My friend ordered an omelette -- Meh.  No table service but the food is good.
Honey Honey Cafe & Crepery,"Love the Breakfast Crepe w/ home fries delicious AND filling the crepe was prepared just right very well done...nice staff as well, always very friendly..."
Honey Honey Cafe & Crepery,"Carrot juice is fresh, a must have. The chicken pesto crepe was delicious. Will definitely go again ;)"
Honey Honey Cafe & Crepery,"Good breakfast place, bit portions, fast service and friendly staff. Would definitely go again."
Honey Honey Cafe & Crepery,Nice menu and very beautiful place. Overpriced food and not super tasty. But haven't tried much.
Honey Honey Cafe & Crepery,Busy restaurant with good service and food options.
Honey Honey Cafe & Crepery,"Amafing food. Big line, you will have to wait, but it's totally worth it. Cool place, polite staff, great food even though it's a crazy busy place"
Honey Honey Cafe & Crepery,The crepes were delicious ! Seems to be busy most of the time but the food came out quite fast :)
Honey Honey Cafe & Crepery,Amazing food but get there before they open to get in line or be prepared to wait. The line soon wraps out the door and down the sidewalk
Honey Honey Cafe & Crepery,"Mediocre, bland food. Potatoes were okay but the rest was flavorless. I don't know why this place has such a high rating."
Honey Honey Cafe & Crepery,"They got our order hopelessly wrong, and bent over backwards to correct it. It turns out the food that arrived was better than what I ordered. Yum!"
Honey Honey Cafe & Crepery,Expect a long wait for Saturday brunch. I recommend the sweet crapes with banana. It comes with crumbled walnuts on top... mmmm yummy.
Honey Honey Cafe & Crepery,The food is delicious but not sure if worth the wait.  The staff is friendly and considerate despite the chaos which is impressive.
Honey Honey Cafe & Crepery,Decent food. Staff was friendly and service was quick despite how busy it was.
Honey Honey Cafe & Crepery,"Long long, but moved super fast. All tables full, but customers didn't linger so seating wasn't an issue. Food was great."
Honey Honey Cafe & Crepery,Only had the chicken soup on the run...it was average.  Will have to try one of the dessert or savory crepes in the future though.
Honey Honey Cafe & Crepery,"In the heart of town, this breakfast place is noted for a large variety of crepes both savory and sweet."
Honey Honey Cafe & Crepery,"Bit of a wait, but the food was delicious. The host have the impatient toddler some strawberries, thankfully, which kept the screams to a minimum."
