0,1
La Promenade Café,"Great place to hang out and to work. Cheerful staff. Good coffee and food. Lots of tables and outlets. Fast wifi.  Quiet, peaceful vibe. The Parisian decor is extremely well done and it works. It's a pleasant 15 minute walk through a quiet neighborhood from Fort Miley VA hospital."
La Promenade Café,"This place has an amazing atmosphere and lounge areas. I would definitely come to hang out and relax. Games and books are available for consumption as well as good food at good prices. I was not impressed with the coffee but I'm not a coffee guy, so it may be a biased opinion."
La Promenade Café,"A friendly staff, a decent lunch menu and a charming interior design adds up to a lovely experience. So whether you just want to read a book in a booth or grab a cup to go this is a great place."
La Promenade Café,"The cafe is separated into a front end with smaller tables and a larger back area with lots of seating and used books for sale.  The coffee is good, the cups are big and still more affordable than Starbucks."
La Promenade Café,"Great study spot.. lots of tables and chairs. Picturesque interior with a wall-size bookshelf (with books for sale  at $5/) in the back. They offer simple but tasty food items, and the coffee isn't bad (not a huge concern for me)."
La Promenade Café,"Lots of space, good wifi. Iced tea is nice and sandwich prices look very reasonable. Great place to work if you can snag one of the numerous outlets."
La Promenade Café,"Only stopped over to get a quick bite, the place was much larger than I expected, and had a great vibe. The coffee was good, but the sandwiches we had were even better. Tried both the Balboa and the BLTA, and both hit the spot. The BLTA was a little on the greasy side, but totally fine."
La Promenade Café,"Great breakfast sandwiches, Allegro coffee and more seating than you would believe could exist in an SF coffee shop. Combine with a friendly staff, a Green Apple stocked book section and free wifi and you have one of the best cafes in SF."
La Promenade Café,Delicious American Breakfast and chai vainilla.
La Promenade Café,"Spacious cafe for coffee/sandwich/smoothies/etc, with plenty of tables for sitting, chatting, reading, working on a laptop (decent free wifi). Various sandwich options, but take note: they usually run out of soup early. Stays open later (10pm) than most coffee shops, which is convenient if you want to drop in before going to a movie across the street at the Balboa theater. (Quite a few other restaurants on this stretch of Balboa to choose from, as well.) Pleasant vibe. And maybe if you’re lucky you can even find parking in a 3 block radius; but the bus goes right past the cafe, too."
La Promenade Café,"This is a fine place to go and have a coffee, an overpriced breakfast sandwich, and then to stay a while to compensate for how much you just spent. They have bowl sized coffees, which goes to help offset the cost. If you’re in the area need coffee, this isn’t a bad option."
La Promenade Café,"A large cafe, largely populated by students and locals. Decorated in a set of clever ""Parisian cafe"" motifs and wall-sized murals, they serve coffee drinks, a wide variety of sandwiches, and desserts. None of these are extraordinary or surprisingly original, but none disappoint either."
La Promenade Café,"Excellent place to go get some work done during the week, comfortable seating with great sandwich pastry and drink selection . On weekends they have board games in the back and occasionally music nights. Highly recommend a stop here if you are in Richmond"
La Promenade Café,"Mostly quiet place to work/study. Some group of ppl can't read ""the air"".  Wifi is slow. really cute place but if you get that white girl on cashier, watch out.  When she's busy, she's scarrrryyyyyyyyyyy.  Not the greatest when you wana sit and chill and focus to study.  Sandwiches are decent.  Power outlets are only on the walls. The whole back wall is book shelf.  Booths are so cute!"
La Promenade Café,"Tons of table space, very reasonable prices, always great service.  The Balboa sandwich is super filling and delicious, and the coffee is always drinkable and decent, not the overpowering artisanal stuff"
La Promenade Café,"It's a big place, but it feels small and cozy. The Danish was the best I've ever had. The breakfast sandwich was great!"
La Promenade Café,"Good coffee and wifi as a baseline, but just a cozy, spacious, bookshelf-lined space that feels like the best of an SF we want to preserve. Eats as well as drinks."
La Promenade Café,"Reliable spot for getting work done. Tons of tables to sit at, and I like the elevated booths when they're free. It's fairly quiet since most are working. Also get sandwiches and drinks here."
La Promenade Café,"Reasonable prices and tons of seating at both down-to-business tables and very lazy, squishy couches. I love this place but I also took away 1 star because their coffee is basically sad brown water."
La Promenade Café,"This cafe is adorable. Great study spot! But also, not too auiet—you can easily meet a friend here and feel comfortable talking with them."
La Promenade Café,Great little coffee spot. Breakfast sandwich was tasty.  I dig the back area with the couches and library area. Good place to chill.
La Promenade Café,"Head here most mornings for a cappuccino and pastry. Always great coffee, kind staff and fair prices. Food is killer for lunch, too!"
La Promenade Café,One of my most favorite cafes in the city. Not your ordinary café! Their food and coffee is actually really good and they have this old school feel.
La Promenade Café,"Great neighborhood cafe that is unusually spacious for SF. La Prom has great drinks & sandwiches, free WiFi, and plenty of space to work."
La Promenade Café,Great decor and environment that makes you feel like you are in a coffee shop/library hybrid. Nice place to study. Both coffee and cookies are yummy.
La Promenade Café,"Cinnamon Chai is so delicious. Love this spot. They've got a Green Apple Books outlet in the back! (They sell food here, so no outside food allowed.)"
La Promenade Café,My first time today....recommended by word of mouth from a local.  I chose the egg salad on Rye... It was toasted to perfection.  Great ambiance and excellent customer service.....nice job Annie!!!
La Promenade Café,"Great food, great music, good vibes"
La Promenade Café,"This is the cutest place. Perfect for doing homework, catching up with a friend, or just relaxing. Parking was very easy to find as well. I would definitely recommend coming here!"
La Promenade Café,Decent but unremarkable coffee and food.  Service often spotty and indifferent.  Best feature is the comfortable and roomy dining area.
La Promenade Café,"It's a quiet little café with its own unique style. I love their vanilla chai latte. Great place to meet clients, get your work done."
La Promenade Café,"Very comfortable and chill, good coffee,  apple pie and music. Free wifi and have outlets for charger."
La Promenade Café,Thank you for the nice review!!
La Promenade Café,"Wifi can be pretty slow. Food is affordable. Charger outlets are scarce. Great place to study, chat and mingle."
La Promenade Café,The San Francisco UKULELE REBELLION meets here monthly on third Saturday nights to jam. Relaxed cool vibe of the neighborhood coffee shop. Thumbs up.
La Promenade Café,Kind and quick staff. Delicious food and coffee for a decent price.
La Promenade Café,One of the best Cafe's to sit for long periods of time and get work done without feeling like you've overstayed your welcome.
La Promenade Café,"The most adorable atmosphere. Their sandwiches aren't super amazing, but the drinks and atmosphere is fantastic."
La Promenade Café,"Really like this place, I Loved the decoration, didn't really liked my coffee that much, but I'll go back for sure."
La Promenade Café,Great food and teas and coffee! Good WiFi and very nice and quiet setting to study or do some work.
La Promenade Café,Good food and coffee drinks in a warm atmosphere. Great space for working remote and fast wifi!
La Promenade Café,"Free wifi, very spacious, love the decorations. Looks like they also have small events scheduled here as well!"
La Promenade Café,Good atmosphere. I can stay here for a day long..
La Promenade Café,Thank you for the awesome review! We really appreciate it. Hope to see you again soon!
La Promenade Café,Great for breakfast. Yummy coffee drinks. And working! Super friendly staff .love this place!
La Promenade Café,Very cosy place to enjoy good coffee and sandwiches however wifi is horrible. It is almost always down. Not a good place to study
La Promenade Café,"Best cafe in SF imo for work, hangout, friendly staff, and coffee/food. Plenty of seats too!"
La Promenade Café,Great coffee drink at great prices. There's tons of seats and the decoration is beautiful.
La Promenade Café,"Spacious, work friendly and affordable food and drink. As good a cafe as you can find in this city"
La Promenade Café,"Great space for working. It’s huge, lots of tables and has even a few individual booths to settle in."
La Promenade Café,"Love to come here and get work done. Very cozy.  However, Be sure you’re being charged correctly."
La Promenade Café,More plugs needed Just a couple of 3 to 6 foot extension cords would work. The latte was fantastic.
La Promenade Café,"Coffee is good and affordable, employees are friendly, and atmosphere is great."
La Promenade Café,Great place to get breakfast and a cup of coffee. Love the lay out and had the BLT was great.
La Promenade Café,Great place to chill and have s variety coffee drinks and food. Great atmosphere.
La Promenade Café,"Had a fantastic breakfast and coffee. It was really busy,and that's always a good sign."
La Promenade Café,"I love getting my cherry ice tea . Or a vanilla late depending on the weather,but it's always a pleasure stopping bye"
La Promenade Café,Their 'Tuscany Chicken' sandwich is to die for! Yum! 😋
La Promenade Café,Hi Mark. Thank you for your great review! We hope to see you again soon and have you try our other delicious sandwiches! 
La Promenade Café,"Great local cafe. Prices are good, coffee and food are average."
La Promenade Café,My favorite cafe I’ve ever been too. EVER.
La Promenade Café,Thank you for your wonderful review. We hope to see you again soon!
La Promenade Café,The bagel was outstanding! Best cream cheese bagel I have in years! Thank you!
La Promenade Café,"Great coffee, quick staff and lots of room for chatting, playing board games or just hanging."
La Promenade Café,Great cafe to work at. There's lots of seating and wifi.
La Promenade Café,Great place to work quietly. Coffee was good! Would go again.
La Promenade Café,"If you're interested in a coffee drink, try to avoid the Parisian Latte. A bit too sweet."
La Promenade Café,"Love to work at La Promenade. Big tables, free wifi, good coffee and sandwiches."
La Promenade Café,Nice neighborhood hang out. Great coffee and food.
La Promenade Café,It’s a very nice place and there are lots of free music lives
La Promenade Café,"One of my favorite places to grab a drink, sit, and write. There are books and games in the back."
La Promenade Café,Nice little affordable cafe to work at. Not enough electric outlets.
La Promenade Café,Really cute place. Had the pizza here and coffee . Really good
La Promenade Café,Kind of confusing which order is yours.
La Promenade Café,Good music on occasional nights and a place where you can have a restfull retreat. Poetry reading in background now.
La Promenade Café,Great spot to enjoy a coffee drink and do some work or play a board game
La Promenade Café,The ambiance was inviting and relaxing and my meal was delicious.
La Promenade Café,"Nice, eclectic atmosphere, friendly staff, OK food."
La Promenade Café,"Very good choice of sandwiches, great ambience, books to read and good coffee"
La Promenade Café,"Free late night jazz concert, people playing chess, plentiful power outlets."
La Promenade Café,Very cozy
La Promenade Café,Roomy laid back coffee house. Good sweet stuff as well as good coffee.
La Promenade Café,"I enjoy this place alot, but I recommend holding your breath when you go to the restroom."
La Promenade Café,"Great food, reasonable prices, friendly atmosphere"
La Promenade Café,Such a pretty place and the coffees are soo good
La Promenade Café,"Great customer service, and environment. I love this coffeeshop!"
La Promenade Café,Best thing everrr! Notice the three rs. Get the balboa or the smoked salmon!
La Promenade Café,Very comfortable place to have a coffee and a book.
La Promenade Café,Open airy environment with friendly staff and solid coffee.
La Promenade Café,Roomy with a book shelf. Waitress is super nice and pretty.
La Promenade Café,Best place on Earth to read a book or do your own things that you won't do at home.
La Promenade Café,"This is a beautiful Internet cafe good for coffee, food, and desserts."
La Promenade Café,Was this place the Outer Richmond campaign headquarters for London Breed? Yeeesh.
La Promenade Café,"Friendly, cozy, community builder, good cappuccino at a reasonable price."
La Promenade Café,"Overpriced, mediocre food. Slow wifi. It's clean though"
La Promenade Café,"BLTA all day all night, best sandwich ever!"
La Promenade Café,Great sandwiches and a very good latte!
La Promenade Café,"Cozy, great ambience, great place to work and read. Service is chill"
La Promenade Café,Good cafe chock full of people using it as an office.
La Promenade Café,The caffe mocha is great.
La Promenade Café,"Great atmosphere, love the board games :)"
La Promenade Café,Nice atmosphere. Really nice sandwiches.
La Promenade Café,Kind considerate service...with expedited speed and good qualify
La Promenade Café,They make a good coffee and smile
La Promenade Café,Nice place to grab coffee and read...or do homework...or work related things
La Promenade Café,"Everybody is getting work done here, so good influence"
La Promenade Café,Lady lox! A must
La Promenade Café,I love this cafe!
La Promenade Café,Amazing place to work on your laptop
La Promenade Café,Love the staff food and ambiance
La Promenade Café,Great ambiance in quiet calm setting.
La Promenade Café,Nice place to study and having coffee
La Promenade Café,Great place to get work done.
La Promenade Café,Great for coffee and a light snack
La Promenade Café,The best in the west 👍
La Promenade Café,Thank you for the 5 stars!
La Promenade Café,"Cozy, comfortable, tasty coffee drinks"
La Promenade Café,Sandwiches and coffee are phenomenal.
La Promenade Café,It's good
La Promenade Café,"Good price, nice environment"
La Promenade Café,Sandwiches a good price!
La Promenade Café,"Damn, those bagels. Oh, my."
La Promenade Café,Cool spot for coffee/studying
La Promenade Café,Very good coffee.
La Promenade Café,Best cafe in the neighbourbood
La Promenade Café,Affordable breakfast in the city
La Promenade Café,Great Food and Great Service!!!!!!!
La Promenade Café,Good choice of breakfast
La Promenade Café,Love this place
La Promenade Café,Love the live music
La Promenade Café,Excellent place to work
La Promenade Café,Good neighborhood cafe.
La Promenade Café,"Grate  design ,, i like it ."
La Promenade Café,Solid neighborhood Cafe 😁 …
La Promenade Café,Good environment!
La Promenade Café,Good chi tea
La Promenade Café,Good music.
La Promenade Café,Great place!
La Promenade Café,Good experience
La Promenade Café,"Nice, tasty."
La Promenade Café,Nice coffee shop
La Promenade Café,Good food.
La Promenade Café,To go cups
La Promenade Café,So cute!!!!
La Promenade Café,Good coffee.
La Promenade Café,Beautiful place
La Promenade Café,Books and coffee
La Promenade Café,Good coffee
La Promenade Café,"San Francisco has many hills, beautiful residential houses, tram, trolley bus and cable car. And also many cafes. One of them is La promenade Café. A café with a French twist. Laptops? Yes, but not dominant. Prices? Remarkably modest. Music? Yes, but as a pleasant background. La Promenade est une vraie promesse."
La Promenade Café,Thank you for your kind review. Hope to see you soon!
La Promenade Café,"Atmosphere is good. House coffee ssam. don't notice There is a code for each seat against the wall. In a word, solid"
La Promenade Café,"I ordered eggs salad sandwich with Cafe Latte, the bread is very crispy, the price is not expensive, and I can sit for a whole afternoon"
La Promenade Café,Thank you for the review!
La Promenade Café,Very cozy cafe where to hang out with good food 🙂
La Promenade Café,"A Parisian decor, nice and inexpensive dishes, 15 minutes walk from the beach."
La Promenade Café,Pleasant
La Promenade Café,Thank you for the 5 stars rating! It puts a smile on our face. 
La Promenade Café,Thank you for the awesome rating! We really appreciate your feedback and hope to see you again soon!
La Promenade Café,Thank you for the 5 stars rating! We really appreciate the feedback.
La Promenade Café,Thank you for the 5 stars review!
La Promenade Café,"Hi, Loc. Thank you for the 5 stars rating! You put a smile on our faces."
La Promenade Café,"Hi Mel. We are sorry to see the 1 start rating and take this very serious. At La Promenade, we strive to give our costumers the best service and dining experience. Please let us know how we can make your experience better. Thank you."
