0,1
Rise & Grind Coffee and Tea,Great quick service with a variety of delicious drinks. I got the iced spicy chai and it actually tasted like chai! Great place to grab a quick drink
Rise & Grind Coffee and Tea,Everything here is delicious!!! I love the Creme Brulee Latte and Avocado toast. The staff is super friendly 🤩 …
Rise & Grind Coffee and Tea,Love their avocado toast mainly the reason why I visit this place. Coffee is great and staff are always accommodating. Highly recommended!
Rise & Grind Coffee and Tea,Thank you!
Rise & Grind Coffee and Tea,Nice little stop for coffee and a light bfast. Loved the bunwich sandwich. Pics on google are misleading - they do not serve waffles anymore.
Rise & Grind Coffee and Tea,"love this neighborhood coffee shop! friendly staff, amazing coffee and food and great atmosphere!  a daily must for my morning pick me up!"
Rise & Grind Coffee and Tea,Great little coffee shop near the park. If you're looking for a great stop to sit down for a bit come on through here. The biscoff cookie butter late is wonderful.
Rise & Grind Coffee and Tea,It was best place in  my trip. People are very kind. Coffee was great. Thank you for giving me two pieces of Cookies.
Rise & Grind Coffee and Tea,"Don’t think I’ll be going back. Cute spot but okay staff — not rude or anything, just standoffish and not my vibe"
Rise & Grind Coffee and Tea,Business should update their hours on google to not waste their customers’ time
Rise & Grind Coffee and Tea,"Super place. Friendly helpful staff. The avocado toast for breakfast is delightful. Coffee's hot, large and tasty."
Rise & Grind Coffee and Tea,"Cute place, good for families, studying, and hanging out with friends. No wait this morning! Espresso had a little bite to it, but otherwise it was delicious."
Rise & Grind Coffee and Tea,Matcha waffles had great flavor but were too dry. Creme brulee latte was a performance to make!
Rise & Grind Coffee and Tea,"They sell a lot of unique, tasty coffees. They have good wifi and tons of outlets. Barista is also really friendly!"
Rise & Grind Coffee and Tea,Great spot for a variety of drinks. Grab a coffee and walk in the park!
Rise & Grind Coffee and Tea,Not a very good cold brew. Spicy chai tastes like ginger water and service was even worse. Would not return.
Rise & Grind Coffee and Tea,"Friendly, cozy spot to grab coffee and a bite. All the baristas are on a first name basis with their regulars. Love the energy of this neighborhood spot."
Rise & Grind Coffee and Tea,Great group of people and great location right near the de Young and Academy of Science.  I recommend the Richmond chill and the creme brulee latter if you want a dessert coffee
Rise & Grind Coffee and Tea,Service was exceptional! Our coffee was taking a bit longer to make due to a special request and they gave us free banana bread for the wait.
Rise & Grind Coffee and Tea,"Rise & Grind is a welcome addition to the neighborhood. Well made coffee drinks, tasty snacks and friendly staff help make this spot a convenient regular pitstop."
Rise & Grind Coffee and Tea,"Black sesame latte, breakfast sandwich"
Rise & Grind Coffee and Tea,Favorite coffee spot in town. Signature lattes are all delicious.
Rise & Grind Coffee and Tea,I asked if my child could use the restroom emergency . Employee stated for customers only . Called me rude for being concerned for my kid peeing on herself. Customers very nice
Rise & Grind Coffee and Tea,"Sandwiches are delicious, highly recommend."
Rise & Grind Coffee and Tea,"Super nice staff, very friendly, knew their regulars, and kept taking orders even after closing."
Rise & Grind Coffee and Tea,Great coffee and kind staff! The Crème Brûlée Latte is delicious!
Rise & Grind Coffee and Tea,Had a really great Ethiopian pour over here. Some tasty but not amazing lunch too.
Rise & Grind Coffee and Tea,I don't often go to cafes but this place is so much more than that. It's a community. Love it here.
Rise & Grind Coffee and Tea,My go-to coffee shop in the Richmond. Can’t miss with the Richmond Chill and Pastrami sandy!
Rise & Grind Coffee and Tea,"Great coffee and food, although the tech douche shouting into his bluetooth earbuds or his Skype session is often found here"
Rise & Grind Coffee and Tea,I like their coffee. It's a nice little neighborhood location that is conducive to quiet conversations and studying.
Rise & Grind Coffee and Tea,"They are so nice here and they always remember my name.  For that reason, I will sometimes go out of my way to stop in even if I am in a different trajectory to work."
Rise & Grind Coffee and Tea,Small little coffee and tea shop right next to the park. Didnt get any food but looked like they had some decent options.
Rise & Grind Coffee and Tea,Great service and good drinks. Plenty of seating and a restroom for customers. No baby changing station... lol.
Rise & Grind Coffee and Tea,"Coffee tasted bitter and burnt, like they need to clean their machine asap. Milk was steamed like one big foam blurb.. ☹️"
Rise & Grind Coffee and Tea,We are so sorry hear that your experience was not pleasant. Can you tell us what drink you ordered and what time you went into the shop. We'll get to the bottom of this right away.
Rise & Grind Coffee and Tea,"Closes at 1, not 5"
Rise & Grind Coffee and Tea,such nice baristas! Loved the cookie something latte 🤍🤍 …
Rise & Grind Coffee and Tea,"Coffee shop itself is OK but coffee is not. Tried this place twice, still didn't like the coffee. It is more expensive too compare to other coffee shops in the neighborhood."
Rise & Grind Coffee and Tea,"Hi Cynthia,  We are sorry you did not enjoy the coffee. Can you tell us how we can make it better?"
Rise & Grind Coffee and Tea,Excellent spicy chai and great variety of fun drinks! Grab one and hang in the park!
Rise & Grind Coffee and Tea,"Great menu, great coffee and friendly quick service!!  Try the Richmond Chill on a hot day!"
Rise & Grind Coffee and Tea,Ginger peach tea had no Ginger flavor.  There coffee is good though
Rise & Grind Coffee and Tea,Great coffee and friendly service. You cannot ask for more.
Rise & Grind Coffee and Tea,Tried a few coffee spots in SF during vacation and this was the best one.  Worth the line.
Rise & Grind Coffee and Tea,Nice boutique coffee shop. Small drinks. Breakfast food was great.
Rise & Grind Coffee and Tea,"Don't let customers use their restroom, lol"
Rise & Grind Coffee and Tea,Closed at 1 pm. Google says 5. Don’t believe google.
Rise & Grind Coffee and Tea,Neat little place off the main road. Food and coffee tastes good and the prices are fair.
Rise & Grind Coffee and Tea,Cool unique drink options and great location
Rise & Grind Coffee and Tea,"Fav coffee shop. Super nice staff, fast internet and excellent coffee and food selection"
Rise & Grind Coffee and Tea,Amazing food and strong cold brew. Not in my neighborhood but will be looping back.
Rise & Grind Coffee and Tea,I really love the vibe in this place. The coffe and waffles were amazing!
Rise & Grind Coffee and Tea,Very good coffee and a mean avocado toast!
Rise & Grind Coffee and Tea,"Small and comfy, good vibes from locals."
Rise & Grind Coffee and Tea,"Great service, and the flavors of lattes were so creative and delicious!"
Rise & Grind Coffee and Tea,Coffee is good. I like the art coner for sale with a reasonable price.
Rise & Grind Coffee and Tea,The “Breakfast Bunwich Sandwich” is great! The mocha too 😊 …
Rise & Grind Coffee and Tea,"Nice costumer service, good coffee, but the ambulance is a bit cold and can improve"
Rise & Grind Coffee and Tea,Overrated sorry to say..the espresso here is very bland no flavor..
Rise & Grind Coffee and Tea,Coffee is very good. But paper cups kill the taste of the coffee.
Rise & Grind Coffee and Tea,"Can’t believe I’m just finding this place. Amazing food, coffee, and art. Great little coffee shop"
Rise & Grind Coffee and Tea,I love this place!  Be sure to try the creme brulee latte!
Rise & Grind Coffee and Tea,Awesome spot by the GG park. Great coffee and snack selection
Rise & Grind Coffee and Tea,Perfect spot to grab a coffee and a bite before exploring Golden Gate Park
Rise & Grind Coffee and Tea,Had spicy mocha....it was unique and spicy....but never again
Rise & Grind Coffee and Tea,Great coffee shop
Rise & Grind Coffee and Tea,"Great coffee, friendly helpful people, good prices."
Rise & Grind Coffee and Tea,Very cute place. Great tea and very friendly❤️
Rise & Grind Coffee and Tea,Friendly staff and a great atmosphere to work or just enjoy a coffee or breakfast
Rise & Grind Coffee and Tea,Soporte tasty avocado toast and a coffee. Highly recommend.
Rise & Grind Coffee and Tea,Great spot to get some work done with great food and cute drinks!
Rise & Grind Coffee and Tea,Unfortunately opening hours weren’t update. Got here only to find out it’s closed.
Rise & Grind Coffee and Tea,"Hi Keren, can you tell us why you left us this rating?"
Rise & Grind Coffee and Tea,"Incorrect hours, only open until 1pm :-("
Rise & Grind Coffee and Tea,I love the breakfast sandwich!!
Rise & Grind Coffee and Tea,Fine place to grab a cup after the golden gate park walk.
Rise & Grind Coffee and Tea,"Tiny place with a lot of people sitting quietly, working on their apple computers."
Rise & Grind Coffee and Tea,"Hi Ma,  Please let us know how we can make your experience more enjoyable?"
Rise & Grind Coffee and Tea,Conveniently locate on edge of GG park. Great coffee.
Rise & Grind Coffee and Tea,Prices are including taxes! Reliable. Good. Nice people.
Rise & Grind Coffee and Tea,Inventive coffees and delicious sandwiches too.
Rise & Grind Coffee and Tea,Great place. Had a London Fog and it was great!!!
Rise & Grind Coffee and Tea,Average coffee but a cute coffee shop!
Rise & Grind Coffee and Tea,Absolutely amazing breakfast sandwich!
Rise & Grind Coffee and Tea,HOURS ARE WRONG  Closed at 1 😡😡 …
Rise & Grind Coffee and Tea,Tasty cold brew and friendly baristas.
Rise & Grind Coffee and Tea,Nice place with WiFi
Rise & Grind Coffee and Tea,"Great food, cool art, and awesome workers"
Rise & Grind Coffee and Tea,Excellent coffee with excellent service!
Rise & Grind Coffee and Tea,Fantastic iced chai tea latte!
Rise & Grind Coffee and Tea,Great hot chocolate
Rise & Grind Coffee and Tea,Great variety of creative lattes.
Rise & Grind Coffee and Tea,I love the art work and the friendly staff
Rise & Grind Coffee and Tea,The best coffeee in the whole world
Rise & Grind Coffee and Tea,"Friendly service, great drinks"
Rise & Grind Coffee and Tea,Good food and Wi-Fi
Rise & Grind Coffee and Tea,super
Rise & Grind Coffee and Tea,Great neighborhood coffee place!
Rise & Grind Coffee and Tea,Best latte in a long time!
Rise & Grind Coffee and Tea,Decent cappuccino
Rise & Grind Coffee and Tea,coffee Soo delicious
Rise & Grind Coffee and Tea,Great location.
Rise & Grind Coffee and Tea,Good Belgian waffle!
Rise & Grind Coffee and Tea,"Egg sandwich, amazing"
Rise & Grind Coffee and Tea,Great coffee and food.
Rise & Grind Coffee and Tea,Good blt good drinks.
Rise & Grind Coffee and Tea,Brunch which was awesome
Rise & Grind Coffee and Tea,Cool place for your needs
Rise & Grind Coffee and Tea,Friendly
Rise & Grind Coffee and Tea,Coffee was average.
Rise & Grind Coffee and Tea,Great ambience
Rise & Grind Coffee and Tea,Such character!
Rise & Grind Coffee and Tea,Great coffee
Rise & Grind Coffee and Tea,Horrible service
Rise & Grind Coffee and Tea,"We're sorry about that. Can you tell us a bit more about your experience? Were you the one that asked to use the restroom at 6:00 PM, when were closed?  We apologize, but it is Mother's Day and our staff want to go home and spend time with their moms.  -Management."
Rise & Grind Coffee and Tea,"Golden Gake Park is really right in front. It was a place I googled for morning coffee, and it was a small but very pleasant place. Coffee is good too."
Rise & Grind Coffee and Tea,"Excellent, very rich the frittata"
Rise & Grind Coffee and Tea,"A very nice place to have a coffee and something to eat. The paintings on the walls, very interesting, by local artists. The chicken salad sandwich is very good."
Rise & Grind Coffee and Tea,"Rich breakfasts and coffee, a fairly quiet environment, ideal to go to work on the computer or study"
Rise & Grind Coffee and Tea,Attention new map!
Rise & Grind Coffee and Tea,real dog taste. super duper great. cookie latte tastes amazing. i cant forget it.
Rise & Grind Coffee and Tea,Best cafe
Rise & Grind Coffee and Tea,Unfriendly staff
Rise & Grind Coffee and Tea,Nice milk
Rise & Grind Coffee and Tea,"Hi Matt, can you give us some feedback so we can improve? We  greatly appreciate it."
Rise & Grind Coffee and Tea,"Hi Andrea, Is there something we can do to make your visit more pleasant next time?"
