0,1
Sightglass Coffee,"My favorite coffee in San Francisco has to be sightglass. If you’re looking for a great place to catch up with a friend, or you’re showing a visitor around the city, definitely make a stop st a sightglass. The place doesn’t have WiFi which makes it perfect for IRL conversations, not for online ones. On top of top quality coffee, they have beautiful interiors (this one in the mission is on the smaller side) and the loveliest baristas. Though on the pricy side, I’d say it’s worth it!"
Sightglass Coffee,"The masala chai was soo tasty, loved the out doir aeating with trees."
Sightglass Coffee,The coffee here is always perfect. Just as good as a good coffee back home in Australia. And picking up through their window is convenient and safe.
Sightglass Coffee,The coffee here is one of my favorites in the city. I always try to visit when I'm back! Also love the decor and ambiance at this location.
Sightglass Coffee,Great coffee and atmosphere
Sightglass Coffee,"The service was polite without being overbearing, the staff were professional and timely and the coffee was made perfectly by an expert barista. However, the espresso was good but very very acidic."
Sightglass Coffee,"Very nice atmosphere. Good service. Coffee is delicious. In do wish there were more tables, but it was not over crowded."
Sightglass Coffee,"My husband and I still talk about this coffee place. Probably one of the best we have been to in this country, and we have been to a lot. The most delicious almond milk latte I have ever had."
Sightglass Coffee,"Nice decor, but windows and doors wide open made the place feel very cold and damp. Benches are very uncomfortable. Beverages are great, but very small, therefore not very good value. Croissant was not fresh."
Sightglass Coffee,"Sitting outside on the bench is my favorite of all the SF cafe perches. Sightglasd has great coffee, great pastries, and a lovely space inside and out."
Sightglass Coffee,"Loves to close for entire days while not bothering to update their website or Google Maps. Luckily, they post a note on their window so you find out after traveling there."
Sightglass Coffee,My favorite way to start a Saturday. Often get the espresso con panna. I've never been disappointed. Love this little 'hood in the Mission.
Sightglass Coffee,Sightglass typical great coffee. Nice miami vibe and great pastries (e.g. Dynamo Donut). Wait was a little long.
Sightglass Coffee,beautiful artisanal coffee! just like in nz
Sightglass Coffee,"Almost nowhere better to caffeinate in the whole city of San Francisco. Great coffee and snacks, friendly staff, comfortable seating, and plenty of natural light."
Sightglass Coffee,Epic coffee. Super rad spots
Sightglass Coffee,Great coffee and pastries. High ceiling and lots of light make the small space feel big. Spot your favorite tech celeb popping in for a ☕️.
Sightglass Coffee,Huge hype on the internet about this place but the coffee turned out quite disappointing both the pour over I was served there and the beans I bought for home. If you don’t care this much about your coffee then it’s a nice place to chill in.
Sightglass Coffee,"❤️ aroma when roasting. Variety of origins & blends, excellent pastries, minimalist high quality fitout. Coffee 5. Pastries 5. Atmosphere 5. Service 5."
Sightglass Coffee,Great cortado - best coffee I’ve had in SF ✨
Sightglass Coffee,One of the best coffee fixes in town that guarantees you coming back for more! Not to mention the place is a sight for sore eyes and the service is wonderful!
Sightglass Coffee,"Small, mostly unassuming coffee shop with really good coffee. I was pretty underwhelmed by the croissant I ordered, but that may have been a function of me visiting them in the afternoon."
Sightglass Coffee,Coffee was  pretty. Good. Not a fan of the cold brew. I would recommend the place add some syrups to add just a bit of sweetness.
Sightglass Coffee,"Great for coffee snobs, but a bit expensive for me. I only went here because it was a holiday and my usual places were closed."
Sightglass Coffee,Love this coffee shop. It is definitely on the trendy side of things but the coffee quality is as great as the Instagram pictures you'll get.
Sightglass Coffee,Great coffee. This place us buzzing! Lots of delicious pastries too. Another great coffee joint in SF
Sightglass Coffee,"The place is very well decorated but you would have a hard time enjoying it. There's very little sitting, No Wifi, No restroom."
Sightglass Coffee,"Located in a quiet neighborhood, this coffee shop is a great place for a afternoon hangout. Good coffee and comfortable chairs!"
Sightglass Coffee,"This comparatively unknown Sightglass location is just as good as 7th Street and, unlike 7th Street, isn't a massive greenhouse that gets insanely hot during the day.  Bring your dog."
Sightglass Coffee,"Love it! Style, passion, coffee!!!"
Sightglass Coffee,Excellent coffee. This location is smaller than the SOMA space. It can get a bit crowded. You still get the same delicious coffee.
Sightglass Coffee,"Very good espresso, house blend and single origin options. One of my regular espresso destinations."
Sightglass Coffee,Cute and fancy coffee shop in Mission. Drinks taste nice and the outside bench on a nice day is amazing. Recommend!
Sightglass Coffee,I like this smaller sight glass coffee shop more than the one on 7th St Soma. It's much cozier. The coffee is always good!
Sightglass Coffee,One of the coffee places that everyone should visit in SF. They also have amazing pastries.
Sightglass Coffee,Very fancy coffee options with great working areas. Perfect place for casual business meetings for small groups.
Sightglass Coffee,"Great coffee, great food! Love the outdoor seating parklet!"
Sightglass Coffee,Nice location.  There are a lot of great restaurants near by and I love sight glass coffee.
Sightglass Coffee,I know this is a highly rated place but I was underwhelmed by the flavors I tried. It's not super pricey so continue going if it's in your neighborhood.
Sightglass Coffee,"My favorite coffee place in SF so far! Loved the coffee, the service and the amazing interior design."
Sightglass Coffee,"Cool place, good shot of espresso,vintage stereo and vinyl. I would want to be seen here if I were as cool  as the crowd that frequents."
Sightglass Coffee,Decent coffee and good pastries
Sightglass Coffee,They serve coffee and pastries but if you want Splenda or stevia or something sugar free they don't have it. All they have is sugar.
Sightglass Coffee,Great space. Tasty savory pastries. Try the sauerkraut cheddar tart if you're avoiding meat.
Sightglass Coffee,"Second best coffee in the city.  Unfortunately, they don't carry Owl's Howl or other roasts available from the SOMA location."
Sightglass Coffee,"The vanilla iced cold brew (with whole milk or almond milk) is great, as is the hand-pour drip coffee."
Sightglass Coffee,"The smaller sibling to the sightglass coffee on 7th, this place is the go to coffee destination while working in the area. Fast friendly service."
Sightglass Coffee,Holy hell their coffee is so damn good. Always a huge fan of their Latte!
Sightglass Coffee,Food and coffee are great but not a good place to linger. The seating is limited and pretty crowded.
Sightglass Coffee,"Delicious coffee. But beware: limited seating, no other drinks besides coffee/espresso (no tea, for example), and no WiFi."
Sightglass Coffee,Staff are friendly and make me want to come back. Coffee is good too!
Sightglass Coffee,Worst atmosphere because it was a toaster inside. Don’t plan on staying to enjoy the steep prices too long.
Sightglass Coffee,They definitely know how to prepare coffee here and the pastry options are excellent. Try the everything croissant!
Sightglass Coffee,Really good coffee and pastries. Pretty quick too...the line is never ridiculous. Not much seating.
Sightglass Coffee,Not your typical sf cafe.  Best cup I've had in the city.  It's worth the $7
Sightglass Coffee,Gorgeous space and delicious coffee! Truly one of the best in the country.
Sightglass Coffee,Good and friendly service. Nice atmosphere. And pretty decent coffee
Sightglass Coffee,"Most people like it but I find it a bit too acidic. The location is great though, nice and spacious."
Sightglass Coffee,Excellent coffee in a very lovely cafe if not a little pretentious.
Sightglass Coffee,"Great coffee, travestious hours. Some of us need coffee after 3pm stop judging me!"
Sightglass Coffee,Fabulous coffee at an excellent price. Also like their taste in tunes.
Sightglass Coffee,Cold coffee was acrid; pastry was stale; no WiFi. ☹️
Sightglass Coffee,"If you are into Coffee and happen to be in SF, you gotta try visit Sight glass. Really nice coffee"
Sightglass Coffee,"Great coffee, great everything croissants!"
Sightglass Coffee,Grab your (excellent) coffee and trot upstairs to the balcony seating for some of the best people watching in the city. Hipster bingo!
Sightglass Coffee,"Light, airy, clean atmosphere. Interesting brews. Only thing is that I wish there was more seating..."
Sightglass Coffee,Why is my iced coffee chalky?? Just not good.
Sightglass Coffee,A great place to get a cup of coffee. The vanilla iced coffee is delicious.
Sightglass Coffee,"Best latte I've had. But I live in the southeast, so I may not have a great point of reference."
Sightglass Coffee,"I love this coffee shop, it's right by my office and their blends are scrumptious."
Sightglass Coffee,"Very nice cold brew, beautiful room. Super friendly staff!"
Sightglass Coffee,"Clean environment and friendly staff. They only had two decaf options, though that shouldn't be a problem for most patrons."
Sightglass Coffee,Great coffee and scones. Very picturesque and love the vinyl music!!
Sightglass Coffee,I tried a Colombian pour-over and it was the best cup of coffee that I have had in a long time.
Sightglass Coffee,Nice Place and Nice Coffee!
Sightglass Coffee,Great coffe with friendly staff
Sightglass Coffee,Beautiful coffee shop.
Sightglass Coffee,"The decor is beautiful and the coffee is decent, but the ordering was confusing and the customers were a bit rude."
Sightglass Coffee,"Solid shot, great space. One of my favorite cafes in the city!"
Sightglass Coffee,"Pricey coffee that's coffee flavored. If you like the flavor of coffee, they have some you can purchase."
Sightglass Coffee,No words can truly describe how good their coffee is!
Sightglass Coffee,Great coffee. Nice place but quite small.
Sightglass Coffee,Sightglass is one of the few places I can count on for excellent espresso.
Sightglass Coffee,"Awesome coffee and ultra friendly staff, ground coffee to go too"
Sightglass Coffee,"Great coffee, cool vibes."
Sightglass Coffee,Nice coffee and casual atmosphere. Great area!
Sightglass Coffee,"Good coffee, staff was friendly, could do with a few more seats."
Sightglass Coffee,"Excellent coffee, quick service, limited seating, no wifi."
Sightglass Coffee,Fantastic coffee! Pleasant barista interaction. Low wait time
Sightglass Coffee,"Nice interior design, although very limited seating.  No outlets or wifi."
Sightglass Coffee,"Delicious cup of coffee, and the cascara soda was great tasting as well."
Sightglass Coffee,Excellent location and very good coffee plain and simple.
Sightglass Coffee,A SF staple. Wonderful coffee and friendly staff.
Sightglass Coffee,Great strong coffee and nice and quiet atmosphere.
Sightglass Coffee,"Good coffee, nice team. Some pastries are just ok."
Sightglass Coffee,Beautiful interior. Sparkling water comes standard with espresso.
Sightglass Coffee,Baristas here are absolute masters of coffee making. This is simply award winning coffee.
Sightglass Coffee,AMAZING lattes and I love that SUBSTITUTING FOR OAT MILK is FREE
Sightglass Coffee,Coffee is good-seating is super limited and space is laid out awkwardly
Sightglass Coffee,Guy who took my order wasn't the most pleasant and then proceeded to correct me on how I said my name. Awesome.
Sightglass Coffee,Over of the most beautiful coffee shops I've ever been in
Sightglass Coffee,My favorite coffee in SF ... super tasty !
Sightglass Coffee,Delicious pastries but no wifi :/
Sightglass Coffee,"What's not to love? Great coffee, ace decor, best music ..."
Sightglass Coffee,They do a nice pour over and roast their beans on on-site.
Sightglass Coffee,I don't think that my days would start any better without Sightglass's flat white every morning
Sightglass Coffee,"Delicious coffee and pastries, almost never a wait, and beautiful interior"
Sightglass Coffee,Good cold brew and their pastries hit the spot.
Sightglass Coffee,"on sight roasting, and excellent craft coffee.  No wifi?  Really?"
Sightglass Coffee,Single origin and espresso offerings in a beautiful converted industrial space.
Sightglass Coffee,Awesome flat white!
Sightglass Coffee,Get their vanilla iced cold brew and you won't be sorry! I dream about it to this day :)
Sightglass Coffee,On weekends it's a great place to bring a dog to socialize outside.
Sightglass Coffee,I just want to know why they have vinyl behind the bar.
Sightglass Coffee,"Quintessential SF coffee shop, expectedly expensive but delicious"
Sightglass Coffee,I like the setting of Sightglass. This location is not as spacious as the SoMa or other branches.
Sightglass Coffee,"Nice space, good coffee. No wifi"
Sightglass Coffee,Getting pastries from neighbor bakehouse without going all the way to dogpatch are what keeps me coming back here all the time!
Sightglass Coffee,Solid coffee but takes a while to get your order
Sightglass Coffee,Nice little spot.
Sightglass Coffee,The Best! I love the rich smooth blend! 😋😁😃 …
Sightglass Coffee,"Low-key location, same great coffee and staff"
Sightglass Coffee,Good stuff to stop by and eat to get your morning started in the city.
Sightglass Coffee,If some of the finest coffee beans grown around the world
Sightglass Coffee,The cappuccino here is one of my favorites in SF!
Sightglass Coffee,Place is great and the cold brew is bonkers good
Sightglass Coffee,They have great pastries from B Patisserie.
Sightglass Coffee,Really tasty cold brew. It was potent as well.
Sightglass Coffee,"This Sightglass location roast their own beans, different from the SOMA location."
Sightglass Coffee,"Nice space, great place to meet a friend for a chat."
Sightglass Coffee,"If you want wifi or outlets, go to the Atlas cafe across the street"
Sightglass Coffee,Great amount of outdoor seating
Sightglass Coffee,"Very good soy cappuccino, delightful decor"
Sightglass Coffee,"pretty good, expensive though. as most things are in the city."
Sightglass Coffee,My favorite coffee bar in San Francisco!
Sightglass Coffee,Nice bench outside for chilling and people/dog watching...
Sightglass Coffee,"Coffee is great here, all I can say."
Sightglass Coffee,As an Aussie in SF - this coffee is legit! Check it out.
Sightglass Coffee,"Expensive, $10 for a coffee"
Sightglass Coffee,Best lattes in San Francisco. Consistently great.
Sightglass Coffee,very cute coffee shop in the mission district
Sightglass Coffee,"Cool space, still the same great coffee"
Sightglass Coffee,"very cool space, good coffee."
Sightglass Coffee,This place is a must eat for any occasion.
Sightglass Coffee,Iced coffee with almond milk is delicious.
Sightglass Coffee,Excellent coffee and interior design.
Sightglass Coffee,Cascara Shrub is wonderfully tangy and sweet
Sightglass Coffee,Open on days other coffee shops are closed.
Sightglass Coffee,Great coffee and a cozy place.
Sightglass Coffee,Very challenging to have a conversation because it was so loud
Sightglass Coffee,Best coffee in SF.  Period.
Sightglass Coffee,Pretty damned good espresso!
Sightglass Coffee,Great place to relax and enjoy an afternoon
Sightglass Coffee,"Yummy granola and a relaxing, airy atmosphere"
Sightglass Coffee,Great coffee and sweet environment.
Sightglass Coffee,Great lattes!
Sightglass Coffee,Tasty pricey coffee
Sightglass Coffee,Best espresso in the city?
Sightglass Coffee,"great coffee, wonderful atmosphere"
Sightglass Coffee,Friendly staff and good coffee.
Sightglass Coffee,Great oat milk lattes!
Sightglass Coffee,the coffee here is sooooo good!!!
Sightglass Coffee,Caffienation has never been sweeter
Sightglass Coffee,"Coffee is excellent, but overpriced"
Sightglass Coffee,Nice pastries and decent coffee.
Sightglass Coffee,Top 5 cappucinos in the city.
Sightglass Coffee,My mocha was perfect
Sightglass Coffee,Cold brew and a cookie! Yum!!!
Sightglass Coffee,Best coffee in SF
Sightglass Coffee,Very cool spot!
Sightglass Coffee,Best breakfast burritos
Sightglass Coffee,My favorite in SF
Sightglass Coffee,Enjoyed the cortado!
Sightglass Coffee,Delicious!
Sightglass Coffee,Chic place for coffee and pastry
Sightglass Coffee,Lovely location.
Sightglass Coffee,No wifi :(
Sightglass Coffee,Great coffee!
Sightglass Coffee,Good
Sightglass Coffee,Really good coffee
Sightglass Coffee,Best in town
Sightglass Coffee,Great staff
Sightglass Coffee,Modern decorations.
Sightglass Coffee,Pretty good
Sightglass Coffee,Great spot
Sightglass Coffee,Good stuff
Sightglass Coffee,Good cofee
Sightglass Coffee,Viennese vibes
Sightglass Coffee,Solid espresso
Sightglass Coffee,Over valued
Sightglass Coffee,Good coffee
Sightglass Coffee,Quality coffee
Sightglass Coffee,Yummy coffee
Sightglass Coffee,Great coffee.
Sightglass Coffee,Great coffee.
Sightglass Coffee,Great coffee.
Sightglass Coffee,Great coffee
Sightglass Coffee,Great coffee.
Sightglass Coffee,Sparkling ㅡ plum + ketchup taste Blue Moon - Ah Vanilla flavored coffee - Vanilla flavored coffee  Conclusion: So
Sightglass Coffee,"T: Similar to the main store. However, it is natural for coffee that the taste changes depending on the storage of the beans, so I unfortunately did not feel the taste that I ate at the main store. However, the milk's velvety cream was really satisfying. Art was asymmetrical, but the taste of coffee always came first. S: In fact, I ask questions with poor English, and they helped me a lot. Also, like the main store, there are unique employees and I think everyone has more than basic skills. You can trust whoever makes the coffee. C: Since the size of the store itself is not large compared to the number of people, I thought the cleaning was good. But there seems to be a rush hour. Considering the rush time and various points, it seems that the number of employees is appropriate and the cleanliness is appropriate. A cafe that will satisfy you in many ways"
Sightglass Coffee,Excellent Coffee!
Sightglass Coffee,"In addition to great coffees, the place is wonderful! It's worth the visit even if you don't like coffee!"
Sightglass Coffee,"The coffee is okay, but the bread is too much like the one I bought from Costco."
Sightglass Coffee,"This cafe is perfect, very ""san francisco""."
Sightglass Coffee,"If you go to just one cafe in San Francisco, this is it!"
Sightglass Coffee,Beautiful coffee in a beautiful space
Sightglass Coffee,Excellent
Sightglass Coffee,Cozy little place.
