0,1,2
Andytown Coffee Roasters,3629 Taraval St,It’s all about the snowy plover
Andytown Coffee Roasters,3629 Taraval St,Amazing coffee! Very very yummy!
Andytown Coffee Roasters,3629 Taraval St,Even their water has swagger.
Andytown Coffee Roasters,3629 Taraval St,"Quick, tasty gourmet coffee. I like the pourovers."
Andytown Coffee Roasters,3629 Taraval St,"High recommend, best coffee shop in SF👍👍👍 …"
Andytown Coffee Roasters,3629 Taraval St,I love their coffee + services.
Andytown Coffee Roasters,3629 Taraval St,Great coffee
Andytown Coffee Roasters,3629 Taraval St,My goto is the snowy plover. Very unique
Andytown Coffee Roasters,3629 Taraval St,"Best coffee in the Sunset, possibly the city."
Andytown Coffee Roasters,3629 Taraval St,This place is an oasis....great people great coffee
Andytown Coffee Roasters,3629 Taraval St,Only the very best coffee.
Andytown Coffee Roasters,3629 Taraval St,Great service. Average coffee.
Andytown Coffee Roasters,3629 Taraval St,Great little cafe. Good drinks and food
Andytown Coffee Roasters,3629 Taraval St,Great iced coffee near the beach
Andytown Coffee Roasters,3629 Taraval St,An outer sunset institution. Can't go wrong.
Andytown Coffee Roasters,3629 Taraval St,Get the snowy plover and walk to the beach
Andytown Coffee Roasters,3629 Taraval St,Their breakfast sandwich is delicious!
Andytown Coffee Roasters,3629 Taraval St,"Andytown is, by far, the best part of my weekend."
Andytown Coffee Roasters,3629 Taraval St,Get a Snowy Plover and sit in the courtyard. The end.
Andytown Coffee Roasters,3629 Taraval St,Great coffee place
Andytown Coffee Roasters,3629 Taraval St,"just a bench to sit on, but still worth coming"
Andytown Coffee Roasters,3629 Taraval St,"Service elite, limited hours it's all about the coffee and you"
Andytown Coffee Roasters,3629 Taraval St,The snowy palova is a MUST TRY
Andytown Coffee Roasters,3629 Taraval St,"Good coffee, tiny shop, just right"
Andytown Coffee Roasters,3629 Taraval St,Cozy coffee shop with great baked goods.
Andytown Coffee Roasters,3629 Taraval St,My favorite place in SF.
Andytown Coffee Roasters,3629 Taraval St,Be careful which location you choose
Andytown Coffee Roasters,3629 Taraval St,Very good coffee
Andytown Coffee Roasters,3629 Taraval St,I recommend the SNOWY PLOVER!
Andytown Coffee Roasters,3629 Taraval St,Amazing snowy plovers
Andytown Coffee Roasters,3629 Taraval St,Good coffee!
Andytown Coffee Roasters,3629 Taraval St,The best cream
Andytown Coffee Roasters,3629 Taraval St,The best in SF
Andytown Coffee Roasters,3629 Taraval St,Excellent spot.
Andytown Coffee Roasters,3629 Taraval St,Unique espresso
Andytown Coffee Roasters,3629 Taraval St,Best in the area
Andytown Coffee Roasters,3629 Taraval St,Snowy plover!
Andytown Coffee Roasters,3629 Taraval St,Great coffee
Andytown Coffee Roasters,3629 Taraval St,Quality coffee.
Andytown Coffee Roasters,3629 Taraval St,"Good coffee, friendly"
Andytown Coffee Roasters,3629 Taraval St,The cookies are so delicious and the coffee is so good!
Andytown Coffee Roasters,3629 Taraval St,"Excellent space to try some of its well-chosen options in pastries and cookies, quality is worth more than quantity, besides obviously the perfect roasted and aromatic coffee in its various styles. The staff is a separate mention and even better than the product, it is very easy to return solely for the unparalleled customer service!"
Andytown Coffee Roasters,3629 Taraval St,very rich
Andytown Coffee Roasters,3629 Taraval St,Excellent attention!.
Andytown Coffee Roasters,3629 Taraval St,Ni
