0,1,2
Andytown Coffee Roasters,3629 Taraval St,They have the best breakfast sandwich in the Outer Sunset.  Pair the sandwich with a sweet iced latte and you’ve got the perfect breakfast combo!  The staff members are incredibly friendly. Great place to stop before you head out to walk Ocean Beach
Andytown Coffee Roasters,3629 Taraval St,"Coffee and breakfast items were good (specifically the breakfast sandwich…yum) but service is a bit curt and it’s not the most warm or welcoming place. I’d recommend taking your food/drinks down to the beach, even if it’s a bit chilly."
Andytown Coffee Roasters,3629 Taraval St,Had both their blend and single origin espressos and felt they were flawless. Best coffee in SF alongside The Coffee Movement.
Andytown Coffee Roasters,3629 Taraval St,Great place to grab a coffee on your way to the beach
Andytown Coffee Roasters,3629 Taraval St,"Staff was friendly. I ordered a regular latte and it was delicious. In the area, it’s probably one of the better lattes I’ve had. Only thing is, it’s small and expensive for what you get. The quality is way better than Starbucks but you’re getting a tall for the price of a venti here."
Andytown Coffee Roasters,3629 Taraval St,"Very cute small neighborhood coffee shop. They roast coffee at this site so the smells are amazing. Very limited seating, only benches are available.  Friendly staff. Fresh coffee 👍"
Andytown Coffee Roasters,3629 Taraval St,One of my favorite coffee roasters in the SF area! The latte with the house blend coffee beans (Short Strand) is very delicious!  The staffs are more than nice with great hospitality!
Andytown Coffee Roasters,3629 Taraval St,"My cousin introduced me to this establishment.  The snowy plover is what she bought me and I liked it because it was different and I never had anything like it before. Reasonably priced at $4.50 but I would only drink one per day, seems like all the caffeine and carbonation they put in it would really keep you up all night if you had more than one cup."
Andytown Coffee Roasters,3629 Taraval St,The snowy plover is incredible. Perfectly refreshing on a warm day. Cute outdoor patio in the back. Good selection of gluten free baked goods as well!
Andytown Coffee Roasters,3629 Taraval St,"Coffee is great, especially the snowy plow (espresso, sparkling water and whip cream). Can’t beat the location too - just a couple blocks up from the beach.  The space is really small though and the only seating they have is outside on a small patio. It’s not covered either so no recommended if you burn easily. They also don’t have WiFi so not an ideal place of you’re trying to come hang out here and work for the day."
Andytown Coffee Roasters,3629 Taraval St,Great location! They have a small outdoor park seating which is great when you want to soak up the sun. It’s even a few blocks from the beach! Grab your coffee and you can enjoy a little walk to watch the Ocean. The baristas know how to make their coffee and are very knowledgeable . Every drink we’ve gotten is full bodied and bright.
Andytown Coffee Roasters,3629 Taraval St,"Great coffee near the Ocean beach! The store is not open for dine-in, so you have to grab your beverage and go.  I tried their cappuccino. It’s creamy, well balanced and delicious. The store just few minutes walk from the ocean beach, you can enjoy your cup of joe at the beach.  This is a high quality coffee and hence prices are more than Starbucks.  Will definitely go back when I am in this neighborhood!"
Andytown Coffee Roasters,3629 Taraval St,Great hot tea! I had the Irish black tea with steamed oat milk! Fast service. Limited seating. Easy to grab and go.
Andytown Coffee Roasters,3629 Taraval St,"I absolutely love this hip little coffee house in the Outer Sunset and try to swing by whenever I'm in the neighborhood. the baristas know their stuff, and the baked goods are delicious. Try not to be intimidated by the lines, they move quickly and the coffee is worth it. Don't pass up the opportunity to try their signature drink: the Snowy Plover, named for one of the species of birds that can be found on the beaches just a few blocks away."
Andytown Coffee Roasters,3629 Taraval St,"I got in line at 2:48 after some minutes one guy came out and said to the first two people that they were not sure if they could help them, then they didn't say anything to me or my brother. We kept waiting because we really wanted to try the coffee here. Then they came out and told two people behind us that they couldn't help them.Then when we were at the door they say we couldn't get anything but iced coffee no drips or anything else. I don't know why they didn't came to us and told us they couldn't help us from the begging is it because i'm mexican? everyone else was being helped.They just made us wait there and denied to prepare anything else just because the barista didn't wanted to. I work in restaurants and this is not the proper thing to do."
Andytown Coffee Roasters,3629 Taraval St,"There’s something about this place that sends me back wanting more. It might not be leaps and bounds beyond the quality of Blue Bottle, or States (my East Bay favorite), but the vibes and smiles you get from ordering at Andytown are a part of what you buy in a cup of coffee. This location is a narrow corridor of a space, with a tiny ordering window and small case of coffee beans. The people are friendly, coffee fresh, and pastries excellent. The sweet latte options are a bit too sweet for my taste, but the espresso beans are creamy and comforting."
Andytown Coffee Roasters,3629 Taraval St,"Very small coffee shop, really loved the latte it was very different and tastier than star bucks"
Andytown Coffee Roasters,3629 Taraval St,"Great small spots for tasty coffee and fresh baked goods. I often use their beans at home, but it’s nice to stop by and try some of their more interesting drinks like the Snowy Plover"
Andytown Coffee Roasters,3629 Taraval St,Coffee is the name of the game at Andytown. Single origin beans from all over the world.  Highly recommend the  sangria cold brew.
Andytown Coffee Roasters,3629 Taraval St,Perfect cappuccino with their Rwanda beans. Great patio. Fun Saturday morning vibe.
Andytown Coffee Roasters,3629 Taraval St,"Nothing special. There are many other similar good coffee shops in SF. Pastry is just ok, very little choice."
Andytown Coffee Roasters,3629 Taraval St,"I have been a big fan of andytown. Until recent visit, it was a huge disappointment! Ordered a latte with oat milk, it is sour. I know this shouldn’t be how it normally tasted like. So I went back and asked if they can remake it. The barista said their coffee taste different everyday… this excuse is super weird. I have also emailed andytown to tell them the visit but it’s more than 2 months without until reply. Will not be back!"
Andytown Coffee Roasters,3629 Taraval St,"Coffee here is great, not too acidic, nice and smooth. Ocean is very close, so this makes an ideal location to grab some coffee and then walk along the coast line."
Andytown Coffee Roasters,3629 Taraval St,Snowy Plover and the soda bread. Andytown classics!  Great place for coffee prepared by very nice people :)
Andytown Coffee Roasters,3629 Taraval St,"Just a little window open, no dine in. But coffee was decent, cold though. Staff is very friendly and welcoming !"
Andytown Coffee Roasters,3629 Taraval St,Great coffee and atmosphere
Andytown Coffee Roasters,3629 Taraval St,"I don’t drink coffee, but the cheddar jalapeño scone was really good. Also, location was great! So close to ocean beach."
Andytown Coffee Roasters,3629 Taraval St,"One of my favorite coffee spots in San Francisco. My favorite drink is the Snowy Plover, which features their delicious homemade whipped cream. It'll always be on my list of go-to's when I visit SF, and 9 times out of 10 I'll grab a few bags of beans to bring back to NY with me."
Andytown Coffee Roasters,3629 Taraval St,The tests of coffee is very good is different  to the others coffee ☕️
Andytown Coffee Roasters,3629 Taraval St,"Very expensive coffee place, hardly any seating, and mediocre mochas. The service was friendly but otherwise I can’t say it was worth the money."
Andytown Coffee Roasters,3629 Taraval St,Really wasn't impressed with either of the drinks I tried from Andytown. We got the plover and the matcha latte. The matcha latte tasted burnt & the plover... was certainly unique but I don't think it's worth the hype. I'm sure the other items on the menu are very good because there was such a long line. The location is perfect for grabbing a to-go cup of coffee and enjoying a nice walk along the beach on a sunny day!
Andytown Coffee Roasters,3629 Taraval St,"cute location with decent parking for san francisco. my friend and i both got lattes. they don't have vanilla syrup but offer a brown sugar sweetener instead. they have lots of other options too like teas and whatnot. order and pickup at the window, very covid conscience!"
Andytown Coffee Roasters,3629 Taraval St,Sweet place! The coffee here is delicious and all of the staff are charming and welcoming. There are some very unique drinks here that other places do not have and are worth trying out. I enjoyed the friendliness of the staff and the family atmosphere. Everything you see inside was in good quality and affordably priced. Highly recommended!
Andytown Coffee Roasters,3629 Taraval St,I don't understand coffee shops that charge an additional $1 for oat milk. We all know how much oat milk costs so stop price gouging. $7 for a regular drink???
Andytown Coffee Roasters,3629 Taraval St,"April 2018 update: Very good coffee. Service was great. Updating rating to 5 🌟.  Coffee was good.  Service can use some improvement.  Drip coffee took a long time.  I thought they forgot my order.  Then when I wanted to get some water after I finished my coffee, the lady was not very nice.  So I just left.  Not sure I would come back again."
Andytown Coffee Roasters,3629 Taraval St,i like the mocha or latter w whip cream added :)
Andytown Coffee Roasters,3629 Taraval St,"Love their cookies and coffee!  The staff is always really nice and super helpful. There is usually a little bit of a line but it always goes really quickly.  I think they have the best whipped cream I've ever tasted too, so that's a plus!"
Andytown Coffee Roasters,3629 Taraval St,Super friendly baristas and really good cold brew!  Love that this spot is walkable to the beach and it's easy to park.
Andytown Coffee Roasters,3629 Taraval St,great coffee but very little seating (outdoor only)
Andytown Coffee Roasters,3629 Taraval St,"We walked in a minute after closing time, but the barista was super friendly and even gave us all free cookies. The coffee is great, but becomes awesome when you add their home made whipped cream to it. The whipped cream itself is SO good!"
Andytown Coffee Roasters,3629 Taraval St,Lovely coffee roasters that serves good espresso. Will be back when I'm in the area again.
Andytown Coffee Roasters,3629 Taraval St,"Great little addition to the Outer Sunset!  Coffee is legit (read: must get the snowy plover) and little outdoor seating area/garden is adorable and relaxing.  Great little spot tucked away.  Staff is super friendly and no lost love to the Lawton location, but whoever chooses the music for the Taraval location is on point."
Andytown Coffee Roasters,3629 Taraval St,Their raw cheddar and toast is delicious and the Ethiopian coffee was perfect!
Andytown Coffee Roasters,3629 Taraval St,"This place is immaculate. The coffee is amazing. The staff is always attentive and smiling. I don't know the owner but I know who he is because when you see this guy at either location he is beaming positive energy. I can't wait until the back patio at this location is approved by the city. Andytown will serve as an anchor in this neighborhood, do yourself a favor and go."
Andytown Coffee Roasters,3629 Taraval St,"This is a very unique little shop that serves carefully crafted drinks.  They make their own whipped cream, too."
Andytown Coffee Roasters,3629 Taraval St,"Not a single redeeming thing about this place.  To-go cups are too thin (too hot), and no sleeves are offered.  The lids leak.  The interior is antiseptic and lacking in character, and the smooth concrete floors have standing water (dangerous for slipping).  The coffee wasn’t even very good - which would have made up for a lot.  But I would rather make a nespresso pod than go to this place for a cup of coffee again."
Andytown Coffee Roasters,3629 Taraval St,"Each time we visit this location, it is busier. Perhaps more people are discovering it. For those seeking a beach-side coffee, this is your place. It's a quick stroll to the sand (however it will likely be quite windy). Andytown has a simple yet strong menu with coffee, toast (home baked bread) and a few pastries. There is very little seating."
Andytown Coffee Roasters,3629 Taraval St,"I really do love Andytown, but this location just isn’t up to snuff. The pastries tend to be pretty dry, and the coffee isn’t nearly as good. They lack a lot of the stuff that originally made Andytown as good as it is. If you can, head over to the Andytown on Lawton. It’s worth it."
Andytown Coffee Roasters,3629 Taraval St,"Very nice for quick coffee, theres a bit of decent seating in the back. Too much cheese on the toastie though XD"
Andytown Coffee Roasters,3629 Taraval St,"Love this place. Coffee is great and the service is super friendly.  Plus, you're a 3 minute walk from the beach. Worth going out of the way for IMO."
Andytown Coffee Roasters,3629 Taraval St,I go here all the time and it is my favorite of the 3 locations in my neighborhood. There are only 2 places around that I like to have my morning coffee. Sight Glass or Andy Town. Lately though this particular location has been making me Luke warm Lattes & Mochas. The flavor is ALWAYS spot on but the temperature is usually hit it miss.
Andytown Coffee Roasters,3629 Taraval St,"I really love the taste of this coffee, the staff is very friendly and I recommend this coffee"
Andytown Coffee Roasters,3629 Taraval St,"Why anyone would want to go and pay the price that this place demands for coffee it's actually beyond me. coffee shop next door has way better coffee and much nicer atmosphere. But hey each to their own, no wonder house prices in the neighborhood are the way they are!! Some people have More money than sense"
Andytown Coffee Roasters,3629 Taraval St,"Best coffee I've had in SF so far! Low key place, with a nice backyard terrace and good beats, with really nice staff! Wish I lived closer, it would be my regular place for sure!"
Andytown Coffee Roasters,3629 Taraval St,"There are no many places open right by the Ocean to get some snacks and coffee. Matcha latte tea was good.$5. but nothing fantastic. About 10 minutes wait, though."
Andytown Coffee Roasters,3629 Taraval St,"I was on a business trip and checked online to see where to go for breakfast. This coffee shop seemed to be a good choice, and it was! Great breakfast, various choices, fresh ingredients, efficient service, and good coffee. The service was also quick. I will definitely recommend this coffee shop!"
Andytown Coffee Roasters,3629 Taraval St,"Staff is quite friendly, but we waited >20 mins just to find out the ticket was lost. They more than made up for it. Coffee was decent."
Andytown Coffee Roasters,3629 Taraval St,"Good coffee, chilled and nice staff, cosy patio."
Andytown Coffee Roasters,3629 Taraval St,"Great coffee, friendly staff. Love to grab an iced coffee and walk the beach."
Andytown Coffee Roasters,3629 Taraval St,Great alternative to the crowded Lawton location. Front window opens on sunnier/warmer days and makes the shop open air. Dog friendly (outside). You wouldn't have enough space to bring the dog inside anyway
Andytown Coffee Roasters,3629 Taraval St,the waiters were very disorganized between online and on-site orders.  I had a cappuccino which wasn't great for the wait time and the waitress was quite rude.  Several customers seemed disappointed and I think the service is usually better that why I put 3 stars instead of 2.  I will not come back
Andytown Coffee Roasters,3629 Taraval St,"Snowy plover. All day, every day. Haha jk, but not. But seriously, it’s real, real good. It’s a caffeinated, sparkly, foamy, sweet delight. And if you’re not down for the coffee caffeinated version, I opt for the matcha snowy plover!  Did you know a snowy plover is a bird? Fun fact of the day. And even more fun when I’m excitedly talking about my fav snowy plover sitch in the Avenues and they’re looking at me like uh, what? The bird? What? Maybe you had to be there 😂  Parking’s not the greatest, now that there’s a ton of these fun, local spots poppin up in the Avenues. Also, HIGH curbs in front of the cafe. My front bumper hates me for it.  4 stars ⭐️"
Andytown Coffee Roasters,3629 Taraval St,"Amazing espresso and friendly staff in a cute, quiet shop. There are also good pastries and some inventive coffee drinks. They sell coffee beans which is really convenient."
Andytown Coffee Roasters,3629 Taraval St,"Great coffee and unique pastries. Back patio seating depends on the weather, virtually no indoor seating. But easy walk to the beach!"
Andytown Coffee Roasters,3629 Taraval St,"Waited 40 minutes for a single shot of espresso on a Saturday morning. The cashier said they were overwhelmed with online orders. In my opinion, they shouldn’t take online orders during rush times in order to prioritize customers who have been waiting in line."
Andytown Coffee Roasters,3629 Taraval St,"Unfortunately mischarged the drink, and could not taste the coffee notes from the shot...  Edit: the back patio is now open! A great spot on a sunny day."
Andytown Coffee Roasters,3629 Taraval St,"Would be 5 stars if their ""Large"" coffee lived up to the size definition. Thankful that this shop opened 30 mins earlier than their competitors."
Andytown Coffee Roasters,3629 Taraval St,Ordered the latte and it was good. Kinda pricey $5 tag
Andytown Coffee Roasters,3629 Taraval St,"Love their snowey plover!! Fresh design both inside and outside. Coffee served properly, by lovely attractive people. Also, +1 for the music selection."
Andytown Coffee Roasters,3629 Taraval St,Amazing
Andytown Coffee Roasters,3629 Taraval St,Came in here before walking down ocean beach. I liked the feel of the place. They have a back patio area also. Had an Americano from here and it’s was good. If I end up around here I would go back.
Andytown Coffee Roasters,3629 Taraval St,Espresso was brewed very well. It was smooth and perfect. Not acidic or bitter. Definitely coming back again!!
Andytown Coffee Roasters,3629 Taraval St,"10/10 best coffee shop in San Francisco. Love the beans I picked up here and the woman who helped me was very informative, kind, and enthusiastic."
Andytown Coffee Roasters,3629 Taraval St,Like the coffee here! The staff are really friendly
Andytown Coffee Roasters,3629 Taraval St,Smooth iced coffee with an amazing flavor! I got got iced coffee with brown sugar syrup and cream. I highly recommend it! Best coffee we had in San Francisco!!!
Andytown Coffee Roasters,3629 Taraval St,Great coffee and minimalist aesthetics! Love their space.
Andytown Coffee Roasters,3629 Taraval St,"One of the best coffee places I ever been: excellent coffee, smiley baristas, relaxed atmosphere, cozy backyard. You got me! 🤲 …"
Andytown Coffee Roasters,3629 Taraval St,The Snowy Plover is a hit. I enjoy the savory scones when they're in stock. I prefer to buy my coffee beans here.
Andytown Coffee Roasters,3629 Taraval St,Not the best experience today. Cold coffee and rude baristas.
Andytown Coffee Roasters,3629 Taraval St,Great coffee especially given lack of options in the Sunset. On the expensive side - especially pastries (eg. piece soda bread 5$).
Andytown Coffee Roasters,3629 Taraval St,Good coffee and their breakfast sandwich is thicccccccc. So much bacon.
Andytown Coffee Roasters,3629 Taraval St,Amazing!!!! I love the snowy plover is delish. My friend recommended it and I was skeptical how a cold coffee soda was going to work but it works!
Andytown Coffee Roasters,3629 Taraval St,"A few blocks out of my commute, but well worth it. Love the sweet almond milk lattes and the cheddar jalapeno muffins."
Andytown Coffee Roasters,3629 Taraval St,"Moved to the neighborhood this past weekend, it's at walking distance to my apartment. The baristas were so nice and friendly! The place is clean and sharp!"
Andytown Coffee Roasters,3629 Taraval St,Coffee and soda don't mix and I don't like it cold. The cashier handled my soda bread with bare hands (the hands that handle money all day). I threw it out. The bread was gross too. Damage: $10 I'll never get back.
Andytown Coffee Roasters,3629 Taraval St,The best place to get the best tasting coffee ever! You ask for a Americano coffee that is not water down and that's what you get. Try their pastries
Andytown Coffee Roasters,3629 Taraval St,Wonderful coffee and nice staff. I would highly suggest giving the Snowy Plover a chance if you're adventurous
Andytown Coffee Roasters,3629 Taraval St,Super chill putter sunset cafe with patio on the back! ✌🏽
Andytown Coffee Roasters,3629 Taraval St,"SF’s best latte, hands down. 😍"
Andytown Coffee Roasters,3629 Taraval St,never disappointed by this place! everything is 10/10 always!!
Andytown Coffee Roasters,3629 Taraval St,"Deliciously hot & perfect cappuccino! Perfect for a rainy & chilly day! Excellent, friendly service... Always! ❤️"
Andytown Coffee Roasters,3629 Taraval St,"Great coffee. If it’s sunny, nothing beats grabbing a snowy plover and walking down ocean beach."
Andytown Coffee Roasters,3629 Taraval St,So glad to have a great coffee shop in the neighborhood.
Andytown Coffee Roasters,3629 Taraval St,One of the best coffees I've had anywhere. Have the mocha with whip -- salted! Amazing!
Andytown Coffee Roasters,3629 Taraval St,Not bad
Andytown Coffee Roasters,3629 Taraval St,"It’s really cute, but they served me a matcha latte that was lukewarm/nearly cold :( I walked like 20 minutes to get here."
Andytown Coffee Roasters,3629 Taraval St,"Best coffee in the outer sunset. Only downside to this location is they don’t serve breakfast sandwiches, so we just drove down the street to the other location."
Andytown Coffee Roasters,3629 Taraval St,"Great coffee roasters. The Lawton location is typically always busy, which is why I visit the Taraval location more"
Andytown Coffee Roasters,3629 Taraval St,great coffee and hot chocolate. cool swag.
Andytown Coffee Roasters,3629 Taraval St,Super friendly staff. Could use more seats. Coffee is killer.  Great experience over all.
Andytown Coffee Roasters,3629 Taraval St,"I expect a $6 pour over to be excellent, but ours was overextracted and the water was not hot enough. Will try again!"
Andytown Coffee Roasters,3629 Taraval St,Really tasty coffee with an amazing staff and hospitable owners. A must stop if you are in the Sunset.
Andytown Coffee Roasters,3629 Taraval St,Besides one of the City’s best cup of cortado there are the must-try corn muffins and/or rhubarb hand pie! Mmmm!
Andytown Coffee Roasters,3629 Taraval St,"Excellent espresso for cappuccino.  Get there early, the long lines are tough."
Andytown Coffee Roasters,3629 Taraval St,"These folks are the best. Great people, great coffee, great location."
Andytown Coffee Roasters,3629 Taraval St,"The best coffee roasters in SF! Ethically sourced, delicious coffee with a delightful staff!"
Andytown Coffee Roasters,3629 Taraval St,Reasonably good coffee but their beans are very pricey.
Andytown Coffee Roasters,3629 Taraval St,Ginger tea is great.
Andytown Coffee Roasters,3629 Taraval St,"Andytown is usually the reason to travel to Sunset. Great coffee, good people & lovely spot"
Andytown Coffee Roasters,3629 Taraval St,Great brews and prices are convective.
Andytown Coffee Roasters,3629 Taraval St,We need more Andy Town in the city!!!!!
Andytown Coffee Roasters,3629 Taraval St,"Delicious, creamy espresso with a beautiful bite. Lovely!"
Andytown Coffee Roasters,3629 Taraval St,Service was so friendly. Breakfast sandwich was awesome.
Andytown Coffee Roasters,3629 Taraval St,Delicious strong coffee and a nice outdoor seating area.
Andytown Coffee Roasters,3629 Taraval St,Didn't particularly love the Snowy Plover. Jalapeno corn muffin was great
Andytown Coffee Roasters,3629 Taraval St,Great coffee and sweet little outdoor seating nook!
Andytown Coffee Roasters,3629 Taraval St,Lovely little coffee shop with great staff and outdoor area.
Andytown Coffee Roasters,3629 Taraval St,"A gem. Typical snobbish sterile decor, but awesome coffee and that's what counts in my book."
Andytown Coffee Roasters,3629 Taraval St,Andytowns (including the Lawton locale) are my favorite coffee spots in the Sunset!
Andytown Coffee Roasters,3629 Taraval St,Best coffee in the outer sunset?
Andytown Coffee Roasters,3629 Taraval St,"Delicious breakfast sandwiches, good espresso drinks"
Andytown Coffee Roasters,3629 Taraval St,"I think everyone behind the counter was high, or at least mentally on another planet."
Andytown Coffee Roasters,3629 Taraval St,Really tasty coffe
Andytown Coffee Roasters,3629 Taraval St,SF prices but excellent people.  And so close to the beach - fabulous
Andytown Coffee Roasters,3629 Taraval St,Very kind and so nice coffee. Cozy
Andytown Coffee Roasters,3629 Taraval St,Great coffee also has snacks
Andytown Coffee Roasters,3629 Taraval St,Great coffee shop along the vicente to twin peaks bike path
Andytown Coffee Roasters,3629 Taraval St,"Obnoxious, long lines because people like being in lines"
Andytown Coffee Roasters,3629 Taraval St,One of the best coffee spots in town!
