0,1,2
Atlas Cafe,3049 20th St,Great.   Food is excellent and outdoor space good.
Atlas Cafe,3049 20th St,Amazing sandwiches and a good place to have breakfast with family and friends
Atlas Cafe,3049 20th St,Cozy place to have a sandwich and beverage. Nice patio in the back with shade
Atlas Cafe,3049 20th St,Love doing work here. Bomb coffee and music. Nice place to read a book and chill.
Atlas Cafe,3049 20th St,A fascinating spot that is becoming a hub for the crypto community.
Atlas Cafe,3049 20th St,Very nice restaurant abd great outdoor seating
Atlas Cafe,3049 20th St,"Great vibe, good snacks great food -recomend the tuna salad+"
Atlas Cafe,3049 20th St,"Love the laid back feel, patio, occasional live music. Pretty great spot!"
Atlas Cafe,3049 20th St,"Great neighborhood joint. Delicious sandwiches, soups and pizzas."
Atlas Cafe,3049 20th St,Ordered a Golden Latte. Just tasted like milk... was it missing something? Not impressed for a $6 Latte
Atlas Cafe,3049 20th St,The Ethiopian drip coffee was very weak - like the one you expect at a highway diner. Espresso alright though.
Atlas Cafe,3049 20th St,"I really like the magazine rack. The food is good, too, especially the yam sandwich."
Atlas Cafe,3049 20th St,"Great neighborhood cafe, great veggie options and outdoor patio"
Atlas Cafe,3049 20th St,Ok. Neither the food or drink is memorable. Nice local joint
Atlas Cafe,3049 20th St,I love this local gem. Their sandwiches are incredible!
Atlas Cafe,3049 20th St,A little oasis with a great grilled cheese and other food. Loved the design!
Atlas Cafe,3049 20th St,"enough variety, although the waiters are not the friendliest. .but for the rest is a normal cafeteria ;)"
Atlas Cafe,3049 20th St,Good food and coffee. A little pricey but you're probably worth it.
Atlas Cafe,3049 20th St,"Still, a great old timer in the Mission district. Live music Thursdays and Fridays."
Atlas Cafe,3049 20th St,Very friendly staff. Thank you.
Atlas Cafe,3049 20th St,"Stumptown ""Hair Bender"" can't be beat!  As an Oregoinian, glad to see a piece of Portland here in the City."
Atlas Cafe,3049 20th St,"pricey, popular, good vibes"
Atlas Cafe,3049 20th St,"Pretty nice spot. Sometimes loud, sometimes over crowded. Sometimes service doesn't give a f***"
Atlas Cafe,3049 20th St,Cute little neighborhood cafe with great sandwiches and a nice patio
Atlas Cafe,3049 20th St,Counter service with table-service prices.  Good food.  Decent coffee.
Atlas Cafe,3049 20th St,Great coffee and good grub and expectations overall good services
Atlas Cafe,3049 20th St,They have the best golden latte I have ever had.
Atlas Cafe,3049 20th St,Great sandwiches if you're not in a hurry 😉 …
Atlas Cafe,3049 20th St,Outdoor patio is awesome. Great food cheap.
Atlas Cafe,3049 20th St,"Coffee is good, so is the eggs and other such stuff. Yum, guys!"
Atlas Cafe,3049 20th St,"Really liked the live music in a casual, living room like atmosphere."
Atlas Cafe,3049 20th St,"Cozy, great service and they will accommodate dietary restrictions."
Atlas Cafe,3049 20th St,"nice cafe for working, warm back porch area, food is good."
Atlas Cafe,3049 20th St,"Tasty, small portions, but my girlfriend really likes it"
Atlas Cafe,3049 20th St,Man...the best cafe in the world! It would be an honour even to work there.
Atlas Cafe,3049 20th St,Great food and coffee. Great relaxed atmosphere.
Atlas Cafe,3049 20th St,Expensive
Atlas Cafe,3049 20th St,Homey Cafe with lots of indoor seating and a nice outdoor courtyard.
Atlas Cafe,3049 20th St,They seen to have a thing for trout here. That's a real good thing.
Atlas Cafe,3049 20th St,Good coffee. And the breakfast and lunch menu looks good
Atlas Cafe,3049 20th St,Nice place but 4 stars since WiFi is to hard to use.
Atlas Cafe,3049 20th St,"Great atmosphere, great sandwich. Has wifi."
Atlas Cafe,3049 20th St,What a cute little place to grab a coffee/bite and soak into live-jazz!
Atlas Cafe,3049 20th St,The espresso is great! And the chicken sandwich too
Atlas Cafe,3049 20th St,"Coffee was weak, but the ham and avocado sandwich was awesome!!👌 …"
Atlas Cafe,3049 20th St,"They have an outdoor area, which is nice, but otherwise seem undistinguished."
Atlas Cafe,3049 20th St,Great panini sandwiches and plenty of beer on tap.
Atlas Cafe,3049 20th St,The hours are wrong here. Atlas was closed when I showed up.
Atlas Cafe,3049 20th St,nice place to chill!!!
Atlas Cafe,3049 20th St,"A nice lunch joint, try the No Cheese Pizza!"
Atlas Cafe,3049 20th St,Nice people and they have great food!
Atlas Cafe,3049 20th St,"Rude staff...grunge with attitude. No where to sit  ,too many coffee shop lizards using the free WiFi"
Atlas Cafe,3049 20th St,Good Stumptown coffee. I find the food a bit hit or miss.
Atlas Cafe,3049 20th St,The the desserts are awesome must try
Atlas Cafe,3049 20th St,"Ok ... liked it, met a friend there. Have to try it out again."
Atlas Cafe,3049 20th St,Nice vibe. Food is just sandwiches though
Atlas Cafe,3049 20th St,Love that it's open late and always has a good vibe
Atlas Cafe,3049 20th St,"Love the food (lunch) love the vibe, love the service."
Atlas Cafe,3049 20th St,Love this place; an old standby from when I used to live in the mission
Atlas Cafe,3049 20th St,Probably one of the cheaper coffees around the area but was still good
Atlas Cafe,3049 20th St,"Good atmosphere, quick service, good sandwiches"
Atlas Cafe,3049 20th St,"Good atmosphere, good coffee, good food."
Atlas Cafe,3049 20th St,Classic hipster cafe before hipsters became the norm. Get the yam sandwich!
Atlas Cafe,3049 20th St,This is a great place delicious food
Atlas Cafe,3049 20th St,Nothing was wrong with this place but also nothing really stood out
Atlas Cafe,3049 20th St,Love their egg and cheese on English muffin
Atlas Cafe,3049 20th St,Great cafe to read in.
Atlas Cafe,3049 20th St,Great beet salad
Atlas Cafe,3049 20th St,Delicious Coffee and Bagels
Atlas Cafe,3049 20th St,"Always friendly staff, working hard during this Covid-19 mess."
Atlas Cafe,3049 20th St,Lovely old cafe still around where everything around it is becoming douche baggy
Atlas Cafe,3049 20th St,Good coffee and reasonable prices (for SF)
Atlas Cafe,3049 20th St,Nice patio and good food!
Atlas Cafe,3049 20th St,Can't complain but I felt like something was missing from the Cuban sandwich
Atlas Cafe,3049 20th St,"Great sandwiches, cozy vibe."
Atlas Cafe,3049 20th St,Maybe a bit expensive but real good coffee and cakes
Atlas Cafe,3049 20th St,Atlas cafe is one of the best
Atlas Cafe,3049 20th St,Very nice early breakfast.
Atlas Cafe,3049 20th St,Great food and plenty of seating
Atlas Cafe,3049 20th St,Great for a lunchtime. Lovely soups!
Atlas Cafe,3049 20th St,Nice place but the food is not that good
Atlas Cafe,3049 20th St,Staff racist. Don't bother. Pizza is freezer pizza as well.
Atlas Cafe,3049 20th St,Cute outdoor space for when the weather's nice!
Atlas Cafe,3049 20th St,Golden beatloaf sandwich is so unusually good.
Atlas Cafe,3049 20th St,Went here for a sandwiches and pizza. Not too exciting.
Atlas Cafe,3049 20th St,They have a lot of outlets. That's important!
Atlas Cafe,3049 20th St,"Good food, Stumptown coffee, patio"
Atlas Cafe,3049 20th St,Great sandwiches and potatoe salad
Atlas Cafe,3049 20th St,Best coffee shop I'm San Francisco!
Atlas Cafe,3049 20th St,excellent steamed eggs :) yummy!!!
Atlas Cafe,3049 20th St,Cozy sandwich place.  Perfectly toasted.
Atlas Cafe,3049 20th St,They don't take AMEX. Thumbs down for that.
Atlas Cafe,3049 20th St,Popular cafe. Food is OK.
Atlas Cafe,3049 20th St,"Great coffee, simple menu"
Atlas Cafe,3049 20th St,"Patio in the back. Order their sandwiches, I command it!!!"
Atlas Cafe,3049 20th St,Food and service is outstanding!
Atlas Cafe,3049 20th St,"Awesome sandwiches, nice porch"
Atlas Cafe,3049 20th St,My favourite cafe in sf
Atlas Cafe,3049 20th St,First time there and liked it
Atlas Cafe,3049 20th St,Nice outside seating :)
Atlas Cafe,3049 20th St,Great food and drink!
Atlas Cafe,3049 20th St,It's ok.
Atlas Cafe,3049 20th St,Antipolo
Atlas Cafe,3049 20th St,Fav place to work and drink coffee
Atlas Cafe,3049 20th St,Always a tasty lunch!
Atlas Cafe,3049 20th St,Good coffee neat neighborhood
Atlas Cafe,3049 20th St,"egg, ham and cheese  so yummi"
Atlas Cafe,3049 20th St,Nice place with decent food
Atlas Cafe,3049 20th St,Good selection of sandwiches
Atlas Cafe,3049 20th St,Great breakfast sandwiches
Atlas Cafe,3049 20th St,What I love here is an atmosphere
Atlas Cafe,3049 20th St,"first time, lunch was filling."
Atlas Cafe,3049 20th St,Very Slow
Atlas Cafe,3049 20th St,The homemade spreads rule
Atlas Cafe,3049 20th St,Staff less than friendly
Atlas Cafe,3049 20th St,Great food and coffee
Atlas Cafe,3049 20th St,Love it
Atlas Cafe,3049 20th St,Grate coffee and a cool location
Atlas Cafe,3049 20th St,incredible
Atlas Cafe,3049 20th St,Pizza is too busy
Atlas Cafe,3049 20th St,Grade A+ sandwiches
Atlas Cafe,3049 20th St,Saturday live music
Atlas Cafe,3049 20th St,Luv this My fav
Atlas Cafe,3049 20th St,Great cafe!
Atlas Cafe,3049 20th St,Tasty
Atlas Cafe,3049 20th St,Good
Atlas Cafe,3049 20th St,Pretty meh.
Atlas Cafe,3049 20th St,Super rude staff
Atlas Cafe,3049 20th St,Amazing
Atlas Cafe,3049 20th St,Sweet patio.
Atlas Cafe,3049 20th St,So many memories
Atlas Cafe,3049 20th St,Friendly neighborhood place
Atlas Cafe,3049 20th St,OVERPRICED
Atlas Cafe,3049 20th St,Good service
Atlas Cafe,3049 20th St,Lovely stuff
Atlas Cafe,3049 20th St,Caring staff.
Atlas Cafe,3049 20th St,Excellent service
Atlas Cafe,3049 20th St,Go for the sandwiches
Atlas Cafe,3049 20th St,Local cafe
Atlas Cafe,3049 20th St,"Good music, friendly service, fair price and the salad, delicious! - SMOKED TROUT SALAD.  Highly recommended place."
Atlas Cafe,3049 20th St,"It looks like an old local coffee shop. I heard that there was no place to wait for a while. The outdoor terrace is still cold, so I can't sit down, Sofas and furniture are old. Broccoli soup comes with bread, but the soup is not creamy and tastes like soup. It doesn't come out boiled like Korean soup, so I feel like I'm eating cold soup. Still, it's been a while since I came to the US and eat vegetables for breakfast. I am still a novice traveler to the US who is worried about tip selection."
Atlas Cafe,3049 20th St,stylish cafe free wifi available Chai tea has less sugar but is delicious
Atlas Cafe,3049 20th St,Very good service and they have a wide variety of sweet bread and
Atlas Cafe,3049 20th St,I really like coffee Sandwches and other delicacies
Atlas Cafe,3049 20th St,"Very good coffee, very good service, and a very nice, clean place."
Atlas Cafe,3049 20th St,"Very cool place, dozens of kinds of coffee, for the perfect breakfast"
Atlas Cafe,3049 20th St,Good service 👍 excellent food I recommend it /100
Atlas Cafe,3049 20th St,Very good coffees rich sanguich
Atlas Cafe,3049 20th St,Excellent
Atlas Cafe,3049 20th St,Excellent service...
Atlas Cafe,3049 20th St,Atlas coffee
