0,1,2
Atlas Cafe,3049 20th St,"Great place with REALLY excellent drip coffee for $3, and many vegetarian options. Great service, too - when I didn't make it clear what kind of coffee I wanted, the barista started over and followed my unusual request to a tee, even though it was probably my fault she didn't understand me in the first place. Keep up the great work!"
Atlas Cafe,3049 20th St,I've had a few pizzas and sandwiches here. They're very tasty. My only complaint is that the crust on the sandwiches is often burnt and not a real pleasant experience. I had the vegetable noodle soup once and it was amazing.
Atlas Cafe,3049 20th St,"Stopped serving breakfast way before the time their menu says they do, and the cashier seemed to be a bit terse about it. Thereafter, I witnessed a breakfast item being cooked and served to someone. Not sure what to think about that... Also, there's a dearth of outlets for a coffee shop. Not a great look."
Atlas Cafe,3049 20th St,"The crew behind the counter was attentive and also seemed happy. Maybe it was just a good day, but it totally makes the place when the staff seem upbeat about being of service and sharing a little TLC to the details. I like it here"
Atlas Cafe,3049 20th St,"Try the Atlas Classic Tuna sandwich, you won't be disappointed.  Many of the bagels and pizzas are equally tasty.  So, how to have a great lunch or brunch is easy: Grab these items and sit right on down at a table in the outside portion where it is almost always sunny.  Rinse and repeat.  You're welcome."
Atlas Cafe,3049 20th St,Really like this place it's comfy and warm. Inside and outside area. You can sit and read bring your laptop and work or drink and catch a buzz from 6:30-11 or eat some really good food. Prices are reasonable.
Atlas Cafe,3049 20th St,"Atlas Cafe has a winning combo for me of a pleasant and clean casual atmosphere, friendly folks, jazz and tasty vegan options, oh and it's affordable and close to lots of goings on in the mission. Try the avocado and beet pizza. Do you have a 6 star rating? Here's one: ⭐⭐⭐⭐⭐⭐"
Atlas Cafe,3049 20th St,"The night bar menu food and drink on its own is solid, but slightly expensive, which would make Atlas a 4/5. But the community vibes and live music make it a 5/5.  Find a weekend day, grab a book a drink and a snack and enjoy the vibes."
Atlas Cafe,3049 20th St,"Great food and lovely atmosphere! Get a coffee, a pastry, and sit in the patio in the back."
Atlas Cafe,3049 20th St,They make the sandwich exactly the way I want it breakfast sandwich lightly toasted wheat with the crusts cut off half a slice of cheese turkey and egg I become a little bit attached to this the past two weeks but the athletic lady who fixes it fixes it perfect and that's why I come back I recommend getting that in particular sandwich just the way I make it best sandwich in the city
Atlas Cafe,3049 20th St,"been going here for over ten years. a good spot for drip coffee. espresso is okay. the food menu is decent, and this is the only place in town that ive had steemed eggs on my bagel!"
Atlas Cafe,3049 20th St,"I've only come here for breakfast on a Sunday morning.  I would say this place is cute, but not a 'brunch' place in the city. You come here to get a bagel or something pastry-esque to eat, and then you have your cup of coffee. It's not very crowded, but it's also not a place where you'll be waited on, have a great selection for food, etc.  Come here if you live in the neighborhood and want to avoid long lines!"
Atlas Cafe,3049 20th St,"Great sandwiches, decent french press coffee and a very peaceful atmosphere."
Atlas Cafe,3049 20th St,"The cuban sandwich was so good.  The bread was perfectly toasted, crunchy, not burnt or too hard. Cheese was melty.  The yam sandwich was warm, perfectly naturally sweet.  Tahe asian side noodle was ok.  I didn't like tge souoy dressing, but I can taste the cashew bits.  Great place to hang out."
Atlas Cafe,3049 20th St,"Great food. A little pricey. But they get a 1 star because the iced tea is $3 and there are no refills. I asked why, and I was told ""everything costs"". Well, it ""costs"" 22 cents to make a gallon of iced tea. You're just being petty when you charge $3 AND don't refill it."
Atlas Cafe,3049 20th St,"Atlas Cafe is a wonderful neighborhood gem. Unpretentious, timeless, and full of character. You can enjoy a great Espresso drink while talking with your friends in the sunlit terrace, or grab a magazine and read in solitaire. If you're a dog owner, enjoy a table outside while your dog sunbathes."
Atlas Cafe,3049 20th St,"The perfect all-around café. If there's one place I'll miss after leaving SF, it's's Atlas. Grab a beer, a coffee, breakfast, lunch or dinner, indoors, outdoors, sit there for a few hours, just pop in for a second, hear some live music, you can do it all here  Only cautions: if you sit there for a long time, your clothes will smell a little smoky later. Also, don't get the eggs (they're steamed, which isn't great) but everything else on the menu is good (especially the spicy chicken pizza and soups!)"
Atlas Cafe,3049 20th St,"Sense8 season 1 episode 7 was shot here, which is more than enough for me 😊 The atmosphere is very nice inside. However prices were a little bit much for me. Other than this,  it was great! …"
Atlas Cafe,3049 20th St,"Ordered to-go twice: pizza and a ham sandwich. The pizza was bland but I ordered cheese so no fault of theirs. The ham sandwich had baby tomatoes (tasty!) but was a bit burned.  Overall: fast, filling, and pretty inexpensive!"
Atlas Cafe,3049 20th St,Friendly staff and good coffee. I like the food: try the pizzas and sandwiches.  They have 2 nice outdoor seating areas.
Atlas Cafe,3049 20th St,"This area in the mission has definitely seen a growth of small restaurants and bars, Atlas is a genuine article in the sea of trendy things in the mission. Decent coffee, tasty breakfast and lunch options, lots of space, and medium fast wifi. I long for the days when this area was a little less happening."
Atlas Cafe,3049 20th St,"Surprisingly delicious food for a cafe. I'd recommend almost anything on the menu based on what I saw, but the cookies and cream cookie and the Cuban sandwich were especially good. Loved the outdoor seating too."
Atlas Cafe,3049 20th St,"The guy who served me was very pleasant, the trout salad was delicious, the chai I had was also perfectlylly made, however the beet salad had weird dry chewy beets—but I think it was an outlier to the norm. Overall very happy, and I'll be back"
Atlas Cafe,3049 20th St,"The best thing I tried at the Atlas Cafe was the Golden Beetloaf sandwich. I don't eat meat so the patty was interesting to see (definitely looked like beef) but it was totally made of beets. I also had a ginger lemonade - I love ginger so it was a really refreshing beverage. Atlas Cafe also has live music on some days, free personalized wifi and a greenroom area in the back where it's really peaceful to study."
Atlas Cafe,3049 20th St,"Fun, chill neighborhood cafe with live music, comfy couches and outdoor seating. Good for studying, working on your laptop, or relaxing with a beer, tea or coffee. Come on a sunny afternoon, enjoy the live music and get a table outside."
Atlas Cafe,3049 20th St,"I live across the street from here, and I've come here on and off, mostly for coffee. I've been there occasionally for live music at night, but I was under the assumption that they didn't have a liquor license. Well, it was apparently a mistake to ask on a sunday morning, because the woman at the cashier rudely answered that they did serve alcohol and then walked away, acting busy and completely ignoring me and my husband for the next five minutes. It was really awkward. Perhaps its my fault for expecting a ""sorry, i have to take care of such and such"", or something resembling politeness and friendliness. If they used to be cool, they're certainly pretentious now. Sightglass is much, much better. You want to go there! And, if you want food, there are lots of great places to eat at alternatively, but progressive grounds is probably the closest equivalent."
Atlas Cafe,3049 20th St,The roast beef sandwich is really good. And there is a nice back patio area that is dog friendly. Don't bother with the pizza.
Atlas Cafe,3049 20th St,"Came here because I saw it on 'Senses 8', a programme on Netflix. It was a lovely setting with wifi for 2 hours, indoor and outdoor seating. Food looked delicious and was around $10 mark. The staff were friendly and helpful. Tea range is great, coffee is fab and they have alcoholic drinks (beer, wine) and one of the biggest ranges of kombucha- they do a delicious green tea kombucha! Would recommend to go here for either catch up with your friends or studying! Has been around for 20 years so well established and knows what's up."
Atlas Cafe,3049 20th St,"A little pricey and the ""cash discount"" policy is weird, but Atlas has the best hours of any cafe in the area, tasty sandwiches, and the staff is friendly.  Keeps me coming back."
Atlas Cafe,3049 20th St,"In a building tucked away behind warehouses and homes lies Atlas. At Last! I've finally found it is how you'll feel when walking around the corner wondering where you're headed. Once you get inside you'll know you've come to the right place with prices that are up anyone's alley. I usually get the Egg Steamers on a bagel - to die for and under $4!  On nice days try and steal a spot outside in their back patio but they have windows looking out so inside isn't so bad either.  Atlas offers a wall of magazines to choose from so if you just need to get away from home and sit with other like-minded people, check out Atlas Cafe."
Atlas Cafe,3049 20th St,"Love Atlas café! one of the last spots in the Mission that remind me of the old San Francisco I used to love so much. Great jazz, great salads and the best Ginger lemonade."
Atlas Cafe,3049 20th St,"Nice place to settle in and get some work done, friendly service. I often come here to meditate about the deeper meaning behind the hit 1996 film The Nutty Professor, is it meant to symbolize the struggle between the conscious and unconscious, chaos and order, the weight of society and the modern epidemic of loneliness and a need for meaning. Plus there's free WiFi here!"
Atlas Cafe,3049 20th St,Jacob was awesome!!! We loved the chai and the chocolate chip cookies! Loved the vibe and atmosphere
Atlas Cafe,3049 20th St,Went there for a meeting and decided to grab a almond cappuccino and a tune salad before the meeting. They were both delicious and they prepared them really fast. Looking forward to going back!
Atlas Cafe,3049 20th St,Great cafe! Breakfast and lunch. Espresso Sandwich  Salads pizza breakfast items My favorite item on the menu is that goat cheese yam sandwich and a Ginger lemonade freshly squeezed
Atlas Cafe,3049 20th St,"It's inexpensive compared to other places, but the serving sizes are also very small. Fun crowd. The cashier with some serious bangs had some serious attitude! 😳 …"
Atlas Cafe,3049 20th St,"The food is top notch, the service is good sometimes, poor others; It's a gamble who will wait on you. They should turn down the crappy punk rock music too."
Atlas Cafe,3049 20th St,"A coffee shop that's been around before the neighborhood became hip.  I usually visit here to get coffee and sandwich to go. Only sat inside few times. They have lots of seating available, inside and outside, where you can catch up with your friends or work away on your laptop."
Atlas Cafe,3049 20th St,"Great coffee, plenty of outdoor seating and there was a great comedy show going on."
Atlas Cafe,3049 20th St,"The Turkey, Avocado, Bacon sandwich was a perfect lunch!  There is outdoor door seating as well."
Atlas Cafe,3049 20th St,"Great lunch spot. On a sunny day, it's a great place to sit and work outside. Make sure you try their drink, The Dirty Bunny. I could tell you what it is, but then I'd have to kill ya. :)"
Atlas Cafe,3049 20th St,"The grilled cheese sandwich took forever before it was ready, and even then only because we nagged them about what took so long. But it's nice to have access to so many magazines while waiting"
Atlas Cafe,3049 20th St,Cute place. The goat cheese pizza was very tasty! Unique in flavor. Outdoor seating. Ill return.
Atlas Cafe,3049 20th St,Good food at reasonable prices. Laid back atmosphere that makes for a good working or meeting space. Pretty good placement of wall outlets. Outdoor seating area.
Atlas Cafe,3049 20th St,"Fantastic sandwiches with great combination of flavours, good quality ingredients and a range of different breads although you would have to ask to change them from the default."
Atlas Cafe,3049 20th St,"Really good sandwitches.  my occasional lunch spot.  The service is very casual and sometimes a bit slow during the lunch hours.  Totally worth it, just make sure you aren't in a hurry."
Atlas Cafe,3049 20th St,"Good food, chai, etc. I love this throwback to 90's cafe culture. Weekly live jazz music and plenty of outdoor seating are enjoyable aspects of this place."
Atlas Cafe,3049 20th St,Wifi and cellular so bad that I had to leave. Also the young man behind the bar was really rude to people there. It was weird. I haven’t seen a waiter so rude to everyone in a long time.
Atlas Cafe,3049 20th St,"Nice little cafe.  More lunchplace-ey than coffeeshop-ey, but, well, not every cafe can survive on people buying a $2 coffee every few hours while they sit on their laptops, or worse, scribble in notebooks.   Which is too bad."
Atlas Cafe,3049 20th St,"Good coffee, breakfast, sandwiches, pizza, cozy seats near book and magazine stand, local art, indoor and outdoor seating. Great place to read, work, study, hang, chat."
Atlas Cafe,3049 20th St,"No frills cozy spot for the neighborhood. Food is often long to get, but decent. Place to stay for over an hour instead of a quick bite."
Atlas Cafe,3049 20th St,Extremely rude to not update your holiday hours on google. How on earth was I supposed to know you’d be closed on 7/5?
Atlas Cafe,3049 20th St,"love love love this place!  good to meet up for brunch or catchup, sunny patio, delicious food, friendly staff. chill and hit the spot-able"
Atlas Cafe,3049 20th St,I have ordered Chicken and Onion Pizza. It's a 9 inch which is $11.75. it's quite expensive. But the location and Ambiance are good.
Atlas Cafe,3049 20th St,Their tofu sandwich is outstanding. Don't know what they season it with but it's one of my favorite sandwiches in SF.
Atlas Cafe,3049 20th St,Great spot for lunch. Awesome grilled cheese and tasty coffee. They also have a cute little terrace
Atlas Cafe,3049 20th St,Nice cafe. Sometimes has live music. Nice outdoor patio for when it's warmer. Food is yummy and service is with a smile!
Atlas Cafe,3049 20th St,"Nice laid back setting but food is very so so. Tiny portions, no side salad etc with sandwiches, plain blah sandwiches. Very disappointing!"
Atlas Cafe,3049 20th St,Really good. Picked up some bagels and they really hit the spot. I'm a New Yorker too. Was very pleasantly surprised.
Atlas Cafe,3049 20th St,These folks are just awesome across the board!
Atlas Cafe,3049 20th St,"Free wifi for two hours with every purchase, the food is a little pricey but it is good. Also a great space to work in for homework or just work in general"
Atlas Cafe,3049 20th St,"I had their sandwiches and loved them. Reasonably priced, quiet location. Great place to chill and unwind."
Atlas Cafe,3049 20th St,"I always like this place for unusual and good sandwiches and salads.  Great bagels in the morning, glass of wine and sandwich in the evening."
Atlas Cafe,3049 20th St,Classic SF style cafe. Dog friendly and they have a patio. They used to have live music. Maybe they will bring it back.
Atlas Cafe,3049 20th St,The location is great and they have stumptown coffee.  Also have patio and outdoor seating.  Lots of Pizza and sandwich options on menu.
Atlas Cafe,3049 20th St,Breakfast and lunch sandwiches.  Nice outdoor patio in the back and the inside space is nice and relaxing for hanging out having a coffee or some food.  They also sell beer and wine.
Atlas Cafe,3049 20th St,I love Atlas very much! As usual - great people and interesting topics for discussion 🥰 …
Atlas Cafe,3049 20th St,This is a very cute little cafe with decent food and an interesting range of drinks. Grab a salad and a grapefruit soda/beer combo and sit in the enclosed but open air courtyard in back!
Atlas Cafe,3049 20th St,"Chill spot with good Wifi, tasty eats, and friendly staff. Nice work, staff!"
Atlas Cafe,3049 20th St,"Fantastic café with plenty of seating, hip clientele and delicious food to boot. The outdoor patio is divine on a sunny day"
Atlas Cafe,3049 20th St,"I cross the city for this place. Ambiance, bites and caffeine are all dialed in. Venue sports just the right vibe to get some work done and has a slick (heated) patio out back."
Atlas Cafe,3049 20th St,"Relaxed vibes, delicious coffee, really tasty tuna melt and egg/cheese croissant. This place never fails."
Atlas Cafe,3049 20th St,"Food is good, but when street urchins walk in, hang out and sleep on the benches inside and don't leave, it's a place I'm not coming back to.  I know this is SF, but this is typical of why I don't like coming into SF all that much anymore."
Atlas Cafe,3049 20th St,One word: disorganized.  Getting food out of the kitchen is the worst
Atlas Cafe,3049 20th St,An interesting cafe with a good selection of lunches. Their pizzas are quite good and they have a patio area with outside seating.
Atlas Cafe,3049 20th St,Very nice outdoor seating on a quiet street. Good vegan sandwiches!
Atlas Cafe,3049 20th St,"Good breakfast egg goods, but worker's have horrible attitudes. It's uncomfortable at times to go support the business because staff is unfriendly."
Atlas Cafe,3049 20th St,Awesome vegan sandwich options. Cute outdoor seating. Food takes a while to come out though :(
Atlas Cafe,3049 20th St,Cashier got the order wrong.
Atlas Cafe,3049 20th St,Wide selection of food. The apple and goat cheese pizza was great.  Nice patio in the back. Wifi and a few outlets.
Atlas Cafe,3049 20th St,Spicy trout bagel is delicious! (Served until noon during the week and 1pm on weekends)
Atlas Cafe,3049 20th St,"a sweet little neighborhood hangout, best magazine rack in the mission and great coffee and steamed eggs on croissant.  free folk music on thursday nights."
Atlas Cafe,3049 20th St,Nice cafe for any meal. Quick service and a good amount of seating. Live music occasionally too.
Atlas Cafe,3049 20th St,Good place to get a bit to eat and they have free WiFi at Atlas is the best place enjoy a great cup of coffee and then you should be good and happy
Atlas Cafe,3049 20th St,Checked out two other places in the area this was the best.  Coffee was great and smooth.  Coming back for lunch next time.
Atlas Cafe,3049 20th St,People from work took me to this cafe and I was shocked by the service. they were super late and didnt care work in an orderly manner. the food is great but not such if its worth the wait.
Atlas Cafe,3049 20th St,"Great workspace. Coffee and food are reliably good, free wifi for 2hrs. Plus there is a little garden out back."
Atlas Cafe,3049 20th St,Love this place during the day for working and in the evening for dinner and jazz. Jazz is on Thursdays and Fridays I believe. Really mellow vibes here.
Atlas Cafe,3049 20th St,"Delicious Melted Gouda on a rich Turkey, Avocado, and Bacon sangie, and their home made Chai is wonderful."
Atlas Cafe,3049 20th St,Kinda crazy it takes them 25+ minutes to make a sandwich. It's my second time I've ordered here and twice I've waited over 20 minutes. Is this a normal experience?
Atlas Cafe,3049 20th St,"Good as heck trout salad for lunch.  This spot has been here for a while, very 90's vibe in a extremely good way."
Atlas Cafe,3049 20th St,One of my favorite cafes to go and have many vegan options
Atlas Cafe,3049 20th St,Great little cafe. Would choose this spot every time for a local breakfast bite and cup of coffee.
Atlas Cafe,3049 20th St,"A local favorite neighborhood cafe. Comfy outdoor seating on a sunny day, great soups & cafe dishes, and often live music in the evenings."
Atlas Cafe,3049 20th St,I like how much space there is and how much different seating is offered. A great meeting space with good coffee and great live performances.
Atlas Cafe,3049 20th St,"Friendly staff and very fun, relaxed atmosphere! When I was here, they were showcasing a local artist's work which was really cool"
Atlas Cafe,3049 20th St,"Great sandwiches (the tuna with shredded coconut is one of my favorites), and a nice place to sit and take a break or work."
Atlas Cafe,3049 20th St,"An outstanding nutrition care - ordered a sandwich, pay for it and get nothing. Be in shape with Atlas Cafe!  P.S. Music was nice."
Atlas Cafe,3049 20th St,Super quiet and low key coffee shop! They have steamed egg sandwiches and awesome bagels.
Atlas Cafe,3049 20th St,Local go to cafe! Great bagels and steamed eggs. Friendly staff
Atlas Cafe,3049 20th St,"trout salad was a great healthy lunch, stumptown cold brew on tap is nice"
Atlas Cafe,3049 20th St,"Food is great (I had the Cubano sandwich). There is plenty of seating, an outdoor patio and free wifi."
Atlas Cafe,3049 20th St,"Great food, drinks as well and staff has been always friendly and professional"
Atlas Cafe,3049 20th St,Great breakfast sandwiches in the morning and an equally cool and intimate experience in the evening with live jazz and good wine
Atlas Cafe,3049 20th St,An old favorite of mine.  Still a good brunch option in the Mission
Atlas Cafe,3049 20th St,"Local great nice ,,,, ok food and drinks ... chill , talk , bond or study Open diverse and real people wich is shocking a bit actually for gentrification deal in that area"
Atlas Cafe,3049 20th St,"Great place to grab coffee, beer, and/or a bite to eat while meeting up with friends or working solo."
Atlas Cafe,3049 20th St,"Was walking towards another shop, but found this one. Goggle should add it to the maps because it doesn't show. I was greeted with a nice warm welcome, nice place."
Atlas Cafe,3049 20th St,Great coffee and plenty of space with an enclosed patio for quiet reflection or busy main area for socializing.
Atlas Cafe,3049 20th St,A reliable neighborhood cafe. Good food and coffee and inviting outdoor spaces.
Atlas Cafe,3049 20th St,"Food was great, coffee service was fast. Nice ambiance. A little pricey."
Atlas Cafe,3049 20th St,Excellent sandwiches. Tuna classic and golden beetloaf in particular are top notch.
Atlas Cafe,3049 20th St,Great laid back atmosphere with quick order response. Excellent food quality with reasonable prices.
Atlas Cafe,3049 20th St,The turkey avocado bacon sandwich and roasted yam sandwich are amazing.
Atlas Cafe,3049 20th St,Great place to have a snack and a coffee while getting some work done. Good WiFi
Atlas Cafe,3049 20th St,Lovely old school cafe with outdoor seating and more moderate pricing than more upscale newer cafes.
Atlas Cafe,3049 20th St,Good service and prices. Their breakfast sandwiches always hit the spot after a long night of drinking.
Atlas Cafe,3049 20th St,"Good coffee, very nice patio and always place to sit. It feels relaxed and nice."
Atlas Cafe,3049 20th St,"One of my favorite neighborhood spots - good sandwiches, coffee, and the space is inviting and comfortable."
Atlas Cafe,3049 20th St,"Fast WiFi, good food - each menu item averaged $12, great atmosphere for working."
Atlas Cafe,3049 20th St,"Good food and coffee but my 5 stars is based on how big, comfortable and nice the cafe itself is."
Atlas Cafe,3049 20th St,The atmosphere is good but I'm not a huge fan of their coffee.
Atlas Cafe,3049 20th St,The bagel and egg sandwich I ate was excellent! Coffee was good as well.
Atlas Cafe,3049 20th St,"Very good pizza, my daughter loves it"
Atlas Cafe,3049 20th St,"Great atmosphere, nice outdoor seating, yummy sangria, and cool music.  Go here."
Atlas Cafe,3049 20th St,Decent food. Outdoor patio is cozy. Friendly staff.
Atlas Cafe,3049 20th St,Nice ambience. Good coffee. Lots of places to sit. Parking is very hard nearby.
Atlas Cafe,3049 20th St,4:00 AM 1/12/2016 Atlas Cafe almost light up on fire lucky neighbors were awake to call fire department Someone left a dryer on during the night bad idea and caught fire Careful Atlas Cafe
Atlas Cafe,3049 20th St,Great prosciutto pizza and Turkey avocado bacon sandwich. I would come again if I'm in the area.
Atlas Cafe,3049 20th St,Good café to grab a bite and/or meet with friends. They have a great outdoor area.
Atlas Cafe,3049 20th St,Delicious vegetarian pizza & sandwiches! You must try their jalapeno pesto 😋 …
Atlas Cafe,3049 20th St,Funky hipster vibe with amazing breakfast and even better coffee!! Must go if in the area!
Atlas Cafe,3049 20th St,Down to earth coffee and eatery. Good coffee and sandwiches. I believe they have a beer tap too.
Atlas Cafe,3049 20th St,"Good food, nice atmosphere, good service. Good for a quick bite and a place to hang around."
Atlas Cafe,3049 20th St,"Great cafe, plenty of seating and food options. Patio seating is great as well."
Atlas Cafe,3049 20th St,"Love the turkey, avocado, and bacon sandwich, to-go or to sit out back!"
Atlas Cafe,3049 20th St,Perfect place to work with interesting people around. Great coffe great sandwiches
Atlas Cafe,3049 20th St,"Wonderful atmosphere, great food, and great coffee - the Mission at its best!"
Atlas Cafe,3049 20th St,Nice outdoor seating area. Good granola with fresh fruit
Atlas Cafe,3049 20th St,Very cool little cafe with a lot of seating and a nice back patio area.
Atlas Cafe,3049 20th St,"Great vegan choc chip cookies & the turkey, avocado, bacon is on point!"
Atlas Cafe,3049 20th St,Very cool place to work remotely and to have small meetings
