0,1,2
BeanStalk Cafe,724 Bush St,"Good food prepared while you wait. The owner and his wife are charming, warm with a good eye for similarly dispositioned staff. Popular with local residents because the food is consistently well prepared. The Union Square adjacent location attracts tourists from hotels and cable cars. Often has an international feel as a result. They expanded the space to add additional seating. You can still pop in for coffee a chat or small selection of baked goods. The sandwiches are good to take out if you prefer. Mornings expect a wait, particularly on weekends. Not inexpensive but, certainly a value.  They are opening a second location, I believe in the Sunset. Stay tuned."
BeanStalk Cafe,724 Bush St,"Great service! I ordered a matcha latte and a cragel... Matcha latte was decent. I was really looking forward to trying the cragel, but it was dry and tasted a few days old. Couldn't finish it :("
BeanStalk Cafe,724 Bush St,Good taste. Wide range of choice including decaf. Nice atmosphere. I like this place.
BeanStalk Cafe,724 Bush St,Loved this little gem! Stopped in for coffee and breakfast sandwiches and they were so delicious! The cragel is soo good. Their lunch sandwiches looked amazing as well. Would highly recommend to anyone looking for a local cafe. I will say the place is kinda small so if you visit while busy you’ll need to grab it to go cause not much seating.
BeanStalk Cafe,724 Bush St,"Got in bright and early at 8am and was nice and quite. Absolutely loved the ☕️, best one around ! The crackle is worth a try... Super friendly staff."
BeanStalk Cafe,724 Bush St,"Wonderful 3rd wave specialty coffee shop, serves contraband coffee which is a plus for me - and also incredible sandwiches. Price for sandwiches is circa $10-$15, but they are big portions and filling.  The egg salad is delicious, if a little onion heavy - but I normally can't stand anything too oniony and the egg salad bagel I got was so delicious I ate it all anyways! I've also had the veggie sandwich and that was delicious. Apple and cucumber for a natural crunch and sweetness, and savory side with the avocado. So nice. The turkey sandwich was stuffed with plenty of real non-processed deli-quality turkey, and was well balanced flavor wise with the spreads and toppings. The french bread they use is surprisingly close to a true french baguette in flavor and texture. Great crust, soft inside, so delicious. Really elevates the sandwich. They do dine-in or takeout for sandwiches, and they're wrapped well for takeout.  I've had a cappuccino, espresso, and black coffee here and all were delicious. Plenty of seating, one good long table ideal for a meeting.  I've not been able to make wifi work, and there doesn't seem to be any outlets or charging ports, so that's the one and only con of an otherwise wonderful place.  I recommend sitting outside, it's a lovely atmosphere. Lastly, get a bagel, not a cragel. Much better. That's a trendy item, but their regular stuff is done so much better here."
BeanStalk Cafe,724 Bush St,"They have a wonderful selection of breakfast items, bagels with cream cheese, bagel sandwiches, croissant sandwiches. They also have a very nice lunch menu, we will have to come back for lunch. We enjoyed some bagel sandwiches and a delicious cup of joe. We will be back the next time we are in San Francisco."
BeanStalk Cafe,724 Bush St,"This cafe is small but bright and airy; it gets busy but the line moves quickly. There's a larger communal table (6-8 people) near the window and several smaller tables (1-3 people); at peak hours some tables are designated ""no computers/food only"" to keep things moving, although the staff were pleasant and didn't rush anyone. Menu has an extensive selection of sandwiches, bagels, cragels (a few vegetarian options) and drinks (with a focus on espresso-based drinks but with other options too). My sandwich was delicious and came on ciabatta that was toasted just right. Overall, a good place for a quick breakfast stop for small groups (<5 people). I look forward to coming back to try more of the menu!"
BeanStalk Cafe,724 Bush St,"Great place to grab a table for some remote work, amazing coffee drinks and bites/sandwiches"
BeanStalk Cafe,724 Bush St,"If you're reading this review just come to Beanstalk. It's has great coffee and a great staff. The place is larger since the expansion (obviously), but still isn't a spot to bring a large group.  The breakfast sandwich and cold brew are one of my favorite weekend morning treats."
BeanStalk Cafe,724 Bush St,"Great spot for coffee and snacks. It's a bit blurry since we went here a couple months ago but I think we had this really yummy bugogi sandwich. Filled with tender and flavorful meat on some toasty bread, it hit the spot! The cafe is quite small with minimal seating. Service was great! Super nice staff and our orders came out fast."
BeanStalk Cafe,724 Bush St,Great lattes and really tasty veggie sandwich with gochujang
BeanStalk Cafe,724 Bush St,"I have only ever gone here for lunch but I really like the sandwiches. Although the sandwich prices pack a heavy San Francisco price, they are very filling. I can usually only eat just a sandwich for lunch with no sides. They use quality ingredients, vegetables and freshly made bread. All sandwiches are toasted in the oven and come with sauces and veggies unless you specify what you don't want. Service is usually quick if you catch them at the right time but they will get a nice sized lunch rush. Only have had a few occasions where new sandwiches makers have taken longer then normal but that won't stop my from still giving this place 5 stars. My personal favorites are the Spicy Chicken and the Bulgogi Beef sandwiches."
BeanStalk Cafe,724 Bush St,"This a great neighborhood place get a sandwich or other things that isn't too far from the more commercial establishments that surround Union Square (SF). The service can be slow, but worth the wait. The photo is of my terrific veggie sandwich that I ate outside in the sun in Union Square."
BeanStalk Cafe,724 Bush St,Clean place!  Sandwich was very good.
BeanStalk Cafe,724 Bush St,"During my trip to San Francisco, I walked into this cafe for breakfast. I had Bush Street breakfast sandwich - Wow, Awesome!! Just perfect! I received kind service, wood tables are beautiful, the cafe has relaxing environment."
BeanStalk Cafe,724 Bush St,I really want to like this cafe but it always seems to disappoint somehow. I've been many times as it's in my neighborhood. I've never been able to get a cragel despite more than 10 visits. Today they made my soy cappuccino with normal milk. While I waited for the new one they suddenly restocked on cragels but the cashier didn't inform me even though she knew I requested one. When I asked to switch it was already too late. Customer service just seems lacking for the high prices. Happy to take my business elsewhere.
BeanStalk Cafe,724 Bush St,"Have eaten their cragel and bulgogi sandwich. Both are good, but not amazing. Pretty heavy meals. Probably better off getting a good bagel instead of their cragel.  Also hard to find seating during brunch / breakfast / lunch hours. Nice atmosphere for a small coffee shop though"
BeanStalk Cafe,724 Bush St,"I wanted to grab a quite bite to eat and a cup of coffee for brunch and found this place on Yelp. It was right across the street from the hotel that I was staying at.  There's a couple chairs out front and about 1-2 small tables inside. They had some pastries and a small menu posted.  After reading some Yelp reviews, I decided to try their Bulgogi sandwich and a cup of coffee. Sadly, they ran out of the toast cups.  The bulgogi sandwich was really good. The meat was flavored well and they gave generous portions. The bread was a baguette and it was nicely toasted. It had a nice crunch every time I bit into it.  However, the coffee was just ok. I'm not sure what brand they use but I didn't enjoy it as much as I had hoped.  Overall, it's a cute cafe. I think it's a good place to come and get a cup of coffee and/or a sandwich/pastry to-go."
BeanStalk Cafe,724 Bush St,Amazing food that will rock your taste buds. The toast cups are a genius creation by the owner. She is extremely kind and makes sure you love your food. The bulgogi sandwich will knock your taste buds out of the park. Can't recommend this place enough!!!!
BeanStalk Cafe,724 Bush St,"Great place. Sandwiches made with love : bul go-gi sandwich is great, spicy chicken also and vegetarian too. Cragel not so much (a matter of taste I guess). Quality of the cappuccino varies with the employee making it, but still 10x better than Starbucks (more ""European style"" at the Beanstalk, not drenching the coffee-taste in a lot of milk). Spicy is just very mild spicy, which is good. Lots of salad on the sandwiches."
BeanStalk Cafe,724 Bush St,We went during Thanksgiving Holidays. I has a vegan sandwich and it was just great! You can feel it is the neighborhood coffee shop. The owner is very friendly. I loved it!
BeanStalk Cafe,724 Bush St,The veggies sandwich is very tasty. It's different from what I have before. Very refreshing. Coffee is good also.
BeanStalk Cafe,724 Bush St,"Breakfast was fine, i did not like how the staff make sandwiches and ring people out without washing their hands in between or using gloves. That was a turn off. The sandwiches tasted fine, i got the egg salad on a ""cragel"" which is a combination between a bagel and crossaint- that was good. We ordered sausage, egg and cheese. My friend ordered avocado and paid extra for it but it was not added to the sandwhich. Nevertheless, if your on the run and need fuel asap, stop at this place it was fine."
BeanStalk Cafe,724 Bush St,Got the cragle  with is a  Croissant shaped like a bagel. With cheese bacon and egg. With a coffee. Just the right amount of food. Great coffee too. Enjoyed the good food
BeanStalk Cafe,724 Bush St,Nice people. Nice food.  Much too slow - wasn’t even crowded.
BeanStalk Cafe,724 Bush St,"Small and pleasant cafe, specialising in sandwiches, bagels and cragels (tried our first ever cragel and it was a winner). Lots of fillings to hopefully suit all tastes and according to the wife the coffee was decent too. Unfortunately sold out of breakfast tea (grumpy Englishman abroad 😲). Staff were friendly, the service quick and the right level of background music."
BeanStalk Cafe,724 Bush St,"Legit breakfast options made quick by what appears to be knowledgable staff. Nice cozy cafe. The cashier/waitress/owner(?) is friendly/competent/cute. I probably have stricter criteria than this for most days but really, can't find any complaints here."
BeanStalk Cafe,724 Bush St,"Interesting place. Pretty nice service. Food... Not so much. Breakfast sandwich was one of the worst I've had; dry bread, pre-made eggs, strange sausage. Espresso is decent."
BeanStalk Cafe,724 Bush St,"It has to he one of the finer mochas I have ever gotten. If you like your mochas creamy, then get one here. The food is also pretty good. It's not the best, but it's good. Fresh ingredients that really make a difference. The food is a bit on the pricey side, but if you're willing to spend a little more, I recommend coming to this place."
BeanStalk Cafe,724 Bush St,"Long wait marrs the place but the bulgogi sandwich and the bread it was on was pretty good. However, not sure it was worth $11+tip. Tight space. Ended up sitting with others at a large table, which was fine, but a bit too cozy to be relaxing."
BeanStalk Cafe,724 Bush St,"Not sure if lunch is better, but this came up as one of the top places for breakfast in the neighbourhood. That it definitely isn’t. Three choices of sandwich for breakfast, I got the cragel (croissant bagel) without meat, and a coffee. $16.00 and worse than food at Einstein Bagels or Panera."
BeanStalk Cafe,724 Bush St,"I had a breakfast sandwich and it was not very good. The eggs are microwaved, the bagel was small and over toasted. I probably wouldn't go back."
BeanStalk Cafe,724 Bush St,Cute little cafe with a nice selection of sandwiches. I tried the pesto grilled cheese which comes on toasted ciabatta. The pesto is flavorful and the cheese is melted evenly. I also got a hot chocolate which was good.
BeanStalk Cafe,724 Bush St,"Beanstalk serves delicious (and overpriced) breakfast sandwiches, but what else do you expect from a place near Union Square? I'd recommend a breakfast sandwich (made right in front of you, so you know its fresh) and a latte - walk down the block and enjoy them at a table in Union Square.  Weekends the line can be a bit long, but if you have some time to kill its worth it."
BeanStalk Cafe,724 Bush St,Burnt coffee. The bagel was good.
BeanStalk Cafe,724 Bush St,The sandwiches here are the perfect start to any day. The cragle is a particular favorite. Perfectly toasted to make an amazingly flakey and tender bite to balance the fillings. And this wouldn't be complete without a coffee made on par with the best coffee shops in town.
BeanStalk Cafe,724 Bush St,"Hole in the wall cafe spot and not too fast of a turn time for scrumptious bakery goods to come out of their oven. I wanted to try their toasted cups, but they said they ran out. I ordered their mint mojito coffee and they ran out of mint. Limited supply for a small cafe storage I suppose, to function. Few seatings and not the ideal bring-your-stuff to do work here for awhile cafe. I prefer that cafe vibe. The norm on coffee and sandwich menu. I left unimpressed."
BeanStalk Cafe,724 Bush St,"Really good sandwiches. For most locals the prices are normal, but for someone who's not used to paying 10 bucks for a sandwich, this may be a bit pricy.  Try the Spicy Chicken w/a little extra spicy sauce, its not hot, but has a nice kick to it.  They do run out of some items. While this is a bit of an annoyance, they only make a certain amount of food and once it runs out, it runs out.  They are very conscious about this. If they run out at 3, try getting there by 2 or 1... That's what most of us do :) especially if you like the way they make their food."
BeanStalk Cafe,724 Bush St,Best coffee I had in SF!
BeanStalk Cafe,724 Bush St,"The BEST Americano I've ever had!!  Nice froth and a smooth finish.  The water is filtered and fluoride is removed making every cup and variation of coffee absolutely delicious.  I have traveled all throughout Europe, Asia and the US and have visited some incredible cafe's.  This is by far the best for Americano.  A simple cup that can expose a weak bean, grind or barista (to which they are not!).  The BeanStalk Cafe has it going on.  The owner was in when I was with a colleague and he was very personable.  I wish you all the success you deserve.  I will be stopping in on all of my visits to San Francisco!"
BeanStalk Cafe,724 Bush St,"Coffee is delicious. Bagels are yum according to hubby. No gluten free options, unless you wanna buy an apple. not suited for celíacs :("
BeanStalk Cafe,724 Bush St,Great hip cafe with nice selection of coffee and bites. Very friendly staff.
BeanStalk Cafe,724 Bush St,Nice little cafe with really tasty sandwiches. Came back the next morning and also enjoyed their breakfast sandwiches.
BeanStalk Cafe,724 Bush St,"There's Roasted and then there's Burnt. This coffee was the latter. Don't know if it was a bad day or how it always is, but it was not good"
BeanStalk Cafe,724 Bush St,Came here on a Sunday morning. There were a few people in front of us but it wasn’t crazy. We ordered two breakfast sandwiches to go and it took 25 minutes for us to get our sandwiches.
BeanStalk Cafe,724 Bush St,Toast cup was the perfect size.  Owner was very friendly.  Trying mojito coffee next time. Reserving our appetite for a seafood lunch at the wharf.
BeanStalk Cafe,724 Bush St,"Great sandwiches on Bush St. The shop is very small so seating may be hard to find, but the food is great. It's near Union Square which makes it a great place to eat if there's no room in the restaurant."
BeanStalk Cafe,724 Bush St,"Tiny cafe with only a handful of seats but with an awesome menu of food and coffee choices. The spicy chicken sandwich was great, and the mocha was deliciously chocolatey."
BeanStalk Cafe,724 Bush St,"Disappointing, given the high rating here. Ordered a beef sandwich and a flat white. The beef was not good, lots of fat and gristle. Flat white was steamed much too hot for a flat white and had too much milk."
BeanStalk Cafe,724 Bush St,Great small place to get coffee and breakfast sandwich.  We got the cragle breakfast and latte before headed out to the airport.
BeanStalk Cafe,724 Bush St,"Great iced coffee. The food can take a little while to prepare, but it is worth the wait. There's a good amount of seating and plenty of tables."
BeanStalk Cafe,724 Bush St,"Good coffee, cragel, WiFi, out door seating, gender neutral bathroom, and friendly baristas. Also love their music <3 (Only thing is no outlets)"
BeanStalk Cafe,724 Bush St,Fast service even in rush hour
BeanStalk Cafe,724 Bush St,Cozy place. Workers shifted their duties among cashier making coffee and making sandwiches. They are all very friendly. Espressos is a two dollar espresso.
BeanStalk Cafe,724 Bush St,"Delicious coffee and bagels, my fav breakfast place in SF!"
BeanStalk Cafe,724 Bush St,Get their toast cup! They are my favorite on the way to work but they usually run out by 9am. It's a cozy little coffee shop with not much space. They only have one table and some bar seats.
BeanStalk Cafe,724 Bush St,Had soy latte and hungarian coffee cake.  Soy latte was better than average but little less soymilk would be better.  Coffee cake was pretty good.    Owner is super nice
BeanStalk Cafe,724 Bush St,"Quiet place, good coffee and food. Service a bit unhelpful. My wife wanted an iced coffee and they said they didn't have anymore. But we see many peolple after us getting theirs... maybe communication problem, but again, not very helpful"
BeanStalk Cafe,724 Bush St,"Food and drink were alright. Good amount of food, good amount of seating although no available power outlets."
BeanStalk Cafe,724 Bush St,"Try the pour down coffee. Brilliant. Good breakfast choices. Reasonable prices. Happy, smile-filled service."
BeanStalk Cafe,724 Bush St,One of the best sandwiches and coffee I’ve ever had… 100% recommended
BeanStalk Cafe,724 Bush St,"This was our go to breakfast place when staying on knob hill. The walk down and up is worth it! Great service, delicious food, perfect coffee."
BeanStalk Cafe,724 Bush St,Had a great coffee and bagel egg and cheese all fresh made. Probably would have earned 5 stars if I didn't go with a basic order
BeanStalk Cafe,724 Bush St,"Coffee was good but the food wasn't fresh. My sandwich had the ""fridge"" taste because the veggies were clearly cut and stored too long"
BeanStalk Cafe,724 Bush St,"good food, good coffee, takes a few minutes to have your sandwich made. nice quiet spot to work or study. WiFi available"
BeanStalk Cafe,724 Bush St,Cute place but got my order wrong. :(  the latte was great but the drip coffee sucked.
BeanStalk Cafe,724 Bush St,"Fabulous coffee and nice bagels (not overly toasted, plenty of cream cheese). My husband had the bagel sando with sausage and loved it :)"
BeanStalk Cafe,724 Bush St,"loved that bagel, thanks ☺️"
BeanStalk Cafe,724 Bush St,Nicest coffee I had whilst visiting San Francisco.  Gem of a cafe. Get out of your hotel and have breakfast here. Great sandwich and bagel too
BeanStalk Cafe,724 Bush St,A nice and quiet cafe with great sandwiches and friendly staff.
BeanStalk Cafe,724 Bush St,"Cozy, minimalist place for drip, espresso, and pourovers. They also have a fairly extensive food menu and various pastries. The pourover I had was solid."
BeanStalk Cafe,724 Bush St,Very good coffee. Five stars for the croissant bagel egg sandwich... It was truly excellent.
BeanStalk Cafe,724 Bush St,Good bagel but the amount of cream cheese they put on is pathetic
BeanStalk Cafe,724 Bush St,"Only thing I tried was their coffee, it was Super weak coffee and not very tasty. I'd compare it to Dunkin donuts, except DD doesn't charge $3 for their colored water."
BeanStalk Cafe,724 Bush St,So nice bagel with super nice cheese and soft scrambled egg. Girls are really busy but kind! Enjoy
BeanStalk Cafe,724 Bush St,Omg! Best cafe. I love the staff here. Must try bagels and coffee in SF.
BeanStalk Cafe,724 Bush St,One of the best cafe in town
BeanStalk Cafe,724 Bush St,"Great coffee. Solid breakfast sandwiches. Great, friendly service. Playlist on-point for 7:30am on a Saturday."
BeanStalk Cafe,724 Bush St,"Lousy. Expensive, burned bagel croissants, and then awful toast cup. Everything tastes like frozen nuked food. Worst coffee in the city."
BeanStalk Cafe,724 Bush St,"Really good cafe is a place where you chill nice and comfontable , you can go with family ,i had the bagel sando witch comes with bacon egg cheese and a resonal price is great i really recommend this place!"
BeanStalk Cafe,724 Bush St,"I have to admit, the first time I came here I was a bit underwhelmed by the coffee. I first tried the cold brew and the cappuccino and both were good, but nothing too amazing."
BeanStalk Cafe,724 Bush St,Excellent place where rhe locals go so got to be good right? Seating is limited but having flown in from London we were up early to enjoy a bagal and really good coffee
BeanStalk Cafe,724 Bush St,"Had a spicy chicken sandwich, tasted nice. Was pretty crowded when I arrived around 9, but cleared up pretty quickly."
BeanStalk Cafe,724 Bush St,Nice site for quality cafe food. The food was amazing. Quick and friendly service. It has an awesome atmosphere.
BeanStalk Cafe,724 Bush St,I came to SF for a conference and this place provides good food in a comfortable atmosphere for a good price from very friendly people. I breakfasted all three days here because of that.
BeanStalk Cafe,724 Bush St,Mmmm cragels are delicious here. Oh annnd the veggie bagel sandwich was yummy but I took the lettuces off and added avocado.
BeanStalk Cafe,724 Bush St,Their croissants are fuego.
BeanStalk Cafe,724 Bush St,"The best coffee I have ever had in America! From an Australian, that is a big compliment, we are total coffee snobs :-)"
BeanStalk Cafe,724 Bush St,One of the nicest veggie sandwiches I have had in the city. Also good coffee.
BeanStalk Cafe,724 Bush St,Excellent sandwiches and coffee in a small bright cafe. The bulgogi beef sandwich is a standout.
BeanStalk Cafe,724 Bush St,Nice coffee place close to the Union square! Egg salad bagel sandwich was good!
BeanStalk Cafe,724 Bush St,After a long walk up and down the hills of San Francisco.A welcome respite.Staff could have been a little more welcoming.Coffee good.
BeanStalk Cafe,724 Bush St,"Great coffee, but the manager was having a loud argument with one of the staff in the cafeteria. Very unprofessional behavior and dampened the otherwise great experience."
BeanStalk Cafe,724 Bush St,"Amazing drinks and sandwiches, overall a very nice environment."
BeanStalk Cafe,724 Bush St,Friendly and fast service. Fresh coffee amd quality espresso beverages.
BeanStalk Cafe,724 Bush St,Excellent food. Amazing service. They serve Contraband coffee and lovely hot cocoa!
BeanStalk Cafe,724 Bush St,Yummy Americano and tasty breakfast bagel. Our hotel was across the street which was awesome and convenient.
BeanStalk Cafe,724 Bush St,Simple breakfast. Egg and cheese bagel was nice. In an area void of weekend options this is a good choice.
BeanStalk Cafe,724 Bush St,Great little coffee place with comfortable seating.  Excellent service.  Close to Union Square.
BeanStalk Cafe,724 Bush St,Strong good coffee and nicely done sandwich. You might have to queue to get a seat.
BeanStalk Cafe,724 Bush St,Cool place with nice staff and nice coffee.
BeanStalk Cafe,724 Bush St,"Tasty breakfast sandwich, but limited seating especially with multiple people parked in seats with their laptops working, which is pretty annoying at 9:00am when you want to eat your meal..."
BeanStalk Cafe,724 Bush St,Toast cups are really overrated. A huge disappointment. However the cragles and the mint coffe were good.
BeanStalk Cafe,724 Bush St,"Love this lil coffee shop, great sandwiches and good coffee, definitely one of neighborhoods hidden gems!!!"
BeanStalk Cafe,724 Bush St,Tasty baguettes and great latte
BeanStalk Cafe,724 Bush St,Came here on accident and heavily enjoyed the Frankenstein sammich :) Get one or get bent!
BeanStalk Cafe,724 Bush St,The bagels and cragels are awesome but the coffee's (got a cappuccino) not that great.
BeanStalk Cafe,724 Bush St,Great spot for a bagel sandwich and delicious coffee and Tea
BeanStalk Cafe,724 Bush St,Friendly staff. Clean. Limited food menu. Small seating area. Food and coffee was great.
BeanStalk Cafe,724 Bush St,"Lots of great options for food and coffee, cute atmosphere as well!"
BeanStalk Cafe,724 Bush St,Not a lot of choices for breakfast. Bagels and some sandwiches. But the Cappuccino is really great.
BeanStalk Cafe,724 Bush St,I love this Cafe!  For a Kiwi who loves his coffee this has been a great find. #kiwicoffeenut
BeanStalk Cafe,724 Bush St,Very cute coffee shop with extensive breakfast menu. Great service and very stylish inside.
BeanStalk Cafe,724 Bush St,"Good atmosphere, friendly - and Best of all the Super delicious breakfast cragel sandwich."
BeanStalk Cafe,724 Bush St,Delicious breakfast and coffee!   One of the better places we have been to while visiting San Fran!
BeanStalk Cafe,724 Bush St,"Great coffee shop with delicious coffee, tasty sandwiches and nice variety of milk alternatives including oat milk!"
BeanStalk Cafe,724 Bush St,Very nice small Cafe with some interesting choices for small meals. Great coffee.
BeanStalk Cafe,724 Bush St,"Excellent and friendly service, breakfast and sandwich items...pour over coffee was tasty!"
