0,1,2
BeanStalk Cafe,724 Bush St,A very cute cafe with an exquisite breakfast menu. The Bush Street Morning Sandwich was perfect: warm and toasty. Their Matcha Latte will also warm your heart.
BeanStalk Cafe,724 Bush St,"Great place for breakfast. We got two items from their specials, funky town and veggie bagel. Both really tasty and big, consider sharing. My daughter got the cragel sando and loved it. Cappucino, hot chocolate and pour coffee were excellent. Stop by if you are hungry!"
BeanStalk Cafe,724 Bush St,"We really liked the Cranberry Turkey and Egg Salad sandwiches- good crust on the bread, the right ratio between ingredients and decent sized portions.  The banana bread was also really good, moist and not too sweet.  The coffee was decent (we got espresso and capuccino), but needs a little bit of extra work to be called a specialty coffee (temperature was too high and and flavour not as strong).  Service was nice and fast, would definitely come back for the food!"
BeanStalk Cafe,724 Bush St,Great coffee taste that competes with any coffee specialist in town. The dishes are very fresh and delicious. Great vibes! Highly recommended
BeanStalk Cafe,724 Bush St,"A more intimate cafe with enough seating for you to enjoy a light breakfast and a couple laughs over coffee. I found the crogel and lux (croissant/bagel with smoked salmon) to over perform expectations, there was something about the mixed greens in there that just balanced everything and was refreshing!"
BeanStalk Cafe,724 Bush St,"I was very lucky that I could find this near the hotel where I stayed. The ingredients were very fresh and so tasty. The late was also great and two guys were very kind! I paid 36 USD for the food in the pictures, I guess this cafe is reasonable with such a freshness in this area."
BeanStalk Cafe,724 Bush St,Very delicious sandwiches. The coffee was great too!
BeanStalk Cafe,724 Bush St,"The Cragel croissant/bagel is solid! This is one of the few breakfast sandwich spots that actually cooks, and crisps their bacon! Will be back, $11.68 for a Breakfast Sando so standard for SF"
BeanStalk Cafe,724 Bush St,I really like the interior and the the style of everything  here. My favorite thing is the mojito coffee here which is spectacular and always has me coming back. It’s a cold brew with mint and getting it half sweet is perfect! The food was decent from what I’ve tried.
BeanStalk Cafe,724 Bush St,"I have lived in the neighborhood for almost 10 years. It is always my goal to support local. But with so many good cafes in the neighborhood no need to waste my time at this one any longer. The service is SO SLOW and the person taking orders is borderline incompetent. The owner does not know how to run an efficient operation. Not to mention the price gouging. $40 for two breakfast sandwiches?! I get hung up on all the time, the order is wrong all the time and the gag is I order the same two breakfast sandwiches every time. As a local who knows what I’m talking about, go to Posh bagel or fresh brew coffee up the street."
BeanStalk Cafe,724 Bush St,"Lovely breakfast cafe in a nice part of San francisco. Delicious ""Lox Bagel"" which they can substitute a croissant for. Croissants the best tasting one I've had in San Francisco so far . Exquisite smoked salmon, cream cheese, cucumber, etc., all very very well done. Delightful to sit outside at cafe table and watch the world go by."
BeanStalk Cafe,724 Bush St,"Bagel and cragel were very good, so we came again for breakfast. The cafe was very clean, the atmosphere was nice."
BeanStalk Cafe,724 Bush St,Cozy little cafe with a variety of sandwiches and drinks. It’s a perfect place for catching up with a friend or two! I had the bulgogi sandwich which was delightful!
BeanStalk Cafe,724 Bush St,"very cute little cafe in the area of Nob Hill. might not be suited for large groups, tables are rather small. highly recommend the cragel sando, best breakfast sandwich i ever had. came out piping hot and delicious. very good drip coffee. also the pastries were really good, had a carrot/nut cake that was just fantastic. staff is very friendly."
BeanStalk Cafe,724 Bush St,Cute cafe with a unique menu. The bulgogi beef sandwich was great!
BeanStalk Cafe,724 Bush St,Visited twice while in SF.  Great bagels and coffee!  Definitely recommended.
BeanStalk Cafe,724 Bush St,"I hate these coffee shops that put at least 15% of tips for selection, and easily trick you into paying too much tip, while you need to get inline and later get everything by yourselves. I can't go get my money back, hence the bad review  sandwiches are pretty special here"
BeanStalk Cafe,724 Bush St,"This place looks really cool and the atmosphere is nice. Good vives and lady there who took our order was awesome 👌 They didn't mark our drinks, and we had 4 of them. It was not a terrible thing, but we had to taste to see which was which. We had iced  lattes with almond milk and another with oatmilk. 2 Italian sodas. The kids loved their drinks. The coffee was okay, I had higher hopes for the coffee because the place was pretty cool. Not a lot of seating, but that's expected  in the city."
BeanStalk Cafe,724 Bush St,"Excellent breakfast spot, be sure to arrive early as this place gets quite busy. The cragel is definitely worth trying and the coffee is amazing. So good that we visited three days in a row during our stay in San Fran!"
BeanStalk Cafe,724 Bush St,Super cute and quaint cafe with semi sweet French vibes. Good for sun gazing and writing your next novel while watching the world pass by their oversized windows. I had a classic bagel with cream cheese and an iced chai that transported me back to Brooklyn on a Saturday afternoon.
BeanStalk Cafe,724 Bush St,"Nice, bright, but small shop.  Great quick stop for some coffee and brunch.  Both cold brew and latte were pretty good.  The cragel with egg and sausage was okay.  Friendly service!"
BeanStalk Cafe,724 Bush St,"My wife and I were visiting from Denver and wanted coffee within walking distance from Union Square. This coffee shop had a great atmosphere and friendly service. Most of all, the coffee is delicious! The cuban latte is to die for."
BeanStalk Cafe,724 Bush St,Cute little coffee shop with some good food and drink options. A reasonable amount of seating packed into a narrow space. Nice exposed brick walls and fun multi-color seating. Fast service.
BeanStalk Cafe,724 Bush St,"Your average dirty, crowded SF coffee bar with good breads and sandwiches. No vegan options really. Just pretty guys to look at."
BeanStalk Cafe,724 Bush St,Quiet place with great coffee and breakfast. Staff are quiet but pleasant. Great ambience to chill out and enjoy your cup of coffee - I had a mocha that was not too sweet and had a really nice balance of coffee and chocolate - most places make it such that you can barely taste the coffee. I also really enjoyed the egg salad on onion bagel. Definitely worth a visit.
BeanStalk Cafe,724 Bush St,We ate breakfast on Sunday early morning. There were few people. Coffee and toastcup were served quickly compared with everything bagel. We got a light meal here. It’s okay quality nothing surprising.
BeanStalk Cafe,724 Bush St,"The most amazing coffee shop in San Francisco! I lived in the neighborhood and was here almost everyday. Whether it was to study, to work, or just to relax. This lil coffee shop never let me down. In Nob Hill, It’s a short uphill walk from Union Square, off of the Powell cable car line. It’s fun if you enjoy people watching, a nice cup of soy mocha and delicious bulgogi sandwich. I became friendly with the staff since they were all amazing and kind as well. I miss this place after moving away!!"
BeanStalk Cafe,724 Bush St,Great place for quick breakfast coffee and sandwiches
BeanStalk Cafe,724 Bush St,Great little coffee and sandwich shop. Decent seating options given the small space. I recommend the iced latte.
BeanStalk Cafe,724 Bush St,Food was amazing and the line was worth it (about 12 people on a Sunday morning) location is cute inside and the staff was nice and joking around with each other. I got the cragel sausage and egg and my partner got the roast beef
BeanStalk Cafe,724 Bush St,"Small cafe with polite helpful staff. Not far from California and Powell which is a great spot for touristy photos. Got a coffee which was OK, not the best but a veggie bagel that was loaded with flavor and veggies."
BeanStalk Cafe,724 Bush St,"It feels pretty nice to have a warm and tasty coffee in a cold & rainy morning. We lived in Union square and had a hangover at the Saturday night. The first thing when I woke up on Sunday was looking for good coffees. Thankfully we found this coffee shop next to our hotel. I ordered a cappuccino and my husband had a cup of americano. Both of us loved it, it made our morning so relaxing and cozy."
BeanStalk Cafe,724 Bush St,"Great local coffee. Friendly staff and atmosphere. The coffee is tasty, fresh with a nice aroma and smooth. Breakfast sandwiches are freshly made and tasty."
BeanStalk Cafe,724 Bush St,"Ate a lemon 🍋 cake 🍰.. hot chocolate with cookies 🍪 whipped cream on top and always.. good time with new member of family..  I’ve review was written to be helpful to you, the consumer and to also bring relevant information to the attention of the business in focus. If you’ve found this review helpful and or relevant for you, please help me by selecting the ""thumbs up"" icon below."
BeanStalk Cafe,724 Bush St,"The BeanStalk Cafe was great for breakfast around there. The Bulgogi sandwich was good and had resonable price. And it had enough quantity to be my breakfast. Also, the staffs are very kind."
BeanStalk Cafe,724 Bush St,Stopped by to grab a sandwich for lunch. Super tasty!
BeanStalk Cafe,724 Bush St,"The breakfast sandwhich was great; hearty, tasty and fulfilling. There was only one guy and a few people came in but he was patient and hardworking. He even hand delivered the food to the guest. Although that sandwich was $11, it was reasonable with SF price. I would come here again."
BeanStalk Cafe,724 Bush St,"Great coffee, baked goods okay but not fresh that day. All in all great spot for quick bite"
BeanStalk Cafe,724 Bush St,"Really delicious coffee. It has a strong coffee flavor, at least the espresso does. I had a cragel breakfast sandwich, which was really fantastic."
BeanStalk Cafe,724 Bush St,"The reviews made me want to try this spot, but it turned out to be disappointing. I ordered a iced chai tea latte and the latte tasted like cinnamon milk. I went back to have it remade and the barista unfortunately didn’t make a new one and just added a shot of espresso inside it (tasted the same). In addition, I got a egg and cheese on a croissant - the croissant was overly hard / stale and the egg did not seem fresh (looked like one of the ready made egg blocks)"
BeanStalk Cafe,724 Bush St,"The cragels here are a must try. Coffee was really good also, and nice coffee shop ambiance. I'll definitely be back"
BeanStalk Cafe,724 Bush St,Really friendly staff and the sandwiches/bagels there were amazing! I really liked the small Italian bistro vibe it has.
BeanStalk Cafe,724 Bush St,Super cute cafe with yummy sandwiches and coffee with latte art. The staff was so sweet. Vibes are cozy!
BeanStalk Cafe,724 Bush St,It was so nice and I came here twice during my stay. I recommend drip coffee and Bush street sandwich.
BeanStalk Cafe,724 Bush St,"Really solid breakfast spot! The coffee is tasty, the staff is super helpful, and the bagel with cream cheese is simple but tasted fresh. Would recommend!"
BeanStalk Cafe,724 Bush St,"Quiet little coffee shop that has an extensive menu. Good lattes, mochas, & americanos. Asiago bagel and cream cheese was good as well. A couple of tables outside and a few more inside. Good place for dogs (outside only)."
BeanStalk Cafe,724 Bush St,Really nice staff and great food! Visited 3x in 3 days. Dine in and take out both great.
BeanStalk Cafe,724 Bush St,"PROS: - really good food! - good drink options, especially warm drinks for winter days - close enough to Union Square for conveniency, but far enough to avoid the crowd (and hence the wait typical at Union Square restaurants) - my friend had a sandwich, and I had a bagel, both have a lot of filling and is extra heavy, so we both had takeaway. Good price for portion!  CONS: - limited seating. You’d have to share tables if needed be."
BeanStalk Cafe,724 Bush St,Definitely I love it !!! ❤️❤️❤️❤️ Staff super friendly !!! Thanks Mylo 👍 …
BeanStalk Cafe,724 Bush St,"The sandwich is a bit dry, the taste is not mellow in every bite. The taste of coffee is not good, I feel like drinking instant coffee."
BeanStalk Cafe,724 Bush St,Super cute little bagel/breakfast sandwich cafe. Delicious lattes and tasty food. Not a lot of seating so I recommend coming prior to 8:30 AM.
BeanStalk Cafe,724 Bush St,"Absolutely fabulous.  The best sandwich and coffee in San Francisco.  We had Mina's veggie sandwich and also an egg sandwich, both were absolutely delicious.  Gorgeous bread and packed with super fresh fillings.  They have so much choice on their menu.  Highly recommended."
BeanStalk Cafe,724 Bush St,BeanStalk Cafe is a quaint and comfortable Cafe to get great coffee and good food to start your day.  If f time permits relax and observe the hum of the city and if you are lucky the cute dogs that love to visit the Cafe.
BeanStalk Cafe,724 Bush St,"Every so often you go to a place that just gets it. Affordable, delicious food and outstanding coffee."
BeanStalk Cafe,724 Bush St,"The service was great, the cragel an interesting sandwich. Coffee is good, all in all a good choice for a hearty breakfast."
BeanStalk Cafe,724 Bush St,"We fled from the rain and found this perfect little café. Friendly staff and great roast beef sandwiches, tea & coffee. It's close to everything and has a very nice atmosphere."
BeanStalk Cafe,724 Bush St,It’s a cozy place. The people in there are nice. I give them 2 stars because I didn’t like the coffee. The quantity versus price is good.
BeanStalk Cafe,724 Bush St,Best iced oat milk latte in San Francisco and nice staff :)
BeanStalk Cafe,724 Bush St,Absolutely delicious flat white coffee and great breakfast sandwich too!
BeanStalk Cafe,724 Bush St,"They make a excellent Americano coffee, only let down by it being served in Cardboard cups."
BeanStalk Cafe,724 Bush St,"Quaint little cafe with great coffee. Serves bagels, perfect place for a light breakfast."
BeanStalk Cafe,724 Bush St,"I have allergies to egg and dairy products, so I searched for a vegan cafe on Google... unfortunately I can tack this onto my growing list of Google messups, because this place could barely accommodate me. However, I would say the staff here are very friendly, and tried their best. I had their only vegan option: Mim's veggies sandwich without the mayo sauces and cheese, which was good. I ordered a soy cappachino as well, which was too hot for the soy (for those of you who don't normally do coffee, it's when the soy is on the verge of burning and so the foam doesn't set properly), but I'm grateful they had the option. If I didn't have allergies, I'd come here for sure!"
BeanStalk Cafe,724 Bush St,"Very good food, a little slow but it was Sunday morning when we visited.  Tea was delicious, had the bush st breakfast sandwich which was huge  (couldn't finish it).  Great little cafe spot."
BeanStalk Cafe,724 Bush St,"Visited during a quiet time of day (1.45pm). Service was exceptionally slow (12mins for a simple order). When delivered, cream cheese bagel was at least ""day-old"" bread, and perhaps older. Coffee (Flat white) was thin and runny, and particularly bitter. Probably one of my worst Quick-Lunch experiences for many a month. A sad member of San Fran's otherwise excellent Cafe set...."
BeanStalk Cafe,724 Bush St,"A perfect place to have brunch!  The background music was enjoyable, the staff were accommodating, and the food was on-point!"
BeanStalk Cafe,724 Bush St,Good spot for breakfast with decented prices. Outstanding service
BeanStalk Cafe,724 Bush St,"Wonderful little spot with delicious coffee (my latte was incredible), delicious sandwiches (I had the lox bagel), and very kind people behind the counter. This a a great breakfast spot and I am sure the lunch would be fantastic too. Nice indoor seating and a few outdoor chairs to sit and watch the cable cars go by."
BeanStalk Cafe,724 Bush St,"A petite spot in SF. Ideal to grab something quick and leave, not for working. Still nice place."
BeanStalk Cafe,724 Bush St,Great everything. Bagels are awesome. Coffe superb.
BeanStalk Cafe,724 Bush St,Ordered the Bush St Morning Sandwich. Delicious stuff. Good focused cafe food.
BeanStalk Cafe,724 Bush St,"Amazing food and great staff! I ordered the egg and cheese on Asiago bagel. It was crispy on the outside and perfectly cooked inside. The iced berry tea is tart and delicious. All in all, a perfect way to start your day."
BeanStalk Cafe,724 Bush St,"Delicious sandwhiches and friendly service. Although food took a while to prepare, it was done thoughfully. Would recommend!"
BeanStalk Cafe,724 Bush St,"I had the breakfast sandwich with egg, sausage and veggies. The bread was deliciously toasted. Crispy and buttery. Recommend for breakfast!"
BeanStalk Cafe,724 Bush St,Lovely small cafe with friendly staff!
BeanStalk Cafe,724 Bush St,"Great breakfast sandwiches and espresso, friendly staff, quick service"
BeanStalk Cafe,724 Bush St,Staff is friendly and coffee is good. I ordered the avocado sandwich which had a trace of avocado and mushrooms and mostly consisted of lettuce
BeanStalk Cafe,724 Bush St,Great little coffee and sandwich shop ... had breakfast there most days when we were staying in a hotel across the road. Breakfast sandwich in a bagel was very good.
BeanStalk Cafe,724 Bush St,All around great place. Interesting layout and decor. Good food and good prices.
BeanStalk Cafe,724 Bush St,"Had a terrible experience here this morning. I ordered a bagel with egg and cheese and some veggies and a grilled cheese sandwich. I was charged $17 for the veggie bagel. Apparently, if you want veggies added to your bagel they charge you an abused amount for the veggies. The sandwich was in no way worth $17. It was small and tasteless and barely had any veggies. They also forgot to put in my grilled cheese order so I had to wait for that which made me late to my morning meeting.  Overall, I wouldn’t go back to this place because they unjustifiably overcharge for bland food."
BeanStalk Cafe,724 Bush St,"Have been coming here since they opened, and the food quality and service has been consistently great. Love the sandwiches!"
BeanStalk Cafe,724 Bush St,"Good coffee, eats and friendly staff. Nice place to come if your waiting for your laundry across the road."
BeanStalk Cafe,724 Bush St,"Cute, small cafe, with a wide selection of breakfast sandwiches and coffee. The sandwiches are large, so large my family saved the other half for lunch. Had the Bulgoli sandwich, Breakfast Special sandwich and pesto grilled cheese - all delicious. My husband enjoyed the drip coffee. Great place."
BeanStalk Cafe,724 Bush St,Great breakfast Cafe in union square. Tried the Crogel sandwich and spicy chicken sandwich and they were DELICIOUS. Also had the coffee and it tasted great.
BeanStalk Cafe,724 Bush St,The man checking me out was so helpful! He was so nice and happy first thing in the morning. They were also playing really nice music. It was really clean inside. It helped that the weather was gorgeous on this morning! Thank you for helping me find a vegetarian dish
BeanStalk Cafe,724 Bush St,Great selection of breakfast sandwiches and coffee’s - would recommend trying the cragel sandwhiches (croissant + bagel)
BeanStalk Cafe,724 Bush St,"A really nice café close to the Union Square. Although quite tiny, it has outlets and great wifi. So everything you would need for a good study session. On top of that, you even have incredibly tasty sandwiches and super nice staff. Big recommendation for whoever is looking for a good snack after a long shopping tour."
BeanStalk Cafe,724 Bush St,The 'Cragel' (half croissant/half bagel) is neither. But transcends expectation and is hard to compare.
BeanStalk Cafe,724 Bush St,"Cute cafe with mostly indoor and a little outdoor seating. I did not order any coffee but tried their chicken sandwich and it was scrumptious!! Although it takes quite a while (around 10mins) to prepare and there it was packed when I was there, which was around 10 am on a Sunday."
BeanStalk Cafe,724 Bush St,"Good food, nothing really special. Coffee was very tasty!"
BeanStalk Cafe,724 Bush St,Amazing new Cafe that actually does coffee right. If you here you must try it!
BeanStalk Cafe,724 Bush St,"Hands down one of the best breakfast sandwich places around! Their croissant bagel hybrids taste SOOOO good that I swear I dreamt about it that night. Peaceful spot to relax, study, or read and eat a great breakfast, you won't regret it!!"
BeanStalk Cafe,724 Bush St,"This is a sweet neighborhood coffee shop that is also downtown. A couple of tables and chairs outdoors (as of now, but could change with the recommendations of the Governor) very good espresso drinks, great menu for breakfast items and a list of sandwiches that would rival anywhere. It is very clean and well organized but I have to say the staff is really welcoming and pleasant. So all in all I highly recommend Beanstalk Coffee, a coffeehouse as it should be."
BeanStalk Cafe,724 Bush St,Large and tasty sandwich. Good coffee.
BeanStalk Cafe,724 Bush St,"Perfect flat white, delicious bagels, fast and good service!"
BeanStalk Cafe,724 Bush St,"the seating is communal here, so be prepared to share a table. Our server was awesome and very attentive. I'd definitely come back again during a nice warm sunny day to enjoy their outdoor services!We have been to dinner here several times, and always enjoy our food. We have had their tamale plate, chicken fajitas, and their Mexican dinner. The complimentary chips & salsa are some of the best in town if you enjoy spice! The location is difficult to get to but once you follow the GPS for your first visit you'll never forget."
BeanStalk Cafe,724 Bush St,"I love their breakfast sandwich (Eggs, cheese, sausage and bacon). What ever you order, you must to try it on Cragel bread (Bagel + Croissant), it's heaven. Their coffee is great too."
BeanStalk Cafe,724 Bush St,Best chai I had this week I have been in San Francisco and bagel was surprising good as well. Only wish I found this place  earlier in my trip to SF.
BeanStalk Cafe,724 Bush St,Delicious Bagel Sando and Flat white coffee
BeanStalk Cafe,724 Bush St,Delicious fresh sandwiches!
BeanStalk Cafe,724 Bush St,Delicious. I just had their Nina’s veggie sandwich and it was phenomenal. Very fresh ingredients with a warm and crunchy bread. Yum. I also STRONGLY recommend their pour over coffee. I had the Colombian one and it was very flavourful. What a great find!
BeanStalk Cafe,724 Bush St,"I love everything about this place.  Coziest, charming decor and amazing sausage, egg and cheese sandwich.  My latte was the creamiest and my husband felt the same about his choices.  The owner and staff were beyond nice and I am going back soon because they now have Pinkberry frozen yogurt!!!!"
BeanStalk Cafe,724 Bush St,"Visiting from Seattle, and tried a cappuccino here.  This might be a nice little cafe for food in general, but not a coffee enthusiast place.  My drink was sour and I only drank a sip or two."
BeanStalk Cafe,724 Bush St,"Awesome breakfast! Got sausage cragel sando and pour over Ethiopian coffee. Expensive for breakfast, but so worth it! The guy making it was so nice too! Def recommend for quick nice breakfast"
BeanStalk Cafe,724 Bush St,"I was just visiting from New York and luckily found this wonderful little cafe.  The food and drinks there are simply amazing, and served with a smile and caring attitude that was incredibly refreshing to this New Yorker!  I stayed in the area for 4 days and had or picked up my breakfast there every morning.   Yeah!  It was THAT GOOD!!  If you are in the Union  Square area, GO to the beanstalk! You will not be disappointed!"
BeanStalk Cafe,724 Bush St,"This is a cute little coffee place just off all the hustling from union square. You'll find a lot of locals here just enjoying a cup of good coffee. They are also good for a light and quick breakfast or brunch. I love their interior - super high ceilings, a lot of light and very modern and cool. It has a good amount of hipster vibe to it and they certainly take it serious preparing your espresso or sandwich. You'll always get a smile from the barista. They also serve slow drip coffee which tastes excellent. Seating is limited but usually you can always grab a table."
BeanStalk Cafe,724 Bush St,"Small cafe vibe, chilled atmosphere, great roast beef sandwich, pour over coffee was ok."
BeanStalk Cafe,724 Bush St,This is a great coffee shop that you can spend a lot of time hanging out in without knowing where the time went. I do like the coffee shop itself though!
BeanStalk Cafe,724 Bush St,Try the beef bugogi (Korean inspired) sandwich! It was simply amazing!!
