0,1,2
BeanStalk Cafe,724 Bush St,Great place for a quick bite. I asked for a special modification to my meal and they fulfilled my request and made it delicious.
BeanStalk Cafe,724 Bush St,Incredible cold brew!  But that's to be expected when you use one of them crazy chemistry-like filter contraptions.
BeanStalk Cafe,724 Bush St,"Drip coffee was delicious, but the breakfast sandwich was just alright."
BeanStalk Cafe,724 Bush St,"Bright, airy, tasty. Very limited seating, but a nice big community table helps."
BeanStalk Cafe,724 Bush St,"Just had coffee but wasn't blown away. Very average, temperature was a bit too hot."
BeanStalk Cafe,724 Bush St,Over rated little cafe. Coffee is very good but the service and food could be better
BeanStalk Cafe,724 Bush St,Delicious cragel egg and cheese 😍 …
BeanStalk Cafe,724 Bush St,Quaint and friendly coffee shop - took extra care to make the perfect drink - highly recommend!
BeanStalk Cafe,724 Bush St,Great sandwiches and coffee (with a few treats). Small and mellow.
BeanStalk Cafe,724 Bush St,"Mocha was great, food was great, wasn’t too long of a wait either. But very limited seating."
BeanStalk Cafe,724 Bush St,"Delicious Cragel Sando, Cappuccino just okay"
BeanStalk Cafe,724 Bush St,"Toast cups, sandwiches, and coffee are all fantastic! Extremely friendly service too!"
BeanStalk Cafe,724 Bush St,Turkey pesto was great
BeanStalk Cafe,724 Bush St,"this guy is a machine, coffee has no burn and he was rushed with customers!!good bagels"
BeanStalk Cafe,724 Bush St,Great breakfast options. A cozy little hole in the wall that will not disappoint.
BeanStalk Cafe,724 Bush St,"Coffee is very small, not really good taste (burnt)"
BeanStalk Cafe,724 Bush St,Definitely get there early for the cragel. Loved the bulgogi sandwich.
BeanStalk Cafe,724 Bush St,Great local spot! Amazing coffee and breakfast sandwich was great!
BeanStalk Cafe,724 Bush St,"Good coffee but moody baristas who are too cool to say ""how are you?"" and smile."
BeanStalk Cafe,724 Bush St,Good coffee but really tiny space. The neighboring space is renovating when I was there.
BeanStalk Cafe,724 Bush St,The chinese girl who takes order is so unhelpful and rude. I didn’t like even the food. I’ll Never go there again.
BeanStalk Cafe,724 Bush St,Very friendly service and great tasting coffee and bagel!!
BeanStalk Cafe,724 Bush St,Awful $5 pour over coffee- zero flavor and watered down
BeanStalk Cafe,724 Bush St,They know me after my first visit and they serve great food and coffee!
BeanStalk Cafe,724 Bush St,Great place for a cup of coffee anytime of day or breakfast is amazing
BeanStalk Cafe,724 Bush St,The food is really good but I’ve never not had to go back to the counter because my order was incorrect or incomplete
BeanStalk Cafe,724 Bush St,Awesome sandwiches and coffee. Vegan friendly as well!
BeanStalk Cafe,724 Bush St,"Just had the coffee, very good coffee"
BeanStalk Cafe,724 Bush St,Nice small cafe with good ambience. Perfect for a quick breakfast.
BeanStalk Cafe,724 Bush St,"Sandwiches and bagels are good, coffee was a little weak. Bit of a line on a Sunday morning"
BeanStalk Cafe,724 Bush St,Great drinks and food but have messed up my order a frustrating amount of times
BeanStalk Cafe,724 Bush St,The egg and cheese cragel was delicious!
BeanStalk Cafe,724 Bush St,"Terrible staff, lazy and not really friendly. However the food and the drinks are pretty good."
BeanStalk Cafe,724 Bush St,The espresso was really nice.
BeanStalk Cafe,724 Bush St,"Delicious sandwich, the vegetarian can be made vegan & is so good!"
BeanStalk Cafe,724 Bush St,Great bagel sandwich and strong dark coffee.
BeanStalk Cafe,724 Bush St,Great little coffee place. Very good coffee and breakfast.
BeanStalk Cafe,724 Bush St,"Nice place,  clean. The Bulgogi sandwich is awesome."
BeanStalk Cafe,724 Bush St,Understaffed but sandwiches are good. Coffee was ok.
BeanStalk Cafe,724 Bush St,Good coffee and fresh sandwiches
BeanStalk Cafe,724 Bush St,Great hole in the wall place. Must have the cragels!
BeanStalk Cafe,724 Bush St,Try the cragel. Also great cold brew ice coffee.
BeanStalk Cafe,724 Bush St,Love This Place - great food and a chance to slow down in San Francisco
BeanStalk Cafe,724 Bush St,Cute cafe with friendly staff and delicious matcha tea
BeanStalk Cafe,724 Bush St,"Service slow, counter-person is moody. My cragel was dry. Day old?"
BeanStalk Cafe,724 Bush St,Fantastic breakfast sandwich and coffee!
BeanStalk Cafe,724 Bush St,"Quaint coffee shop with delicious coffee, and  decent breakfast sandwiches."
BeanStalk Cafe,724 Bush St,Great sandwiches!
BeanStalk Cafe,724 Bush St,Great coffee with nice atmosphere to enjoy it in.
BeanStalk Cafe,724 Bush St,The breakfast is very good and it is not particularly expensive
BeanStalk Cafe,724 Bush St,Best coffee and sandwich!
BeanStalk Cafe,724 Bush St,Good coffee.
BeanStalk Cafe,724 Bush St,Awesome vanilla iced latte and bagels!!!
BeanStalk Cafe,724 Bush St,My favorite weekend ritual - bagel and Mocha.
BeanStalk Cafe,724 Bush St,One of my fav places in san fran
BeanStalk Cafe,724 Bush St,outrageously delicious mocha!!!
BeanStalk Cafe,724 Bush St,"If you want a solid mid-afternoon snack, get the pesto grilled cheese."
BeanStalk Cafe,724 Bush St,Good coffee. OK service. OK food
BeanStalk Cafe,724 Bush St,Nom Nom. Breakfast and drip coffee is a must. Thanks!
BeanStalk Cafe,724 Bush St,"A little hard to find unless you're really looking, but I loved the coffee."
BeanStalk Cafe,724 Bush St,SUper cute spot!!! makes me warm with happiness just being here!
BeanStalk Cafe,724 Bush St,Morning sandwich was unparalleled! Super yum!!
BeanStalk Cafe,724 Bush St,Just what's needed for grab and go.  Good coffee
BeanStalk Cafe,724 Bush St,Cozy little place with a very good hot chocolate!
BeanStalk Cafe,724 Bush St,Good decaf espresso
BeanStalk Cafe,724 Bush St,"The Toast Cups are perfect, the service was wonderful"
BeanStalk Cafe,724 Bush St,"Reasonable prices, very good quality, amazing environment"
BeanStalk Cafe,724 Bush St,This is a hidden gem with great sandwiches and coffee.
BeanStalk Cafe,724 Bush St,Best sandwich I've had.
BeanStalk Cafe,724 Bush St,Quick service and good quality food.
BeanStalk Cafe,724 Bush St,"Good service , black eye great coffee!!!"
BeanStalk Cafe,724 Bush St,"The service is a bit slow, but good quality."
BeanStalk Cafe,724 Bush St,Small but good coffee and breakfast
BeanStalk Cafe,724 Bush St,Coffee was very good here!
BeanStalk Cafe,724 Bush St,Excellent
BeanStalk Cafe,724 Bush St,Delicious food and lovely owners!
BeanStalk Cafe,724 Bush St,Good coffee
BeanStalk Cafe,724 Bush St,"Good coffee, minutes from union square"
BeanStalk Cafe,724 Bush St,Very nice ambience and good food
BeanStalk Cafe,724 Bush St,Great breakfast spot
BeanStalk Cafe,724 Bush St,Great bagel-croissant! 🥐👌🏻 …
BeanStalk Cafe,724 Bush St,Cute little place to grab a bite and coffee.
BeanStalk Cafe,724 Bush St,Great espresso cute digs
BeanStalk Cafe,724 Bush St,"Small, clean, good coffee."
BeanStalk Cafe,724 Bush St,Good service and nice place!
BeanStalk Cafe,724 Bush St,serving contraband coffee and yummy sandwiches
BeanStalk Cafe,724 Bush St,Bulgogi sandwiches was awesome!!
BeanStalk Cafe,724 Bush St,Sandwiches are amazing
BeanStalk Cafe,724 Bush St,Amazing breakfast bagels!
BeanStalk Cafe,724 Bush St,Good coffee & breakfast sammich
BeanStalk Cafe,724 Bush St,Try Americano. It's good.
BeanStalk Cafe,724 Bush St,It's ok
BeanStalk Cafe,724 Bush St,Overpriced coffee with nothing spectacular
BeanStalk Cafe,724 Bush St,Good breakfast sandwich
BeanStalk Cafe,724 Bush St,Wow super tasty.
BeanStalk Cafe,724 Bush St,Very good coffee
BeanStalk Cafe,724 Bush St,Really good coffe
BeanStalk Cafe,724 Bush St,Excellent sandwiches!
BeanStalk Cafe,724 Bush St,"Bad experience, rude staff"
BeanStalk Cafe,724 Bush St,Good breakfast food and coffee
BeanStalk Cafe,724 Bush St,Delightful breakfast spot.
BeanStalk Cafe,724 Bush St,Really great coffee
BeanStalk Cafe,724 Bush St,Try the espresso cola
BeanStalk Cafe,724 Bush St,Awesome sandwiches.
BeanStalk Cafe,724 Bush St,Get the cragle sandwich
BeanStalk Cafe,724 Bush St,Tasty coffee and sandwiches!
BeanStalk Cafe,724 Bush St,Just popped in for a bite
BeanStalk Cafe,724 Bush St,Nice little coffee shop
BeanStalk Cafe,724 Bush St,Great coffee.
BeanStalk Cafe,724 Bush St,Delicious sandwiches!
BeanStalk Cafe,724 Bush St,OK
BeanStalk Cafe,724 Bush St,Good bagel.
BeanStalk Cafe,724 Bush St,Unfriendly!
BeanStalk Cafe,724 Bush St,Love this place
BeanStalk Cafe,724 Bush St,Great place
BeanStalk Cafe,724 Bush St,Cream cheese
BeanStalk Cafe,724 Bush St,Great coffee
BeanStalk Cafe,724 Bush St,"This was my third time at this establishment. I first went 2 years ago when I was in SF and returned because the food is fresh, beverages are good and the service is friendly. The lox bagel was great!  It gets crowded otherwise I would have given the atmosphere 4 stars…hard to get a table at times."
BeanStalk Cafe,724 Bush St,Bul-go-gi beef sandwich. Get it.
BeanStalk Cafe,724 Bush St,We stumbled across this cafe today and were very pleased. We chose the veggie bagel in the Daily Specials menu and it was the right decision. Very very tasty bagel. Coffee was very strong but good by American standards. The service was very nice and polite. I can only recommend!
BeanStalk Cafe,724 Bush St,Very good baggel for morning breakfast. Pleasant service. The coffee was too bitter and strong acid for my taste. The milk chocolate was very well executed.
BeanStalk Cafe,724 Bush St,"A warm pastrami sandwich to kneel in and nice service, I really liked going there more often. There's only a small deduction for the many hipsters, you almost never get a seat. But beware, the sweet counter offers many delicious temptations."
BeanStalk Cafe,724 Bush St,lots of sheep I ate green onions and something with eggs in it Coke not sold A little bit of taste still delicious
BeanStalk Cafe,724 Bush St,"We decided to have breakfast several times during our stay in the city. The bagels are delicious, highly recommended."
BeanStalk Cafe,724 Bush St,"Bagels taste very good, coffee and espresso too. Everything in self-service. Water is free. Great for breakfast or a small lunch. All bagels are also available as a croissant variant with a 25 percent surcharge. There are also sandwiches that cost a little more."
BeanStalk Cafe,724 Bush St,"I ordered a morning sandwich after reading the reviews, and I liked the light taste of warm-roasted ciabatta with scrambled eggs. The owner is skilled, so I think the other menus are also delicious. But if you're near Union Square, it's worth a try, but it's not a great restaurant to visit from far away."
BeanStalk Cafe,724 Bush St,"I happened to come in while going to the laundromat, and decaffeinated coffee is also available! Two cups of coffee and a sandwich cost about $20, and it's really delicious.. Highly recommended"
BeanStalk Cafe,724 Bush St,"Not good at all! Coffee not of good quality, complaints are not addressed. By far one of the worst flat whites from SF  Avoid"
BeanStalk Cafe,724 Bush St,"I passed by without expecting much, but the sandwiches were so delicious that I stopped by every day. There's a bulgogi sandwich, but I made it with a gochujang base, and it's really delicious!!! I hope they sell it in Korea too."
BeanStalk Cafe,724 Bush St,Another great place for breakfast. You can order delivery and eat there. fantastic coffee!!
BeanStalk Cafe,724 Bush St,Nice and clean little place where they serve really well made mega sandwiches! Great idea to have lunch before resuming the San Francisco climbs tour!
BeanStalk Cafe,724 Bush St,Nice stop for a latte-macha and dessert.
BeanStalk Cafe,724 Bush St,"tasty bagels, but take a long time to cook, unless you've ordered a bagel with a simple philadelphia. coffee so so"
BeanStalk Cafe,724 Bush St,Great cafe for breakfast. The bagels stuffed with eggs and bacon are very good.
BeanStalk Cafe,724 Bush St,Cafe near Union Square I recommend the Bush Street Morning Sandwich for breakfast.
BeanStalk Cafe,724 Bush St,Excellent breakfast and excellent service. 👌
BeanStalk Cafe,724 Bush St,The breakfast is delicious and the coffee is delicious
BeanStalk Cafe,724 Bush St,"Great coffee, a little cold atmosphere"
BeanStalk Cafe,724 Bush St,I love the coffee in this place
BeanStalk Cafe,724 Bush St,Morning sandwiches are the best.
