0,1,2
Cafe La Taza,2475 Mission St,Its ok the food its so so the waiter had taken my order wrong like 3 times out of 5. Its my mother favorite place so that's the reason i continue going. Nice atmosphere
Cafe La Taza,2475 Mission St,Would rate this higher if I could. Fantastic food big portions good price. Fun people. Not pretentious.
Cafe La Taza,2475 Mission St,"Real chill, local Mission Latino vibe. Came here for breakfast one morning and everyone was watching the Mexico world cup game. Bougie brunch food if you're into that, but without the pretentiousness."
Cafe La Taza,2475 Mission St,What a pleasant surprise. The food here is pretty delicious. We had the fried calamari and tilapia and baby back ribs. Fabulous!
Cafe La Taza,2475 Mission St,"Breakfast portions are generous and do not lack flavor or spice, the coffee is delicious, service is genuine and fast. Everything was so good we came back the next day for more."
Cafe La Taza,2475 Mission St,Best breakfast spot in the Mission...people are great and most importantly the food is amazing. Its hard to please me coffee wise...they can make a mean cup hell yeah!!!
Cafe La Taza,2475 Mission St,"I love this place! Yummy food, great happy hours, legit atmosphere, and not too too expensive prices. This is definitely a go-to!"
Cafe La Taza,2475 Mission St,"Stumbled into here one morning on my way from the latin market down the street, and I honestly had no idea what an operation this was! Upon first glance, thought it was just a coffee shop. Nope, they have baked goods, a full menu - breakfast and lunch (maybe also dinner), along with a full cafe drink menu. Delicious, and super fast, efficient service."
Cafe La Taza,2475 Mission St,"I love  this place so much. I come almost every day and I feel at home. Parking ? Yes a little hard but well worth it Staff??? The best!!! Thank you Leonor., Leah., Giovanni and everyone. !!"
Cafe La Taza,2475 Mission St,"People is super kind.  I visit the place with my friend when they were about to close, and   they were super flexible to let us have a cup of coffee. The place is clean and warming with low music that allows conversation"
Cafe La Taza,2475 Mission St,"Good breakfast, great coffee, just too expensive to be on that Mission, area with dirty streets. Visit just for tbe Chilaquiles. Expended $40.00 + tip, the advised on receipt. ""Just for breakfast, more then in Orlando Florida, and you know is ecpensive in Orlando!!!"
Cafe La Taza,2475 Mission St,First time here and can't wait to go back!
Cafe La Taza,2475 Mission St,The servings are large and although tne food is pricey everything is better than most places and our waiter has been consistently really nice and vantastic service.
Cafe La Taza,2475 Mission St,"Very friendly ambiance with a respectable menu. However, the drinks were sub-par and the service was pretty slow despite us dining there on a slower night."
Cafe La Taza,2475 Mission St,I wish is place was in my local area!!! Everything is perfect! The food drinks service atmosphere! I always come here at least once when I visit!
Cafe La Taza,2475 Mission St,"La Taza is a warm, friendly, and well run spot. They have great Mexican and American fare as well as delicious coffee."
Cafe La Taza,2475 Mission St,Plenty of options in the Mission but this is stellar. Wished I had photographed my huevos rancheros but it was perfect. Great service and bilingual. Check it out.
Cafe La Taza,2475 Mission St,Maricella is a top tier server. Food was delicious. Will return.
Cafe La Taza,2475 Mission St,Great service and delicious food!! Go to brunch spot for me and my girls!
Cafe La Taza,2475 Mission St,The menu has changed over the years but the food is still good.
Cafe La Taza,2475 Mission St,The environment was nice but the customer service was not. The waitress there are racist and made me feel that my money is less that a white person
Cafe La Taza,2475 Mission St,"I went here for a coffee, which was great, but the food looked fantastic. They have an extensive ceviche selection which looked great."
Cafe La Taza,2475 Mission St,"Always great service, food, coffees, juices. this is a must weekends brunches! Guillermo is a great bartender and server, very very efficient!"
Cafe La Taza,2475 Mission St,I got a hot chocolate and it seriously is the best one I've ever had and I'm almost 30. It was so delightful I wanted to chug it.
Cafe La Taza,2475 Mission St,"Excellent local Mexican cafe with bustling atmosphere, solid menu, popular items, happy hour and a lovely tea selection."
Cafe La Taza,2475 Mission St,"Very bland, fatty and unhealthy food. Even kale and quinoa salad is prepared with heavy dressing. Not recommended for health conscious people."
Cafe La Taza,2475 Mission St,Very friendly & fast service! Good food and salads. My hot chocolate is always on point!
Cafe La Taza,2475 Mission St,Excellent place for breakfast lunch or dinner. Has really big portions! Great happy hour!
Cafe La Taza,2475 Mission St,Food was amazing.  1st time here.
Cafe La Taza,2475 Mission St,"Not peaceful environment, hard to have a conversation with loud regueton Food okay."
Cafe La Taza,2475 Mission St,"Cafe La Taza is a great Latin-inspired spot on Mission, across the street from Foreign Cinema. The food is fresh and consistently good, and is fairly inexpensive compared to most of its competition. The coffee and espresso drinks are above average, maybe not on par with Four Barrel or Blue Bottle, but certainly acceptable for all but the most snobbish of caffeine snobs."
Cafe La Taza,2475 Mission St,Great brunch place. Nice pancakes and scrambles.
Cafe La Taza,2475 Mission St,"Good place overall. Don't come here if you plan to use the wifi. It is advertised as free, but doesn't actually connect to the Internet."
Cafe La Taza,2475 Mission St,Excellent service! The money is definitely worth the varieties of food that they offer..
Cafe La Taza,2475 Mission St,Very yummy! Good portions! a bit noisy but the servers noticed and fixed it!
Cafe La Taza,2475 Mission St,"accidentally came here and got a huge plate of food for moderate price, which was incredibly delicious. Highly recommend this place, authentic af"
Cafe La Taza,2475 Mission St,"Super pricey for the Mission Street. The food is good and the staff are very friendly, but the prices are ridiculously high."
Cafe La Taza,2475 Mission St,"Sadly they roved my favorite sandwich, El Cubano, but their coffee is delicious and the staff is so friendly."
Cafe La Taza,2475 Mission St,"Great coffee, attentive service. They took the time to measure the capacity of my new to-go cup."
Cafe La Taza,2475 Mission St,Excellent food and service. Talk to Cuba and he will set you up with what you need.
Cafe La Taza,2475 Mission St,Fine cafe with good iced coffee and great mocha frappe. Good service and friendly staff. Prices are fair.
Cafe La Taza,2475 Mission St,You must try their Dulce De Leche Latte. Delicious! Nice environment!
Cafe La Taza,2475 Mission St,"Excellent service, food, and place to have a nice time."
Cafe La Taza,2475 Mission St,I only had empanadas but they were great. Service was good.
Cafe La Taza,2475 Mission St,"Delicious food, my favorite restaurant so far to eat breakfast!"
Cafe La Taza,2475 Mission St,Great service and the food is one of my favorite in SF
Cafe La Taza,2475 Mission St,"Good coffee, bagels and croissants always fresh and good, all the workers really nice"
Cafe La Taza,2475 Mission St,One Best Place On The Mission Street?
Cafe La Taza,2475 Mission St,"Great food, great staff, nice location. What more can you ask for?"
Cafe La Taza,2475 Mission St,The food was good ppl were great I will recommend this place
Cafe La Taza,2475 Mission St,"Delicious breakfast, great service.  Basic decor and ambience tho"
Cafe La Taza,2475 Mission St,"Great place for a big breakfast on a weekend morning.  Good coffee, wonderful staff."
Cafe La Taza,2475 Mission St,Great food and drinks and also reasonably priced. Hidden gem in the Mission District!
Cafe La Taza,2475 Mission St,"Awesome atmosphere, yummy pastries and really good hot chocolate"
Cafe La Taza,2475 Mission St,Great place to do work or grab breakfast. Good vibe with an eclectic mix of people.
Cafe La Taza,2475 Mission St,Excellent place for your early breakfast!!
Cafe La Taza,2475 Mission St,"Awesome food, great atmosphere, great service."
Cafe La Taza,2475 Mission St,Good brunch and happy hour place. Nothing fancy but good enough to hit the spot.
Cafe La Taza,2475 Mission St,very nice restaurant in the mission district. their vanilla lemonade is very good
Cafe La Taza,2475 Mission St,"Nice place for a quick dinner, ceviche and lomo saltado were good."
Cafe La Taza,2475 Mission St,"Consistent, tasty food at a reasonable price. Everything a neighborhood Cafe should be"
Cafe La Taza,2475 Mission St,Out door din was great and yes the food was yummy
Cafe La Taza,2475 Mission St,Good was delicious. Drink were excellent. Staff was friendly.
Cafe La Taza,2475 Mission St,I went with my friend and they have a good food.
Cafe La Taza,2475 Mission St,The best coffee shop on earth.  I would give them more stars but stupid app only have 5 stars.
Cafe La Taza,2475 Mission St,"Delicious brunch, also good for a quick snack any time. A real neighborhood cafe."
Cafe La Taza,2475 Mission St,I get my morning latte here. They are the cheapest in th ed hood and it's a damn good cuppa Joe.
Cafe La Taza,2475 Mission St,Great coffee. Fast service. Friendly staff.
Cafe La Taza,2475 Mission St,"Leonor,George, steve. And everyone else are so good. The food is superb"
Cafe La Taza,2475 Mission St,"Good food, mmmmmm"
Cafe La Taza,2475 Mission St,My favorite cafe/breakfast spot in the mission. Locally owned and operated!!
Cafe La Taza,2475 Mission St,Delicious and filling food at a decent price!
Cafe La Taza,2475 Mission St,"Great jazz music, good service and good portion meals"
Cafe La Taza,2475 Mission St,Excellent Cafe' Perfect for FOOTBALL GAME Food & Drinks Quality Service Owner
Cafe La Taza,2475 Mission St,Great live music Saturday night. Day drink on the happy hour.
Cafe La Taza,2475 Mission St,"Great breakfast, excellent coffee, wonderful service and people"
Cafe La Taza,2475 Mission St,"You can find everything in this small but good place, from coffee to dessert after a very good dish."
Cafe La Taza,2475 Mission St,Very good food and service. Prices ok
Cafe La Taza,2475 Mission St,Great local café and breakfast.   Good neighborhood gathering spot
Cafe La Taza,2475 Mission St,"Great food good drinks, excellent service."
Cafe La Taza,2475 Mission St,"Great food, service and even better people! La Taza tiene raza!"
Cafe La Taza,2475 Mission St,"Happy Hour is great! Good food, good company!"
Cafe La Taza,2475 Mission St,"Very bad service and bad place,is best Starbucks"
Cafe La Taza,2475 Mission St,Love having brunch at the counter. A great local spot.
Cafe La Taza,2475 Mission St,definetly five star rating la taza is the place to be for breakfast...
Cafe La Taza,2475 Mission St,Great balance of American and Nicaraguan food at excellent prices.
Cafe La Taza,2475 Mission St,"Not what used to be...cold moka, no more my favorite sandwich, unclear signs... Was beter before .."
Cafe La Taza,2475 Mission St,"Nice setting, very lively, good food and service."
Cafe La Taza,2475 Mission St,opens early at 6am and has a wide array of drinks and quick bites!
Cafe La Taza,2475 Mission St,Tastiest cup of coffee I've had in the Mission District so far... And I've tried most of them.
Cafe La Taza,2475 Mission St,Really good place to breakfast
Cafe La Taza,2475 Mission St,Always a great experience with delicious food.
Cafe La Taza,2475 Mission St,Food is GREAT !! I would definitely recommend!
Cafe La Taza,2475 Mission St,great food and nice people working there
Cafe La Taza,2475 Mission St,Online prices is different than what they charge they charge like double.. people working their are rude too
Cafe La Taza,2475 Mission St,I was there yesterday for 15 minutes and nobody come to ask if I need something The costumers services it pura mierda
Cafe La Taza,2475 Mission St,"Coffee is roasted too strong for my taste, but there is wifi!"
Cafe La Taza,2475 Mission St,"Good food, nice waiters. Comfortable."
Cafe La Taza,2475 Mission St,"The food was OK, but the coffee was not very good and the barista burned the milk."
Cafe La Taza,2475 Mission St,Nice
Cafe La Taza,2475 Mission St,Really nice place.  Friendly and warm employees
Cafe La Taza,2475 Mission St,Really nice! Great food
Cafe La Taza,2475 Mission St,"Fresh squeezed juices, attentive service, creative drinks, and excellent, creative food"
Cafe La Taza,2475 Mission St,"Good, reasonably priced brunch stop. Nothing to go out of the way for."
Cafe La Taza,2475 Mission St,"Coffee is great,breakfast/brunch is great also has a bar."
Cafe La Taza,2475 Mission St,Food is delicious prices are a bit much
Cafe La Taza,2475 Mission St,"One of the best spot in town, Memo and Steven are awesome!"
Cafe La Taza,2475 Mission St,"One star..The music is TOO LOUD..VERY LOUD, THE FOOD AND SERVICE IS OK"
Cafe La Taza,2475 Mission St,Great sandwiches. Good choice for brunch or lunch.
Cafe La Taza,2475 Mission St,Very nice comfortable place
Cafe La Taza,2475 Mission St,Best food in The Mission!
Cafe La Taza,2475 Mission St,Terrible chorizo scramble. Terrible home fried potatoes. Way overprice.
Cafe La Taza,2475 Mission St,"Flank steak salad is amazing, so is the 🦀 omlette …"
Cafe La Taza,2475 Mission St,Great food staff and music
Cafe La Taza,2475 Mission St,"Good service, delicious coffee and food."
Cafe La Taza,2475 Mission St,"Good food, ceviche, salads, breakfast and more!!"
Cafe La Taza,2475 Mission St,"A find in the Mish! Up the street from the Alamo. Service, menu and value"
Cafe La Taza,2475 Mission St,Delicious breakfasts.  Great little place
Cafe La Taza,2475 Mission St,Good restaurant that now serves hard alcohol
Cafe La Taza,2475 Mission St,Deysayuno Tipico was amazing. Fried pork!
Cafe La Taza,2475 Mission St,"Good food ,when busy a bit hard to hear."
Cafe La Taza,2475 Mission St,Kids love the Mexican Hot chocolate
Cafe La Taza,2475 Mission St,Just love it. Good coffe.
Cafe La Taza,2475 Mission St,This was a special dinner at this lovely restaurant.
Cafe La Taza,2475 Mission St,Nice place if you want something fast
Cafe La Taza,2475 Mission St,Very good service. It was nice.
Cafe La Taza,2475 Mission St,Coffee is ok staff should smile more
Cafe La Taza,2475 Mission St,Great place and amazing catering!!!
Cafe La Taza,2475 Mission St,Best Guacamole & Chips. Solid Sangria
Cafe La Taza,2475 Mission St,Too noisy that music should be play at a lower volume.
Cafe La Taza,2475 Mission St,Really nice place with liquor.
Cafe La Taza,2475 Mission St,This place is fantastic! A San Francisco institution.
Cafe La Taza,2475 Mission St,Love the food and energy of this place.
Cafe La Taza,2475 Mission St,Great spot on Mission and 22nd Street.
Cafe La Taza,2475 Mission St,Food is really good here....
Cafe La Taza,2475 Mission St,The fresh orange juice is the hit
Cafe La Taza,2475 Mission St,Good food and good service!
Cafe La Taza,2475 Mission St,Loved the food and atmosphere
Cafe La Taza,2475 Mission St,Excellent food and service
Cafe La Taza,2475 Mission St,I like allredo 15 year loveit
Cafe La Taza,2475 Mission St,Great food and service.
Cafe La Taza,2475 Mission St,The 2 2 2 breakfast is really good.
Cafe La Taza,2475 Mission St,Food was very nice!
Cafe La Taza,2475 Mission St,Pretty good breakfast burritos
Cafe La Taza,2475 Mission St,Good place to eat
Cafe La Taza,2475 Mission St,Food is best in the place best coffèe
Cafe La Taza,2475 Mission St,Very good food..
Cafe La Taza,2475 Mission St,"Horrible services,  food microwave."
Cafe La Taza,2475 Mission St,Good and variety of plates!
Cafe La Taza,2475 Mission St,I love their breackfast
Cafe La Taza,2475 Mission St,Nice spot to have breakfast..
Cafe La Taza,2475 Mission St,Good food good service
Cafe La Taza,2475 Mission St,Just okay
Cafe La Taza,2475 Mission St,Service is always great!
Cafe La Taza,2475 Mission St,Excelent food and service!
Cafe La Taza,2475 Mission St,Fantastic breakfast burritos!
Cafe La Taza,2475 Mission St,Good food
Cafe La Taza,2475 Mission St,Omg yum the veggie burger !!!
Cafe La Taza,2475 Mission St,Good cafe
Cafe La Taza,2475 Mission St,the Salads were good!
Cafe La Taza,2475 Mission St,Great and friendly service
Cafe La Taza,2475 Mission St,Good food and good service.
Cafe La Taza,2475 Mission St,Love the Lentils Soup
Cafe La Taza,2475 Mission St,Great food and service
Cafe La Taza,2475 Mission St,Delicious brunch!
Cafe La Taza,2475 Mission St,"Good coffee, busy..."
Cafe La Taza,2475 Mission St,Good.
Cafe La Taza,2475 Mission St,Cool 👌 …
Cafe La Taza,2475 Mission St,Yummy every time
Cafe La Taza,2475 Mission St,Awesome place!
Cafe La Taza,2475 Mission St,Good food!
Cafe La Taza,2475 Mission St,Nice!
Cafe La Taza,2475 Mission St,Great food
Cafe La Taza,2475 Mission St,Good service and good food
Cafe La Taza,2475 Mission St,Salad was delicious
Cafe La Taza,2475 Mission St,Food is ok
Cafe La Taza,2475 Mission St,Love this place!
Cafe La Taza,2475 Mission St,Excellent
Cafe La Taza,2475 Mission St,Favorite place :)
Cafe La Taza,2475 Mission St,Good cevucge
Cafe La Taza,2475 Mission St,Very good place
Cafe La Taza,2475 Mission St,Beautiful restaurant
Cafe La Taza,2475 Mission St,Nice
Cafe La Taza,2475 Mission St,Its dirty often.
Cafe La Taza,2475 Mission St,Good food
Cafe La Taza,2475 Mission St,Good
Cafe La Taza,2475 Mission St,Upscale
Cafe La Taza,2475 Mission St,Nice place!
Cafe La Taza,2475 Mission St,Amazing food
Cafe La Taza,2475 Mission St,Good people
Cafe La Taza,2475 Mission St,Good place
Cafe La Taza,2475 Mission St,Delicious food
Cafe La Taza,2475 Mission St,The best ⭐
Cafe La Taza,2475 Mission St,Great service and food !!!
Cafe La Taza,2475 Mission St,Latte time
Cafe La Taza,2475 Mission St,Great food and service
Cafe La Taza,2475 Mission St,Excellent
Cafe La Taza,2475 Mission St,Great food
Cafe La Taza,2475 Mission St,"I love all the dishes, there is a variety of everything ... and everything is very delicious. I love the friendliness and service as if you were at home."
Cafe La Taza,2475 Mission St,"Good place to eat with friends and family, reasonable prices and good atmosphere. The food is good. It does not have parking so you must use the streets."
Cafe La Taza,2475 Mission St,Excellent cafeteria and bar to have a drink. The service was very good and the food delicious and very well presented. It was a shame to discover it on the last day of my stay in San Francisco. The price is reasonable considering the prices that are handled in the city
Cafe La Taza,2475 Mission St,"wow!! Another unique flavor with style, come and enjoy it with your family, friends... come and you will not regret the taste of the food and the dessert is excellent!!👍👍👌"
Cafe La Taza,2475 Mission St,"Very good place to share with friends, delicious food, varied menu, or simply to enjoy a delicious coffee while reading a book, affordable prices."
Cafe La Taza,2475 Mission St,"Typical breakfast. Good seasoning, delicious coffee, comfortable place and fair price!"
Cafe La Taza,2475 Mission St,"Very good to go for breakfast, all very rich"
Cafe La Taza,2475 Mission St,The food is very good and the service is usually fast.
Cafe La Taza,2475 Mission St,"I have been a frequent customer for several years. And they are all super nice and accommodating to me. That is enough for me. I'm not very varied in what I order, but from what I've tried I can say: *Sandwiches ⭐⭐⭐⭐⭐👍🏼 *Omelets ⭐⭐⭐⭐ *Coffee and options of bread and/or empanadas ⭐⭐⭐⭐⭐👍🏼👌🏽 *Service in person ⭐⭐⭐⭐⭐👍🏼👌🏽 *Service by phone ⭐⭐ if they are busy they can leave you on the line for a few minutes... My experience on 2 occasions was that they forgot about me 🤷🏽‍♀️ but they rewarded me with delicious bread 👍🏼 * Soups of the day ⭐⭐⭐⭐⭐ *Portions ⭐⭐⭐⭐⭐ *Price ⭐⭐⭐⭐⭐"
Cafe La Taza,2475 Mission St,"Atmospheric place. I ordered Chorizo, an interesting dish according to the description, but, unfortunately, I was not at all impressed. It doesn't look like an omelet. Didn't like the taste of potatoes. My friend ordered Ham and chees omlet, the omelette is delicious. I think you can find something better for this price."
Cafe La Taza,2475 Mission St,"If you're. A religious person is not very welcome. They stand up with the face they put on you when you serve yourself and ahuque. You spend 70 dollars with the people you go to, they lift you up from the table. In an offensive way (not everyone is like that but one person. That was us last Saturday)"
Cafe La Taza,2475 Mission St,"Today a friend invited me to have our lunch and I suggested that we go to this place at the entrance, a waitress and another employee refused us to sit at a large table, claiming it was for 4 and not 2 people, the girl gave us a small table when it was time to take the order did not bring me what I asked for the food was delicious and in the end the table that they denied us was given to two people in short this was my experience"
Cafe La Taza,2475 Mission St,"The service is very good, the food is very tasty, the only thing is that when it is served it is cold in the chilaquiles the beans were cold and they lack their cream, it would also be good if they served you more coffee!!"
Cafe La Taza,2475 Mission St,I loved the place because they are very friendly with the service to the people
Cafe La Taza,2475 Mission St,"Two two two, huevos rancheros 😋😋👍👍 …"
Cafe La Taza,2475 Mission St,"Delicious Chocolate!! Also all the food but my favorites: sandwiches, empanadas, Arugula salad and chilaquiles 👍... Some guys who antiend sometimes are not in a very good mood to serve customers without distinction, but the vast majority are fabulous!!! I love it that's why I'm a frequent customer."
Cafe La Taza,2475 Mission St,"Very good coffee, it maintains the essence of coffee and they prepare it to your liking, a good place where you can go to relax while having a coffee, although it is very good it can always be improved."
Cafe La Taza,2475 Mission St,"Good place, clean and it shows that there is good attention from the staff."
Cafe La Taza,2475 Mission St,Friendly and fast service. Food with excellent taste and quality. Variety of dishes for all tastes including vegetarians. Highly recommended.
Cafe La Taza,2475 Mission St,"Everything is delicious, the place is clean and pleasant, as well as very good service."
