0,1,2
Cavalli Cafe,1441 Stockton St,Cannoli here are freshly filled so they maintain a nice toothsome texture. Tiramisu is also great with an excellent balance in its boozyness and sweetness.
Cavalli Cafe,1441 Stockton St,Great coffee and tasty cannoli. Friendly atmosphere. The owner is making coffee by himself. I will definitely come back.
Cavalli Cafe,1441 Stockton St,"Good service (but we were the only ones there as it had just opened), well designed cool space with interesting old photos of the 1906 earthquake on the walls, lovely coffee. Worth a visit."
Cavalli Cafe,1441 Stockton St,Great atmosphere. Owner was very friendly and made the BEST fresh cannoli!!!! Love this place.
Cavalli Cafe,1441 Stockton St,"Now that i've visited several moretimes, this has definitely earned all five stars. i've never had any disappointing food or coffee yet !! everything is always gracefully done and delicious..."
Cavalli Cafe,1441 Stockton St,"Cannoli has a citrus flavor, lemon or orange in the filling, didn’t enjoy it"
Cavalli Cafe,1441 Stockton St,The seats colour and wall desk are wonderful!
Cavalli Cafe,1441 Stockton St,The BEST cannoli I’ve ever had! And the sweetest little shop! Will definitely be going back.
Cavalli Cafe,1441 Stockton St,"Favorite coffee in North Beach and one of top favorites in SF!  There's no wifi, so it's more of a place to grab coffee and go, or grab some dessert and coffee and stay there for a lil bit."
Cavalli Cafe,1441 Stockton St,"Barista didn’t know what a cortado was, latte was really mediocre. Coffee here is closer to a Starbucks than anything Italian"
Cavalli Cafe,1441 Stockton St,"This has got to be like mine and my family's favorite place in San Francisco. The drinks and food are great, and the workers are so inviting!"
Cavalli Cafe,1441 Stockton St,What is better than to have your espresso with delicious homemade biscuits in an authentic Italian café while you sit on a table overlooking little Italy San Francisco
Cavalli Cafe,1441 Stockton St,Sweet 😃 …
Cavalli Cafe,1441 Stockton St,Great coffee and Italian desserts!
Cavalli Cafe,1441 Stockton St,"Great little cafe, with homemade cakes and funny barista."
Cavalli Cafe,1441 Stockton St,"I ate a tuna sandwich, it was small but so delicious. And my latte was so good 👍 …"
Cavalli Cafe,1441 Stockton St,"My husband raves about the canoli. I love the coffee !! Great, friendly service. Cozy, European cafe."
Cavalli Cafe,1441 Stockton St,"Beautiful decor, friendly & helpful staff, upstairs as well as street level seating, various options on their menus of coffees, tea or food options."
Cavalli Cafe,1441 Stockton St,Classic Italian coffee shop with nice chairs outside and a friendly owner.
Cavalli Cafe,1441 Stockton St,"A great place with a real Italian vibe and great drinks. They serve tasty Italian sodas, great espresso and teas."
Cavalli Cafe,1441 Stockton St,delicious coffee and tiramisu) I recommend everything)
Cavalli Cafe,1441 Stockton St,Made me a Latte that’s so incredibly hot to drink and then wanted to charge $1.50 when I asked for a cup of ice to pour the coffee in in order to drink. What business attitude?
Cavalli Cafe,1441 Stockton St,"This place is pretty good. Four out of five stars, I recommend it. Check it out."
Cavalli Cafe,1441 Stockton St,Best canolis in town
Cavalli Cafe,1441 Stockton St,Seemed prejudiced against Asians. My white friend says the owner yells even when only whites are present. Just bad personality.
Cavalli Cafe,1441 Stockton St,The Real deal! Authentic capuccino made by Italian barista in North Beach....great pastries too
Cavalli Cafe,1441 Stockton St,"Tasty treats, good coffee, good service and not crowded."
Cavalli Cafe,1441 Stockton St,One of the best coffee and almonds tarts you'll ever have
Cavalli Cafe,1441 Stockton St,Best coffee with delicious pastries in the center of north beach.
Cavalli Cafe,1441 Stockton St,"Stumbled on this walking through north beach, and great find.  Super easy counter service, solid options, and great happy hour beer/wine."
Cavalli Cafe,1441 Stockton St,Excellent atmosphere super delicious sandwiches Good coffee The new owners are friendly!
Cavalli Cafe,1441 Stockton St,Authentic Italian house made cannoli and best cappuccino outside Italy! Must try!
Cavalli Cafe,1441 Stockton St,Best tiramisu in the city. Will sell by the tray if you order a day ahead.
Cavalli Cafe,1441 Stockton St,"The Espresso is very authentic Italian and the brand they use, Danesi is very tasty."
Cavalli Cafe,1441 Stockton St,"I had roasted beef, many cookies and coffee with friends in the past few years. Recommended!!!"
Cavalli Cafe,1441 Stockton St,"Excellent service. Managed by its owner, this little and authentic Italian place is a cozy refuge for the cold days in the city"
Cavalli Cafe,1441 Stockton St,A wonderful place to stop for a cup of coffee.
Cavalli Cafe,1441 Stockton St,Best Italian Cofee in San Francisco fresh cannolo siciliano delicious must try it :-)
Cavalli Cafe,1441 Stockton St,I come here everyday to remember Italy so amazing the owner is always here trying to be nice even when he is exhausted from real life.
Cavalli Cafe,1441 Stockton St,Very friendly people. Good coffee and danishes. Best of luck to the owners
Cavalli Cafe,1441 Stockton St,Amazing cappuccino!  Great relaxing environment to enjoy your afternoon coffee.
Cavalli Cafe,1441 Stockton St,Great cappuccinos and Americanos that’ll have you bouncing off the walls. Even the black coffee is bomb!
Cavalli Cafe,1441 Stockton St,Perfect place to seat and drink delicious cafe late night
Cavalli Cafe,1441 Stockton St,Best spiced chai latte I've ever had in my life!
Cavalli Cafe,1441 Stockton St,"Fantastic cappuccino, not bitter like American version. Reminded me of the cappuccino I had in Rome."
Cavalli Cafe,1441 Stockton St,Fine location for delicious cafe food. The bill won't break you.
Cavalli Cafe,1441 Stockton St,Great service! Best coffee in the area. Thank you guys
Cavalli Cafe,1441 Stockton St,Great authentic Italian caffe! Good spot to watch soccer games
Cavalli Cafe,1441 Stockton St,"Best espresso in town, if you like the Italian style. Full stop."
Cavalli Cafe,1441 Stockton St,Great hot chocolate and friendly atmosphere. Liked the place!
Cavalli Cafe,1441 Stockton St,Owner grouchy . Nothing special. Any of the cafes on Columbus Avenue are more legit
Cavalli Cafe,1441 Stockton St,Great tiramisu and their Americano is strong but very tasty.
Cavalli Cafe,1441 Stockton St,Best Cannoli I have eaten Vacationer from Arizona
Cavalli Cafe,1441 Stockton St,It's ok..
Cavalli Cafe,1441 Stockton St,Came here on a sunny afternoon and tried the cannoli... delicious! Reminds me a little of Italy.
Cavalli Cafe,1441 Stockton St,"Awesome cannoli, nice outdoor seating."
Cavalli Cafe,1441 Stockton St,Best coffee in North Beach. Get a cappuccino and sit upstairs
Cavalli Cafe,1441 Stockton St,"Great service, amazing people, best Cafe in San Francisco"
Cavalli Cafe,1441 Stockton St,"Great cannolis handmade by a curt, angry Italian man."
Cavalli Cafe,1441 Stockton St,Great pastry
Cavalli Cafe,1441 Stockton St,Quiet little place to grab a coffee and a bite to eat.
Cavalli Cafe,1441 Stockton St,They have a good selection of imported soda drinks.
Cavalli Cafe,1441 Stockton St,Great place to watch the parade!
Cavalli Cafe,1441 Stockton St,coffee was excellent. service was relaxed. Enjoyed it.
Cavalli Cafe,1441 Stockton St,Friendly staff and delicious cannoli and tiramisu.
Cavalli Cafe,1441 Stockton St,Nice staff. Nice desserts
Cavalli Cafe,1441 Stockton St,Great macchiato & cannolis!
Cavalli Cafe,1441 Stockton St,the coffee is tasty and the atmosphere is very good
Cavalli Cafe,1441 Stockton St,"Very nice, limited choice but great coffeecoffee"
Cavalli Cafe,1441 Stockton St,The owner working  the counter was rude and violent towards me ...Don't ever go in that place man working counter ticking time bomb.
Cavalli Cafe,1441 Stockton St,Best tiramisu in San Francisco and great food!
Cavalli Cafe,1441 Stockton St,Good coffee and Italian deserts. Historical building and design.
Cavalli Cafe,1441 Stockton St,"Great people, fantastic canollis"
Cavalli Cafe,1441 Stockton St,Fresh made cannoli..
Cavalli Cafe,1441 Stockton St,Friendly service in a comfortable atmosphere.
Cavalli Cafe,1441 Stockton St,Great place and more than great service 👋 …
Cavalli Cafe,1441 Stockton St,Great orange juice
Cavalli Cafe,1441 Stockton St,Very good one!
Cavalli Cafe,1441 Stockton St,Imported espresso and great atmosphere
Cavalli Cafe,1441 Stockton St,Delicious true-italian coffee
Cavalli Cafe,1441 Stockton St,Can I give this place 10 stars??? Love Love Love!
Cavalli Cafe,1441 Stockton St,The tiramisu and cappuccino is awesone!
Cavalli Cafe,1441 Stockton St,Thought the cannoli was just ok.
Cavalli Cafe,1441 Stockton St,Good cappuccinos!
Cavalli Cafe,1441 Stockton St,Best tiramisu ever!!!
Cavalli Cafe,1441 Stockton St,Not open at 7
Cavalli Cafe,1441 Stockton St,Best espresso in SF
Cavalli Cafe,1441 Stockton St,Great cannoli and cappuccino.
Cavalli Cafe,1441 Stockton St,Delish
Cavalli Cafe,1441 Stockton St,Amazing coffee
Cavalli Cafe,1441 Stockton St,Excellent!
Cavalli Cafe,1441 Stockton St,bad food and too expensive
Cavalli Cafe,1441 Stockton St,Great strong coffee
Cavalli Cafe,1441 Stockton St,Very nice place
Cavalli Cafe,1441 Stockton St,Best
Cavalli Cafe,1441 Stockton St,The owner is a jewel!
Cavalli Cafe,1441 Stockton St,Good coffee.
Cavalli Cafe,1441 Stockton St,Fantastic cannolis
Cavalli Cafe,1441 Stockton St,Great cannolli
Cavalli Cafe,1441 Stockton St,Good cappuccinos
Cavalli Cafe,1441 Stockton St,"First time in San Francisco, I came across this place, and the word tiramisu made me enter. I was not wrong. Excellent everything! 10/10"
Cavalli Cafe,1441 Stockton St,"Exquisite coffee! They have treated me very well. If it's busy it's worth the wait. It may look older than other places in the area, but inside it has beautiful memorabilia of the neighborhood. Remember that the final price will include taxes and tips (the latter are always suggested).  You can eat inside or at the tables set up outside.  You can pay in cash or card.  Bathrooms on the second level. Mixed. Very well conditioned and clean."
Cavalli Cafe,1441 Stockton St,Great place in a great tourist location The owner of the cafe is great and the staff is great coffee (nosnos) excellent everything 100%
Cavalli Cafe,1441 Stockton St,The cannoli had a special flavor because of the caramelized orange. There are places to sit inside
Cavalli Cafe,1441 Stockton St,"Hello everyone, for the visit from March 9 to March 24, I always go to the Cavalli cafeteria, which is characterized by its rich breakfast, especially the sweet and fresh natural orange juice with the kindness of the owner."
Cavalli Cafe,1441 Stockton St,"Excellent cannoli and unbeatable tiramisu. Good place to take a rest on the tourist route. Mint water is complimentary, refreshing, thank you. Kind attention."
Cavalli Cafe,1441 Stockton St,"A characteristic place, not so much for the bar itself, which in any case has one of the best ""Italian coffees"" in the United States, but for what the owner can tell you, one of the few true Italians left in the little Italy of Frisco."
Cavalli Cafe,1441 Stockton St,"Bar located in San Francisco's little Italy, I recommend it to all Italians who, being in America, feel the need to drink a good Italian coffee"
Cavalli Cafe,1441 Stockton St,very good pastry
Cavalli Cafe,1441 Stockton St,A singing experience
Cavalli Cafe,1441 Stockton St,Delicious coffee !!!
Cavalli Cafe,1441 Stockton St,Super fresh centered
