0,1,2
Delah Coffee,370 4th St,"Great place to hang out! The staff is really nice and friendly, they make a great Yemeni Latte, and the pastries are delicious! Love that they’re open late!"
Delah Coffee,370 4th St,Very delicious coffee and treats. A great place to meet friends or bring over some visiting family. Staff is always very friendly.
Delah Coffee,370 4th St,Beautiful cortado espresso drink ☕️ and friendly staff. They just opened yesterday on the day of the Warriors parade. There are cakes 🍰 along with sweet and savory pastries. I grabbed a flaky phyllo dough type pastry with a side of honey. The tiny cheese ball pastries also caught my eye. Next time… …
Delah Coffee,370 4th St,"My absolute favorite coffee shop in San Francisco. The hours are incredibly convenient, the coffee is distinct & flavorful, and there's a wide variety of delicious pastries + desserts."
Delah Coffee,370 4th St,"You're paying for the ambiance, especially if you're familiar with Middle Eastern and Khaleeji coffee/sweets. Limited parking and cramped seating. To-go orders added to the crowdedness and should be streamlined. Rose latte lacked any rose & coffee flavor, but the shared teapot was a highlight. Saffron milk cake tasted freezer burnt and lacked saffron flavor, not worth the cost.  I would come back here only to get the shared teapot with friends if I'm too lazy to make tea myself."
Delah Coffee,370 4th St,"I am so glad to see a place like this in SF. Finally a coffee shop that doesn’t end at 3 pm like everywhere else. Their Yemeni latte is to die for. Great assortment of desserts, this spot will become an SF must-try one day."
Delah Coffee,370 4th St,"Great service. Nice place. However, coffee was not that good"
Delah Coffee,370 4th St,"Very aromatic Aisien black tea with almond milk. I cannot spell or pronounce this drink (feedback: could change it to make it easier to order than fumble) good stuff they do have plant-base 🌱 (oat, almond and soy) milk"
Delah Coffee,370 4th St,I got the Rose Latte and I was so glad that they had oat milk. This place is super busy so finding a spot to sit might be tough but I loved the drink and the overall atmosphere of the shop!
Delah Coffee,370 4th St,"SF needs more middle eastern food / coffee, and this place has really cemented its place in the city. The iced Yemeni latte is awesome 🙌🏽 …"
Delah Coffee,370 4th St,This place has amazing coffee and great customer service. Will definitely come back.
Delah Coffee,370 4th St,"This is the best Yemen Latte I’ve ever  had. Rich flavor, that turkish coffee base… delicious 🤌 Certainly is a “must visit” place if You happen to be in SoMa See You soon lattér"
Delah Coffee,370 4th St,Not your commercial coffee shop. They make coffee an Arabic experience with amazing pastries. Unique flavors that will make you come back.
Delah Coffee,370 4th St,"I dropped by today at this new coffee shop, the environment was very welcoming and organized, I loved the combination of both modern and traditional design. I ordered a mangorabian and it was spectacular, I also loved the great smell of the fresh coffee that I'll try in my next visit."
Delah Coffee,370 4th St,Amazing food really good coffee the person making all that was super nice the place was also super stylish. I wish there was one where I lived.
Delah Coffee,370 4th St,"Got green tea, which is hot water + tea bag. It was 12$ for two. I got the same order a week ago it was 4.5$ for two. It was wired when I asked why they said 16oz???"
