0,1,2
Home Coffee Roasters,1222 Noriega St,"One of my favorite cafes in San Francisco. The menu is limited, but everything is tasty and prepared fresh. Good coffee and a friendly, young vibe in a neighborhood where there are not many other outstanding cafes."
Home Coffee Roasters,1222 Noriega St,"My favorite coffee shop, every weekend is great when you can start it at home."
Home Coffee Roasters,1222 Noriega St,"I wish my experience had been as nice and welcoming as others’. Unfortunately, while I silently and patiently waited in line, an employee got very stressed out and told everyone in line to leave for being too loud. All of the people quietly waiting to order looked at her in confusion so she reiterated that we were too loud and had to get out of the cafe"
Home Coffee Roasters,1222 Noriega St,"I LOVE THIS PLACE! Home is one of my favorite places for a fun and exciting coffee. It's not cheap, but I can see why; they really make some delicious coffees and drinks here. I also had a toast while I was here (can't remember the name but it had eggs), and it was so unique and delicious! I can't wait to come back."
Home Coffee Roasters,1222 Noriega St,"A bit pricey, but the place is cozy and clean. The lattes are also super pretty and nice, and the food is good too. Overall a good experience."
Home Coffee Roasters,1222 Noriega St,"Amazing espresso macchiato and the rose latte was a nice surprise, very good!"
Home Coffee Roasters,1222 Noriega St,The latte art is the best I've seen. I challenged them with a hippo and they without experience nailed it.
Home Coffee Roasters,1222 Noriega St,"Very cozy coffee shop. Delicious coffee and lattes. Have milk substitutions. (Soy, almond and milk) Just be sure to ask. Their most gram worthy drink is their birthday latte. Hazelnut and vanilla flavored I asked them to just put a tad little so it’s not overly sweet. Their regular cappuccino is pretty solid. There’s meter parking outside. Will definitely visit again. I went during lunch, so it was busy and not enough seating. Recommend going after the lunch rush. Closes early by 5pm."
Home Coffee Roasters,1222 Noriega St,One of the best coffee shops I’ve ever been to. Delicious avocado toast. You MUST order one of their special drinks. They are delicious. I ordered an iced Red Velvet Latte and got a Cookie Monster Affogato to go. I just had to try another one.
Home Coffee Roasters,1222 Noriega St,"It is a beautifully cozy place, great to start your day with the friendly staff. Do make sure to check out their interior collection. The menu is also all inclusive and kind of unique. I had slated caramel hot chocolate-to die for. And cinnamon sugar toast- creepy, sweet but not excessively and perfect timing of cinnamon on butter. Overall it was a great place and I would definitely come here over and over. I won't be surprised it this becomes my favorite breakfast place."
Home Coffee Roasters,1222 Noriega St,A beaut latte indeed. So perf for IG. But this place also draws that crowd - lots of “micro influencers” documenting every second of their lives. Find me making faces in the back of every photo taken here.
Home Coffee Roasters,1222 Noriega St,First time experiencing this coffee shop. Carl was an amazing help and very friendly. Felt very welcomed and he went out of his way to help my party of 7 get seated. He recommended a Cookie Monster for me and it was amazing. definitely would come back here
Home Coffee Roasters,1222 Noriega St,"This cafe is so cute, and their drinks are tasty and gorgeous! My friend who was visiting out of town made us keep coming back here because she wanted to try so many drinks. I had the lavender jasmine tea latte, rose latte, and the red velvet latte - they were so good and beautifully prepared!"
Home Coffee Roasters,1222 Noriega St,"Great place to work/study. They close at 5pm, which is kind of early for me. They have such creative drinks and there is always something new to try. They are friendly with those who bring their laptops. Very popular place for students. Sometimes it gets so crowded that you have to share with other patrons. Really nice staff. They always greet you and wish you goodbye."
Home Coffee Roasters,1222 Noriega St,"A very good and quiet bar, perfect for work with a laptop or drink something with friends!"
Home Coffee Roasters,1222 Noriega St,"Great coffee, good service, no waiting."
Home Coffee Roasters,1222 Noriega St,Really tasty coffee. I got a Lavender latte with oatmilk and a Vanilla Coconut Latte and both were fantastic. Cute latte art too! The chocolate Mochi brownie was enjoyed by my 3 yr old and myself. Very pleasant service as well ☺️
Home Coffee Roasters,1222 Noriega St,"I have been coming here since they opened. The business owners and all of the baristas are super nice! They serve counter culture coffee here, and it tastes great as well. I personally am a big fan of their cold brew, their hangover (an Americano but with sparkling water), and their lavender lattes. The place is a little small and can get very crowded,  but people are very nice about sharing tables. Also make sure you try their toasts, they're so good!!"
Home Coffee Roasters,1222 Noriega St,"I really love their specialty flavored lattes, though I normally just enjoy black coffee or a dry cappuccino. The rose latte is my favorite. Their toast is delicious. The location is small and there’s usually a bunch of students in here. I’ve tried coming to do some work and it’s been difficult finding a seat. Definitely a gem in the sunset."
Home Coffee Roasters,1222 Noriega St,"I always enjoy going to this coffee shop! It is such a quaint coffee shop and there is always plenty of comfortable seats to sit. Lots of choices to choose from that would definitely satisfy your taste. All of the staff are very friendly, accommodating, and always happy to serve. I would highly recommend this place to everyone."
Home Coffee Roasters,1222 Noriega St,"The drinks are not only Instagram worthy, but tasty. Drinks are priced around your average Starbucks lattes, which for San Francisco is a great deal. Service was excellent and the cashier was super friendly. Due to it's popularity know that there can be a long wait time in ordering drinks and the cafe is very small."
Home Coffee Roasters,1222 Noriega St,Got the iced coconut vanilla latte with oat milk it was so good. would come again. Cute quiet atmosphere. Has wifi!!!
Home Coffee Roasters,1222 Noriega St,"The coffee is really good here. I like the creative drinks they offer as well. Ive had the Birthday Cake, Ube Latte as well as the Nutella Latte...all very good options. The latte art is always something cute and photo worthy, I never have time because i just like to enjoy the drink lol. I have yet to try the food so thats next on my list."
Home Coffee Roasters,1222 Noriega St,First time here and it was pleasant.  I just had coffee and a pastry but will come back again.  It was a little busy (Sunday morning) so I didn't feel like I could really enjoy my time there.  Decor was really nice. The breakfasts sounded really yummy.
Home Coffee Roasters,1222 Noriega St,"Great coffee, but the place is so badly organized. I was waiting for at least 15min to get a coffee and there was no waiting line. I suppose many people order on line. Also, the girls making the coffee were quite rude. I won’t go again."
Home Coffee Roasters,1222 Noriega St,"I loved this cafe!! Aside from their unique and creative lattes (and super cute latte art), the staff were friendly and warm. The space was very cozy and they had tables where no laptops were allowed. I liked that- we really ought to enjoy one anothers company more and put the devices away."
Home Coffee Roasters,1222 Noriega St,Awesome little spot to get coffee and a quick bite. The avocado toast is their speciality and it is very delicious and not too heavy. I would recommend this place to anyone that lives or travel by frequently. It's a bit pricey which is why it didn't get 5 stars.
Home Coffee Roasters,1222 Noriega St,This is my favorite coffee place. Delicious coffee with fun flavors. The specialty toasts are also great and well worth the price. Plus the staff is friendly and they make adorable latte art.
Home Coffee Roasters,1222 Noriega St,"I only had coffee. It took an unreasonable amount of time to wait in line for it. The place serves food too so you have to wait behind food orders. They need a separate line for to go coffees. Very good quality coffee. People there seemed very happy. I saw strollers, lots of babies, laptops. Looked like a great demographic mix. The coffee took so long, my car oil change next door was fine before my coffee. They measure every single espresso shot first. It's ridiculous, like an amateur runs the place. It's a burden in customers time to do that. Very loud room, clean, bright, nicely decorated. Near two bus lines: 28 on 19th Ave and 71 Noriega."
Home Coffee Roasters,1222 Noriega St,"What I love about this place is the extremely friendly staff. Great lighting and atmosphere. Awesome sandwiches and super affordable! Also, their drinks are well presented and will get many hearts when you post them on Instagram. LOL Highly recommended for everyone!"
Home Coffee Roasters,1222 Noriega St,The bravo toast is such a perfect balance of savory flavors and hint of spice. I absolutely love it with an egg or two on top. The baristas are all friendly and genuine which just makes my day!
Home Coffee Roasters,1222 Noriega St,Good coffee and one of the best avacado Sandwich
Home Coffee Roasters,1222 Noriega St,This place is cozy and welcoming. My wife and I stumbled across this place on our way to the beach and it was awesome. The coffees nd toasts they offer are delicious. Definitely a SF gem and a must try spot. We will definitely go back when we are in SF.
Home Coffee Roasters,1222 Noriega St,Fun spot with lots of charm and a long list of creative coffee drinks. Coconut latte and Birthday Cake latte were delicious and true to their respective flavors. Fun latte art was an added bonus.
Home Coffee Roasters,1222 Noriega St,"Prices went up, quality went down sadly. Been coming here for years and was surprised my last latte was 7 dollars and was lacking the usual flavor."
Home Coffee Roasters,1222 Noriega St,Tried a matcha mochi 🍩 and a pour over coffee. Both were fantastic. …
Home Coffee Roasters,1222 Noriega St,This cafe is so cute. The baristas remember their regular's names and very clearly genuinely care about their customers. The food is deliciously gourmet and Instagram worthy but you can tell is also made with love. It's no wonder this place is called Home because it truly feels like one.
Home Coffee Roasters,1222 Noriega St,"Nice coffee shop. I had latte, it was tasty and had very nice ornament on it.."
Home Coffee Roasters,1222 Noriega St,"There are tons of cafes in the city, but not all have the creativity and character of Home. The drink menu is clever, coffee is quality (Americano for me, black), toasts are great. Will look forward to having the opportunity to go back until I have the chance."
Home Coffee Roasters,1222 Noriega St,Great feel like Home ambiance. Good place to study. Great staff. Variety list of unique coffee with artistic cream on top and a selected menu of food and bakery choices. Try the hazelnut latte and egg in a basket toast.
Home Coffee Roasters,1222 Noriega St,Pricey fancy brioche toast. Lavender mocha and hot chocolate could be hotter.
Home Coffee Roasters,1222 Noriega St,This is a cute coffee shop. The decor is so chic and creative.
Home Coffee Roasters,1222 Noriega St,Wonderful Coffee! Just anything you can imagine! Love their Mochi - muffin! :)
Home Coffee Roasters,1222 Noriega St,"Great drip coffee, always tasty. Interesting latte creations too."
Home Coffee Roasters,1222 Noriega St,"I said for here, but they gave me to go. The birthday cake just look nice but I will not try again. Also the toast is not my cup of tea."
Home Coffee Roasters,1222 Noriega St,"Pretty interesting coffee shop, not big into artisan coffee but this place is an exception! Ordered a churro latte and I was not disappointed! Would recommend to those that like a unique take on their morning bean juice!"
Home Coffee Roasters,1222 Noriega St,Recommended by a friend. Love the spot. Had  Birthday Cake Latte with Let's Avo-Cuddle. Both delish! I was told by the lady the latte is not bday cake flavor but inspired. I was totally ok with that. Also she mentioned if I wanted it lightly sweet I could request it so I did. Perfect for me. I loved it! Going back again! Tomorrow in fact!
Home Coffee Roasters,1222 Noriega St,Super cute little space with awesome lavender oat lattes
Home Coffee Roasters,1222 Noriega St,Great coffee and the avocado toast and egg was great. Made fresh. The employees acted more like friends. Very nice I will definitely be bac
Home Coffee Roasters,1222 Noriega St,"One of the best cafe in Sunset! I tried cookie monster(sweet latte), red velvet latte(the best sweet latte, rose latte(little bit bitter, less sweet, holy milk latter(best choice), and matcha latte(medium sweet). Tosts are also good. But always hard to find seats. So go early and enjoy special coffee and tosts. Also workers are very nice and friendly."
Home Coffee Roasters,1222 Noriega St,Cute cafe. Tried the signature lavender infused latte with soy milk. It's on the sweeter side which suited my taste. Seating is a little difficult with most people camped out working but was able to find seating.
Home Coffee Roasters,1222 Noriega St,"I am a coffee lover and all coffee is NOT the same that's why I adore coffee roasters over a starbucks. I buy small batch coffee from local rosters as often as I can. Their coffee , first thing in the morning was perfect. Nice little place in China Town... so glad this was open during this pandemic."
Home Coffee Roasters,1222 Noriega St,Pretty good sandwiches and great variety of coffees.
Home Coffee Roasters,1222 Noriega St,The best breakfast we've had so far! We ordered the cappuccino and the birthday cake vanilla latte.  Try the avocuddle toast and the condensed milky way toast! We will be back for sure!
Home Coffee Roasters,1222 Noriega St,"Small place, friendly staff and great and unique menu items."
Home Coffee Roasters,1222 Noriega St,coffee is delicious and the staff is friendly. The store is very small.
Home Coffee Roasters,1222 Noriega St,"This place was definitely designed for Instagram photos. The latte art is beautiful, and their toasts are delicious. Taking one star just for it being so crowded and not tons of places to sit."
Home Coffee Roasters,1222 Noriega St,"Some what of a coffee hound. Its rare you find such quality beans, unique drinks, amazing staff and delicious food. they have the best pastries , and they have my all time favorite breakfast invention. Eggs in A Basket . Or Toads in a Hole my grandma would say. If you are in the area. stop in ,it will make your day."
Home Coffee Roasters,1222 Noriega St,Cool coffee place with fun concoctions! Picture is the birthday cake rainbow latte! Tastes yummy 😋
Home Coffee Roasters,1222 Noriega St,"i loved this cafe so much. adorable shop, super sweet staff, and delicious coffee. and adorable latte art"
Home Coffee Roasters,1222 Noriega St,"Cute little study spot for college students. There's a wifi available if you ask them. When we went there it was full. Everyone was studying wih their laptop, so we couldn't really stay there and enjoy our drinks. Red velvet latte was pretty good."
Home Coffee Roasters,1222 Noriega St,The coconut vanilla latte is amazing! Wish I had more time in SF to try all the lattes
Home Coffee Roasters,1222 Noriega St,"Clean, modern, hip and at the same time classic classy feeling.  Positive environment.  Mochi muffins are the only pastries I like. I am glad they are in the neighborhood."
Home Coffee Roasters,1222 Noriega St,Really cute little spot with excellent quality coffees. Very creative menu.
Home Coffee Roasters,1222 Noriega St,Cozy ambiance but latte left something to be desired. The latte art was impressive on my Birthday Cake Latte and I appreciated that it wasn't overly hot nevertheless it tasted like a plain latte.
Home Coffee Roasters,1222 Noriega St,Cute and delicious little cafe in the sunset district. My husband absolutely loved his milk toast and I the birthday cake latte. Must see when in SF.
Home Coffee Roasters,1222 Noriega St,"Cute latte art, tasty drinks, and friendly staff! It tends to be very packed but if you’re lucky to get a seat, is a nice place to sit and enjoy the ambiance with friends."
Home Coffee Roasters,1222 Noriega St,"Birthday Cake was my best coffee I have ever gotten. Red Velvet Latte is my second best 😊 However, be ready for some sugary stuff😅 …"
Home Coffee Roasters,1222 Noriega St,"We love all their drinks, especially the chocolate mint latte. The avocado toasts are a must! Sooo good!!"
Home Coffee Roasters,1222 Noriega St,Unique and creative drinks. Love visiting home. Can be a bit crowded at times.
Home Coffee Roasters,1222 Noriega St,"Good coffee, but very slow service. Staff wanted to hang out instead of work. Took 15 minutes for two basic drinks.  Will probably go somewhere with good baristas instead of high schoolers on their phones."
Home Coffee Roasters,1222 Noriega St,No indoor seating yet. Saw a crowd outside. Looks very popular. Excited to study here with a latte once it opens back up
Home Coffee Roasters,1222 Noriega St,"Elegant comfortable place for a great coffee to go or to sit down for an hour to get some work done. In addition to great pour over, long list of creative options. Like their specialty today's as well."
Home Coffee Roasters,1222 Noriega St,"Great place to grab a latte, and they had a lot of really interesting flavors to choose from! Food tasted great, was disappointed that there were no gluten free options."
Home Coffee Roasters,1222 Noriega St,i definitely got the at-home vibes as i walked in.  i like this home-themed cafe almost as much as i do my own home!  it's a place that makes me feel at home and i feel as comfortable here as i would at home.  a very homely place.
Home Coffee Roasters,1222 Noriega St,Customer service was exceptional. Cute decor. I like the concept that the the front two tables are non laptop tables  I like the idea they requested these tables just for talking.
Home Coffee Roasters,1222 Noriega St,If you love latte art then this is the place for you. They got many different types of lattes and coffee drinks. A good place to get some work done or hangout. Good drinks too
Home Coffee Roasters,1222 Noriega St,For a latte and an espresso it'll run about $12 but it is an extremely delicious treat!!! Guaranteed!!
Home Coffee Roasters,1222 Noriega St,Good Expresso drinks and consistent friendly service.
Home Coffee Roasters,1222 Noriega St,Got a let's avo-cuddle & a cookie monster & they were awesome! Never disappointed when I go to home! The girls working there were also really nice!
Home Coffee Roasters,1222 Noriega St,A cute little cafe nearby the tiled stairs! There are also other cute little shops within walking distance as well! The food here is delicious and the coffee art is amazing!!
Home Coffee Roasters,1222 Noriega St,Love the fun drink options and the avocado toast is amazing! Super nice staff and quick for takeout.
Home Coffee Roasters,1222 Noriega St,Great variety of coffees and lattes. The decoration in the mugs is really cute. Toasts are delicious.  The staff is really welcoming.
Home Coffee Roasters,1222 Noriega St,"Their coffee and costumer service is always on point! Plus they have drink mixtures of their own, don't always like them (personally) but good to try if you are willing to explore new stuff."
Home Coffee Roasters,1222 Noriega St,"Nice service, great tasting coffee, and friendly patrons."
Home Coffee Roasters,1222 Noriega St,Pricey but really excellent coffee! Baristas all very kind. Plus all baked goods are gluten free!!!
Home Coffee Roasters,1222 Noriega St,"Cute little spot! I used to visit when it was the Bashful Bill diner, and this is a good use of the space! Cheerful staff, fun drink items, modern and clean and cozy."
Home Coffee Roasters,1222 Noriega St,The food and drinks are delicious here.  The only thing that would have made it better is if we could sit down and enjoy our beverages there.
Home Coffee Roasters,1222 Noriega St,"Highly recommend. Not only was the coffee amazing (birthday cake latte with almond milk is a must), but the service was spectacular."
Home Coffee Roasters,1222 Noriega St,The rainbow latte looks cool and tastes amazing
Home Coffee Roasters,1222 Noriega St,Amazing coffee (I really liked the 'Birthday Cake' latte) and a good/welcoming atmosphere. Service was great!
Home Coffee Roasters,1222 Noriega St,Amazing coffer .. Amazing staff
Home Coffee Roasters,1222 Noriega St,"A bit pricey, but very good coffee and cozy atmosphere! No indoor seating or bathroom available though."
Home Coffee Roasters,1222 Noriega St,"Doesn't get a lot of props bc of the teen clientele, but it has some really fun and interesting drinks you won't find anywhere else."
Home Coffee Roasters,1222 Noriega St,Lots of options like Red Velvet and Lavender lattes! 🤩 3 options for avocado toast too ( I got it with 🥓) …
Home Coffee Roasters,1222 Noriega St,Nice place to work from and creative drinks and food menu with Korean influence. I will update my review after I've tried the corn and cheese toast.
Home Coffee Roasters,1222 Noriega St,"Great atmosphere and good playlist. Pretty crowded, so if you're studying, camp out early! Wait time not bad."
Home Coffee Roasters,1222 Noriega St,Love this place! Awesome and tasty drinks. And very cute art on drinks.
Home Coffee Roasters,1222 Noriega St,"Very friendly and knowledgeable staff! Great atmosphere and ambiance, as they play some very dope jams and the decor is very minimalist which I personally enjoy!"
Home Coffee Roasters,1222 Noriega St,Amazing service and great quality latte 🙌🏼 …
Home Coffee Roasters,1222 Noriega St,Cleanest restroom in the Sunset. Cleaner than my home. It feels like home sweet home only everything costs $$$$.
Home Coffee Roasters,1222 Noriega St,"Good atmosphere, the place sometimes gets really busy but the staff tries there best to accommodate everyone. They are really popular and is usually busy on most days."
Home Coffee Roasters,1222 Noriega St,Home has been a reliable place for me to get work done early in the morning. The staff is wonderful and they have delicious cookies!
Home Coffee Roasters,1222 Noriega St,"Great service, selection of food,and good location. And the prices are reasonable. One of the best cafes in San Francisco."
Home Coffee Roasters,1222 Noriega St,My most favorite coffee cafe in SF
Home Coffee Roasters,1222 Noriega St,Lovely little place! Fancy toast and creative coffee and tea. All I could ever want in a brunch place ^_^
Home Coffee Roasters,1222 Noriega St,"Coffee is good, obviously.  But, they don’t have indoor seating."
Home Coffee Roasters,1222 Noriega St,A staple. They're always friendly their coffee is ALWAYS consistent. Been going here for yearssss and will continue to!
Home Coffee Roasters,1222 Noriega St,Super cute and the drinks are delicious but there's typically a line but it goes by quickly
Home Coffee Roasters,1222 Noriega St,"Awesome service, food and coffee!!"
Home Coffee Roasters,1222 Noriega St,"Can get a little crowded and busy but the food and their specialty drinks are absolutely worth the wait. Super friendly staff, really on top of things."
Home Coffee Roasters,1222 Noriega St,"Had the cookie butter latter, it was sweet but not overwhelming, would definitely be back"
Home Coffee Roasters,1222 Noriega St,Great cappuccino if you're into that kind of thing. They even put the flower in the foam just the way I like.
Home Coffee Roasters,1222 Noriega St,Friendly staff Awesome customer service Thank you ;)
Home Coffee Roasters,1222 Noriega St,We thought it was great fun and coffee and food good. Didn't understand the signs for no laptops as they were everywhere.
Home Coffee Roasters,1222 Noriega St,Friendly and tasty mint chocolate latte.
Home Coffee Roasters,1222 Noriega St,Great avocado toast.  Good coffee.  Cold inside during the winter.  You should try it.
Home Coffee Roasters,1222 Noriega St,Yummy coffee! Lines can be long…because yummy coffee!
Home Coffee Roasters,1222 Noriega St,Coffee was delicious! Definitely somewhere I would love to return to as it was a very comfy atmosphere.
Home Coffee Roasters,1222 Noriega St,"They treat you like family. If you order the cookie monster, eat the cookies fast before they get soggy."
Home Coffee Roasters,1222 Noriega St,"I love this place. Great studying environment, amazing coffee and tasty food! Forever my favorite."
Home Coffee Roasters,1222 Noriega St,"Virtually no wait and greeted with a friendly ""Good morning"". I picked up some croissants and a cappuccino to go."
Home Coffee Roasters,1222 Noriega St,Looking for a breakfast place this is a good one. Friendly service and awesome Counterculture Coffee.
Home Coffee Roasters,1222 Noriega St,Lots of creative coffee and alternative milk options! I enjoyed the cookie butter coffee 😋 …
Home Coffee Roasters,1222 Noriega St,Everything here is absolutely fantastic but I am a huge fan of the mochi donuts!!
Home Coffee Roasters,1222 Noriega St,sweet little spot with awesome coffee newly remodeled and very cozy place to chill with a cup of joe and light toast
Home Coffee Roasters,1222 Noriega St,Lovely spot for coffee and pastries! Try the lavender late and you won't be disappointed
Home Coffee Roasters,1222 Noriega St,"Very cute place, nice coffee and toast options, but overrun with laptops!"
