0,1,2
Il Canto Cafe,475 Sacramento St,"Their chipotle breakfast burrito has a mean and bold flavor.  It comes from the creamy chipotle sauce and melted, what I think is cheddar, cheese.  It is rich from start to finish, which is good or bad depending on your taste.  There are bits of your chioice of protein and vegetables in the scrambled egg filling.  Personally, I think there is too much egg filling, which throws the eggs-vegies-protein ratio, but maybe I am just being picky.  I think I will try it again to confirm."
Il Canto Cafe,475 Sacramento St,found this place on accident and tried my luck at the chicken alfredo - was the best decision of the day! absolutely delicious! and the staff was very sweet and kind.
Il Canto Cafe,475 Sacramento St,The absolute best veggie breakfast burritos you'll find in FIDI.. and for just $5!! Comes with veggies eggs avo and their specialty chipotle sauce and grilled on a panini press. Start the day off right!
Il Canto Cafe,475 Sacramento St,"I use my meal pal pass here about 3 times in the last month now.  I really like their panini, it's pretty awesome for the price. Especially since I got it through Meal Pal, it was about $6 with tax included for lunch. I have the 12 meal pass.  Beware the lines do get a bit long during rush hours so make sure you order through meal pal, use other forms of Pre-ordering, or go before 12 and after 1. I've seen others wait but I never had to wait in line, I just pick up my meal at the cash register.  Go try their paninis now!"
Il Canto Cafe,475 Sacramento St,Great coffee and the breakfast burrito is awesome.  Extremely reasonable prices. Limited seating. Gets very busy at mealtimes so plan accordingly.  The owner is super nice.
Il Canto Cafe,475 Sacramento St,Great egg and avocado sandwich. Friendly owner and staff.
Il Canto Cafe,475 Sacramento St,The best breakfast burrito in all bay area! My fav is chipotle avocado burrito... Strongly recommended.
Il Canto Cafe,475 Sacramento St,I got the turkey panini & I didn't like it. They put mayo on it then heated the sandwich. I don't like hot/warm mayo.  I also got the pesto pasta & it was good.
Il Canto Cafe,475 Sacramento St,"Breakfast burrito is the best, open early, convenient for FiDi workers.  Plenty of outdoor tables available."
Il Canto Cafe,475 Sacramento St,"Very great, friendly helpful staff! The food was really good, chicken burrito was one of the best I’ve ever tried!"
Il Canto Cafe,475 Sacramento St,Very polite staff & best breakfast burrito I've ever had in my life
Il Canto Cafe,475 Sacramento St,Went there because I wanted a GOOD breakfast burrito. I didn't get that. I got an awesome breakfast burrito. Will definitely be coming back. Keep doing what you do...
Il Canto Cafe,475 Sacramento St,best breakfast burrito in the city!
Il Canto Cafe,475 Sacramento St,The BEST Breakfast Burrito in SF hands down. Highly recommend the chipotle meat lovers burrito!
Il Canto Cafe,475 Sacramento St,Outstanding customer service and the food is on point! They’re always so friendly even in the middle of the work lunch hour.
Il Canto Cafe,475 Sacramento St,"Awesome chipotle breakfast burrito! So good I had it two mornings in a row, once with bacon, once with sausage, and maybe again tomorrow!"
Il Canto Cafe,475 Sacramento St,Great food & coffee and very nice staff!! Price is very reasonable as well!!
Il Canto Cafe,475 Sacramento St,"Great prices, friendly service, and very tasty. Chipotle breakfast burrito!"
Il Canto Cafe,475 Sacramento St,best breakfast burrito i ever had.  Every other breakfast burrito i ever ate before was trash.
Il Canto Cafe,475 Sacramento St,Great food and most of all great service. Would recommend!
Il Canto Cafe,475 Sacramento St,"Great service, delicious croissants and paninis. It was a great stop on our way to the hotel. Highly recommend it."
Il Canto Cafe,475 Sacramento St,This is a really great family restaurant with tasty wraps and paninis. The personnel is very friendly and nice.
Il Canto Cafe,475 Sacramento St,Amazing spot for a tastey breakfast burrito. Highly recommend!
Il Canto Cafe,475 Sacramento St,Pickup and go great food
Il Canto Cafe,475 Sacramento St,Quick and delicious! Breakfast burrito was top notch
Il Canto Cafe,475 Sacramento St,Got an avocado breakfast burrito and it was amazing. Very friendly staff as well.
Il Canto Cafe,475 Sacramento St,Pesto breakfast burrito is bland
Il Canto Cafe,475 Sacramento St,"Excellent place to have breakfast, serves freshly prepared tasty stuffs.small place with few seats inside and couple of tables to sit outside"
Il Canto Cafe,475 Sacramento St,"You have to order ahead.  The place is so busy that order in person is impossible. I would recommend going somewhere else, if you are in the area."
Il Canto Cafe,475 Sacramento St,I recommend BLTA. Tasty
Il Canto Cafe,475 Sacramento St,"Great breakfast burrito, ready in about 5-10 minutes"
Il Canto Cafe,475 Sacramento St,Best breakfast burritos I’ve tasted
Il Canto Cafe,475 Sacramento St,Best breakfast burrito in the city
Il Canto Cafe,475 Sacramento St,"My first time here, BEST VEGIE BREAKFAST  BURITTO I EVER  HAD VERY FLAVORFUL N GREAT PRICE, I WILL BE BACK."
Il Canto Cafe,475 Sacramento St,"Nice latte, opens early in the morning"
Il Canto Cafe,475 Sacramento St,Breakfast burrito capital of the world
Il Canto Cafe,475 Sacramento St,Chipotle sauce they use on breakfast sandwiches is great - great service.
Il Canto Cafe,475 Sacramento St,My tastebuds were not ready for such a great breakfast. Only downside is there is not inside eating.
Il Canto Cafe,475 Sacramento St,"The burrito was more than I could eat in one sitting. So good, but share with a friend 😀 …"
Il Canto Cafe,475 Sacramento St,"Solid panini sandwiches.  I hear they have great breakfast burritos, but they only make them in the morning."
Il Canto Cafe,475 Sacramento St,Wow! Best bang for your buck. This place is a gem. Croissant deluxe egg sandwich for $5.50?!
Il Canto Cafe,475 Sacramento St,Staff was super friendly and the service was great. Had the prosciutto panini and an iced latte. 10/10
Il Canto Cafe,475 Sacramento St,4.5 stars. Enjoyed a tasty cappuccino and delicous pesto panini.
Il Canto Cafe,475 Sacramento St,"Great burritos and pleasant working crew, both 5 stars.  -Odev"
Il Canto Cafe,475 Sacramento St,"Great experience, nice staff. Highly recommend the Meat lovers breakfast burrito"
Il Canto Cafe,475 Sacramento St,This place has on of the best chicken burritos I’ve ever tried 😍 …
Il Canto Cafe,475 Sacramento St,"I'm not sure how others experienced bad service, this was an amazing place for service and price. The ladies were super friendly! Will be back again for sure."
Il Canto Cafe,475 Sacramento St,"Kudo's to Sandy what a great personality warm Welcome.  Delightful. Great breakfast, Excellent ."
Il Canto Cafe,475 Sacramento St,Friendly service. Meat lovers burrito was outstanding!
Il Canto Cafe,475 Sacramento St,The breakfast burrito is 🔥 …
Il Canto Cafe,475 Sacramento St,My first decent breakfast in SF.
Il Canto Cafe,475 Sacramento St,Very nice people. Efficient service. All i got was an ice tea and she could not have been nicer!
Il Canto Cafe,475 Sacramento St,"Egg burrito was nice, a bit bland for my taste."
Il Canto Cafe,475 Sacramento St,The avocado burrito absolutely delicious
Il Canto Cafe,475 Sacramento St,That breakfast was too good for a price that lower than any other place in SF around here!
Il Canto Cafe,475 Sacramento St,Awesome little cafe for have breakfast and coffee. Veggie delight sandwich is yummy!
Il Canto Cafe,475 Sacramento St,"Always get the breakfast burritos, but drop the sriracha and add chipotle."
Il Canto Cafe,475 Sacramento St,Great breakfast burrito! This place is not closed as of the date of this review.
Il Canto Cafe,475 Sacramento St,Local gem.  Fair prices.  Quick service.  Good food and coffee.
Il Canto Cafe,475 Sacramento St,Excellent breakfast burrito
Il Canto Cafe,475 Sacramento St,Best breakfast burrito in the city.
Il Canto Cafe,475 Sacramento St,Simple and fast breakfast. Perfect !
Il Canto Cafe,475 Sacramento St,Love their coffee and turkey panini
Il Canto Cafe,475 Sacramento St,Amazing breakfast burrito with tofu and eggs
Il Canto Cafe,475 Sacramento St,Horrible coffee and awful service. High prices. I would never come back.
Il Canto Cafe,475 Sacramento St,Always appreciate the efficiency and the customer service!
Il Canto Cafe,475 Sacramento St,Go here for breakfast. All the breakfast burritos are great.
Il Canto Cafe,475 Sacramento St,Too long wait please do not order on line never ready
Il Canto Cafe,475 Sacramento St,Awesome outside private do as you will outside zone in financial district period..
Il Canto Cafe,475 Sacramento St,Delicious hot chocolate yummy tiramisu and chocolate chip cookies
Il Canto Cafe,475 Sacramento St,Fantastic burritos. Lovely people.
Il Canto Cafe,475 Sacramento St,The best breakfast burrito in the world!
Il Canto Cafe,475 Sacramento St,Super nice staff and great burritos
Il Canto Cafe,475 Sacramento St,Awesome breakfast burrito!
Il Canto Cafe,475 Sacramento St,I'm writing this from a coma of veggie panini happiness.  And it's on Mealpal
Il Canto Cafe,475 Sacramento St,"Reasonable prices, great quality, and open early!"
Il Canto Cafe,475 Sacramento St,I love their ham and cheese panini.
Il Canto Cafe,475 Sacramento St,Pesto Chicken Burrito add Bacon = #fire
Il Canto Cafe,475 Sacramento St,"Fantastic food, coffee was delicious!"
Il Canto Cafe,475 Sacramento St,Crazy good breakfast! I will be back.
Il Canto Cafe,475 Sacramento St,The prices are right in the food is amazing
Il Canto Cafe,475 Sacramento St,Great Breakfast Burrito with sausage
Il Canto Cafe,475 Sacramento St,The BLTA sandwich was amazing!
Il Canto Cafe,475 Sacramento St,I have to get another burrito before I leave!!
Il Canto Cafe,475 Sacramento St,super friendly and amazing food!
Il Canto Cafe,475 Sacramento St,Amazing food and amazing staff
Il Canto Cafe,475 Sacramento St,Best burrito in SF.
Il Canto Cafe,475 Sacramento St,Chicken Chipotle is my favorite
Il Canto Cafe,475 Sacramento St,Excellent breakfast burrito!
Il Canto Cafe,475 Sacramento St,Delicious food with excellent service.
Il Canto Cafe,475 Sacramento St,The paninis are so good!!
Il Canto Cafe,475 Sacramento St,Great grilled breakfast burritos
Il Canto Cafe,475 Sacramento St,Food and service is always good
Il Canto Cafe,475 Sacramento St,I use mealpal and food is huge
Il Canto Cafe,475 Sacramento St,Love the Coconut Mocha ❤
Il Canto Cafe,475 Sacramento St,Fantastic breakfast burrito.
Il Canto Cafe,475 Sacramento St,Amazing
Il Canto Cafe,475 Sacramento St,This place is 🔥🔥🔥🔥 …
Il Canto Cafe,475 Sacramento St,Popular selection.
Il Canto Cafe,475 Sacramento St,Best breakfast
Il Canto Cafe,475 Sacramento St,Excellent service!
Il Canto Cafe,475 Sacramento St,Tasty mealpal.
Il Canto Cafe,475 Sacramento St,Best panini
Il Canto Cafe,475 Sacramento St,Bad service
Il Canto Cafe,475 Sacramento St,Popular spot for a reason.....breakfast burrito is fire
Il Canto Cafe,475 Sacramento St,"This place is a must if you’re in the financial district! My wife and I tried several breakfast items along with amazing lattes, and kept going back day after day for more. Jeff is an amazing person, full of positive energy, and never loses his smile. Even with 10+ people at the window the wait for the food was never more than 10 minutes. Absolutely don’t skip this place while in SF."
Il Canto Cafe,475 Sacramento St,"A small shop I found by accident, the food taste combines Italian taste with Chinese elements and American flavor. The stuffing is very rich. We ordered the vegan flavor. You can choose avocado or tofu... It is very delicious. I will come again next time I have the opportunity to come to San Francisco."
Il Canto Cafe,475 Sacramento St,"The sandwiches here are the best. Elm service is fast and very courteous, I recommend ordering to go since the place is small."
Il Canto Cafe,475 Sacramento St,"Good food, excellent location, good service… I recommend it"
Il Canto Cafe,475 Sacramento St,"The best burritos and sandwiches 👌🏼🥰 and the best service, they are super friendly and attentive 💕"
Il Canto Cafe,475 Sacramento St,For 10 orders they give you a free sanwitch
Il Canto Cafe,475 Sacramento St,Great spot in FiDi
