0,1,2
Pat's Cafe,2330 Taylor St,We were looking for a non-touristy brunch restaurant not too far from Pier 39 and lombard street. This place was perfect. The food was very good and prices were fair (16 and 18$). I recommend
Pat's Cafe,2330 Taylor St,"Service, menu, and flavors were top notch. Also highly recommend the soju Bloody Mary. We went for breakfast and it is one of our favorite spots in SF so far!"
Pat's Cafe,2330 Taylor St,"Excellent little spot for breakfast. Crab cake Benedict was my wife’s highlight. Home fries were also delicious. Service was super friendly, food was fast, and coffee refilled quickly. Make the quick walk!"
Pat's Cafe,2330 Taylor St,Delicious and they greeted us in the most welcoming way. Highly recommend it!
Pat's Cafe,2330 Taylor St,The food is average and breakfast is pricey (but it is San Francisco!). The service was great and friendly.
Pat's Cafe,2330 Taylor St,I went two times this week to have breakfast before work and the first time I was told that they will be ready in one hour so 8:30 a.m. The second time we were three people outside waiting patiently at 7:35 a.m. while the person inside keep ignoring us. The company has to update your business hours and improve the customer satisfaction. I am ISO 9001  leader so I know about quality :).
Pat's Cafe,2330 Taylor St,"We would eat there again to be sure, just had to reacquaint ourselves with the costs involved... I had a yummy omelet, grandma had pancakes, son had steak fajitas....yummy!"
Pat's Cafe,2330 Taylor St,"Best place in San Francisco for breakfast. Everything on the menu is great. My personal favs are the breakfast burrito, California omelette and pancakes."
Pat's Cafe,2330 Taylor St,Staff were friendly and welcoming. Lovely feel to the place. A genuine experience at a small and friendly cafe.
Pat's Cafe,2330 Taylor St,"Delicious meal, however a bit expensive.  Just enough food on the plate. Pancakes were great!"
Pat's Cafe,2330 Taylor St,"Came here Monday morning, and there was a short wait. This place does not do substitutions, but there's no need to! Lots of different breakfast options, there's something for everyone. This is a heavy breakfast spot, and close to Lombard street, so stop by here and walk it off after!"
Pat's Cafe,2330 Taylor St,"The staff was great however the food was cold when it got to the table. Other than that, it was a great experience."
Pat's Cafe,2330 Taylor St,The food was great and the service too! It is a small restaurant and felt a bit crammed during the time I went for breakfast. No open spaces as the tables are close to each other. I guess the more the merrier. If you don't mind the limited space then this restaurant is great for quality food. Eggs Benedict was delicious!
