0,1,2
Philz Coffee,300 Folsom St,Great tea and coffee but the baristas are rude and never fill the cup to the top ☹️
Philz Coffee,300 Folsom St,"Great service, fun people, and a wonderful selection. Spring for the Philz iced tea with mint (large, of course) and a Fresh Cucumber and Tomato Bagel on Asiago. You won't regret it."
Philz Coffee,300 Folsom St,"Love this Philz location! They are right on the SOMA bike route & the baristas are nice even if it's busy. Plus, Philz gives you a discount price for bringing your own cup."
Philz Coffee,300 Folsom St,"I went to philz coffee near Folsom st San Francisco, I tried new rose cafe cold there, it was very fresh taste and felt like relaxed. Must try that if you want to taste differ."
Philz Coffee,300 Folsom St,"I judge cities by their coffee shops, luckily for SF, they're currently a frontrunner. Luckily for SF they have Philz. Just got myself their app so I can order while walking over, and it's ready when I arrive. Can't beat this next level efficiency! Personal favorites include philtered soul, the Michael Jackson, and Jacob's wunderbar. Thank me after you go K thanks bye."
Philz Coffee,300 Folsom St,I've never seen such love and attention given to my order of a small decaf coffee. Philz decaf is truly decaf btw. Most are most certainly not. Google it. And it is still is a very satisfying cup of coffee. Thank you Stevey and the gang.
Philz Coffee,300 Folsom St,"This location is a godsend. Thanks to this Philz Coffee, I am able to enjoy my favorite coffee just how I like it every single morning. Baristas are very friendly as well."
Philz Coffee,300 Folsom St,"Have been getting Philz since their first location opened. Now with so many locations, it's so much more convenient. They always have a friendly staff and great coffee!"
Philz Coffee,300 Folsom St,"If you really like coffee, this is the place to go. The first time I went there I thought I was in a Starbucks-like place and asked for a cappuccino, and was replied they don't do that :-). There are so many different coffees with different tastes, I love it."
Philz Coffee,300 Folsom St,I tried Philz Coffee because of the high rating.  Really don't get the combo of mint in coffee.  I feel like really good coffee doesn't need mint in it.  But the space of the shop is nice.
Philz Coffee,300 Folsom St,"Newest philz coffee and totally love this location. There's a bit of construction around this corner but that should not deter you.  Familiar great coffee and they are open weekends, so excited!"
Philz Coffee,300 Folsom St,Great coffee and snacks. Amazing service and very friendly people
Philz Coffee,300 Folsom St,"Super charming place right next to the greyhound bus terminal,  friendly staff make for a wonderful experience. Also the twice baked almond croissant was awesome,  get it warmed for ""thrice baked""."
Philz Coffee,300 Folsom St,"Best light roast coffee I have ever had. Normally Starbucks ends up burning their blond roast, this was on a completely different level of amazing."
Philz Coffee,300 Folsom St,Another great Philz.  Big windows and open space. Has some window facing bar seats and a table that can fit 4.  So not a great Philz for working but great coffee and people.
Philz Coffee,300 Folsom St,"Comfy seats, some music and you’ll see pet owners coming in with their dogs once in awhile; does add to the liveliness of the place"
Philz Coffee,300 Folsom St,Went on a Saturday and Sunday on my last trip to SF. This location had an awesome staff (all their locations do). Great coffee as always!
Philz Coffee,300 Folsom St,Great coffee. Variety a plenty to please all tastes. Toilets do not require a passcode. Cheerful staff. Seating available inside and out.
Philz Coffee,300 Folsom St,"This coffee tastes great, but more importantly, it gave me the energy boost I needed. I don’t know what roast they use, but it works"
Philz Coffee,300 Folsom St,I love Philz coffee...a bit pricey but worth it
Philz Coffee,300 Folsom St,"Philz coffee, on the street corner of Beale and Folsom in San Francisco. Expect the usual selection of filter coffee drinks with delicious cream. My favourite remains the mint mojito ice coffee."
Philz Coffee,300 Folsom St,"i went in to this location for the first time on halloween, i was with someone who never had philz before and the gentleman at the first had a fantastic intro speach to breakdown what philz is all about. love the hospitality. this branch looks tight knit and efficient."
Philz Coffee,300 Folsom St,"Pretty cool spot. Unique spin on drinks, friendly staff, lots of space"
Philz Coffee,300 Folsom St,Very eclectic and cheerful staff putting together a tough to be at $5 pour over cup of coffee.    Only downside is their Caviar app is iPhone only.
Philz Coffee,300 Folsom St,The coffee shop I have ever tried. The Jacob's is my favorite coffee
Philz Coffee,300 Folsom St,If you need strong coffee that is delicious this is the place. Relatively good hours and interesting drinks.
Philz Coffee,300 Folsom St,Coffee was unique and flavorful. Highly recommend it. Serves just pour-over coffee. No espresso. But the coffee is excellent.
Philz Coffee,300 Folsom St,no latte here. but : great service to explain the medium roast choices. they added oat milk cream free. they have foam on top.
Philz Coffee,300 Folsom St,Love the coffee and the staff! I'd suggest you try one of the special iced coffees like Mint Mojito or Gingersnap. And definitely get it sweet and creamy. 👊😉 …
Philz Coffee,300 Folsom St,The coffee was great. The staff was friendly and helpful. The prices were too high for me but you certainly get what you pay for!
Philz Coffee,300 Folsom St,"Seems to be a consistent wait here, but good coffee nonetheless. Not too many places to sit and work onside, but has nice outdoor seating."
Philz Coffee,300 Folsom St,Who wouldn't love Philz? I love using Order Ahead for my tea every morning. Also the avocado toast and selection of pastries generally brighten my morning.
Philz Coffee,300 Folsom St,"Their coffee tends to not stand out, yet require a lot of time to prepare.  Their pastries are the kind that rely on reheating and are, unfortunately, sub par."
Philz Coffee,300 Folsom St,If you like a side of pretense with your coffee this is the place. Hipster heaven for overpaid techies and woke type. Coffee is a step above most places though.
Philz Coffee,300 Folsom St,This coffee is by far best coffee I've ever had . Tesora is my favorite.  They make each cup 1 at a time . It's like a custom coffee . Thanks pgil
Philz Coffee,300 Folsom St,I've never been disappointed by any Philz locations - expect consistent great brews. Staff is always friendly and welcoming!
Philz Coffee,300 Folsom St,Excellent coffee with lots of variety of breakfast stuff
Philz Coffee,300 Folsom St,Great coffee made with the pour over method.
Philz Coffee,300 Folsom St,"Really friendly staff and a good cup of coffee, brewed to perfection with an impressive pouring technique that would make any bartender jealous."
Philz Coffee,300 Folsom St,Spacious interior with a modern twist. The few outside chairs are ideal to catch that late afternoon ray of sunshine that made it's way between the tall office buildings
Philz Coffee,300 Folsom St,Great coffee. Lots of variety and each cup is hand-dripped by one of the baristas. A must try! Philtered soul is great
Philz Coffee,300 Folsom St,Always a good solid cup of coffee. Wish there was more parking in the area though.
Philz Coffee,300 Folsom St,"Philz is the best coffee around, and they'll make you literally anything you can dream up. Super friendly service and great atmosphere!"
Philz Coffee,300 Folsom St,This is well located close to Bus station and few steps away from Bay Trail or Water front. Tesora is best coffee. There is limited sitting at this location.
Philz Coffee,300 Folsom St,"I love Philz, as always. Good location with nice big windows. Beautiful big coffee bar and some seating around the perimeter."
Philz Coffee,300 Folsom St,Philz is always consistent and their coffee drinks are so good!
Philz Coffee,300 Folsom St,I was never really a coffee drinker but has been turned on to a drink called an oatmeal cookie. Love it.
Philz Coffee,300 Folsom St,"These guys brew drop code only, but it has very high quality. Probably the best drip coffee that I've tasted."
Philz Coffee,300 Folsom St,Awesome. Unique coffee experience.  Make sure to ask if you are not familiar with their process. Friendly baristas!
Philz Coffee,300 Folsom St,"Trendy little coffee shop, always very busy but the coffee is good. Limited seating so don't expect to hang out for long."
Philz Coffee,300 Folsom St,Great location. Near the bus terminal and has plenty of seating according to SF standards.  Gotta get the Mint Mojito!
Philz Coffee,300 Folsom St,Consistent great coffee and friendly staff.  Use phone app to order ahead if you are short on time.
Philz Coffee,300 Folsom St,Great coffee. Even the decaf grows hair on your chest!  The staff is very friendly and fast.
Philz Coffee,300 Folsom St,Hazelnut coffee is great!
Philz Coffee,300 Folsom St,Acoustics are messing up the whole experience of being there. Needs more outside sitting and inside sitting. Otherwise staff is great and product is original.
Philz Coffee,300 Folsom St,Delicious coffee - drip is their speciality - a refreshing change to the espresso bars. Delicious snacks too.
Philz Coffee,300 Folsom St,"Friendly staff, quick turn around for coffee and gorgeous new amenities. Recommend this coffee shop and will definitely come back!"
Philz Coffee,300 Folsom St,Great coffee and staff…always helpful and courteous. That wonderbar stuff rocks.
Philz Coffee,300 Folsom St,Great place for coffee.  Barista gave me a baklava square for my first visit to their location!
Philz Coffee,300 Folsom St,The chai tea was watery but tasty. Brownie was fresh.
Philz Coffee,300 Folsom St,"What an experience this was. Friendly social staff, samples handed out while waiting and then the huge variety of coffees. Excellent experience."
Philz Coffee,300 Folsom St,"I literally waited 20 minutes for a cookie. The man was an Asian guy. He completely ignored me, served others before me and the service was just horrible. And I missed 2 buses. Never  coming here again"
Philz Coffee,300 Folsom St,"Exactly what you'd expect from a Philz: top notch coffee, unique ambiance with a quirky feel, and a staff that knows their stuff and doesn't mind a bit of banter."
Philz Coffee,300 Folsom St,"Consistantly great coffee, fast service, friendly smiles. Super convenient mobile app for ordering ahead."
Philz Coffee,300 Folsom St,Great hot chocolate and croissant with bacon and onions and avocado bread was good next time I'll have them toast it.😀 …
Philz Coffee,300 Folsom St,Terrible service.  I stood there for 30 minutes to realize they didn't get my order. The guy named oscar is a moran.
Philz Coffee,300 Folsom St,It is great to have a brand new Philz Coffee place here! Don't need to visit Starbucks anymore :)
Philz Coffee,300 Folsom St,"welcoming friendly lively informative customer service, looks like chill spot to read do work, needs more seating, awsome coffee selection."
Philz Coffee,300 Folsom St,Cool coffee place with contemporary decor and nice urban setting.
Philz Coffee,300 Folsom St,"Great coffee, though music is sometimes too loud for reading or getting some quick work done"
Philz Coffee,300 Folsom St,The best Great customer service in the coffee is awesome￼
Philz Coffee,300 Folsom St,Philz was wonderful. I had a cup of joe and a tasty bagel. Much preferred to the other guys
Philz Coffee,300 Folsom St,Great coffee service is superb always happy to help.  Just a great place to go!
Philz Coffee,300 Folsom St,Good coffee but holy smokes it's expensive. You're definitely paying San Francisco techworker prices.
Philz Coffee,300 Folsom St,"Iced Mocha Tesoro on the patio. Yes, out by the traffic of SoMa but the taste of the coffee drink transported me elsewhere...ahhh"
Philz Coffee,300 Folsom St,I live Above This Philz and the workers are very nice and they keep the crowds to a minimum so I feel safe going in and out of my home.
Philz Coffee,300 Folsom St,"Strong light bold and good. ""Dancing Water my favorite. Drink a cup before your work out!"
Philz Coffee,300 Folsom St,You'll never go wrong with Philz Coffee. Very tasty. Will back soon.
Philz Coffee,300 Folsom St,Very good mint mojito
Philz Coffee,300 Folsom St,Not much selection. Green Chili burrito is really good though.  Ill go back for it.
Philz Coffee,300 Folsom St,"Great drinks, lovely people with attention to detail. Be prepared to wait a bit, but worth it."
Philz Coffee,300 Folsom St,Very slow. Orders are not processed in a FIFO order. Food is good though. Please automate the staff away to improve service.
Philz Coffee,300 Folsom St,Nice place to order coffee to go! One of the best coffee shops tbh
Philz Coffee,300 Folsom St,there hot chocolate is the best.
Philz Coffee,300 Folsom St,Good selection of pastries& breakfast snacks. Good unpretentious coffees in generous portions.
Philz Coffee,300 Folsom St,"Very unique styles and decorations. Great hot chocolate, friendly servers."
Philz Coffee,300 Folsom St,"Very friendly staff and pleasant tables outside, away from the traffic.  Great place to meet south of market"
Philz Coffee,300 Folsom St,Delicious coffee and very friendly atmosphere. An interesting and enriching experience.
Philz Coffee,300 Folsom St,"Jacobs, Tesora and Arabic are the blends of choice. Also get the Labneh toast if you're hungry"
