0,1,2
Progressive Grounds,400 Cortland Ave,tons of room indoor and excellent outdoor patio space. owners are very friendly and serve good food for decent prices. the mitchell's ice cream is a definite plus
Progressive Grounds,400 Cortland Ave,"Amazing food, drinks and pastries and a wonderful staff. I come here somewhat regularly and I never leave disappointed. I'm always more satisfied than the last"
Progressive Grounds,400 Cortland Ave,"One of the few remaining places with an original San Francisco feel. The owner (Aziz) is authentic, good - spirited and they have a wonderful patio that is very peaceful."
Progressive Grounds,400 Cortland Ave,great little spot in Betnal Heights
Progressive Grounds,400 Cortland Ave,Earliest open coffee and food spot on Cortland. Tasty coffee and croissant breakfast sandwich was delicious. Nice selection especially at 6 AM
Progressive Grounds,400 Cortland Ave,This place great if you like wraps also carries Mitchell ice cream. Their doing construction in the back can't wait till they open the back. Great place
Progressive Grounds,400 Cortland Ave,Adorable and spacious coffee shop. Good food too.
Progressive Grounds,400 Cortland Ave,"Love this place! My favortie is there Mediterainian Beet Salad, they also have very yummy Med wraps, the staff is friendly and the seats are comfortable, free wifi, one of my favorite places to work out of in the city!"
Progressive Grounds,400 Cortland Ave,"Great little coffee house, huge selection of cafe-style food and ice cream. Can't wait until the back patio is open again."
Progressive Grounds,400 Cortland Ave,"wonderful cafe, friendly fast service, clean bathrooms. indoor and patio seating. outside benches great for people watching and enjoying the neighborhood"
Progressive Grounds,400 Cortland Ave,Stale croissants and bad atmosphere.
Progressive Grounds,400 Cortland Ave,Best salmon wrap I've EVER had. Always great service and delicious food and drinks. I'll keep going back.
Progressive Grounds,400 Cortland Ave,Cool coffee shop with several interesting seating areas and an outdoor area in the back.  Get the Kafka (spelling?).  It is amazing!
Progressive Grounds,400 Cortland Ave,"They have a nice patio. The food is ok, I love the hummus that they make. Great service."
Progressive Grounds,400 Cortland Ave,"Lots of sitting space, decent coffee! Great food options too!"
Progressive Grounds,400 Cortland Ave,Lovely coffee shop. Attentive excellent staff. Dog friendly!
Progressive Grounds,400 Cortland Ave,It's really quiet and inviting. The new outside seating area is beautiful! I love sitting there and relaxing
Progressive Grounds,400 Cortland Ave,Staying in the local area for a few days and the two times we had breakfast here we we're more than happy with the food and the welcome. Would thoroughly recommend
Progressive Grounds,400 Cortland Ave,Comfy seating and fast wifi. Great place to hang out or do work. Friendly and courteous staff.
Progressive Grounds,400 Cortland Ave,It is so beautiful to see my late sister Anna Shami's business is still booming.
Progressive Grounds,400 Cortland Ave,"Nice staff, beautiful outside patio.  Good place to study, read or relax with your coffee."
Progressive Grounds,400 Cortland Ave,Moroccan twist on classic breakfast cuisine and very good coffee. 2 thumbs up for this place.
Progressive Grounds,400 Cortland Ave,Great little place for breakfast. Friendly staff. The Granola and the bagels are delicious.
Progressive Grounds,400 Cortland Ave,"Great staff, great food, try the veggie bagel. Local art work on display in the  back with an amazing deck."
Progressive Grounds,400 Cortland Ave,"I live close by.But the pastries,coffees,sandwichs,salads,are wonderful.Love the owners Brothers.Staff is great.Try Chicken Wrap with a side salad.Marcos & Aziz are as nice as they come."
Progressive Grounds,400 Cortland Ave,"Great coffee, food, treat, place in Bernal with a couple nice areas to hang out and get some work done."
Progressive Grounds,400 Cortland Ave,"Pretty good coffee, kinda pricey, often slow. But a cozy neighborhood place."
Progressive Grounds,400 Cortland Ave,"Used to be a print shop, rustic building could be sittin' on a farm. One reason Bernal feels more like a village than part of a city."
Progressive Grounds,400 Cortland Ave,"Neighborhood spot, cozy.  Also has outdoor seating.  Good food, coffee, Mitchell's ice cream and baked goods."
Progressive Grounds,400 Cortland Ave,"Wide selection of food and drink, including smoothies.  Cozy seating area in the back plus a patio.  Outlets and wifi."
Progressive Grounds,400 Cortland Ave,Really nice spot with a big patio in the back. Wifi is reliable and fast
Progressive Grounds,400 Cortland Ave,"Decent drinks, food was okay but nothing notable. Space was fairly noisy and unfortunately the back patio was closed for renovations."
Progressive Grounds,400 Cortland Ave,"Great atmosphere and friendly service. Sadly, anytime I’ve been here on my way to work I’ve also ended up 30min late. The service is so slow it’s embarrassing."
Progressive Grounds,400 Cortland Ave,Had a good time!
Progressive Grounds,400 Cortland Ave,imagine being transported to 1996 to a coffee shop in San Francisco and you'll end up at this homey little I Dream of Jeannie inspired set.
Progressive Grounds,400 Cortland Ave,Great local place with superb bagels and the friendliest stuff in SF. Perfect breakfast.
Progressive Grounds,400 Cortland Ave,One of my favorite places to drink my americano and my bagel before work nice patio.
Progressive Grounds,400 Cortland Ave,"Friendly staff, free WiFi and outlets, good ambiance."
Progressive Grounds,400 Cortland Ave,Cutest coffee shop on the block with great food selection and friendly staff
Progressive Grounds,400 Cortland Ave,"Nice people, good coffee and food, safe practices, and a lovely outdoor patio"
Progressive Grounds,400 Cortland Ave,I ordered a cappuccino and was very disappointed
Progressive Grounds,400 Cortland Ave,"Rude stuff; cold sits. I did not feel welcome there, sorry("
Progressive Grounds,400 Cortland Ave,"Nice cuisine, beautiful and cozy backyard, moderate prices. Approved by locals."
Progressive Grounds,400 Cortland Ave,They have a back patio which is perfect on a sunny day. Their food is also delicious.
Progressive Grounds,400 Cortland Ave,Sweet patio. Great place to enjoy a local cafe with good food and awesome staff.
Progressive Grounds,400 Cortland Ave,Great service food ambiance patio yogurt parfait coffee tables wi-fi people!!!
Progressive Grounds,400 Cortland Ave,Great attention. Variety on the menu. Vegan friendly and free WiFi
Progressive Grounds,400 Cortland Ave,The place is cool. Good Berry Smoothie and very kind staffs!
Progressive Grounds,400 Cortland Ave,"Delicious food as always, every time I go to San Francisco I go there"
Progressive Grounds,400 Cortland Ave,"Great coffee, fantastic breakfast sandwich and outstanding customer service!"
Progressive Grounds,400 Cortland Ave,"""croque Monsieur"" is nothing more than a ham and cheese sandwich., And they forgot the mustard.  Not worth 7.95; probably won't come again."
Progressive Grounds,400 Cortland Ave,"Comfy, fast internet,  big options menu. It's a great place to get your work done."
Progressive Grounds,400 Cortland Ave,Low key cozy cafe with space in the back. Super friendly staff and toddler friendly
Progressive Grounds,400 Cortland Ave,Good seating in back and a nice backyard area. Coffee could be better though.
Progressive Grounds,400 Cortland Ave,"Nice selection of coffee, and they have Mitchell's Ice Cream"
Progressive Grounds,400 Cortland Ave,Yummy food & friendly service!
Progressive Grounds,400 Cortland Ave,Always loved coming here. Cozy atmosphere and good menu!
Progressive Grounds,400 Cortland Ave,"Nice vibe and place to work, the house coffee is somewhat acrid and would not recommend."
Progressive Grounds,400 Cortland Ave,Great service. The venue has an inviting vibe. Food was good.
Progressive Grounds,400 Cortland Ave,Super cute café. Coffee was excellent.  Banana cake could be better.
Progressive Grounds,400 Cortland Ave,WiFi and a LOT of power outlets. Great place to work.
Progressive Grounds,400 Cortland Ave,Nice little joint.  Bigger than it looks with good coffee and friendly folks.
Progressive Grounds,400 Cortland Ave,"Good salads, friendly staff, funky space (check out the back part)."
Progressive Grounds,400 Cortland Ave,Very good quiet shop to go to haven't been there in a while but I'll go and visit it again.
Progressive Grounds,400 Cortland Ave,Lovely humans working here!! Such a happy and friendly environment 😌 …
Progressive Grounds,400 Cortland Ave,"Coffee isn't the best, food isn't the greatest but great location and patio."
Progressive Grounds,400 Cortland Ave,super cute coffee place with a wonderful patio!
Progressive Grounds,400 Cortland Ave,"Great coffee and hot, fresh banana bundt cake!"
Progressive Grounds,400 Cortland Ave,Great karma.. Friendly service.. Lots if pastry and excellent java
Progressive Grounds,400 Cortland Ave,Great drink options.  Love the food too
Progressive Grounds,400 Cortland Ave,Great local spot. Awesome new back yard and killer wraps.
Progressive Grounds,400 Cortland Ave,"Pleasant environment, tasty coffee, friendly staff."
Progressive Grounds,400 Cortland Ave,Havent had coffee this good in a while!!! Will definitely be back SOON.
Progressive Grounds,400 Cortland Ave,Super cozy place to have coffee and work on your laptop
Progressive Grounds,400 Cortland Ave,Great indoor/outdoor space to grab a coffee and do some work
Progressive Grounds,400 Cortland Ave,"neighborhood spot, check out the wraps and the seating in the back. good vibes"
Progressive Grounds,400 Cortland Ave,A favorite place for a quick casual bite to eat.
Progressive Grounds,400 Cortland Ave,"Friendly staff, delicious smoothies!"
Progressive Grounds,400 Cortland Ave,cosy neighborhood cafe. good food and good place to work
Progressive Grounds,400 Cortland Ave,Staff knows their locals and greets new guests with welcome arms.
Progressive Grounds,400 Cortland Ave,Decent food with cozy back room and patio
Progressive Grounds,400 Cortland Ave,A nice place to hung around while enjoying your food
Progressive Grounds,400 Cortland Ave,Great patio and good food!
Progressive Grounds,400 Cortland Ave,Love the back yard were you can have coffee
Progressive Grounds,400 Cortland Ave,service is surly but the coffee and levash wraps are tasty.
Progressive Grounds,400 Cortland Ave,Always a nice place to have coffee
Progressive Grounds,400 Cortland Ave,"Decent coffee, lovely back patio."
Progressive Grounds,400 Cortland Ave,"Great atmosphere, food and coffee."
Progressive Grounds,400 Cortland Ave,"Nice staff, many gluten free options"
Progressive Grounds,400 Cortland Ave,Great lunch options in a relaxed environment
Progressive Grounds,400 Cortland Ave,"Friendly, good service, tasty food."
Progressive Grounds,400 Cortland Ave,Nice coffee shop to work with funky space🥰 …
Progressive Grounds,400 Cortland Ave,My favorite coffee shop in this city.
Progressive Grounds,400 Cortland Ave,Nice little neighborhood coffee house. Good coffee.
Progressive Grounds,400 Cortland Ave,Excellent. And delicious. Food.  And. Very.  Good.
Progressive Grounds,400 Cortland Ave,Really lively and friendly. Good chai.
Progressive Grounds,400 Cortland Ave,Coffee is great. Pastries as well.
Progressive Grounds,400 Cortland Ave,Great food service music
Progressive Grounds,400 Cortland Ave,Local haunt on bernal heights for working with a coffee
Progressive Grounds,400 Cortland Ave,Great grilled salmon wraps!.
Progressive Grounds,400 Cortland Ave,Great little shop with amazing sandos
Progressive Grounds,400 Cortland Ave,Excellent coffee n food.
Progressive Grounds,400 Cortland Ave,Very clean place and good location
Progressive Grounds,400 Cortland Ave,"Tasty smoothies, cozy backroom :-)"
Progressive Grounds,400 Cortland Ave,Good service chill hangout spot
Progressive Grounds,400 Cortland Ave,I love u
Progressive Grounds,400 Cortland Ave,Nice outdoor seating
Progressive Grounds,400 Cortland Ave,super cozy place to work in
Progressive Grounds,400 Cortland Ave,Many rooms for hanging out
Progressive Grounds,400 Cortland Ave,Cozy cute neighborhood hangout
Progressive Grounds,400 Cortland Ave,Always friendly service
Progressive Grounds,400 Cortland Ave,Sandwich was delicious.
Progressive Grounds,400 Cortland Ave,Bernal Heights festival
Progressive Grounds,400 Cortland Ave,Sweet
Progressive Grounds,400 Cortland Ave,Great selection
Progressive Grounds,400 Cortland Ave,Tea
Progressive Grounds,400 Cortland Ave,Great Place!
Progressive Grounds,400 Cortland Ave,Good hang out
Progressive Grounds,400 Cortland Ave,Friendly place
Progressive Grounds,400 Cortland Ave,"・There is wifi ・ There are many tables and it is not crowded ・There are many kinds of food and drinks, relatively cheap and delicious ・Friendly staff ・The area around the store is calm and calm"
Progressive Grounds,400 Cortland Ave,"I love the coffee in this place, it's delicious and its atmosphere is extremely pleasant"
Progressive Grounds,400 Cortland Ave,Great place for lunch. Super friendly staff. Fast service. Live TV.
Progressive Grounds,400 Cortland Ave,"On the cortland a good little cafe with a nice patio !! Have had breakfast here many times, always a pleasure!"
Progressive Grounds,400 Cortland Ave,"very nice cafe in a friendly neighborhood, charming welcome (and French-speaking!), an original, generous menu with fresh and quality products"
Progressive Grounds,400 Cortland Ave,"I love this place, I worked for many years and here everyone is respectful if you know about respect"
Progressive Grounds,400 Cortland Ave,I like sandwiches
