0,1,2
Snowbird Coffee,1352 9th Ave A,Cozy and relaxed atmosphere. Their branding is on point. Latte was delicious and beautifully made. Will definitely come again!
Snowbird Coffee,1352 9th Ave A,Great spot in the inner Sunset or need some caffeine while at Golden Gate Park.
Snowbird Coffee,1352 9th Ave A,"They can make the chai latte spicier and less sweet, the way a chai should taste, in my opinion"
Snowbird Coffee,1352 9th Ave A,"Good service, a pleasant atmosphere, and deliciously sweet coffee beverages."
Snowbird Coffee,1352 9th Ave A,"A very quaint coffee shop with a variety of speciality drinks. A bit pricey, especially considering that they charge 75 cents for a splash of almond milk in cold brew."
Snowbird Coffee,1352 9th Ave A,Everyone who works there is so nice and they make a great cappuccino!
Snowbird Coffee,1352 9th Ave A,"Best cappuccino in town, although depends on which barista makes it. I absolutely love their espresso beans and highly recommend them."
Snowbird Coffee,1352 9th Ave A,Solid coffee shop. They freeze cold brew into ice cubes so your drink is never diluted! Great idea!
Snowbird Coffee,1352 9th Ave A,"Owner with glasses was rude, hard to deal with, should not be in service industry. Coffee is bad."
Snowbird Coffee,1352 9th Ave A,"One of my favorite coffee shops in the city (and the world!) Great coffee and friendly baristas. Try an iced Spaniard, especially on a hot day!"
Snowbird Coffee,1352 9th Ave A,"Great service and delicious coffee. It can get pretty loud and crowded, though, so it may not always be the best place to study."
Snowbird Coffee,1352 9th Ave A,"Had breakfast, which is served all day long...french toast. It was your classic yummy big ole plate of french toast in a timely manner."
Snowbird Coffee,1352 9th Ave A,"Great coffee, great pastries (but they run out so fast!). Nice spot in the Inner Sunset."
Snowbird Coffee,1352 9th Ave A,Amazing coffee and wonderful atmosphere. A nice place to tuck away and do some reading or drawing. I recommend the Americano.
Snowbird Coffee,1352 9th Ave A,well made flat white! would come back if in the area
Snowbird Coffee,1352 9th Ave A,"Easy to miss, but now that I've found it I'll almost certainly become a regular as I wait for the morning train. Easily the best coffee in the area."
Snowbird Coffee,1352 9th Ave A,"Nice cup of hot chocolate, great people. It's the type of a small friendly coffee shop in a very nice neighborhood"
Snowbird Coffee,1352 9th Ave A,Some of the best coffee in the Inner Sunset (easily comparable to good Australian coffee) but you'll pay top dollar for it!
Snowbird Coffee,1352 9th Ave A,"Really nice cafe with amazing coffee and pastries. Great place to work, though not that many power outlets."
Snowbird Coffee,1352 9th Ave A,Good Macchiato and the Brevano is a tasty sweet option. WiFi wouldn't work and they offered to restart the router for me.
Snowbird Coffee,1352 9th Ave A,"One of my favorite cafe in SF, good latte, good staff, special and cool logo of the snowbird as well!"
Snowbird Coffee,1352 9th Ave A,Great coffee and the best green tea matcha lattes! Always fantastic staff too :)
Snowbird Coffee,1352 9th Ave A,"Very friendly staff, I love having small conversations when ordering a latte, I look forward to coming here all the time !"
Snowbird Coffee,1352 9th Ave A,Nice staff and great coffee
Snowbird Coffee,1352 9th Ave A,One of my favorite coffee shops in the city. Super cozy and stellar baristas.
Snowbird Coffee,1352 9th Ave A,"Great coffee shop, lots of room for seating with a laptop. Loved the iced mocha!"
Snowbird Coffee,1352 9th Ave A,A very cool coffee shop in the sunset.
Snowbird Coffee,1352 9th Ave A,Everything I've ever ordered here has been fantastic. Also always good to support your local businesses.
Snowbird Coffee,1352 9th Ave A,Favourite cafe in SF; the staff are lovely and so's the coffee. Go to the botanical gardens
Snowbird Coffee,1352 9th Ave A,Excellent coffee and the place is charming. I had a cortado and it was just perfect.
Snowbird Coffee,1352 9th Ave A,Great coffee and very nice Service. On the weekends is also a natural soap shop.
Snowbird Coffee,1352 9th Ave A,Great tasting coffee and a friendly environment. Keep in mind the tables are very small
Snowbird Coffee,1352 9th Ave A,"there is this handsome Meditarrenean piece of ""man candy,"" that makes his everything Extra Delicious, ask for anything and he will make it so, want a dragon in your latte art?"
Snowbird Coffee,1352 9th Ave A,"Great coffee, good price and excellent service! Thank you, again."
Snowbird Coffee,1352 9th Ave A,Cute little spot for coffee or tea. Not a ton of seating but turnover seemed good. Cozy.
Snowbird Coffee,1352 9th Ave A,There is no better location for their excellent coffee: just across the street from Arizmendi and around the corner from the doughnut shop. ;)
Snowbird Coffee,1352 9th Ave A,"Decent coffee, they tend to burn it. For the price, and by San Francisco standards, it’s on the lower end of middle of the road."
Snowbird Coffee,1352 9th Ave A,"Nice intimate atmosphere, with a pleasantly simple interior - highly recommend (and great coffee!)"
Snowbird Coffee,1352 9th Ave A,Good place for small or solo bands. The pace is relaxed. Local feel of the neighborhood.
Snowbird Coffee,1352 9th Ave A,Popped in for a great macchiato. I appreciate that one of the staffers wore a Leonard’s Bakery tee.
Snowbird Coffee,1352 9th Ave A,Great spot for coffee. We used to frequent Snowbird when we lived here in the Inner Sunset.
Snowbird Coffee,1352 9th Ave A,"Nice place, fine location and good coffee that kept me going through the afternoon."
Snowbird Coffee,1352 9th Ave A,An inspired cafe with thoughtful baristas and tasty baked items...  Guiding you through your service
Snowbird Coffee,1352 9th Ave A,Perfect crema on the espresso and wonderful texture in my cappuccinos every time.
Snowbird Coffee,1352 9th Ave A,One of my regular joints. I'm there every Sunday. Can't say enough good things.
Snowbird Coffee,1352 9th Ave A,Very tasty espresso. Definitely your best bet in the area.
Snowbird Coffee,1352 9th Ave A,"Great coffee, nice pastries. Good neighborhood atmosphere"
Snowbird Coffee,1352 9th Ave A,Great coffee!  Perfect mix of foam and coffee with a great presentation.
Snowbird Coffee,1352 9th Ave A,"Tasty pastries, good coffee and friendly service in a cozy and cool shop."
Snowbird Coffee,1352 9th Ave A,Great coffee. Friendly people. The best place to get your fix.
Snowbird Coffee,1352 9th Ave A,Their Early Gray is a must have and they add the perfect amount of steamed milk
Snowbird Coffee,1352 9th Ave A,"Super cute decor and, most importantly, excellent coffee."
Snowbird Coffee,1352 9th Ave A,Nice coffee. Not much seating but nice atmosphere
Snowbird Coffee,1352 9th Ave A,Hands down the best cold brew in SF
Snowbird Coffee,1352 9th Ave A,My latte was ok and very light on coffee aroma.
Snowbird Coffee,1352 9th Ave A,Great little spot. Awesome coffee & espresso drinks.
Snowbird Coffee,1352 9th Ave A,"Love the vibe hear always, great coffee too"
Snowbird Coffee,1352 9th Ave A,"Got the ""Spaniard"" with almond milk and bought a coffee cake. Very good!"
Snowbird Coffee,1352 9th Ave A,Drinks are always accurate and staff always friendly. Thank the lord for this joint!
Snowbird Coffee,1352 9th Ave A,It's okay coffee.  Good place to kill some time.
Snowbird Coffee,1352 9th Ave A,"Great coffee, but clearly on the expensive side. Limited seating."
Snowbird Coffee,1352 9th Ave A,"At the tangy, light roast end of the artisan coffee spectrum, but well executed"
Snowbird Coffee,1352 9th Ave A,Great local coffee shop that roasts their own beans.
Snowbird Coffee,1352 9th Ave A,Friendly and helpful staff.  Great coffee.
Snowbird Coffee,1352 9th Ave A,Snowbird makes an excellent cappuccino! My go-to coffee cafe.
Snowbird Coffee,1352 9th Ave A,"Cozy with good coffee, I had some sort of iced espresso drink that was good"
Snowbird Coffee,1352 9th Ave A,"Excellent place, excellent customer service and excellent coffee variety"
Snowbird Coffee,1352 9th Ave A,Yummy!!! Nice cozy place. Popped in to meet some friends from out of town.
Snowbird Coffee,1352 9th Ave A,Great coffee and fairly good pastries!
Snowbird Coffee,1352 9th Ave A,Super cute decor and excellent coffee.
Snowbird Coffee,1352 9th Ave A,Cozy place with great coffee 👍🏻 so crowded though …
Snowbird Coffee,1352 9th Ave A,The coffee was delightful.  Relaxing atmosphere.
Snowbird Coffee,1352 9th Ave A,Great cup of Joe. Extra charge for almond milk.
Snowbird Coffee,1352 9th Ave A,Attracts hipster Japanese coffeshop bloggers in their global pilgrimages.
Snowbird Coffee,1352 9th Ave A,Very delicious cappuccino!
Snowbird Coffee,1352 9th Ave A,Great service & very comfortable place to hang out for a bit.
Snowbird Coffee,1352 9th Ave A,Matcha green tea latte and the Spaniard are my go-to drinks.
Snowbird Coffee,1352 9th Ave A,love u 4ever snowbird
Snowbird Coffee,1352 9th Ave A,Good real cold brew coffee. Nice Cafe.
Snowbird Coffee,1352 9th Ave A,The oat milk latte does NOT disappoint!
Snowbird Coffee,1352 9th Ave A,Expertly brewed single source pour-overs. Nice!
Snowbird Coffee,1352 9th Ave A,Great study spot. Lots of tables. Spacious.
Snowbird Coffee,1352 9th Ave A,Their iced coffee is especially good.
Snowbird Coffee,1352 9th Ave A,Quiet and small. Great coffee.
Snowbird Coffee,1352 9th Ave A,Chilled local place for coffee (or a nice matcha latte)
Snowbird Coffee,1352 9th Ave A,Chai latte and shakerato we're excellent.
Snowbird Coffee,1352 9th Ave A,One of the best coffees in the neighborhood.
Snowbird Coffee,1352 9th Ave A,No wifi and bad hotspot reception
Snowbird Coffee,1352 9th Ave A,"Great coffee, great venue, great service."
Snowbird Coffee,1352 9th Ave A,"Fun, funky, hole in the wall, and great coffee"
Snowbird Coffee,1352 9th Ave A,Always good. Always consistent. Great staff.
Snowbird Coffee,1352 9th Ave A,Love this place! Really love their gibraltar
Snowbird Coffee,1352 9th Ave A,Nice little coffee shop with relaxing atmosphere.
Snowbird Coffee,1352 9th Ave A,a little too stuck up- not many charging outlets
Snowbird Coffee,1352 9th Ave A,Fantastic coffee and a comfy neighbourhood hangout
Snowbird Coffee,1352 9th Ave A,Great coffee and good atmosphere
Snowbird Coffee,1352 9th Ave A,"If you need some coffee, this is a good place"
Snowbird Coffee,1352 9th Ave A,Nice place to sit down and have tea.
Snowbird Coffee,1352 9th Ave A,great coffee and cafe. thanks
Snowbird Coffee,1352 9th Ave A,Always run out of pastries quite early!
Snowbird Coffee,1352 9th Ave A,Kind staff buy a little pricey for coffee.
Snowbird Coffee,1352 9th Ave A,small cozy coffee shop. great coffee
Snowbird Coffee,1352 9th Ave A,Very nice specialty coffee.
Snowbird Coffee,1352 9th Ave A,Cozy coffee shop with small pastries for sale.
Snowbird Coffee,1352 9th Ave A,Cozy and low noise place for IT geeks
Snowbird Coffee,1352 9th Ave A,Best. Coffee. EVER! All natural
Snowbird Coffee,1352 9th Ave A,Favorite little coffee shop in the inner sunset
Snowbird Coffee,1352 9th Ave A,That's some damn fine coffee.
Snowbird Coffee,1352 9th Ave A,Best coffee in sf...really
Snowbird Coffee,1352 9th Ave A,best in s
Snowbird Coffee,1352 9th Ave A,"Fantastic coffee, thanks!"
Snowbird Coffee,1352 9th Ave A,So far so good!💃 …
Snowbird Coffee,1352 9th Ave A,Great espresso drinks.
Snowbird Coffee,1352 9th Ave A,Best coffee in area!
Snowbird Coffee,1352 9th Ave A,Solid coffee and espresso drinks!
Snowbird Coffee,1352 9th Ave A,Great matcha latte
Snowbird Coffee,1352 9th Ave A,the coffee is a bit weak...
Snowbird Coffee,1352 9th Ave A,Amazing coffee and service
Snowbird Coffee,1352 9th Ave A,Good coffee cost location
Snowbird Coffee,1352 9th Ave A,Very disappointed with the service here.
Snowbird Coffee,1352 9th Ave A,Love this coffee shop.
Snowbird Coffee,1352 9th Ave A,Solid third wave coffee.
Snowbird Coffee,1352 9th Ave A,Management is extremely rude.
Snowbird Coffee,1352 9th Ave A,loved it
Snowbird Coffee,1352 9th Ave A,Brevano = delicious
Snowbird Coffee,1352 9th Ave A,Cute little coffee shop.
Snowbird Coffee,1352 9th Ave A,Great
Snowbird Coffee,1352 9th Ave A,"Wow, great coffee"
Snowbird Coffee,1352 9th Ave A,Great place ⭐️⭐️⭐️
Snowbird Coffee,1352 9th Ave A,Excellent coffee!
Snowbird Coffee,1352 9th Ave A,Quality coffee
Snowbird Coffee,1352 9th Ave A,Great new cafe
Snowbird Coffee,1352 9th Ave A,Good expresso!
Snowbird Coffee,1352 9th Ave A,Great coffee.
Snowbird Coffee,1352 9th Ave A,Pretty hipster
Snowbird Coffee,1352 9th Ave A,Great cafe
Snowbird Coffee,1352 9th Ave A,Cozy and delicious
Snowbird Coffee,1352 9th Ave A,Tasty coffee..
Snowbird Coffee,1352 9th Ave A,Delicious coffee
Snowbird Coffee,1352 9th Ave A,Nice coffee
Snowbird Coffee,1352 9th Ave A,"Excellent coffee, friendly and cordial service. Cold Brew is prepared with coffee ice. It's really good. The best coffee on Sunset."
Snowbird Coffee,1352 9th Ave A,The attention of the waiter very unpleasant. The coffee at the typical price and food few options at least for breakfast. The feeling that they did not want tourists
Snowbird Coffee,1352 9th Ave A,Delicious for overs and unique lattes.
Snowbird Coffee,1352 9th Ave A,They have coffee with milk!
Snowbird Coffee,1352 9th Ave A,Good for overs!
Snowbird Coffee,1352 9th Ave A,nice place
